number,value,datetime_start,datetime_complete,duration,params_colsample_bytree,params_gamma,params_learning_rate,params_max_depth,params_min_child_weight,params_n_estimators,params_ngramas,params_preprocessing,params_reg_alpha,params_reg_lambda,params_scale_pos_weight,params_subsample,user_attrs_inner_f1_std,system_attrs_fixed_params,system_attrs_tpe:relative_params:0,state
0,0.5791493767292758,2026-10-01 08:31:29.131569,2026-10-01 08:31:29.669004,0 days 00:00:00.537435,0.8198418406640215,5.341713908812194,0.0887371787765412,7,6,200,uni,normal,0.04554056650541418,4.213068640264806,1.369974072661963,0.7976617983906784,0.013972774922853896,"{'preprocessing': 'normal', 'ngramas': 'uni'}",,COMPLETE
1,0.573374509402429,2026-10-01 08:31:29.671011,2026-10-01 08:31:30.981485,0 days 00:00:01.310474,0.6288831792277916,1.8912060355691782,0.013441428574233813,2,6,300,uni_bi,normal,4.66416811964312,0.42014277058045485,1.4103218373962032,0.774299487233649,0.008844805304077087,"{'preprocessing': 'normal', 'ngramas': 'uni_bi'}",,COMPLETE
2,0.5465510679775533,2026-10-01 08:31:30.986000,2026-10-01 08:31:31.935641,0 days 00:00:00.949641,0.7783824805286792,4.647692781759115,0.09380240737581035,2,2,700,uni,stem,5.507356497854536,1.5120359548651754,1.2664180983936855,0.8498767127525279,0.013963413790649998,"{'preprocessing': 'stem', 'ngramas': 'uni'}",,COMPLETE
3,0.5938639724731272,2026-10-01 08:31:31.937651,2026-10-01 08:31:34.271100,0 days 00:00:02.333449,0.876902389058918,6.087089733274703,0.010322706723101325,3,14,450,uni_bi,stem,0.011717684031659526,0.6802324349708322,1.7896058283592255,0.7797437268432061,0.014565614928876395,"{'preprocessing': 'stem', 'ngramas': 'uni_bi'}",,COMPLETE
4,0.5921458997613361,2026-10-01 08:31:34.275620,2026-10-01 08:31:35.056685,0 days 00:00:00.781065,0.6556314620606654,4.039162506093462,0.016873575773608734,3,7,450,uni,lemma,7.504256880623388,0.2162494779824781,1.7713820826482651,0.5990637928482865,0.01559171726931147,"{'preprocessing': 'lemma', 'ngramas': 'uni'}",,COMPLETE
5,0.5778982627602344,2026-10-01 08:31:35.059689,2026-10-01 08:31:37.287670,0 days 00:00:02.227981,0.7271864354075595,3.3972978559015674,0.016133984942950163,3,10,450,uni_bi,lemma,0.0021821680392635975,1.964160459738051,1.9721075178287282,0.5863050837516292,0.013417466868392186,"{'preprocessing': 'lemma', 'ngramas': 'uni_bi'}",,COMPLETE
6,0.5951082687094983,2026-10-01 08:31:37.291685,2026-10-01 08:31:39.624005,0 days 00:00:02.332320,0.85752939177751,6.155404022548753,0.1607579940959742,3,8,600,uni_bi,lemma,1.2526566980575673,10.537000279658317,1.7222234759503365,0.6820029668160755,0.015021902214011338,,,COMPLETE
7,0.5923553427982239,2026-10-01 08:31:39.627017,2026-10-01 08:31:40.810178,0 days 00:00:01.183161,0.8601252063212457,7.377919063730868,0.12210827548434999,5,3,700,uni,lemma,0.007371130115661973,0.8352981135856257,1.817758235373197,0.7209017875367081,0.023959859731224227,,,COMPLETE
8,0.562798605584083,2026-10-01 08:31:40.812185,2026-10-01 08:31:41.931571,0 days 00:00:01.119386,0.7201997696938602,6.498456879243526,0.04168099529637218,7,14,600,uni,normal,0.018159474084619286,0.1227925418626537,2.212503455379453,0.7813200368731505,0.009754353077769144,,,COMPLETE
9,0.49437758068782817,2026-10-01 08:31:41.935920,2026-10-01 08:31:43.440411,0 days 00:00:01.504491,0.6915180251981358,7.871813919440823,0.010100839810949176,2,10,350,uni_bi,normal,0.0060253938800961,0.5573606208674275,2.4651397010975105,0.67088362842534,0.027227009713219622,,,COMPLETE
10,0.5465184472480766,2026-10-01 08:31:43.445421,2026-10-01 08:31:45.374735,0 days 00:00:01.929314,0.546065286468819,4.313731903292889,0.1550003528413438,3,7,600,uni_bi,lemma,4.856409441029773,0.558854667527952,1.1833948766240212,0.6323417754266413,0.02103965968852609,,"{""colsample_bytree"": 0.546065286468819, ""gamma"": 4.313731903292889, ""learning_rate"": 0.1550003528413438, ""max_depth"": 3, ""min_child_weight"": 7, ""n_estimators"": 600, ""ngramas"": ""uni_bi"", ""preprocessing"": ""lemma"", ""reg_alpha"": 4.856409441029773, ""reg_lambda"": 0.558854667527952, ""scale_pos_weight"": 1.1833948766240212, ""subsample"": 0.6323417754266413}",COMPLETE
11,0.5934542515391994,2026-10-01 08:31:45.379748,2026-10-01 08:31:47.903617,0 days 00:00:02.523869,0.838449394765679,5.8544419640440175,0.0390043222756784,2,10,650,uni_bi,lemma,0.06603564352058176,12.362215604232054,1.6258558817172157,0.7395368538988001,0.01921294194276161,,"{""colsample_bytree"": 0.838449394765679, ""gamma"": 5.8544419640440175, ""learning_rate"": 0.0390043222756784, ""max_depth"": 2, ""min_child_weight"": 10, ""n_estimators"": 650, ""ngramas"": ""uni_bi"", ""preprocessing"": ""lemma"", ""reg_alpha"": 0.06603564352058176, ""reg_lambda"": 12.362215604232054, ""scale_pos_weight"": 1.6258558817172157, ""subsample"": 0.7395368538988001}",COMPLETE
12,0.5724206632874488,2026-10-01 08:31:47.908130,2026-10-01 08:31:49.878915,0 days 00:00:01.970785,0.7853698521815574,4.796532519534009,0.038495337632078346,4,9,400,uni_bi,stem,0.010031143006418566,0.23860047707422263,2.0169978091501055,0.6920859987841324,0.01938502143719073,,"{""colsample_bytree"": 0.7853698521815574, ""gamma"": 4.796532519534009, ""learning_rate"": 0.038495337632078346, ""max_depth"": 4, ""min_child_weight"": 9, ""n_estimators"": 400, ""ngramas"": ""uni_bi"", ""preprocessing"": ""stem"", ""reg_alpha"": 0.010031143006418566, ""reg_lambda"": 0.23860047707422263, ""scale_pos_weight"": 2.0169978091501055, ""subsample"": 0.6920859987841324}",COMPLETE
13,0.6018643539923096,2026-10-01 08:31:49.882516,2026-10-01 08:31:52.123126,0 days 00:00:02.240610,0.8253570338566245,5.279423592300987,0.019738339816136503,3,13,550,uni_bi,normal,0.004458576279584504,0.9753390436303053,1.6811725690769117,0.8340488269082247,0.02607485442052187,,"{""colsample_bytree"": 0.8253570338566245, ""gamma"": 5.279423592300987, ""learning_rate"": 0.019738339816136503, ""max_depth"": 3, ""min_child_weight"": 13, ""n_estimators"": 550, ""ngramas"": ""uni_bi"", ""preprocessing"": ""normal"", ""reg_alpha"": 0.004458576279584504, ""reg_lambda"": 0.9753390436303053, ""scale_pos_weight"": 1.6811725690769117, ""subsample"": 0.8340488269082247}",COMPLETE
14,0.5844023427318579,2026-10-01 08:31:52.129150,2026-10-01 08:31:54.040661,0 days 00:00:01.911511,0.838561835391464,5.863273829509723,0.10349750466311397,3,13,450,uni_bi,lemma,1.5940465147090046,16.19658796770475,1.4691102700493441,0.6993672933169878,0.0143077746884312,,"{""colsample_bytree"": 0.838561835391464, ""gamma"": 5.863273829509723, ""learning_rate"": 0.10349750466311397, ""max_depth"": 3, ""min_child_weight"": 13, ""n_estimators"": 450, ""ngramas"": ""uni_bi"", ""preprocessing"": ""lemma"", ""reg_alpha"": 1.5940465147090046, ""reg_lambda"": 16.19658796770475, ""scale_pos_weight"": 1.4691102700493441, ""subsample"": 0.6993672933169878}",COMPLETE
15,0.6027628494341678,2026-10-01 08:31:54.045685,2026-10-01 08:31:56.363903,0 days 00:00:02.318218,0.8802042503956686,6.942296231465392,0.02145507687441899,3,10,550,uni_bi,normal,0.002787674263728601,0.25649391625639717,1.6425812493659397,0.7644833699493548,0.029649715449749897,,"{""colsample_bytree"": 0.8802042503956686, ""gamma"": 6.942296231465392, ""learning_rate"": 0.02145507687441899, ""max_depth"": 3, ""min_child_weight"": 10, ""n_estimators"": 550, ""ngramas"": ""uni_bi"", ""preprocessing"": ""normal"", ""reg_alpha"": 0.002787674263728601, ""reg_lambda"": 0.25649391625639717, ""scale_pos_weight"": 1.6425812493659397, ""subsample"": 0.7644833699493548}",COMPLETE
16,0.5926539667498657,2026-10-01 08:31:56.370420,2026-10-01 08:31:58.479633,0 days 00:00:02.109213,0.7566874162438287,5.504051121259478,0.02621615958324384,4,15,550,uni_bi,normal,0.007309837193238539,3.7793195732489506,1.5211525681802203,0.7703877369868471,0.01433555343160628,,"{""colsample_bytree"": 0.7566874162438287, ""gamma"": 5.504051121259478, ""learning_rate"": 0.02621615958324384, ""max_depth"": 4, ""min_child_weight"": 15, ""n_estimators"": 550, ""ngramas"": ""uni_bi"", ""preprocessing"": ""normal"", ""reg_alpha"": 0.007309837193238539, ""reg_lambda"": 3.7793195732489506, ""scale_pos_weight"": 1.5211525681802203, ""subsample"": 0.7703877369868471}",COMPLETE
17,0.6034088691301002,2026-10-01 08:31:58.485027,2026-10-01 08:32:00.681337,0 days 00:00:02.196310,0.70533490352145,4.057681256895114,0.01133538697099614,2,12,550,uni_bi,normal,0.0014375771634218414,1.4763427225165828,1.8213426631872494,0.842820279150492,0.017041190751375473,,"{""colsample_bytree"": 0.70533490352145, ""gamma"": 4.057681256895114, ""learning_rate"": 0.01133538697099614, ""max_depth"": 2, ""min_child_weight"": 12, ""n_estimators"": 550, ""ngramas"": ""uni_bi"", ""preprocessing"": ""normal"", ""reg_alpha"": 0.0014375771634218414, ""reg_lambda"": 1.4763427225165828, ""scale_pos_weight"": 1.8213426631872494, ""subsample"": 0.842820279150492}",COMPLETE
18,0.577474230475791,2026-10-01 08:32:00.686567,2026-10-01 08:32:02.145869,0 days 00:00:01.459302,0.6947733522788584,6.691330210749085,0.021801886939671427,5,13,350,uni_bi,normal,0.03254607876464115,0.5588341901826454,1.392706138907452,0.8221631851657757,0.014647778860864038,,"{""colsample_bytree"": 0.6947733522788584, ""gamma"": 6.691330210749085, ""learning_rate"": 0.021801886939671427, ""max_depth"": 5, ""min_child_weight"": 13, ""n_estimators"": 350, ""ngramas"": ""uni_bi"", ""preprocessing"": ""normal"", ""reg_alpha"": 0.03254607876464115, ""reg_lambda"": 0.5588341901826454, ""scale_pos_weight"": 1.392706138907452, ""subsample"": 0.8221631851657757}",COMPLETE
19,0.6011056382464574,2026-10-01 08:32:02.151522,2026-10-01 08:32:03.877467,0 days 00:00:01.725945,0.6187594215504896,4.985491605894141,0.014092003387940068,2,11,450,uni_bi,normal,0.0015976258697999687,0.26144424150865553,1.7413632542595883,0.8541274584559684,0.023001159624517764,,"{""colsample_bytree"": 0.6187594215504896, ""gamma"": 4.985491605894141, ""learning_rate"": 0.014092003387940068, ""max_depth"": 2, ""min_child_weight"": 11, ""n_estimators"": 450, ""ngramas"": ""uni_bi"", ""preprocessing"": ""normal"", ""reg_alpha"": 0.0015976258697999687, ""reg_lambda"": 0.26144424150865553, ""scale_pos_weight"": 1.7413632542595883, ""subsample"": 0.8541274584559684}",COMPLETE
20,0.6067802168762082,2026-10-01 08:32:03.882949,2026-10-01 08:32:05.676599,0 days 00:00:01.793650,0.67622908909174,3.568585682723999,0.01859288223185068,2,8,450,uni_bi,normal,0.012477606478163513,0.9938878948796769,1.648170243388684,0.8014893882798426,0.022818187199480762,,"{""colsample_bytree"": 0.67622908909174, ""gamma"": 3.568585682723999, ""learning_rate"": 0.01859288223185068, ""max_depth"": 2, ""min_child_weight"": 8, ""n_estimators"": 450, ""ngramas"": ""uni_bi"", ""preprocessing"": ""normal"", ""reg_alpha"": 0.012477606478163513, ""reg_lambda"": 0.9938878948796769, ""scale_pos_weight"": 1.648170243388684, ""subsample"": 0.8014893882798426}",COMPLETE
21,0.6015644310159558,2026-10-01 08:32:05.683643,2026-10-01 08:32:07.190984,0 days 00:00:01.507341,0.6125509792754156,3.881054912518266,0.026639598351935585,2,10,400,uni_bi,normal,0.004119599543969645,1.6504427695027082,1.553149317119645,0.7798102868795992,0.022289887243670498,,"{""colsample_bytree"": 0.6125509792754156, ""gamma"": 3.881054912518266, ""learning_rate"": 0.026639598351935585, ""max_depth"": 2, ""min_child_weight"": 10, ""n_estimators"": 400, ""ngramas"": ""uni_bi"", ""preprocessing"": ""normal"", ""reg_alpha"": 0.004119599543969645, ""reg_lambda"": 1.6504427695027082, ""scale_pos_weight"": 1.553149317119645, ""subsample"": 0.7798102868795992}",COMPLETE
22,0.5982945547277138,2026-10-01 08:32:07.196007,2026-10-01 08:32:09.433903,0 days 00:00:02.237896,0.7059824607717717,5.626512471061595,0.014198026876974577,2,10,600,uni_bi,normal,0.003915573682396501,2.69638158007508,1.9248739821986465,0.8703867256860977,0.009959827334616447,,"{""colsample_bytree"": 0.7059824607717717, ""gamma"": 5.626512471061595, ""learning_rate"": 0.014198026876974577, ""max_depth"": 2, ""min_child_weight"": 10, ""n_estimators"": 600, ""ngramas"": ""uni_bi"", ""preprocessing"": ""normal"", ""reg_alpha"": 0.003915573682396501, ""reg_lambda"": 2.69638158007508, ""scale_pos_weight"": 1.9248739821986465, ""subsample"": 0.8703867256860977}",COMPLETE
23,0.5687766678497527,2026-10-01 08:32:09.439912,2026-10-01 08:32:11.999850,0 days 00:00:02.559938,0.8995318735447493,6.726104393921009,0.013671879782515531,3,13,600,uni_bi,normal,0.004419379261126909,0.34798612339348206,2.0694822755795586,0.8851473519936678,0.018876466107706047,,"{""colsample_bytree"": 0.8995318735447493, ""gamma"": 6.726104393921009, ""learning_rate"": 0.013671879782515531, ""max_depth"": 3, ""min_child_weight"": 13, ""n_estimators"": 600, ""ngramas"": ""uni_bi"", ""preprocessing"": ""normal"", ""reg_alpha"": 0.004419379261126909, ""reg_lambda"": 0.34798612339348206, ""scale_pos_weight"": 2.0694822755795586, ""subsample"": 0.8851473519936678}",COMPLETE
24,0.5991571136316953,2026-10-01 08:32:12.006237,2026-10-01 08:32:13.972136,0 days 00:00:01.965899,0.6603603746889629,3.9820305094793143,0.012037048095178802,2,12,500,uni_bi,normal,0.0020989890612678357,1.0475371220551146,1.8802400329448974,0.7807452651720854,0.01267554225334076,,"{""colsample_bytree"": 0.6603603746889629, ""gamma"": 3.9820305094793143, ""learning_rate"": 0.012037048095178802, ""max_depth"": 2, ""min_child_weight"": 12, ""n_estimators"": 500, ""ngramas"": ""uni_bi"", ""preprocessing"": ""normal"", ""reg_alpha"": 0.0020989890612678357, ""reg_lambda"": 1.0475371220551146, ""scale_pos_weight"": 1.8802400329448974, ""subsample"": 0.7807452651720854}",COMPLETE
25,0.6041447733226403,2026-10-01 08:32:13.979870,2026-10-01 08:32:15.927120,0 days 00:00:01.947250,0.6919940366256131,5.140368278746762,0.018219466926690416,2,9,500,uni_bi,normal,0.021622293633485615,1.582976622136048,1.776912767648556,0.6979447398695434,0.019713487157751706,,"{""colsample_bytree"": 0.6919940366256131, ""gamma"": 5.140368278746762, ""learning_rate"": 0.018219466926690416, ""max_depth"": 2, ""min_child_weight"": 9, ""n_estimators"": 500, ""ngramas"": ""uni_bi"", ""preprocessing"": ""normal"", ""reg_alpha"": 0.021622293633485615, ""reg_lambda"": 1.582976622136048, ""scale_pos_weight"": 1.776912767648556, ""subsample"": 0.6979447398695434}",COMPLETE
26,0.6033553653142926,2026-10-01 08:32:15.933645,2026-10-01 08:32:18.352173,0 days 00:00:02.418528,0.6950408406618812,2.1704312538942006,0.012766255515095078,3,10,550,uni_bi,normal,0.02296410060302676,0.9475031665968771,1.6968124569238583,0.894615974790268,0.01897113025933231,,"{""colsample_bytree"": 0.6950408406618812, ""gamma"": 2.1704312538942006, ""learning_rate"": 0.012766255515095078, ""max_depth"": 3, ""min_child_weight"": 10, ""n_estimators"": 550, ""ngramas"": ""uni_bi"", ""preprocessing"": ""normal"", ""reg_alpha"": 0.02296410060302676, ""reg_lambda"": 0.9475031665968771, ""scale_pos_weight"": 1.6968124569238583, ""subsample"": 0.894615974790268}",COMPLETE
27,0.5894489905646113,2026-10-01 08:32:18.358173,2026-10-01 08:32:20.433969,0 days 00:00:02.075796,0.8028996786176278,3.404484584110212,0.013230646322457764,3,12,450,uni_bi,normal,0.004499440917127708,3.3307923049347226,1.5022202312356407,0.8607065581734499,0.01384273753405172,,"{""colsample_bytree"": 0.8028996786176278, ""gamma"": 3.404484584110212, ""learning_rate"": 0.013230646322457764, ""max_depth"": 3, ""min_child_weight"": 12, ""n_estimators"": 450, ""ngramas"": ""uni_bi"", ""preprocessing"": ""normal"", ""reg_alpha"": 0.004499440917127708, ""reg_lambda"": 3.3307923049347226, ""scale_pos_weight"": 1.5022202312356407, ""subsample"": 0.8607065581734499}",COMPLETE
28,0.5969168077717183,2026-10-01 08:32:20.439982,2026-10-01 08:32:21.915172,0 days 00:00:01.475190,0.6199082261173067,3.2487752554959783,0.013779092597923166,2,6,350,uni_bi,normal,0.012223752961130863,1.9270733716644208,1.6862573927853013,0.7888258868827052,0.019364541469657683,,"{""colsample_bytree"": 0.6199082261173067, ""gamma"": 3.2487752554959783, ""learning_rate"": 0.013779092597923166, ""max_depth"": 2, ""min_child_weight"": 6, ""n_estimators"": 350, ""ngramas"": ""uni_bi"", ""preprocessing"": ""normal"", ""reg_alpha"": 0.012223752961130863, ""reg_lambda"": 1.9270733716644208, ""scale_pos_weight"": 1.6862573927853013, ""subsample"": 0.7888258868827052}",COMPLETE
29,0.5995003641589142,2026-10-01 08:32:21.921296,2026-10-01 08:32:24.311916,0 days 00:00:02.390620,0.6628842020334474,4.120329487784649,0.011796007044672286,2,15,650,uni_bi,normal,0.0026163513815067106,2.156890648868511,1.9069791633756343,0.8730413186616773,0.010153438542760363,,"{""colsample_bytree"": 0.6628842020334474, ""gamma"": 4.120329487784649, ""learning_rate"": 0.011796007044672286, ""max_depth"": 2, ""min_child_weight"": 15, ""n_estimators"": 650, ""ngramas"": ""uni_bi"", ""preprocessing"": ""normal"", ""reg_alpha"": 0.0026163513815067106, ""reg_lambda"": 2.156890648868511, ""scale_pos_weight"": 1.9069791633756343, ""subsample"": 0.8730413186616773}",COMPLETE
30,0.6012272001338257,2026-10-01 08:32:24.320123,2026-10-01 08:32:26.575092,0 days 00:00:02.254969,0.725195722069499,5.39427865777742,0.0160677087966827,2,13,600,uni_bi,normal,0.008106051973465773,0.9546240856882104,1.6526876079511885,0.8084285350569043,0.02767715771136626,,"{""colsample_bytree"": 0.725195722069499, ""gamma"": 5.39427865777742, ""learning_rate"": 0.0160677087966827, ""max_depth"": 2, ""min_child_weight"": 13, ""n_estimators"": 600, ""ngramas"": ""uni_bi"", ""preprocessing"": ""normal"", ""reg_alpha"": 0.008106051973465773, ""reg_lambda"": 0.9546240856882104, ""scale_pos_weight"": 1.6526876079511885, ""subsample"": 0.8084285350569043}",COMPLETE
31,0.6014792826446674,2026-10-01 08:32:26.583751,2026-10-01 08:32:28.389004,0 days 00:00:01.805253,0.7020160005459839,2.8536371104714977,0.01774931731971823,3,12,400,uni_bi,normal,0.006027026426281565,0.7154234566324998,1.8717809141720025,0.8513340909452938,0.006407430664677103,,"{""colsample_bytree"": 0.7020160005459839, ""gamma"": 2.8536371104714977, ""learning_rate"": 0.01774931731971823, ""max_depth"": 3, ""min_child_weight"": 12, ""n_estimators"": 400, ""ngramas"": ""uni_bi"", ""preprocessing"": ""normal"", ""reg_alpha"": 0.006027026426281565, ""reg_lambda"": 0.7154234566324998, ""scale_pos_weight"": 1.8717809141720025, ""subsample"": 0.8513340909452938}",COMPLETE
32,0.5962519984517692,2026-10-01 08:32:28.396547,2026-10-01 08:32:30.521243,0 days 00:00:02.124696,0.7088750910237881,5.098219184310156,0.01282501940399747,2,13,550,uni_bi,normal,0.00627347168826204,0.5049158157926104,1.9901448594513365,0.8017037231537819,0.012276778162387095,,"{""colsample_bytree"": 0.7088750910237881, ""gamma"": 5.098219184310156, ""learning_rate"": 0.01282501940399747, ""max_depth"": 2, ""min_child_weight"": 13, ""n_estimators"": 550, ""ngramas"": ""uni_bi"", ""preprocessing"": ""normal"", ""reg_alpha"": 0.00627347168826204, ""reg_lambda"": 0.5049158157926104, ""scale_pos_weight"": 1.9901448594513365, ""subsample"": 0.8017037231537819}",COMPLETE
33,0.5969920066351744,2026-10-01 08:32:30.527254,2026-10-01 08:32:32.813663,0 days 00:00:02.286409,0.7095949295696369,3.280730143202061,0.010083880494049917,3,12,500,uni_bi,normal,0.06506659225138682,0.5550111497228654,1.8445859947271206,0.872174259306019,0.007073876219976836,,"{""colsample_bytree"": 0.7095949295696369, ""gamma"": 3.280730143202061, ""learning_rate"": 0.010083880494049917, ""max_depth"": 3, ""min_child_weight"": 12, ""n_estimators"": 500, ""ngramas"": ""uni_bi"", ""preprocessing"": ""normal"", ""reg_alpha"": 0.06506659225138682, ""reg_lambda"": 0.5550111497228654, ""scale_pos_weight"": 1.8445859947271206, ""subsample"": 0.872174259306019}",COMPLETE
34,0.6040854184426202,2026-10-01 08:32:32.821843,2026-10-01 08:32:34.957366,0 days 00:00:02.135523,0.6178990468539194,2.5849225085173893,0.010929971136105015,2,9,550,uni_bi,normal,0.04207341428954082,2.1717874387637353,1.8558901465032016,0.8801807186184915,0.015888217712940748,,"{""colsample_bytree"": 0.6178990468539194, ""gamma"": 2.5849225085173893, ""learning_rate"": 0.010929971136105015, ""max_depth"": 2, ""min_child_weight"": 9, ""n_estimators"": 550, ""ngramas"": ""uni_bi"", ""preprocessing"": ""normal"", ""reg_alpha"": 0.04207341428954082, ""reg_lambda"": 2.1717874387637353, ""scale_pos_weight"": 1.8558901465032016, ""subsample"": 0.8801807186184915}",COMPLETE
35,0.5969391863118944,2026-10-01 08:32:34.965392,2026-10-01 08:32:37.303381,0 days 00:00:02.337989,0.7090419215559164,4.610269311093177,0.01736729167014443,3,8,550,uni_bi,normal,0.03397258374646006,0.3814928549463126,1.8360869877375592,0.8689574176444237,0.013097102946053749,,"{""colsample_bytree"": 0.7090419215559164, ""gamma"": 4.610269311093177, ""learning_rate"": 0.01736729167014443, ""max_depth"": 3, ""min_child_weight"": 8, ""n_estimators"": 550, ""ngramas"": ""uni_bi"", ""preprocessing"": ""normal"", ""reg_alpha"": 0.03397258374646006, ""reg_lambda"": 0.3814928549463126, ""scale_pos_weight"": 1.8360869877375592, ""subsample"": 0.8689574176444237}",COMPLETE
