number,value,datetime_start,datetime_complete,duration,params_colsample_bytree,params_gamma,params_learning_rate,params_max_depth,params_min_child_weight,params_n_estimators,params_ngramas,params_preprocessing,params_reg_alpha,params_reg_lambda,params_scale_pos_weight,params_subsample,user_attrs_inner_f1_std,system_attrs_fixed_params,system_attrs_tpe:relative_params:0,state
36,0.6249160831345826,2026-10-01 08:39:02.380132,2026-10-01 08:39:05.462888,0 days 00:00:03.082756,0.5989019827470151,4.279310640024577,0.01107472176914641,6,2,500,uni_bi,normal,0.008351753849105241,0.23044231650580968,2.3983268560277793,0.781995010848506,0.02337425055448667,,"{""colsample_bytree"": 0.5989019827470151, ""gamma"": 4.279310640024577, ""learning_rate"": 0.01107472176914641, ""max_depth"": 6, ""min_child_weight"": 2, ""n_estimators"": 500, ""ngramas"": ""uni_bi"", ""preprocessing"": ""normal"", ""reg_alpha"": 0.008351753849105241, ""reg_lambda"": 0.23044231650580968, ""scale_pos_weight"": 2.3983268560277793, ""subsample"": 0.781995010848506}",COMPLETE
37,0.64470876114936,2026-10-01 08:39:05.470422,2026-10-01 08:39:08.718213,0 days 00:00:03.247791,0.503956680300245,4.086064493823393,0.019680518416824742,7,2,650,uni_bi,normal,0.03898043541208,0.45555475035767845,1.9095254238018105,0.8488655337119289,0.01290855704749091,,"{""colsample_bytree"": 0.503956680300245, ""gamma"": 4.086064493823393, ""learning_rate"": 0.019680518416824742, ""max_depth"": 7, ""min_child_weight"": 2, ""n_estimators"": 650, ""ngramas"": ""uni_bi"", ""preprocessing"": ""normal"", ""reg_alpha"": 0.03898043541208, ""reg_lambda"": 0.45555475035767845, ""scale_pos_weight"": 1.9095254238018105, ""subsample"": 0.8488655337119289}",COMPLETE
38,0.626194870496903,2026-10-01 08:39:08.727744,2026-10-01 08:39:11.709581,0 days 00:00:02.981837,0.5402693998041346,3.2499099128775866,0.01614477137223322,7,5,500,uni_bi,normal,0.04531134214209325,0.31899461870643664,2.1269912519779735,0.8923098184304289,0.023055357607467276,,"{""colsample_bytree"": 0.5402693998041346, ""gamma"": 3.2499099128775866, ""learning_rate"": 0.01614477137223322, ""max_depth"": 7, ""min_child_weight"": 5, ""n_estimators"": 500, ""ngramas"": ""uni_bi"", ""preprocessing"": ""normal"", ""reg_alpha"": 0.04531134214209325, ""reg_lambda"": 0.31899461870643664, ""scale_pos_weight"": 2.1269912519779735, ""subsample"": 0.8923098184304289}",COMPLETE
39,0.6472514061985111,2026-10-01 08:39:11.720713,2026-10-01 08:39:15.400045,0 days 00:00:03.679332,0.5467642692744042,3.3036944676365154,0.016088289131381602,7,2,650,uni_bi,normal,0.023992871038499765,0.6557837767004437,1.8691927988855073,0.8126901004240374,0.023135796848845317,,"{""colsample_bytree"": 0.5467642692744042, ""gamma"": 3.3036944676365154, ""learning_rate"": 0.016088289131381602, ""max_depth"": 7, ""min_child_weight"": 2, ""n_estimators"": 650, ""ngramas"": ""uni_bi"", ""preprocessing"": ""normal"", ""reg_alpha"": 0.023992871038499765, ""reg_lambda"": 0.6557837767004437, ""scale_pos_weight"": 1.8691927988855073, ""subsample"": 0.8126901004240374}",COMPLETE
40,0.6397829896716235,2026-10-01 08:39:15.408678,2026-10-01 08:39:19.097220,0 days 00:00:03.688542,0.592655168600394,2.8168479573708796,0.020124134085553608,7,2,600,uni_bi,normal,0.044879598377107324,0.15143161471510602,2.2007745823442826,0.7928024581570553,0.011919151481161044,,"{""colsample_bytree"": 0.592655168600394, ""gamma"": 2.8168479573708796, ""learning_rate"": 0.020124134085553608, ""max_depth"": 7, ""min_child_weight"": 2, ""n_estimators"": 600, ""ngramas"": ""uni_bi"", ""preprocessing"": ""normal"", ""reg_alpha"": 0.044879598377107324, ""reg_lambda"": 0.15143161471510602, ""scale_pos_weight"": 2.2007745823442826, ""subsample"": 0.7928024581570553}",COMPLETE
41,0.646877308732955,2026-10-01 08:39:19.106850,2026-10-01 08:39:23.135784,0 days 00:00:04.028934,0.5408951038808674,4.310042101555942,0.011114672181289231,7,2,700,uni_bi,normal,0.03854751697368546,0.1783587641782702,1.9315603014169156,0.8028158456934713,0.018038761948566143,,"{""colsample_bytree"": 0.5408951038808674, ""gamma"": 4.310042101555942, ""learning_rate"": 0.011114672181289231, ""max_depth"": 7, ""min_child_weight"": 2, ""n_estimators"": 700, ""ngramas"": ""uni_bi"", ""preprocessing"": ""normal"", ""reg_alpha"": 0.03854751697368546, ""reg_lambda"": 0.1783587641782702, ""scale_pos_weight"": 1.9315603014169156, ""subsample"": 0.8028158456934713}",COMPLETE
42,0.6414800651884972,2026-10-01 08:39:23.144377,2026-10-01 08:39:27.092533,0 days 00:00:03.948156,0.551357353548223,2.619255263658853,0.022399565204069192,7,2,700,uni_bi,normal,0.02282809485424586,0.9549205241337456,2.100693279724611,0.8455633443180486,0.014116731580046818,,"{""colsample_bytree"": 0.551357353548223, ""gamma"": 2.619255263658853, ""learning_rate"": 0.022399565204069192, ""max_depth"": 7, ""min_child_weight"": 2, ""n_estimators"": 700, ""ngramas"": ""uni_bi"", ""preprocessing"": ""normal"", ""reg_alpha"": 0.02282809485424586, ""reg_lambda"": 0.9549205241337456, ""scale_pos_weight"": 2.100693279724611, ""subsample"": 0.8455633443180486}",COMPLETE
43,0.650352880704231,2026-10-01 08:39:27.099565,2026-10-01 08:39:30.704148,0 days 00:00:03.604583,0.5628568908629167,3.6952817564068527,0.013250518030968772,6,2,650,uni_bi,normal,0.03756252273619435,1.1725907709620258,1.8810681352334842,0.7556025999676909,0.014681770959620389,,"{""colsample_bytree"": 0.5628568908629167, ""gamma"": 3.6952817564068527, ""learning_rate"": 0.013250518030968772, ""max_depth"": 6, ""min_child_weight"": 2, ""n_estimators"": 650, ""ngramas"": ""uni_bi"", ""preprocessing"": ""normal"", ""reg_alpha"": 0.03756252273619435, ""reg_lambda"": 1.1725907709620258, ""scale_pos_weight"": 1.8810681352334842, ""subsample"": 0.7556025999676909}",COMPLETE
44,0.6410963072110477,2026-10-01 08:39:30.712137,2026-10-01 08:39:34.038429,0 days 00:00:03.326292,0.6080595297872393,3.974254646668631,0.01067246030343493,6,2,550,uni_bi,normal,0.004831977304582734,0.3205169065386699,1.9588913887535226,0.8007625076504004,0.02491103268991069,,"{""colsample_bytree"": 0.6080595297872393, ""gamma"": 3.974254646668631, ""learning_rate"": 0.01067246030343493, ""max_depth"": 6, ""min_child_weight"": 2, ""n_estimators"": 550, ""ngramas"": ""uni_bi"", ""preprocessing"": ""normal"", ""reg_alpha"": 0.004831977304582734, ""reg_lambda"": 0.3205169065386699, ""scale_pos_weight"": 1.9588913887535226, ""subsample"": 0.8007625076504004}",COMPLETE
45,0.6515892746399462,2026-10-01 08:39:34.046500,2026-10-01 08:39:37.701477,0 days 00:00:03.654977,0.5871685196962138,4.1145091844311,0.013250277680455195,6,2,650,uni_bi,normal,0.022364276338380715,0.6176520883495178,1.9184083960827765,0.732031194705894,0.007032529178439416,,"{""colsample_bytree"": 0.5871685196962138, ""gamma"": 4.1145091844311, ""learning_rate"": 0.013250277680455195, ""max_depth"": 6, ""min_child_weight"": 2, ""n_estimators"": 650, ""ngramas"": ""uni_bi"", ""preprocessing"": ""normal"", ""reg_alpha"": 0.022364276338380715, ""reg_lambda"": 0.6176520883495178, ""scale_pos_weight"": 1.9184083960827765, ""subsample"": 0.732031194705894}",COMPLETE
46,0.6291937477525091,2026-10-01 08:39:37.711341,2026-10-01 08:39:41.749867,0 days 00:00:04.038526,0.5916209247218557,2.394957990386352,0.01400572644109705,7,3,650,uni_bi,normal,0.047670966640265516,0.6695144707214259,2.0412554969496015,0.7514915624947844,0.022792110197091837,,"{""colsample_bytree"": 0.5916209247218557, ""gamma"": 2.394957990386352, ""learning_rate"": 0.01400572644109705, ""max_depth"": 7, ""min_child_weight"": 3, ""n_estimators"": 650, ""ngramas"": ""uni_bi"", ""preprocessing"": ""normal"", ""reg_alpha"": 0.047670966640265516, ""reg_lambda"": 0.6695144707214259, ""scale_pos_weight"": 2.0412554969496015, ""subsample"": 0.7514915624947844}",COMPLETE
47,0.6397008928443588,2026-10-01 08:39:41.757967,2026-10-01 08:39:45.652140,0 days 00:00:03.894173,0.536690359755813,3.9084796409465405,0.012327453486445856,7,3,700,uni_bi,normal,0.061917817732945024,0.12211896180683017,2.2861224315219975,0.8274431877279794,0.01499791417789386,,"{""colsample_bytree"": 0.536690359755813, ""gamma"": 3.9084796409465405, ""learning_rate"": 0.012327453486445856, ""max_depth"": 7, ""min_child_weight"": 3, ""n_estimators"": 700, ""ngramas"": ""uni_bi"", ""preprocessing"": ""normal"", ""reg_alpha"": 0.061917817732945024, ""reg_lambda"": 0.12211896180683017, ""scale_pos_weight"": 2.2861224315219975, ""subsample"": 0.8274431877279794}",COMPLETE
48,0.6299387699983346,2026-10-01 08:39:45.661284,2026-10-01 08:39:48.873515,0 days 00:00:03.212231,0.5019917034131424,5.204554516521927,0.012518535557081895,7,3,650,uni_bi,normal,0.07289595854011448,0.19408368798606282,1.9096599943650336,0.8567180624219434,0.021349588211035813,,"{""colsample_bytree"": 0.5019917034131424, ""gamma"": 5.204554516521927, ""learning_rate"": 0.012518535557081895, ""max_depth"": 7, ""min_child_weight"": 3, ""n_estimators"": 650, ""ngramas"": ""uni_bi"", ""preprocessing"": ""normal"", ""reg_alpha"": 0.07289595854011448, ""reg_lambda"": 0.19408368798606282, ""scale_pos_weight"": 1.9096599943650336, ""subsample"": 0.8567180624219434}",COMPLETE
49,0.645899308455129,2026-10-01 08:39:48.884063,2026-10-01 08:39:52.468104,0 days 00:00:03.584041,0.5690377694487893,3.9784645743932354,0.012763914149378299,7,2,600,uni_bi,normal,0.011308645919443073,0.6210360586450258,1.7704174450792773,0.7769734142369875,0.01569274450669349,,"{""colsample_bytree"": 0.5690377694487893, ""gamma"": 3.9784645743932354, ""learning_rate"": 0.012763914149378299, ""max_depth"": 7, ""min_child_weight"": 2, ""n_estimators"": 600, ""ngramas"": ""uni_bi"", ""preprocessing"": ""normal"", ""reg_alpha"": 0.011308645919443073, ""reg_lambda"": 0.6210360586450258, ""scale_pos_weight"": 1.7704174450792773, ""subsample"": 0.7769734142369875}",COMPLETE
