number,value,datetime_start,datetime_complete,duration,params_colsample_bytree,params_gamma,params_learning_rate,params_max_depth,params_min_child_weight,params_n_estimators,params_ngramas,params_preprocessing,params_reg_alpha,params_reg_lambda,params_scale_pos_weight,params_subsample,user_attrs_inner_f1_std,system_attrs_fixed_params,system_attrs_tpe:relative_params:0,state
37,0.6023314170984096,2026-10-01 08:28:20.644604,2026-10-01 08:28:21.467594,0 days 00:00:00.822990,0.546548300024527,1.4837777785214192,0.08982500647722863,6,4,300,uni,stem,0.13614135450806972,0.11136036555442795,2.0522515300642787,0.8178837280460531,0.006824781890452416,,"{""colsample_bytree"": 0.546548300024527, ""gamma"": 1.4837777785214192, ""learning_rate"": 0.08982500647722863, ""max_depth"": 6, ""min_child_weight"": 4, ""n_estimators"": 300, ""ngramas"": ""uni"", ""preprocessing"": ""stem"", ""reg_alpha"": 0.13614135450806972, ""reg_lambda"": 0.11136036555442795, ""scale_pos_weight"": 2.0522515300642787, ""subsample"": 0.8178837280460531}",COMPLETE
38,0.5966243728995603,2026-10-01 08:28:21.475628,2026-10-01 08:28:22.009174,0 days 00:00:00.533546,0.7121858720971241,3.3326699076501214,0.1723364112933299,5,2,200,uni,stem,0.17669686675563837,1.0861472096290476,2.1046053396578013,0.7821230080266441,0.003298864426213648,,"{""colsample_bytree"": 0.7121858720971241, ""gamma"": 3.3326699076501214, ""learning_rate"": 0.1723364112933299, ""max_depth"": 5, ""min_child_weight"": 2, ""n_estimators"": 200, ""ngramas"": ""uni"", ""preprocessing"": ""stem"", ""reg_alpha"": 0.17669686675563837, ""reg_lambda"": 1.0861472096290476, ""scale_pos_weight"": 2.1046053396578013, ""subsample"": 0.7821230080266441}",COMPLETE
39,0.6045764744253086,2026-10-01 08:28:22.017699,2026-10-01 08:28:22.614154,0 days 00:00:00.596455,0.6155629655630767,3.3469457881735067,0.17770371464616533,7,3,300,uni,stem,0.25920062030110724,0.14198144798644668,1.6863558041264044,0.8160964100654154,0.0012257965322479238,,"{""colsample_bytree"": 0.6155629655630767, ""gamma"": 3.3469457881735067, ""learning_rate"": 0.17770371464616533, ""max_depth"": 7, ""min_child_weight"": 3, ""n_estimators"": 300, ""ngramas"": ""uni"", ""preprocessing"": ""stem"", ""reg_alpha"": 0.25920062030110724, ""reg_lambda"": 0.14198144798644668, ""scale_pos_weight"": 1.6863558041264044, ""subsample"": 0.8160964100654154}",COMPLETE
40,0.5938359979989322,2026-10-01 08:28:22.622676,2026-10-01 08:28:23.254650,0 days 00:00:00.631974,0.5717722289212074,2.260110408369258,0.13617719218316893,5,5,300,uni,stem,0.31534940354249635,0.3228436924992302,1.6533633433784516,0.7539267143151954,0.023755389167138253,,"{""colsample_bytree"": 0.5717722289212074, ""gamma"": 2.260110408369258, ""learning_rate"": 0.13617719218316893, ""max_depth"": 5, ""min_child_weight"": 5, ""n_estimators"": 300, ""ngramas"": ""uni"", ""preprocessing"": ""stem"", ""reg_alpha"": 0.31534940354249635, ""reg_lambda"": 0.3228436924992302, ""scale_pos_weight"": 1.6533633433784516, ""subsample"": 0.7539267143151954}",COMPLETE
41,0.57991606259998,2026-10-01 08:28:23.261675,2026-10-01 08:28:24.983851,0 days 00:00:01.722176,0.6984624163633132,0.7599064234829332,0.1759391980398989,7,4,700,uni,stem,0.11783253130658934,0.11395099973473531,1.6681529664574275,0.7322335434372045,0.015741853629398544,,"{""colsample_bytree"": 0.6984624163633132, ""gamma"": 0.7599064234829332, ""learning_rate"": 0.1759391980398989, ""max_depth"": 7, ""min_child_weight"": 4, ""n_estimators"": 700, ""ngramas"": ""uni"", ""preprocessing"": ""stem"", ""reg_alpha"": 0.11783253130658934, ""reg_lambda"": 0.11395099973473531, ""scale_pos_weight"": 1.6681529664574275, ""subsample"": 0.7322335434372045}",COMPLETE
42,0.6026938627240412,2026-10-01 08:28:24.991348,2026-10-01 08:28:25.967313,0 days 00:00:00.975965,0.6089656074363337,2.0771402739428235,0.15687916123455822,7,2,450,uni,stem,0.2864950377006384,0.13311984070231064,2.060366111314978,0.7191106109895475,0.008857812873103275,,"{""colsample_bytree"": 0.6089656074363337, ""gamma"": 2.0771402739428235, ""learning_rate"": 0.15687916123455822, ""max_depth"": 7, ""min_child_weight"": 2, ""n_estimators"": 450, ""ngramas"": ""uni"", ""preprocessing"": ""stem"", ""reg_alpha"": 0.2864950377006384, ""reg_lambda"": 0.13311984070231064, ""scale_pos_weight"": 2.060366111314978, ""subsample"": 0.7191106109895475}",COMPLETE
43,0.6028565843000818,2026-10-01 08:28:25.977165,2026-10-01 08:28:26.701945,0 days 00:00:00.724780,0.6720007544210665,3.792447707353128,0.14088024965525295,6,3,400,uni,stem,0.17171097407368574,0.7272490844694104,1.655753582181576,0.747930572764047,0.020528012642133872,,"{""colsample_bytree"": 0.6720007544210665, ""gamma"": 3.792447707353128, ""learning_rate"": 0.14088024965525295, ""max_depth"": 6, ""min_child_weight"": 3, ""n_estimators"": 400, ""ngramas"": ""uni"", ""preprocessing"": ""stem"", ""reg_alpha"": 0.17171097407368574, ""reg_lambda"": 0.7272490844694104, ""scale_pos_weight"": 1.655753582181576, ""subsample"": 0.747930572764047}",COMPLETE
44,0.6041825983130746,2026-10-01 08:28:26.712091,2026-10-01 08:28:27.943081,0 days 00:00:01.230990,0.6179055341098052,0.9916805349150425,0.13163546654909256,7,2,450,uni,stem,0.3259617872437585,0.11092077775673698,1.8408829980613246,0.7152110950180062,0.007601274025403282,,"{""colsample_bytree"": 0.6179055341098052, ""gamma"": 0.9916805349150425, ""learning_rate"": 0.13163546654909256, ""max_depth"": 7, ""min_child_weight"": 2, ""n_estimators"": 450, ""ngramas"": ""uni"", ""preprocessing"": ""stem"", ""reg_alpha"": 0.3259617872437585, ""reg_lambda"": 0.11092077775673698, ""scale_pos_weight"": 1.8408829980613246, ""subsample"": 0.7152110950180062}",COMPLETE
45,0.6075166318862717,2026-10-01 08:28:27.951612,2026-10-01 08:28:29.207012,0 days 00:00:01.255400,0.6219700912060702,1.1363477589017572,0.12607970493511936,6,2,500,uni,stem,0.024105375669859607,0.10092081579584337,1.6778611177530565,0.7577450142780191,0.0027589385135657475,,"{""colsample_bytree"": 0.6219700912060702, ""gamma"": 1.1363477589017572, ""learning_rate"": 0.12607970493511936, ""max_depth"": 6, ""min_child_weight"": 2, ""n_estimators"": 500, ""ngramas"": ""uni"", ""preprocessing"": ""stem"", ""reg_alpha"": 0.024105375669859607, ""reg_lambda"": 0.10092081579584337, ""scale_pos_weight"": 1.6778611177530565, ""subsample"": 0.7577450142780191}",COMPLETE
46,0.5954448402858163,2026-10-01 08:28:29.215032,2026-10-01 08:28:29.945355,0 days 00:00:00.730323,0.7053734452522626,3.002018968588366,0.14975193478763868,5,3,300,uni,stem,0.015882825992906607,0.45401196263708865,1.9746362621153721,0.7515556090428351,0.011432433299096515,,"{""colsample_bytree"": 0.7053734452522626, ""gamma"": 3.002018968588366, ""learning_rate"": 0.14975193478763868, ""max_depth"": 5, ""min_child_weight"": 3, ""n_estimators"": 300, ""ngramas"": ""uni"", ""preprocessing"": ""stem"", ""reg_alpha"": 0.015882825992906607, ""reg_lambda"": 0.45401196263708865, ""scale_pos_weight"": 1.9746362621153721, ""subsample"": 0.7515556090428351}",COMPLETE
47,0.5867947394395799,2026-10-01 08:28:29.954407,2026-10-01 08:28:31.002195,0 days 00:00:01.047788,0.6046382719850112,0.60389785420103,0.08005052767492495,6,4,350,uni,stem,0.005477119168086316,0.1455867546983575,1.581828645146699,0.7787321795235108,0.013475239409307333,,"{""colsample_bytree"": 0.6046382719850112, ""gamma"": 0.60389785420103, ""learning_rate"": 0.08005052767492495, ""max_depth"": 6, ""min_child_weight"": 4, ""n_estimators"": 350, ""ngramas"": ""uni"", ""preprocessing"": ""stem"", ""reg_alpha"": 0.005477119168086316, ""reg_lambda"": 0.1455867546983575, ""scale_pos_weight"": 1.581828645146699, ""subsample"": 0.7787321795235108}",COMPLETE
48,0.5927417106090936,2026-10-01 08:28:31.009732,2026-10-01 08:28:32.233679,0 days 00:00:01.223947,0.668159452203067,1.5937369300755162,0.13005497166982186,5,3,550,uni,stem,0.017442403683047402,0.2485152913731849,1.8909452246524185,0.714466052679625,0.008421358926772109,,"{""colsample_bytree"": 0.668159452203067, ""gamma"": 1.5937369300755162, ""learning_rate"": 0.13005497166982186, ""max_depth"": 5, ""min_child_weight"": 3, ""n_estimators"": 550, ""ngramas"": ""uni"", ""preprocessing"": ""stem"", ""reg_alpha"": 0.017442403683047402, ""reg_lambda"": 0.2485152913731849, ""scale_pos_weight"": 1.8909452246524185, ""subsample"": 0.714466052679625}",COMPLETE
49,0.5942176965733176,2026-10-01 08:28:32.243921,2026-10-01 08:28:33.223575,0 days 00:00:00.979654,0.5824610641005779,2.139351029652827,0.10020418926359921,7,2,600,uni,stem,2.1144657352695506,2.2304222802222684,1.91436027663629,0.7442485125460305,0.010790765619594312,,"{""colsample_bytree"": 0.5824610641005779, ""gamma"": 2.139351029652827, ""learning_rate"": 0.10020418926359921, ""max_depth"": 7, ""min_child_weight"": 2, ""n_estimators"": 600, ""ngramas"": ""uni"", ""preprocessing"": ""stem"", ""reg_alpha"": 2.1144657352695506, ""reg_lambda"": 2.2304222802222684, ""scale_pos_weight"": 1.91436027663629, ""subsample"": 0.7442485125460305}",COMPLETE
