number,value,datetime_start,datetime_complete,duration,params_colsample_bytree,params_gamma,params_learning_rate,params_max_depth,params_min_child_weight,params_n_estimators,params_ngramas,params_preprocessing,params_reg_alpha,params_reg_lambda,params_scale_pos_weight,params_subsample,user_attrs_inner_f1_std,system_attrs_fixed_params,system_attrs_tpe:relative_params:0,state
37,0.6899489539584732,2026-10-01 08:37:33.770479,2026-10-01 08:37:34.803286,0 days 00:00:01.032807,0.8399128791642141,6.836108103881969,0.13964143780770463,6,2,450,uni,normal,0.014387367574175705,1.6156029674520547,1.5821204579284052,0.8123724716603735,0.01190492085944682,,"{""colsample_bytree"": 0.8399128791642141, ""gamma"": 6.836108103881969, ""learning_rate"": 0.13964143780770463, ""max_depth"": 6, ""min_child_weight"": 2, ""n_estimators"": 450, ""ngramas"": ""uni"", ""preprocessing"": ""normal"", ""reg_alpha"": 0.014387367574175705, ""reg_lambda"": 1.6156029674520547, ""scale_pos_weight"": 1.5821204579284052, ""subsample"": 0.8123724716603735}",COMPLETE
38,0.6760731138650277,2026-10-01 08:37:34.810325,2026-10-01 08:37:36.039146,0 days 00:00:01.228821,0.8230174038171898,7.432445544344614,0.14111890738368504,6,7,600,uni,normal,0.025395231390893152,0.10284753166242093,1.5939929123368353,0.7833010054670101,0.017278854031999028,,"{""colsample_bytree"": 0.8230174038171898, ""gamma"": 7.432445544344614, ""learning_rate"": 0.14111890738368504, ""max_depth"": 6, ""min_child_weight"": 7, ""n_estimators"": 600, ""ngramas"": ""uni"", ""preprocessing"": ""normal"", ""reg_alpha"": 0.025395231390893152, ""reg_lambda"": 0.10284753166242093, ""scale_pos_weight"": 1.5939929123368353, ""subsample"": 0.7833010054670101}",COMPLETE
39,0.6801704921605901,2026-10-01 08:37:36.046686,2026-10-01 08:37:37.204558,0 days 00:00:01.157872,0.8422315800160235,6.076900037006423,0.17753978350087357,7,5,550,uni,normal,0.00849717319252535,1.1880048702974824,1.525423354169647,0.8036141044843513,0.015605873839503822,,"{""colsample_bytree"": 0.8422315800160235, ""gamma"": 6.076900037006423, ""learning_rate"": 0.17753978350087357, ""max_depth"": 7, ""min_child_weight"": 5, ""n_estimators"": 550, ""ngramas"": ""uni"", ""preprocessing"": ""normal"", ""reg_alpha"": 0.00849717319252535, ""reg_lambda"": 1.1880048702974824, ""scale_pos_weight"": 1.525423354169647, ""subsample"": 0.8036141044843513}",COMPLETE
40,0.6719313775657193,2026-10-01 08:37:37.213082,2026-10-01 08:37:38.529194,0 days 00:00:01.316112,0.8490209092800721,5.519020285260237,0.1429836818183278,5,2,600,uni,normal,0.0386956490283103,1.197204651161813,1.7882293960387035,0.6969985720306144,0.01434666080169886,,"{""colsample_bytree"": 0.8490209092800721, ""gamma"": 5.519020285260237, ""learning_rate"": 0.1429836818183278, ""max_depth"": 5, ""min_child_weight"": 2, ""n_estimators"": 600, ""ngramas"": ""uni"", ""preprocessing"": ""normal"", ""reg_alpha"": 0.0386956490283103, ""reg_lambda"": 1.197204651161813, ""scale_pos_weight"": 1.7882293960387035, ""subsample"": 0.6969985720306144}",COMPLETE
41,0.6960768178209555,2026-10-01 08:37:38.537344,2026-10-01 08:37:39.624326,0 days 00:00:01.086982,0.8662940896172828,7.247143985219829,0.07184939289363687,6,3,650,uni,stem,0.0012685844109961806,5.869542939319684,1.3416280350965095,0.6520508207460295,0.009069599748688121,,"{""colsample_bytree"": 0.8662940896172828, ""gamma"": 7.247143985219829, ""learning_rate"": 0.07184939289363687, ""max_depth"": 6, ""min_child_weight"": 3, ""n_estimators"": 650, ""ngramas"": ""uni"", ""preprocessing"": ""stem"", ""reg_alpha"": 0.0012685844109961806, ""reg_lambda"": 5.869542939319684, ""scale_pos_weight"": 1.3416280350965095, ""subsample"": 0.6520508207460295}",COMPLETE
42,0.6751524472153573,2026-10-01 08:37:39.633599,2026-10-01 08:37:40.977885,0 days 00:00:01.344286,0.8542667698194836,5.403708438433543,0.15813139245631913,6,4,600,uni,normal,0.008059238060545914,0.23707023437457894,1.521908710063688,0.7102671983465682,0.019607377060592457,,"{""colsample_bytree"": 0.8542667698194836, ""gamma"": 5.403708438433543, ""learning_rate"": 0.15813139245631913, ""max_depth"": 6, ""min_child_weight"": 4, ""n_estimators"": 600, ""ngramas"": ""uni"", ""preprocessing"": ""normal"", ""reg_alpha"": 0.008059238060545914, ""reg_lambda"": 0.23707023437457894, ""scale_pos_weight"": 1.521908710063688, ""subsample"": 0.7102671983465682}",COMPLETE
43,0.6845728431045884,2026-10-01 08:37:40.986509,2026-10-01 08:37:41.937821,0 days 00:00:00.951312,0.8994681702266736,7.541249205400674,0.07899892811819649,7,3,550,uni,stem,0.001583069842588108,12.071895389878742,1.3367370259559173,0.6101533253240831,0.008481971805366313,,"{""colsample_bytree"": 0.8994681702266736, ""gamma"": 7.541249205400674, ""learning_rate"": 0.07899892811819649, ""max_depth"": 7, ""min_child_weight"": 3, ""n_estimators"": 550, ""ngramas"": ""uni"", ""preprocessing"": ""stem"", ""reg_alpha"": 0.001583069842588108, ""reg_lambda"": 12.071895389878742, ""scale_pos_weight"": 1.3367370259559173, ""subsample"": 0.6101533253240831}",COMPLETE
44,0.6817989453061871,2026-10-01 08:37:41.946344,2026-10-01 08:37:43.010705,0 days 00:00:01.064361,0.8211663604529224,7.139527814395345,0.0548015574028356,6,5,650,uni,stem,0.0024329226757272516,6.505169672844723,1.2481422126449189,0.6516035850748472,0.002928906490367735,,"{""colsample_bytree"": 0.8211663604529224, ""gamma"": 7.139527814395345, ""learning_rate"": 0.0548015574028356, ""max_depth"": 6, ""min_child_weight"": 5, ""n_estimators"": 650, ""ngramas"": ""uni"", ""preprocessing"": ""stem"", ""reg_alpha"": 0.0024329226757272516, ""reg_lambda"": 6.505169672844723, ""scale_pos_weight"": 1.2481422126449189, ""subsample"": 0.6516035850748472}",COMPLETE
45,0.6836990934397575,2026-10-01 08:37:43.019046,2026-10-01 08:37:44.320444,0 days 00:00:01.301398,0.8621095958702275,6.2356037631084185,0.15167310776945706,6,2,600,uni,normal,0.0032196569240323563,0.6010995955068451,1.6368295147125829,0.7287173725109102,0.014542518051975263,,"{""colsample_bytree"": 0.8621095958702275, ""gamma"": 6.2356037631084185, ""learning_rate"": 0.15167310776945706, ""max_depth"": 6, ""min_child_weight"": 2, ""n_estimators"": 600, ""ngramas"": ""uni"", ""preprocessing"": ""normal"", ""reg_alpha"": 0.0032196569240323563, ""reg_lambda"": 0.6010995955068451, ""scale_pos_weight"": 1.6368295147125829, ""subsample"": 0.7287173725109102}",COMPLETE
46,0.6892974254628218,2026-10-01 08:37:44.329471,2026-10-01 08:37:45.338102,0 days 00:00:01.008631,0.81468922829145,5.821611776729816,0.14325160593661104,6,2,450,uni,normal,0.02011770439580299,6.437520410270671,1.6048953273290936,0.8205414246490496,0.022393881034227927,,"{""colsample_bytree"": 0.81468922829145, ""gamma"": 5.821611776729816, ""learning_rate"": 0.14325160593661104, ""max_depth"": 6, ""min_child_weight"": 2, ""n_estimators"": 450, ""ngramas"": ""uni"", ""preprocessing"": ""normal"", ""reg_alpha"": 0.02011770439580299, ""reg_lambda"": 6.437520410270671, ""scale_pos_weight"": 1.6048953273290936, ""subsample"": 0.8205414246490496}",COMPLETE
47,0.6819450422457457,2026-10-01 08:37:45.346624,2026-10-01 08:37:46.493798,0 days 00:00:01.147174,0.7748331220285808,5.846567743466538,0.18505611885580683,6,2,550,uni,normal,0.00802242102421375,0.6674753045139807,1.4372520121108991,0.7884169382393624,0.00533799963061641,,"{""colsample_bytree"": 0.7748331220285808, ""gamma"": 5.846567743466538, ""learning_rate"": 0.18505611885580683, ""max_depth"": 6, ""min_child_weight"": 2, ""n_estimators"": 550, ""ngramas"": ""uni"", ""preprocessing"": ""normal"", ""reg_alpha"": 0.00802242102421375, ""reg_lambda"": 0.6674753045139807, ""scale_pos_weight"": 1.4372520121108991, ""subsample"": 0.7884169382393624}",COMPLETE
48,0.6781815749574783,2026-10-01 08:37:46.503227,2026-10-01 08:37:47.685784,0 days 00:00:01.182557,0.8776920400007023,6.256738422756153,0.18885012358655462,5,4,550,uni,normal,0.028666182633025727,1.4258732719078755,1.544247436789468,0.7175519387367418,0.020166597213609475,,"{""colsample_bytree"": 0.8776920400007023, ""gamma"": 6.256738422756153, ""learning_rate"": 0.18885012358655462, ""max_depth"": 5, ""min_child_weight"": 4, ""n_estimators"": 550, ""ngramas"": ""uni"", ""preprocessing"": ""normal"", ""reg_alpha"": 0.028666182633025727, ""reg_lambda"": 1.4258732719078755, ""scale_pos_weight"": 1.544247436789468, ""subsample"": 0.7175519387367418}",COMPLETE
49,0.6842184780066626,2026-10-01 08:37:47.694305,2026-10-01 08:37:48.968725,0 days 00:00:01.274420,0.8928169368580141,7.922305213300364,0.18134282620514322,6,3,600,uni,normal,0.014010435704041372,1.2451028672113529,1.6169515274251272,0.7702284772914103,0.018390830923304433,,"{""colsample_bytree"": 0.8928169368580141, ""gamma"": 7.922305213300364, ""learning_rate"": 0.18134282620514322, ""max_depth"": 6, ""min_child_weight"": 3, ""n_estimators"": 600, ""ngramas"": ""uni"", ""preprocessing"": ""normal"", ""reg_alpha"": 0.014010435704041372, ""reg_lambda"": 1.2451028672113529, ""scale_pos_weight"": 1.6169515274251272, ""subsample"": 0.7702284772914103}",COMPLETE
