number,value,datetime_start,datetime_complete,duration,params_colsample_bytree,params_gamma,params_learning_rate,params_max_depth,params_min_child_weight,params_n_estimators,params_ngramas,params_preprocessing,params_reg_alpha,params_reg_lambda,params_scale_pos_weight,params_subsample,user_attrs_inner_f1_std,system_attrs_fixed_params,system_attrs_tpe:relative_params:0,state
36,0.6414498051629471,2026-10-01 08:44:19.914811,2026-10-01 08:44:23.099624,0 days 00:00:03.184813,0.516147569544459,5.089231113221602,0.020933733144672177,7,2,550,uni_bi,lemma,0.02006605188888041,0.28040272476546185,2.1584319455975187,0.665732419784981,0.021762568100226698,,"{""colsample_bytree"": 0.516147569544459, ""gamma"": 5.089231113221602, ""learning_rate"": 0.020933733144672177, ""max_depth"": 7, ""min_child_weight"": 2, ""n_estimators"": 550, ""ngramas"": ""uni_bi"", ""preprocessing"": ""lemma"", ""reg_alpha"": 0.02006605188888041, ""reg_lambda"": 0.28040272476546185, ""scale_pos_weight"": 2.1584319455975187, ""subsample"": 0.665732419784981}",COMPLETE
37,0.639200817573331,2026-10-01 08:44:23.107155,2026-10-01 08:44:25.968196,0 days 00:00:02.861041,0.6694872689652582,5.0785095591171725,0.029113919133741426,7,2,450,uni_bi,lemma,0.03718262271220732,0.18193365878059112,2.171975432008394,0.6185462043309404,0.014181409909887933,,"{""colsample_bytree"": 0.6694872689652582, ""gamma"": 5.0785095591171725, ""learning_rate"": 0.029113919133741426, ""max_depth"": 7, ""min_child_weight"": 2, ""n_estimators"": 450, ""ngramas"": ""uni_bi"", ""preprocessing"": ""lemma"", ""reg_alpha"": 0.03718262271220732, ""reg_lambda"": 0.18193365878059112, ""scale_pos_weight"": 2.171975432008394, ""subsample"": 0.6185462043309404}",COMPLETE
38,0.6391209789243908,2026-10-01 08:44:25.976446,2026-10-01 08:44:28.457049,0 days 00:00:02.480603,0.6205730379525168,4.935179181154866,0.019582073839061152,7,3,350,uni_bi,lemma,0.005414997516824357,0.9319182795706324,1.959841203144826,0.6896256407656319,0.02450611448953367,,"{""colsample_bytree"": 0.6205730379525168, ""gamma"": 4.935179181154866, ""learning_rate"": 0.019582073839061152, ""max_depth"": 7, ""min_child_weight"": 3, ""n_estimators"": 350, ""ngramas"": ""uni_bi"", ""preprocessing"": ""lemma"", ""reg_alpha"": 0.005414997516824357, ""reg_lambda"": 0.9319182795706324, ""scale_pos_weight"": 1.959841203144826, ""subsample"": 0.6896256407656319}",COMPLETE
39,0.6429554742527162,2026-10-01 08:44:28.465002,2026-10-01 08:44:32.079022,0 days 00:00:03.614020,0.5900628192702213,3.9928359897162,0.012478079826386856,7,2,500,uni_bi,lemma,0.001585752161639275,0.7208842254702622,2.172319135192804,0.677770609267678,0.02200123451489966,,"{""colsample_bytree"": 0.5900628192702213, ""gamma"": 3.9928359897162, ""learning_rate"": 0.012478079826386856, ""max_depth"": 7, ""min_child_weight"": 2, ""n_estimators"": 500, ""ngramas"": ""uni_bi"", ""preprocessing"": ""lemma"", ""reg_alpha"": 0.001585752161639275, ""reg_lambda"": 0.7208842254702622, ""scale_pos_weight"": 2.172319135192804, ""subsample"": 0.677770609267678}",COMPLETE
40,0.6347182557733547,2026-10-01 08:44:32.088314,2026-10-01 08:44:35.128253,0 days 00:00:03.039939,0.631935561591764,4.643843105217728,0.011577044947542563,7,3,400,uni_bi,lemma,0.005464523704973614,0.23125650369216122,2.0928168564204594,0.6023855346990385,0.01998225724668937,,"{""colsample_bytree"": 0.631935561591764, ""gamma"": 4.643843105217728, ""learning_rate"": 0.011577044947542563, ""max_depth"": 7, ""min_child_weight"": 3, ""n_estimators"": 400, ""ngramas"": ""uni_bi"", ""preprocessing"": ""lemma"", ""reg_alpha"": 0.005464523704973614, ""reg_lambda"": 0.23125650369216122, ""scale_pos_weight"": 2.0928168564204594, ""subsample"": 0.6023855346990385}",COMPLETE
41,0.6390725267119814,2026-10-01 08:44:35.136522,2026-10-01 08:44:38.695627,0 days 00:00:03.559105,0.5605563834288818,3.957339022836021,0.012615465888443677,6,3,550,uni_bi,lemma,0.0012228764245528698,1.3647420098181102,2.043839406404423,0.640444838369052,0.01598585027955905,,"{""colsample_bytree"": 0.5605563834288818, ""gamma"": 3.957339022836021, ""learning_rate"": 0.012615465888443677, ""max_depth"": 6, ""min_child_weight"": 3, ""n_estimators"": 550, ""ngramas"": ""uni_bi"", ""preprocessing"": ""lemma"", ""reg_alpha"": 0.0012228764245528698, ""reg_lambda"": 1.3647420098181102, ""scale_pos_weight"": 2.043839406404423, ""subsample"": 0.640444838369052}",COMPLETE
42,0.6307000704199474,2026-10-01 08:44:38.704030,2026-10-01 08:44:42.123863,0 days 00:00:03.419833,0.6337641680938145,5.007291037568837,0.010343443786327738,7,2,450,uni_bi,lemma,0.005181210683697102,1.3038252008402227,2.1860814174073235,0.6780547262079177,0.014080659085987284,,"{""colsample_bytree"": 0.6337641680938145, ""gamma"": 5.007291037568837, ""learning_rate"": 0.010343443786327738, ""max_depth"": 7, ""min_child_weight"": 2, ""n_estimators"": 450, ""ngramas"": ""uni_bi"", ""preprocessing"": ""lemma"", ""reg_alpha"": 0.005181210683697102, ""reg_lambda"": 1.3038252008402227, ""scale_pos_weight"": 2.1860814174073235, ""subsample"": 0.6780547262079177}",COMPLETE
43,0.6465219272562318,2026-10-01 08:44:42.132009,2026-10-01 08:44:45.035689,0 days 00:00:02.903680,0.5826189928965452,3.190435717668035,0.016062199512129338,6,2,400,uni_bi,lemma,0.005438946214690958,0.8999967880356071,2.063072739721207,0.6594441618468685,0.02473710591835484,,"{""colsample_bytree"": 0.5826189928965452, ""gamma"": 3.190435717668035, ""learning_rate"": 0.016062199512129338, ""max_depth"": 6, ""min_child_weight"": 2, ""n_estimators"": 400, ""ngramas"": ""uni_bi"", ""preprocessing"": ""lemma"", ""reg_alpha"": 0.005438946214690958, ""reg_lambda"": 0.8999967880356071, ""scale_pos_weight"": 2.063072739721207, ""subsample"": 0.6594441618468685}",COMPLETE
44,0.6369394696533287,2026-10-01 08:44:45.043991,2026-10-01 08:44:47.823512,0 days 00:00:02.779521,0.5028470606860859,4.989755974268996,0.01689877962288591,6,3,450,uni_bi,lemma,0.0029281409830740185,0.2275708972326802,2.148217192875881,0.6160245754789235,0.017593546332861806,,"{""colsample_bytree"": 0.5028470606860859, ""gamma"": 4.989755974268996, ""learning_rate"": 0.01689877962288591, ""max_depth"": 6, ""min_child_weight"": 3, ""n_estimators"": 450, ""ngramas"": ""uni_bi"", ""preprocessing"": ""lemma"", ""reg_alpha"": 0.0029281409830740185, ""reg_lambda"": 0.2275708972326802, ""scale_pos_weight"": 2.148217192875881, ""subsample"": 0.6160245754789235}",COMPLETE
45,0.6335101682044061,2026-10-01 08:44:47.831533,2026-10-01 08:44:50.951312,0 days 00:00:03.119779,0.6470687577023033,3.435767825206189,0.01194407810828516,7,3,400,uni_bi,lemma,0.016263264231167553,0.5141333291596051,2.228929959688771,0.6097555811259207,0.013587979556477482,,"{""colsample_bytree"": 0.6470687577023033, ""gamma"": 3.435767825206189, ""learning_rate"": 0.01194407810828516, ""max_depth"": 7, ""min_child_weight"": 3, ""n_estimators"": 400, ""ngramas"": ""uni_bi"", ""preprocessing"": ""lemma"", ""reg_alpha"": 0.016263264231167553, ""reg_lambda"": 0.5141333291596051, ""scale_pos_weight"": 2.228929959688771, ""subsample"": 0.6097555811259207}",COMPLETE
46,0.6415608127646552,2026-10-01 08:44:50.959882,2026-10-01 08:44:53.830791,0 days 00:00:02.870909,0.5829569451458011,4.180657187635503,0.021578875780183852,6,2,450,uni_bi,lemma,0.008687100249136236,1.0379353676668195,1.9317686337353719,0.6699339564905015,0.021268382616746656,,"{""colsample_bytree"": 0.5829569451458011, ""gamma"": 4.180657187635503, ""learning_rate"": 0.021578875780183852, ""max_depth"": 6, ""min_child_weight"": 2, ""n_estimators"": 450, ""ngramas"": ""uni_bi"", ""preprocessing"": ""lemma"", ""reg_alpha"": 0.008687100249136236, ""reg_lambda"": 1.0379353676668195, ""scale_pos_weight"": 1.9317686337353719, ""subsample"": 0.6699339564905015}",COMPLETE
47,0.6392469517493177,2026-10-01 08:44:53.841150,2026-10-01 08:44:56.551572,0 days 00:00:02.710422,0.5612920546999707,5.5536009902676255,0.015312637624266138,7,3,400,uni_bi,lemma,0.007124095325933334,0.14725080252641398,2.1120140337592916,0.6791530155294567,0.010813552114748366,,"{""colsample_bytree"": 0.5612920546999707, ""gamma"": 5.5536009902676255, ""learning_rate"": 0.015312637624266138, ""max_depth"": 7, ""min_child_weight"": 3, ""n_estimators"": 400, ""ngramas"": ""uni_bi"", ""preprocessing"": ""lemma"", ""reg_alpha"": 0.007124095325933334, ""reg_lambda"": 0.14725080252641398, ""scale_pos_weight"": 2.1120140337592916, ""subsample"": 0.6791530155294567}",COMPLETE
48,0.6390754907621963,2026-10-01 08:44:56.560680,2026-10-01 08:44:59.528818,0 days 00:00:02.968138,0.60066743356961,5.489201680421264,0.018556793246932015,7,3,500,uni_bi,lemma,0.0011231710978901127,0.5141144451540329,1.8727280826095916,0.6312338782632174,0.022201191760525013,,"{""colsample_bytree"": 0.60066743356961, ""gamma"": 5.489201680421264, ""learning_rate"": 0.018556793246932015, ""max_depth"": 7, ""min_child_weight"": 3, ""n_estimators"": 500, ""ngramas"": ""uni_bi"", ""preprocessing"": ""lemma"", ""reg_alpha"": 0.0011231710978901127, ""reg_lambda"": 0.5141144451540329, ""scale_pos_weight"": 1.8727280826095916, ""subsample"": 0.6312338782632174}",COMPLETE
49,0.631542983259493,2026-10-01 08:44:59.537652,2026-10-01 08:45:02.528582,0 days 00:00:02.990930,0.527613334060426,4.011824607763047,0.01772034969416767,7,2,450,uni_bi,lemma,0.01239697803954433,0.3268829356130765,2.274010234401211,0.5535013507851001,0.01156036702587648,,"{""colsample_bytree"": 0.527613334060426, ""gamma"": 4.011824607763047, ""learning_rate"": 0.01772034969416767, ""max_depth"": 7, ""min_child_weight"": 2, ""n_estimators"": 450, ""ngramas"": ""uni_bi"", ""preprocessing"": ""lemma"", ""reg_alpha"": 0.01239697803954433, ""reg_lambda"": 0.3268829356130765, ""scale_pos_weight"": 2.274010234401211, ""subsample"": 0.5535013507851001}",COMPLETE
