number,value,datetime_start,datetime_complete,duration,params_colsample_bytree,params_gamma,params_learning_rate,params_max_depth,params_min_child_weight,params_n_estimators,params_ngramas,params_preprocessing,params_reg_alpha,params_reg_lambda,params_scale_pos_weight,params_subsample,user_attrs_inner_f1_std,system_attrs_fixed_params,system_attrs_tpe:relative_params:0,state
37,0.6863162642177256,2026-10-01 08:33:45.705773,2026-10-01 08:33:46.557227,0 days 00:00:00.851454,0.8756451121517481,7.605060231778211,0.06632889427207848,3,2,350,uni,normal,0.00904308276271171,0.10725635772415587,1.4819288897742031,0.8797283968564916,0.006670316366677665,,"{""colsample_bytree"": 0.8756451121517481, ""gamma"": 7.605060231778211, ""learning_rate"": 0.06632889427207848, ""max_depth"": 3, ""min_child_weight"": 2, ""n_estimators"": 350, ""ngramas"": ""uni"", ""preprocessing"": ""normal"", ""reg_alpha"": 0.00904308276271171, ""reg_lambda"": 0.10725635772415587, ""scale_pos_weight"": 1.4819288897742031, ""subsample"": 0.8797283968564916}",COMPLETE
38,0.6858489980278498,2026-10-01 08:33:46.565242,2026-10-01 08:33:47.061906,0 days 00:00:00.496664,0.8508321938852587,6.88306883576409,0.13425569836023546,4,4,150,uni,normal,0.0036697505598512065,0.27251105051746916,1.7561144561213058,0.8688998360768682,0.019654903052926376,,"{""colsample_bytree"": 0.8508321938852587, ""gamma"": 6.88306883576409, ""learning_rate"": 0.13425569836023546, ""max_depth"": 4, ""min_child_weight"": 4, ""n_estimators"": 150, ""ngramas"": ""uni"", ""preprocessing"": ""normal"", ""reg_alpha"": 0.0036697505598512065, ""reg_lambda"": 0.27251105051746916, ""scale_pos_weight"": 1.7561144561213058, ""subsample"": 0.8688998360768682}",COMPLETE
39,0.6807400877745106,2026-10-01 08:33:47.071161,2026-10-01 08:33:47.615392,0 days 00:00:00.544231,0.8583584099276886,7.921494057836952,0.02650936954509985,3,5,150,uni,normal,0.0160855988068911,0.22003225901204665,1.7079433620920768,0.8388815826518337,0.023340895630619227,,"{""colsample_bytree"": 0.8583584099276886, ""gamma"": 7.921494057836952, ""learning_rate"": 0.02650936954509985, ""max_depth"": 3, ""min_child_weight"": 5, ""n_estimators"": 150, ""ngramas"": ""uni"", ""preprocessing"": ""normal"", ""reg_alpha"": 0.0160855988068911, ""reg_lambda"": 0.22003225901204665, ""scale_pos_weight"": 1.7079433620920768, ""subsample"": 0.8388815826518337}",COMPLETE
40,0.6932403402516343,2026-10-01 08:33:47.621041,2026-10-01 08:33:48.153240,0 days 00:00:00.532199,0.869980093651524,7.423395048852353,0.08227180444504834,4,2,150,uni,normal,0.0030559804087206587,0.27692693078803227,1.790204835111479,0.89070683365568,0.01724865320630717,,"{""colsample_bytree"": 0.869980093651524, ""gamma"": 7.423395048852353, ""learning_rate"": 0.08227180444504834, ""max_depth"": 4, ""min_child_weight"": 2, ""n_estimators"": 150, ""ngramas"": ""uni"", ""preprocessing"": ""normal"", ""reg_alpha"": 0.0030559804087206587, ""reg_lambda"": 0.27692693078803227, ""scale_pos_weight"": 1.790204835111479, ""subsample"": 0.89070683365568}",COMPLETE
41,0.684664749281208,2026-10-01 08:33:48.160896,2026-10-01 08:33:48.666709,0 days 00:00:00.505813,0.8085898857427177,7.569893913983382,0.07548820862734332,3,3,150,uni,normal,0.0028627431980431783,0.18880736663323663,1.893330337589692,0.880218766448187,0.01922869918565694,,"{""colsample_bytree"": 0.8085898857427177, ""gamma"": 7.569893913983382, ""learning_rate"": 0.07548820862734332, ""max_depth"": 3, ""min_child_weight"": 3, ""n_estimators"": 150, ""ngramas"": ""uni"", ""preprocessing"": ""normal"", ""reg_alpha"": 0.0028627431980431783, ""reg_lambda"": 0.18880736663323663, ""scale_pos_weight"": 1.893330337589692, ""subsample"": 0.880218766448187}",COMPLETE
42,0.6900520612836037,2026-10-01 08:33:48.676082,2026-10-01 08:33:49.261018,0 days 00:00:00.584936,0.8916658087152106,7.691724624772495,0.05641251937320431,4,2,150,uni,normal,0.001685320704474897,0.4634306614778729,1.6160203996536724,0.8629707540463645,0.018005042525910345,,"{""colsample_bytree"": 0.8916658087152106, ""gamma"": 7.691724624772495, ""learning_rate"": 0.05641251937320431, ""max_depth"": 4, ""min_child_weight"": 2, ""n_estimators"": 150, ""ngramas"": ""uni"", ""preprocessing"": ""normal"", ""reg_alpha"": 0.001685320704474897, ""reg_lambda"": 0.4634306614778729, ""scale_pos_weight"": 1.6160203996536724, ""subsample"": 0.8629707540463645}",COMPLETE
43,0.6951336905687132,2026-10-01 08:33:49.270061,2026-10-01 08:33:50.097128,0 days 00:00:00.827067,0.8599440772626952,6.847813578634069,0.10247615875096772,4,3,300,uni,normal,0.0017207130046780139,0.2741014690081569,1.5824232707459682,0.8856656961832943,0.018177934494135788,,"{""colsample_bytree"": 0.8599440772626952, ""gamma"": 6.847813578634069, ""learning_rate"": 0.10247615875096772, ""max_depth"": 4, ""min_child_weight"": 3, ""n_estimators"": 300, ""ngramas"": ""uni"", ""preprocessing"": ""normal"", ""reg_alpha"": 0.0017207130046780139, ""reg_lambda"": 0.2741014690081569, ""scale_pos_weight"": 1.5824232707459682, ""subsample"": 0.8856656961832943}",COMPLETE
44,0.694022847084517,2026-10-01 08:33:50.105025,2026-10-01 08:33:50.854682,0 days 00:00:00.749657,0.8722586940181543,6.493604938499262,0.05301341156612857,4,2,250,uni,normal,0.001020126742984709,0.22142015664596848,1.5055086770672257,0.8287696643627213,0.01666393385385048,,"{""colsample_bytree"": 0.8722586940181543, ""gamma"": 6.493604938499262, ""learning_rate"": 0.05301341156612857, ""max_depth"": 4, ""min_child_weight"": 2, ""n_estimators"": 250, ""ngramas"": ""uni"", ""preprocessing"": ""normal"", ""reg_alpha"": 0.001020126742984709, ""reg_lambda"": 0.22142015664596848, ""scale_pos_weight"": 1.5055086770672257, ""subsample"": 0.8287696643627213}",COMPLETE
45,0.6907603010899347,2026-10-01 08:33:50.861468,2026-10-01 08:33:51.416108,0 days 00:00:00.554640,0.854554269844124,6.620384694593862,0.06445544201077563,4,3,150,uni,normal,0.003997296045030007,0.29022829540513423,1.8289713628740505,0.8900650723965675,0.026718962858837948,,"{""colsample_bytree"": 0.854554269844124, ""gamma"": 6.620384694593862, ""learning_rate"": 0.06445544201077563, ""max_depth"": 4, ""min_child_weight"": 3, ""n_estimators"": 150, ""ngramas"": ""uni"", ""preprocessing"": ""normal"", ""reg_alpha"": 0.003997296045030007, ""reg_lambda"": 0.29022829540513423, ""scale_pos_weight"": 1.8289713628740505, ""subsample"": 0.8900650723965675}",COMPLETE
46,0.6937810204496344,2026-10-01 08:33:51.426018,2026-10-01 08:33:52.089074,0 days 00:00:00.663056,0.8770034568618494,7.144405115586616,0.130342242405211,4,3,250,uni,normal,0.0010734458992134365,0.12438337475622437,1.5502501987485842,0.8797365573589064,0.025190656029232466,,"{""colsample_bytree"": 0.8770034568618494, ""gamma"": 7.144405115586616, ""learning_rate"": 0.130342242405211, ""max_depth"": 4, ""min_child_weight"": 3, ""n_estimators"": 250, ""ngramas"": ""uni"", ""preprocessing"": ""normal"", ""reg_alpha"": 0.0010734458992134365, ""reg_lambda"": 0.12438337475622437, ""scale_pos_weight"": 1.5502501987485842, ""subsample"": 0.8797365573589064}",COMPLETE
47,0.6889364841227108,2026-10-01 08:33:52.097622,2026-10-01 08:33:52.671424,0 days 00:00:00.573802,0.8851011966573672,7.12875207637488,0.18640137763306044,4,2,200,uni,normal,0.005550568396820667,0.19808282961780338,1.6782193445295939,0.8975614272049539,0.023017118879641297,,"{""colsample_bytree"": 0.8851011966573672, ""gamma"": 7.12875207637488, ""learning_rate"": 0.18640137763306044, ""max_depth"": 4, ""min_child_weight"": 2, ""n_estimators"": 200, ""ngramas"": ""uni"", ""preprocessing"": ""normal"", ""reg_alpha"": 0.005550568396820667, ""reg_lambda"": 0.19808282961780338, ""scale_pos_weight"": 1.6782193445295939, ""subsample"": 0.8975614272049539}",COMPLETE
48,0.6814484275562682,2026-10-01 08:33:52.678219,2026-10-01 08:33:53.442970,0 days 00:00:00.764751,0.8793758690659561,6.937386986167865,0.1328556236947508,3,4,300,uni,normal,0.0020622968984362437,0.27981046039793994,1.7639894126791522,0.8215584120252865,0.025852930938313166,,"{""colsample_bytree"": 0.8793758690659561, ""gamma"": 6.937386986167865, ""learning_rate"": 0.1328556236947508, ""max_depth"": 3, ""min_child_weight"": 4, ""n_estimators"": 300, ""ngramas"": ""uni"", ""preprocessing"": ""normal"", ""reg_alpha"": 0.0020622968984362437, ""reg_lambda"": 0.27981046039793994, ""scale_pos_weight"": 1.7639894126791522, ""subsample"": 0.8215584120252865}",COMPLETE
49,0.6807061849204935,2026-10-01 08:33:53.452016,2026-10-01 08:33:54.123508,0 days 00:00:00.671492,0.8688828651587313,6.068535708568184,0.13468684562609384,4,2,250,uni,normal,0.0013454028852854392,0.17514930832311162,1.292661572284034,0.8621836094551134,0.01403156256737995,,"{""colsample_bytree"": 0.8688828651587313, ""gamma"": 6.068535708568184, ""learning_rate"": 0.13468684562609384, ""max_depth"": 4, ""min_child_weight"": 2, ""n_estimators"": 250, ""ngramas"": ""uni"", ""preprocessing"": ""normal"", ""reg_alpha"": 0.0013454028852854392, ""reg_lambda"": 0.17514930832311162, ""scale_pos_weight"": 1.292661572284034, ""subsample"": 0.8621836094551134}",COMPLETE
