number,value,datetime_start,datetime_complete,duration,params_colsample_bytree,params_gamma,params_learning_rate,params_max_depth,params_min_child_weight,params_n_estimators,params_ngramas,params_preprocessing,params_reg_alpha,params_reg_lambda,params_scale_pos_weight,params_subsample,user_attrs_inner_f1_std,system_attrs_fixed_params,system_attrs_tpe:relative_params:0,state
0,0.5451504431547539,2026-10-01 08:27:39.040911,2026-10-01 08:27:39.944505,0 days 00:00:00.903594,0.8436549963794391,5.495676598235193,0.014912334799978505,5,5,200,uni,normal,0.1460995401984744,0.11661695042823148,2.1006224444204245,0.6644986695338989,0.03214876724943705,"{'preprocessing': 'normal', 'ngramas': 'uni'}",,COMPLETE
1,0.5643734546888316,2026-10-01 08:27:39.947513,2026-10-01 08:27:41.932371,0 days 00:00:01.984858,0.5884115983537486,3.5374208603544477,0.021429375567205422,6,2,350,uni_bi,normal,0.01838170889617177,0.15010776969324383,2.264837041344557,0.8533270243147202,0.022758504573142734,"{'preprocessing': 'normal', 'ngramas': 'uni_bi'}",,COMPLETE
2,0.5739799635839602,2026-10-01 08:27:41.935624,2026-10-01 08:27:43.076740,0 days 00:00:01.141116,0.7678898606887231,1.1187503727286656,0.0317239257884236,7,15,650,uni,stem,3.876094171803447,0.4849701336699878,1.393457233894572,0.7060154262939016,0.02431936956675906,"{'preprocessing': 'stem', 'ngramas': 'uni'}",,COMPLETE
3,0.5154130938787556,2026-10-01 08:27:43.079762,2026-10-01 08:27:44.033624,0 days 00:00:00.953862,0.8634651031324352,7.326148068351174,0.0415685752358692,5,10,150,uni_bi,stem,0.12618934451314417,0.17352047335193588,1.2713718928868514,0.8923714469287022,0.012902859563598604,"{'preprocessing': 'stem', 'ngramas': 'uni_bi'}",,COMPLETE
4,0.5188302238995912,2026-10-01 08:27:44.038654,2026-10-01 08:27:45.011905,0 days 00:00:00.973251,0.6102235106595808,7.22560452305647,0.13347908492973548,4,11,700,uni,lemma,0.006723036752122265,0.8522138632181322,2.490358738591155,0.7700750285587564,0.016952045019357154,"{'preprocessing': 'lemma', 'ngramas': 'uni'}",,COMPLETE
5,0.5622487468062434,2026-10-01 08:27:45.016441,2026-10-01 08:27:47.059242,0 days 00:00:02.042801,0.6596787543616299,5.526088735267864,0.05363392753815193,4,7,550,uni_bi,lemma,0.6589651263273641,2.5270599675396843,1.810051696272484,0.8044457971887959,0.021781590742565967,"{'preprocessing': 'lemma', 'ngramas': 'uni_bi'}",,COMPLETE
6,0.5667106586186962,2026-10-01 08:27:47.062990,2026-10-01 08:27:48.516098,0 days 00:00:01.453108,0.7352416170633504,2.3400743972251985,0.03353974378857238,2,6,300,uni_bi,lemma,0.9796759510335362,4.540242377729664,2.0428913004326397,0.6351893056983369,0.02410323746812313,,,COMPLETE
7,0.6063095847195864,2026-10-01 08:27:48.518101,2026-10-01 08:27:49.711375,0 days 00:00:01.193274,0.6165690758694432,0.9779042623798591,0.19922157744046312,7,2,500,uni,stem,0.1898880329986574,0.10272988230855988,1.9169163845050325,0.7184561667093609,0.017583248110832703,,,COMPLETE
8,0.5478024400703978,2026-10-01 08:27:49.715373,2026-10-01 08:27:50.722364,0 days 00:00:01.006991,0.5413410043512618,4.175822458017969,0.021469546007741834,7,8,400,uni,lemma,0.0015094461003314766,0.521271708121548,2.1280595295490374,0.7659279415373134,0.024839259292581226,,,COMPLETE
9,0.5572325595235642,2026-10-01 08:27:50.726505,2026-10-01 08:27:52.637201,0 days 00:00:01.910696,0.7392752546328507,3.7452355967270012,0.15855739027695478,7,13,450,uni_bi,stem,0.5978449195497908,1.3040016804653507,1.1923905123641099,0.6879692992859042,0.013666823552644692,,,COMPLETE
10,0.5681769252450878,2026-10-01 08:27:52.642815,2026-10-01 08:27:53.507261,0 days 00:00:00.864446,0.7560630792990303,3.4242052711943964,0.1034660224378086,5,8,450,uni,stem,0.00284390413614949,1.5700630846881987,1.8469011321591582,0.6402670461504556,0.005416127401259913,,"{""colsample_bytree"": 0.7560630792990303, ""gamma"": 3.4242052711943964, ""learning_rate"": 0.1034660224378086, ""max_depth"": 5, ""min_child_weight"": 8, ""n_estimators"": 450, ""ngramas"": ""uni"", ""preprocessing"": ""stem"", ""reg_alpha"": 0.00284390413614949, ""reg_lambda"": 1.5700630846881987, ""scale_pos_weight"": 1.8469011321591582, ""subsample"": 0.6402670461504556}",COMPLETE
11,0.6046496736242906,2026-10-01 08:27:53.511270,2026-10-01 08:27:54.911028,0 days 00:00:01.399758,0.737533842810827,1.3292152820040823,0.03804219706614932,7,2,400,uni,stem,0.09019416850083548,0.4696832929084579,2.0359637501148944,0.7191011960894823,0.011019400004575524,,"{""colsample_bytree"": 0.737533842810827, ""gamma"": 1.3292152820040823, ""learning_rate"": 0.03804219706614932, ""max_depth"": 7, ""min_child_weight"": 2, ""n_estimators"": 400, ""ngramas"": ""uni"", ""preprocessing"": ""stem"", ""reg_alpha"": 0.09019416850083548, ""reg_lambda"": 0.4696832929084579, ""scale_pos_weight"": 2.0359637501148944, ""subsample"": 0.7191011960894823}",COMPLETE
12,0.5918322170495326,2026-10-01 08:27:54.915038,2026-10-01 08:27:56.083759,0 days 00:00:01.168721,0.6920747590074551,0.6546711970561477,0.1557468056771745,6,3,500,uni,stem,1.187577342587818,0.5911775257288125,1.7686226734183754,0.8016274261823584,0.006954046582265967,,"{""colsample_bytree"": 0.6920747590074551, ""gamma"": 0.6546711970561477, ""learning_rate"": 0.1557468056771745, ""max_depth"": 6, ""min_child_weight"": 3, ""n_estimators"": 500, ""ngramas"": ""uni"", ""preprocessing"": ""stem"", ""reg_alpha"": 1.187577342587818, ""reg_lambda"": 0.5911775257288125, ""scale_pos_weight"": 1.7686226734183754, ""subsample"": 0.8016274261823584}",COMPLETE
13,0.5646782124908097,2026-10-01 08:27:56.087380,2026-10-01 08:27:56.923885,0 days 00:00:00.836505,0.6022181828012564,2.235834171863689,0.11574505005514792,7,9,450,uni,stem,0.10278847213080484,0.1358644323474598,1.9398253540327355,0.7971309259966329,0.012397039749235613,,"{""colsample_bytree"": 0.6022181828012564, ""gamma"": 2.235834171863689, ""learning_rate"": 0.11574505005514792, ""max_depth"": 7, ""min_child_weight"": 9, ""n_estimators"": 450, ""ngramas"": ""uni"", ""preprocessing"": ""stem"", ""reg_alpha"": 0.10278847213080484, ""reg_lambda"": 0.1358644323474598, ""scale_pos_weight"": 1.9398253540327355, ""subsample"": 0.7971309259966329}",COMPLETE
14,0.5895533015802229,2026-10-01 08:27:56.928902,2026-10-01 08:27:58.732835,0 days 00:00:01.803933,0.745201784512767,0.7581497990230541,0.013675976053925412,6,4,600,uni,stem,0.026654585646235268,0.34756218711414844,2.1508497274605376,0.6681894423657069,0.01213512810837496,,"{""colsample_bytree"": 0.745201784512767, ""gamma"": 0.7581497990230541, ""learning_rate"": 0.013675976053925412, ""max_depth"": 6, ""min_child_weight"": 4, ""n_estimators"": 600, ""ngramas"": ""uni"", ""preprocessing"": ""stem"", ""reg_alpha"": 0.026654585646235268, ""reg_lambda"": 0.34756218711414844, ""scale_pos_weight"": 2.1508497274605376, ""subsample"": 0.6681894423657069}",COMPLETE
15,0.5814389716539886,2026-10-01 08:27:58.735849,2026-10-01 08:28:00.237434,0 days 00:00:01.501585,0.6581899611916892,0.8562154291842753,0.053605093297169434,7,6,500,uni,stem,0.027796406197810316,0.2092974399284562,2.3438315021483227,0.7212049789412289,0.016761778170443803,,"{""colsample_bytree"": 0.6581899611916892, ""gamma"": 0.8562154291842753, ""learning_rate"": 0.053605093297169434, ""max_depth"": 7, ""min_child_weight"": 6, ""n_estimators"": 500, ""ngramas"": ""uni"", ""preprocessing"": ""stem"", ""reg_alpha"": 0.027796406197810316, ""reg_lambda"": 0.2092974399284562, ""scale_pos_weight"": 2.3438315021483227, ""subsample"": 0.7212049789412289}",COMPLETE
16,0.602888956461308,2026-10-01 08:28:00.241446,2026-10-01 08:28:01.216861,0 days 00:00:00.975415,0.7620370009012645,2.946603300872499,0.03354616644633191,5,3,350,uni,stem,0.06324982542622433,0.18396342206430286,1.7769722977376141,0.8035902186945644,0.008465197434349916,,"{""colsample_bytree"": 0.7620370009012645, ""gamma"": 2.946603300872499, ""learning_rate"": 0.03354616644633191, ""max_depth"": 5, ""min_child_weight"": 3, ""n_estimators"": 350, ""ngramas"": ""uni"", ""preprocessing"": ""stem"", ""reg_alpha"": 0.06324982542622433, ""reg_lambda"": 0.18396342206430286, ""scale_pos_weight"": 1.7769722977376141, ""subsample"": 0.8035902186945644}",COMPLETE
17,0.5855353227430894,2026-10-01 08:28:01.223403,2026-10-01 08:28:02.067435,0 days 00:00:00.844032,0.619742237593646,2.8941621380819558,0.17593552973093796,7,6,500,uni,stem,0.31216592115649994,0.5889822904831848,2.250175177334325,0.7545722423372021,0.01636009300246069,,"{""colsample_bytree"": 0.619742237593646, ""gamma"": 2.8941621380819558, ""learning_rate"": 0.17593552973093796, ""max_depth"": 7, ""min_child_weight"": 6, ""n_estimators"": 500, ""ngramas"": ""uni"", ""preprocessing"": ""stem"", ""reg_alpha"": 0.31216592115649994, ""reg_lambda"": 0.5889822904831848, ""scale_pos_weight"": 2.250175177334325, ""subsample"": 0.7545722423372021}",COMPLETE
18,0.5881288234509244,2026-10-01 08:28:02.074053,2026-10-01 08:28:03.097321,0 days 00:00:01.023268,0.7775233600603138,1.8952690104514676,0.06300078171402827,7,4,300,uni,stem,0.020156555176619264,1.8282449206529936,2.0574911771290796,0.6279107836170409,0.010882452931483964,,"{""colsample_bytree"": 0.7775233600603138, ""gamma"": 1.8952690104514676, ""learning_rate"": 0.06300078171402827, ""max_depth"": 7, ""min_child_weight"": 4, ""n_estimators"": 300, ""ngramas"": ""uni"", ""preprocessing"": ""stem"", ""reg_alpha"": 0.020156555176619264, ""reg_lambda"": 1.8282449206529936, ""scale_pos_weight"": 2.0574911771290796, ""subsample"": 0.6279107836170409}",COMPLETE
19,0.5971166947658385,2026-10-01 08:28:03.101327,2026-10-01 08:28:04.451289,0 days 00:00:01.349962,0.7139241940701876,3.6925052020439675,0.031387052467630225,7,2,450,uni,stem,0.027749685667904773,0.25079043505118614,2.00514012583883,0.7610300967401785,0.01095435065433027,,"{""colsample_bytree"": 0.7139241940701876, ""gamma"": 3.6925052020439675, ""learning_rate"": 0.031387052467630225, ""max_depth"": 7, ""min_child_weight"": 2, ""n_estimators"": 450, ""ngramas"": ""uni"", ""preprocessing"": ""stem"", ""reg_alpha"": 0.027749685667904773, ""reg_lambda"": 0.25079043505118614, ""scale_pos_weight"": 2.00514012583883, ""subsample"": 0.7610300967401785}",COMPLETE
20,0.6034810240700758,2026-10-01 08:28:04.457351,2026-10-01 08:28:05.388751,0 days 00:00:00.931400,0.709469151642732,2.643994975063361,0.17809751324474757,6,2,500,uni,stem,0.5272196503883934,0.5460847564411163,1.825047409635095,0.6769199167004283,0.012393909964630469,,"{""colsample_bytree"": 0.709469151642732, ""gamma"": 2.643994975063361, ""learning_rate"": 0.17809751324474757, ""max_depth"": 6, ""min_child_weight"": 2, ""n_estimators"": 500, ""ngramas"": ""uni"", ""preprocessing"": ""stem"", ""reg_alpha"": 0.5272196503883934, ""reg_lambda"": 0.5460847564411163, ""scale_pos_weight"": 1.825047409635095, ""subsample"": 0.6769199167004283}",COMPLETE
21,0.6100495516382365,2026-10-01 08:28:05.394771,2026-10-01 08:28:06.125560,0 days 00:00:00.730789,0.6579655043110203,3.4757974377762215,0.12784060217540152,6,2,350,uni,stem,0.11672437918440413,0.8110435138533653,1.7862510069409807,0.7823502255927506,0.00536065141383987,,"{""colsample_bytree"": 0.6579655043110203, ""gamma"": 3.4757974377762215, ""learning_rate"": 0.12784060217540152, ""max_depth"": 6, ""min_child_weight"": 2, ""n_estimators"": 350, ""ngramas"": ""uni"", ""preprocessing"": ""stem"", ""reg_alpha"": 0.11672437918440413, ""reg_lambda"": 0.8110435138533653, ""scale_pos_weight"": 1.7862510069409807, ""subsample"": 0.7823502255927506}",COMPLETE
22,0.5912970257844135,2026-10-01 08:28:06.131828,2026-10-01 08:28:07.246643,0 days 00:00:01.114815,0.6013812249301695,1.034791475891323,0.18517773183007194,7,3,400,uni,stem,0.011706834186437153,0.27123675620549353,1.9833397896829172,0.6880686925594365,0.009122263288672326,,"{""colsample_bytree"": 0.6013812249301695, ""gamma"": 1.034791475891323, ""learning_rate"": 0.18517773183007194, ""max_depth"": 7, ""min_child_weight"": 3, ""n_estimators"": 400, ""ngramas"": ""uni"", ""preprocessing"": ""stem"", ""reg_alpha"": 0.011706834186437153, ""reg_lambda"": 0.27123675620549353, ""scale_pos_weight"": 1.9833397896829172, ""subsample"": 0.6880686925594365}",COMPLETE
23,0.5886179405234399,2026-10-01 08:28:07.252187,2026-10-01 08:28:08.763196,0 days 00:00:01.511009,0.7237642820219615,1.1934979993270087,0.05344420125903092,7,3,450,uni,stem,0.039519058002831606,1.620931209549745,1.6704859507816638,0.7517612733933736,0.01760091852072913,,"{""colsample_bytree"": 0.7237642820219615, ""gamma"": 1.1934979993270087, ""learning_rate"": 0.05344420125903092, ""max_depth"": 7, ""min_child_weight"": 3, ""n_estimators"": 450, ""ngramas"": ""uni"", ""preprocessing"": ""stem"", ""reg_alpha"": 0.039519058002831606, ""reg_lambda"": 1.620931209549745, ""scale_pos_weight"": 1.6704859507816638, ""subsample"": 0.7517612733933736}",COMPLETE
24,0.5792400004481845,2026-10-01 08:28:08.769219,2026-10-01 08:28:10.049655,0 days 00:00:01.280436,0.760332540582564,0.7239690550107025,0.18859840399832659,6,3,450,uni,stem,0.15413266791476696,0.18421075520435237,1.975372276290484,0.7145801128232576,0.010811293188409735,,"{""colsample_bytree"": 0.760332540582564, ""gamma"": 0.7239690550107025, ""learning_rate"": 0.18859840399832659, ""max_depth"": 6, ""min_child_weight"": 3, ""n_estimators"": 450, ""ngramas"": ""uni"", ""preprocessing"": ""stem"", ""reg_alpha"": 0.15413266791476696, ""reg_lambda"": 0.18421075520435237, ""scale_pos_weight"": 1.975372276290484, ""subsample"": 0.7145801128232576}",COMPLETE
25,0.6113766415183303,2026-10-01 08:28:10.055748,2026-10-01 08:28:11.191627,0 days 00:00:01.135879,0.5391702947289692,1.8628533227424193,0.09282296845318676,6,2,550,uni,stem,0.8625752497394977,0.6684863826849675,1.9623999505465044,0.7378196933976532,0.007283753662316486,,"{""colsample_bytree"": 0.5391702947289692, ""gamma"": 1.8628533227424193, ""learning_rate"": 0.09282296845318676, ""max_depth"": 6, ""min_child_weight"": 2, ""n_estimators"": 550, ""ngramas"": ""uni"", ""preprocessing"": ""stem"", ""reg_alpha"": 0.8625752497394977, ""reg_lambda"": 0.6684863826849675, ""scale_pos_weight"": 1.9623999505465044, ""subsample"": 0.7378196933976532}",COMPLETE
26,0.5800767637795454,2026-10-01 08:28:11.197644,2026-10-01 08:28:11.960761,0 days 00:00:00.763117,0.5008481114755148,2.498980381368745,0.10191228652643396,6,4,550,uni,stem,3.6168500605851484,4.100229058915761,1.8723462185952757,0.7432017138650373,0.0048498484534144435,,"{""colsample_bytree"": 0.5008481114755148, ""gamma"": 2.498980381368745, ""learning_rate"": 0.10191228652643396, ""max_depth"": 6, ""min_child_weight"": 4, ""n_estimators"": 550, ""ngramas"": ""uni"", ""preprocessing"": ""stem"", ""reg_alpha"": 3.6168500605851484, ""reg_lambda"": 4.100229058915761, ""scale_pos_weight"": 1.8723462185952757, ""subsample"": 0.7432017138650373}",COMPLETE
27,0.5915127558792023,2026-10-01 08:28:11.968803,2026-10-01 08:28:13.028567,0 days 00:00:01.059764,0.5979063155280716,1.50597717408803,0.12291545372560503,6,3,500,uni,stem,0.6105165508218511,0.5368720679805893,1.8911630367279433,0.7278909722708005,0.014635107852667932,,"{""colsample_bytree"": 0.5979063155280716, ""gamma"": 1.50597717408803, ""learning_rate"": 0.12291545372560503, ""max_depth"": 6, ""min_child_weight"": 3, ""n_estimators"": 500, ""ngramas"": ""uni"", ""preprocessing"": ""stem"", ""reg_alpha"": 0.6105165508218511, ""reg_lambda"": 0.5368720679805893, ""scale_pos_weight"": 1.8911630367279433, ""subsample"": 0.7278909722708005}",COMPLETE
28,0.6154842585906316,2026-10-01 08:28:13.036612,2026-10-01 08:28:13.802391,0 days 00:00:00.765779,0.6089507800880731,2.3542844243426444,0.13504684057077604,6,2,300,uni,stem,0.1273009651042833,0.11558395633723663,1.8536916353334685,0.7902350949353221,0.011669977058159732,,"{""colsample_bytree"": 0.6089507800880731, ""gamma"": 2.3542844243426444, ""learning_rate"": 0.13504684057077604, ""max_depth"": 6, ""min_child_weight"": 2, ""n_estimators"": 300, ""ngramas"": ""uni"", ""preprocessing"": ""stem"", ""reg_alpha"": 0.1273009651042833, ""reg_lambda"": 0.11558395633723663, ""scale_pos_weight"": 1.8536916353334685, ""subsample"": 0.7902350949353221}",COMPLETE
29,0.6063030632107661,2026-10-01 08:28:13.810958,2026-10-01 08:28:15.053340,0 days 00:00:01.242382,0.5962587031693709,1.9044529388146025,0.05378626665201647,7,2,400,uni,stem,0.045519038194453396,1.3584749278910204,1.8958555566985322,0.7351935673556709,0.010092565065685379,,"{""colsample_bytree"": 0.5962587031693709, ""gamma"": 1.9044529388146025, ""learning_rate"": 0.05378626665201647, ""max_depth"": 7, ""min_child_weight"": 2, ""n_estimators"": 400, ""ngramas"": ""uni"", ""preprocessing"": ""stem"", ""reg_alpha"": 0.045519038194453396, ""reg_lambda"": 1.3584749278910204, ""scale_pos_weight"": 1.8958555566985322, ""subsample"": 0.7351935673556709}",COMPLETE
30,0.6145179492652643,2026-10-01 08:28:15.059357,2026-10-01 08:28:15.683653,0 days 00:00:00.624296,0.6663365406472717,3.8965362674642545,0.1540495226587541,5,2,300,uni,stem,0.221434083779094,0.798053694783248,1.8214997030100308,0.7752443669180508,0.0016523282957855811,,"{""colsample_bytree"": 0.6663365406472717, ""gamma"": 3.8965362674642545, ""learning_rate"": 0.1540495226587541, ""max_depth"": 5, ""min_child_weight"": 2, ""n_estimators"": 300, ""ngramas"": ""uni"", ""preprocessing"": ""stem"", ""reg_alpha"": 0.221434083779094, ""reg_lambda"": 0.798053694783248, ""scale_pos_weight"": 1.8214997030100308, ""subsample"": 0.7752443669180508}",COMPLETE
31,0.6029125346384113,2026-10-01 08:28:15.690282,2026-10-01 08:28:16.444504,0 days 00:00:00.754222,0.6275477442327034,2.670373732459321,0.1477928308683498,6,2,350,uni,stem,0.04381736414407547,1.0160291490725168,1.8341097277839653,0.8090738450397824,0.010750262235869248,,"{""colsample_bytree"": 0.6275477442327034, ""gamma"": 2.670373732459321, ""learning_rate"": 0.1477928308683498, ""max_depth"": 6, ""min_child_weight"": 2, ""n_estimators"": 350, ""ngramas"": ""uni"", ""preprocessing"": ""stem"", ""reg_alpha"": 0.04381736414407547, ""reg_lambda"": 1.0160291490725168, ""scale_pos_weight"": 1.8341097277839653, ""subsample"": 0.8090738450397824}",COMPLETE
32,0.5957203548036732,2026-10-01 08:28:16.452029,2026-10-01 08:28:17.709643,0 days 00:00:01.257614,0.5387622313914108,2.155681756890792,0.08950815932890366,6,3,700,uni,stem,0.13493499474890508,1.2850487888056257,2.0556688061093356,0.7562474091466146,0.011321820294870324,,"{""colsample_bytree"": 0.5387622313914108, ""gamma"": 2.155681756890792, ""learning_rate"": 0.08950815932890366, ""max_depth"": 6, ""min_child_weight"": 3, ""n_estimators"": 700, ""ngramas"": ""uni"", ""preprocessing"": ""stem"", ""reg_alpha"": 0.13493499474890508, ""reg_lambda"": 1.2850487888056257, ""scale_pos_weight"": 2.0556688061093356, ""subsample"": 0.7562474091466146}",COMPLETE
33,0.6027330469622328,2026-10-01 08:28:17.715883,2026-10-01 08:28:18.362069,0 days 00:00:00.646186,0.6259147178184944,1.689669225662983,0.11492517098386078,4,2,250,uni,stem,0.04341923704665843,0.746007802054344,1.8688122201113293,0.8043508768192374,0.007843038623306663,,"{""colsample_bytree"": 0.6259147178184944, ""gamma"": 1.689669225662983, ""learning_rate"": 0.11492517098386078, ""max_depth"": 4, ""min_child_weight"": 2, ""n_estimators"": 250, ""ngramas"": ""uni"", ""preprocessing"": ""stem"", ""reg_alpha"": 0.04341923704665843, ""reg_lambda"": 0.746007802054344, ""scale_pos_weight"": 1.8688122201113293, ""subsample"": 0.8043508768192374}",COMPLETE
34,0.5894080017983431,2026-10-01 08:28:18.368587,2026-10-01 08:28:19.083875,0 days 00:00:00.715288,0.6306014949719448,2.2410004225276525,0.1600631252117828,5,3,350,uni,stem,0.8638583490685469,0.7378982538030989,1.8700253379790457,0.776200649560714,0.003714727150919192,,"{""colsample_bytree"": 0.6306014949719448, ""gamma"": 2.2410004225276525, ""learning_rate"": 0.1600631252117828, ""max_depth"": 5, ""min_child_weight"": 3, ""n_estimators"": 350, ""ngramas"": ""uni"", ""preprocessing"": ""stem"", ""reg_alpha"": 0.8638583490685469, ""reg_lambda"": 0.7378982538030989, ""scale_pos_weight"": 1.8700253379790457, ""subsample"": 0.776200649560714}",COMPLETE
35,0.5962659589066147,2026-10-01 08:28:19.091566,2026-10-01 08:28:19.725996,0 days 00:00:00.634430,0.6441560873592976,3.4860442335919237,0.14198020850375884,5,2,300,uni,stem,0.1120671251409127,1.8146355096050186,1.4725932256328766,0.7071140883670947,0.028626319088997074,,"{""colsample_bytree"": 0.6441560873592976, ""gamma"": 3.4860442335919237, ""learning_rate"": 0.14198020850375884, ""max_depth"": 5, ""min_child_weight"": 2, ""n_estimators"": 300, ""ngramas"": ""uni"", ""preprocessing"": ""stem"", ""reg_alpha"": 0.1120671251409127, ""reg_lambda"": 1.8146355096050186, ""scale_pos_weight"": 1.4725932256328766, ""subsample"": 0.7071140883670947}",COMPLETE
36,0.5941459351749492,2026-10-01 08:28:19.732013,2026-10-01 08:28:20.637072,0 days 00:00:00.905059,0.7110404925834218,3.276378897628983,0.16053374844013704,7,2,500,uni,stem,0.10333086111098659,0.9185998121557509,1.600673226101655,0.7255507381384676,0.012727270962193199,,"{""colsample_bytree"": 0.7110404925834218, ""gamma"": 3.276378897628983, ""learning_rate"": 0.16053374844013704, ""max_depth"": 7, ""min_child_weight"": 2, ""n_estimators"": 500, ""ngramas"": ""uni"", ""preprocessing"": ""stem"", ""reg_alpha"": 0.10333086111098659, ""reg_lambda"": 0.9185998121557509, ""scale_pos_weight"": 1.600673226101655, ""subsample"": 0.7255507381384676}",COMPLETE
