number,value,datetime_start,datetime_complete,duration,params_colsample_bytree,params_gamma,params_learning_rate,params_max_depth,params_min_child_weight,params_n_estimators,params_ngramas,params_preprocessing,params_reg_alpha,params_reg_lambda,params_scale_pos_weight,params_subsample,user_attrs_inner_f1_std,system_attrs_fixed_params,system_attrs_tpe:relative_params:0,state
0,0.6235427876186059,2026-10-01 08:43:00.757270,2026-10-01 08:43:03.285657,0 days 00:00:02.528387,0.874894942995359,0.8214908626419793,0.02108688998712124,5,12,600,uni,normal,0.058005451785441836,12.595092659243525,1.6825058783901683,0.659576927471088,0.013527188620306234,"{'preprocessing': 'normal', 'ngramas': 'uni'}",,COMPLETE
1,0.6159546874114922,2026-10-01 08:43:03.289665,2026-10-01 08:43:05.160904,0 days 00:00:01.871239,0.6294663307602683,1.280557979849662,0.035866902055082216,2,12,450,uni_bi,normal,1.6159658826251597,0.810065540991291,1.9416521323512845,0.8534784884637766,0.009331926213966916,"{'preprocessing': 'normal', 'ngramas': 'uni_bi'}",,COMPLETE
2,0.6278263272347903,2026-10-01 08:43:05.165127,2026-10-01 08:43:05.695784,0 days 00:00:00.530657,0.8962104825650745,3.4635901107729525,0.011534486580212257,3,7,150,uni,stem,0.016988578856135868,0.3226713059542976,1.741037537479581,0.641845318749869,0.030647681331397864,"{'preprocessing': 'stem', 'ngramas': 'uni'}",,COMPLETE
3,0.6002998508246769,2026-10-01 08:43:05.698261,2026-10-01 08:43:06.858960,0 days 00:00:01.160699,0.8450335877208167,1.1756394215003227,0.02021517501781213,3,15,150,uni_bi,stem,0.003944169826212177,3.5287034801585984,2.468487887218651,0.7654858555771249,0.001521312323467304,"{'preprocessing': 'stem', 'ngramas': 'uni_bi'}",,COMPLETE
4,0.6186374715577626,2026-10-01 08:43:06.862708,2026-10-01 08:43:07.538964,0 days 00:00:00.676256,0.602293369523341,1.7720582334980068,0.01189943945641824,7,12,150,uni,lemma,0.006032664691710865,0.175869492597536,1.7811844005832906,0.572611007331439,0.019210253389890256,"{'preprocessing': 'lemma', 'ngramas': 'uni'}",,COMPLETE
5,0.6418732822691531,2026-10-01 08:43:07.543483,2026-10-01 08:43:08.840493,0 days 00:00:01.297010,0.5875891509501385,6.7688879679728275,0.015151899213942333,6,3,150,uni_bi,lemma,0.0010555987814221286,0.21942971082112142,2.0475157638097787,0.7003604072608834,0.025740076861891815,"{'preprocessing': 'lemma', 'ngramas': 'uni_bi'}",,COMPLETE
6,0.6354865634532609,2026-10-01 08:43:08.844012,2026-10-01 08:43:10.013461,0 days 00:00:01.169449,0.7856061586672805,4.149288284766351,0.028177381498663497,7,7,400,uni,stem,0.008530561236333053,3.517904764265231,1.8679820236787972,0.8401242507817004,0.015166833402852584,,,COMPLETE
7,0.6337586381213512,2026-10-01 08:43:10.017795,2026-10-01 08:43:10.757820,0 days 00:00:00.740025,0.7230670508362705,2.9919163027527325,0.11343900023857142,5,8,350,uni,stem,0.0035388339011866517,12.035327894400558,1.3431544340025008,0.7685020537144995,0.010030568301967089,,,COMPLETE
8,0.5991909731787647,2026-10-01 08:43:10.761847,2026-10-01 08:43:12.812254,0 days 00:00:02.050407,0.5315117615108721,5.861270996685928,0.04687303072292285,6,11,550,uni_bi,lemma,0.7834236484860668,0.11307393730252309,1.184410107210054,0.658676894974765,0.01860596517301156,,,COMPLETE
9,0.6295877424316689,2026-10-01 08:43:12.816395,2026-10-01 08:43:14.757192,0 days 00:00:01.940797,0.5052526182824153,5.484751507084719,0.02051419574500176,6,4,400,uni_bi,lemma,0.022145633883549187,14.76355756770037,1.8926410761463255,0.5792307082785086,0.007963207900411745,,,COMPLETE
10,0.6267517583641332,2026-10-01 08:43:14.761205,2026-10-01 08:43:16.220382,0 days 00:00:01.459177,0.518634020301696,3.4749534611025457,0.014894054263955828,5,8,200,uni_bi,lemma,0.11495049099661821,1.6291671528398546,1.7190012104483592,0.5533380593022712,0.023151581424828985,,"{""colsample_bytree"": 0.518634020301696, ""gamma"": 3.4749534611025457, ""learning_rate"": 0.014894054263955828, ""max_depth"": 5, ""min_child_weight"": 8, ""n_estimators"": 200, ""ngramas"": ""uni_bi"", ""preprocessing"": ""lemma"", ""reg_alpha"": 0.11495049099661821, ""reg_lambda"": 1.6291671528398546, ""scale_pos_weight"": 1.7190012104483592, ""subsample"": 0.5533380593022712}",COMPLETE
11,0.6440142214388719,2026-10-01 08:43:16.224398,2026-10-01 08:43:17.358162,0 days 00:00:01.133764,0.6683865338517486,4.428534086139827,0.030320699357014515,6,4,350,uni,lemma,0.003238770449071997,0.9273425866174394,2.033877040529453,0.8341787918677233,0.01460413874366943,,"{""colsample_bytree"": 0.6683865338517486, ""gamma"": 4.428534086139827, ""learning_rate"": 0.030320699357014515, ""max_depth"": 6, ""min_child_weight"": 4, ""n_estimators"": 350, ""ngramas"": ""uni"", ""preprocessing"": ""lemma"", ""reg_alpha"": 0.003238770449071997, ""reg_lambda"": 0.9273425866174394, ""scale_pos_weight"": 2.033877040529453, ""subsample"": 0.8341787918677233}",COMPLETE
12,0.642687120819757,2026-10-01 08:43:17.363918,2026-10-01 08:43:20.163571,0 days 00:00:02.799653,0.6080639850493069,3.8256498103343484,0.015550900065087277,6,2,400,uni_bi,lemma,0.0018816758895277565,0.7197056304713383,2.0961064290839433,0.6495295837538535,0.013365083291871516,,"{""colsample_bytree"": 0.6080639850493069, ""gamma"": 3.8256498103343484, ""learning_rate"": 0.015550900065087277, ""max_depth"": 6, ""min_child_weight"": 2, ""n_estimators"": 400, ""ngramas"": ""uni_bi"", ""preprocessing"": ""lemma"", ""reg_alpha"": 0.0018816758895277565, ""reg_lambda"": 0.7197056304713383, ""scale_pos_weight"": 2.0961064290839433, ""subsample"": 0.6495295837538535}",COMPLETE
13,0.6248320459237272,2026-10-01 08:43:20.167840,2026-10-01 08:43:22.417761,0 days 00:00:02.249921,0.6492911302653491,4.302688864599685,0.011341542157251685,6,4,300,uni_bi,lemma,0.0039518048606027876,1.2545677255797623,1.6309254697700077,0.6482953954285924,0.025600473464653894,,"{""colsample_bytree"": 0.6492911302653491, ""gamma"": 4.302688864599685, ""learning_rate"": 0.011341542157251685, ""max_depth"": 6, ""min_child_weight"": 4, ""n_estimators"": 300, ""ngramas"": ""uni_bi"", ""preprocessing"": ""lemma"", ""reg_alpha"": 0.0039518048606027876, ""reg_lambda"": 1.2545677255797623, ""scale_pos_weight"": 1.6309254697700077, ""subsample"": 0.6482953954285924}",COMPLETE
14,0.6263969771093899,2026-10-01 08:43:22.423274,2026-10-01 08:43:23.671554,0 days 00:00:01.248280,0.6031374603091577,3.9614800143623854,0.041116430869268084,7,2,350,uni,lemma,0.0030414012562876287,1.2948552413070598,2.428649878343396,0.6661102682357765,0.006879745021199726,,"{""colsample_bytree"": 0.6031374603091577, ""gamma"": 3.9614800143623854, ""learning_rate"": 0.041116430869268084, ""max_depth"": 7, ""min_child_weight"": 2, ""n_estimators"": 350, ""ngramas"": ""uni"", ""preprocessing"": ""lemma"", ""reg_alpha"": 0.0030414012562876287, ""reg_lambda"": 1.2948552413070598, ""scale_pos_weight"": 2.428649878343396, ""subsample"": 0.6661102682357765}",COMPLETE
15,0.6066238232215572,2026-10-01 08:43:23.675786,2026-10-01 08:43:25.604491,0 days 00:00:01.928705,0.6506250189660724,6.906959290517337,0.011480353486925873,6,6,250,uni_bi,lemma,0.002233922023986418,2.3120933138923925,2.4936666341769733,0.7591139930125611,0.005215953797192857,,"{""colsample_bytree"": 0.6506250189660724, ""gamma"": 6.906959290517337, ""learning_rate"": 0.011480353486925873, ""max_depth"": 6, ""min_child_weight"": 6, ""n_estimators"": 250, ""ngramas"": ""uni_bi"", ""preprocessing"": ""lemma"", ""reg_alpha"": 0.002233922023986418, ""reg_lambda"": 2.3120933138923925, ""scale_pos_weight"": 2.4936666341769733, ""subsample"": 0.7591139930125611}",COMPLETE
16,0.6290571491704687,2026-10-01 08:43:25.609512,2026-10-01 08:43:27.833886,0 days 00:00:02.224374,0.7250976770098124,4.96595786831411,0.04747170301529687,6,4,400,uni_bi,lemma,0.002781077351360594,1.3930565787795013,1.9637118400355502,0.6807341772680415,0.013855174084524708,,"{""colsample_bytree"": 0.7250976770098124, ""gamma"": 4.96595786831411, ""learning_rate"": 0.04747170301529687, ""max_depth"": 6, ""min_child_weight"": 4, ""n_estimators"": 400, ""ngramas"": ""uni_bi"", ""preprocessing"": ""lemma"", ""reg_alpha"": 0.002781077351360594, ""reg_lambda"": 1.3930565787795013, ""scale_pos_weight"": 1.9637118400355502, ""subsample"": 0.6807341772680415}",COMPLETE
17,0.6371541824676393,2026-10-01 08:43:27.839208,2026-10-01 08:43:31.570555,0 days 00:00:03.731347,0.6376340443159566,3.2476783471687423,0.010994939504571938,6,4,550,uni_bi,lemma,0.004410031868020382,0.16452274294808567,2.0363810991453186,0.8354689691112199,0.022333855942304182,,"{""colsample_bytree"": 0.6376340443159566, ""gamma"": 3.2476783471687423, ""learning_rate"": 0.010994939504571938, ""max_depth"": 6, ""min_child_weight"": 4, ""n_estimators"": 550, ""ngramas"": ""uni_bi"", ""preprocessing"": ""lemma"", ""reg_alpha"": 0.004410031868020382, ""reg_lambda"": 0.16452274294808567, ""scale_pos_weight"": 2.0363810991453186, ""subsample"": 0.8354689691112199}",COMPLETE
18,0.6278706574741905,2026-10-01 08:43:31.575553,2026-10-01 08:43:34.044450,0 days 00:00:02.468897,0.6860268766714323,2.3106288567376634,0.02560703301206085,7,5,300,uni_bi,lemma,0.0017183833263568929,0.5451826098197743,1.7256668969946478,0.6320698032842685,0.026021920505699382,,"{""colsample_bytree"": 0.6860268766714323, ""gamma"": 2.3106288567376634, ""learning_rate"": 0.02560703301206085, ""max_depth"": 7, ""min_child_weight"": 5, ""n_estimators"": 300, ""ngramas"": ""uni_bi"", ""preprocessing"": ""lemma"", ""reg_alpha"": 0.0017183833263568929, ""reg_lambda"": 0.5451826098197743, ""scale_pos_weight"": 1.7256668969946478, ""subsample"": 0.6320698032842685}",COMPLETE
19,0.6397397028676958,2026-10-01 08:43:34.049930,2026-10-01 08:43:36.947684,0 days 00:00:02.897754,0.5349825250916839,2.9878264151311638,0.01947836938685975,7,3,400,uni_bi,lemma,0.009869432561470342,2.614960926439666,2.1058170861073444,0.805707298171096,0.019165494031160395,,"{""colsample_bytree"": 0.5349825250916839, ""gamma"": 2.9878264151311638, ""learning_rate"": 0.01947836938685975, ""max_depth"": 7, ""min_child_weight"": 3, ""n_estimators"": 400, ""ngramas"": ""uni_bi"", ""preprocessing"": ""lemma"", ""reg_alpha"": 0.009869432561470342, ""reg_lambda"": 2.614960926439666, ""scale_pos_weight"": 2.1058170861073444, ""subsample"": 0.805707298171096}",COMPLETE
20,0.6313429202890487,2026-10-01 08:43:36.952859,2026-10-01 08:43:39.348862,0 days 00:00:02.396003,0.7353811721527962,4.7364164182650415,0.027445658910229893,6,4,350,uni_bi,lemma,0.030339227509397243,2.3197901526572475,2.3115062775435478,0.5810448987837814,0.012946668750636414,,"{""colsample_bytree"": 0.7353811721527962, ""gamma"": 4.7364164182650415, ""learning_rate"": 0.027445658910229893, ""max_depth"": 6, ""min_child_weight"": 4, ""n_estimators"": 350, ""ngramas"": ""uni_bi"", ""preprocessing"": ""lemma"", ""reg_alpha"": 0.030339227509397243, ""reg_lambda"": 2.3197901526572475, ""scale_pos_weight"": 2.3115062775435478, ""subsample"": 0.5810448987837814}",COMPLETE
21,0.642566547089185,2026-10-01 08:43:39.354913,2026-10-01 08:43:42.066929,0 days 00:00:02.712016,0.6243300641989493,4.455669282638835,0.01522812108053858,6,4,400,uni_bi,lemma,0.00202189345965379,0.1058922423800524,1.7034798341257575,0.6178030742253383,0.024024665229239583,,"{""colsample_bytree"": 0.6243300641989493, ""gamma"": 4.455669282638835, ""learning_rate"": 0.01522812108053858, ""max_depth"": 6, ""min_child_weight"": 4, ""n_estimators"": 400, ""ngramas"": ""uni_bi"", ""preprocessing"": ""lemma"", ""reg_alpha"": 0.00202189345965379, ""reg_lambda"": 0.1058922423800524, ""scale_pos_weight"": 1.7034798341257575, ""subsample"": 0.6178030742253383}",COMPLETE
22,0.6309264011760017,2026-10-01 08:43:42.073068,2026-10-01 08:43:44.630028,0 days 00:00:02.556960,0.6098854068298178,2.07971179460953,0.013912692221284752,6,2,350,uni_bi,lemma,0.014240631614846707,0.26845820042398894,1.6796356758388111,0.6331262056361614,0.02360168417261975,,"{""colsample_bytree"": 0.6098854068298178, ""gamma"": 2.07971179460953, ""learning_rate"": 0.013912692221284752, ""max_depth"": 6, ""min_child_weight"": 2, ""n_estimators"": 350, ""ngramas"": ""uni_bi"", ""preprocessing"": ""lemma"", ""reg_alpha"": 0.014240631614846707, ""reg_lambda"": 0.26845820042398894, ""scale_pos_weight"": 1.6796356758388111, ""subsample"": 0.6331262056361614}",COMPLETE
23,0.6378807285670031,2026-10-01 08:43:44.635481,2026-10-01 08:43:46.402277,0 days 00:00:01.766796,0.5495472854054104,3.5038481275463793,0.013882138188180862,5,5,250,uni_bi,lemma,0.002732129379058958,0.5663882874972149,1.8068985910660107,0.7910450365987565,0.02978101250283699,,"{""colsample_bytree"": 0.5495472854054104, ""gamma"": 3.5038481275463793, ""learning_rate"": 0.013882138188180862, ""max_depth"": 5, ""min_child_weight"": 5, ""n_estimators"": 250, ""ngramas"": ""uni_bi"", ""preprocessing"": ""lemma"", ""reg_alpha"": 0.002732129379058958, ""reg_lambda"": 0.5663882874972149, ""scale_pos_weight"": 1.8068985910660107, ""subsample"": 0.7910450365987565}",COMPLETE
24,0.6295726819036106,2026-10-01 08:43:46.407794,2026-10-01 08:43:49.503772,0 days 00:00:03.095978,0.6082731777729771,4.114479478099337,0.017962017404257784,6,8,550,uni_bi,lemma,0.0039729276850824615,0.4465039778823356,1.7688271303460537,0.6513769540837943,0.010579639745184673,,"{""colsample_bytree"": 0.6082731777729771, ""gamma"": 4.114479478099337, ""learning_rate"": 0.017962017404257784, ""max_depth"": 6, ""min_child_weight"": 8, ""n_estimators"": 550, ""ngramas"": ""uni_bi"", ""preprocessing"": ""lemma"", ""reg_alpha"": 0.0039729276850824615, ""reg_lambda"": 0.4465039778823356, ""scale_pos_weight"": 1.7688271303460537, ""subsample"": 0.6513769540837943}",COMPLETE
25,0.6411289131645267,2026-10-01 08:43:49.509784,2026-10-01 08:43:52.831817,0 days 00:00:03.322033,0.5856371429550215,2.9128003750505163,0.014965190450703169,5,3,550,uni_bi,lemma,0.0013751478475939915,0.2634657987219019,1.7040805815311582,0.5860486542794239,0.021967564330016554,,"{""colsample_bytree"": 0.5856371429550215, ""gamma"": 2.9128003750505163, ""learning_rate"": 0.014965190450703169, ""max_depth"": 5, ""min_child_weight"": 3, ""n_estimators"": 550, ""ngramas"": ""uni_bi"", ""preprocessing"": ""lemma"", ""reg_alpha"": 0.0013751478475939915, ""reg_lambda"": 0.2634657987219019, ""scale_pos_weight"": 1.7040805815311582, ""subsample"": 0.5860486542794239}",COMPLETE
26,0.6373982423619305,2026-10-01 08:43:52.836439,2026-10-01 08:43:56.064246,0 days 00:00:03.227807,0.6205796728944116,4.182807612207913,0.01817953484191342,7,7,500,uni_bi,lemma,0.004729157414011262,0.10980261733498295,2.033748959757746,0.5996774502678899,0.00814878979328822,,"{""colsample_bytree"": 0.6205796728944116, ""gamma"": 4.182807612207913, ""learning_rate"": 0.01817953484191342, ""max_depth"": 7, ""min_child_weight"": 7, ""n_estimators"": 500, ""ngramas"": ""uni_bi"", ""preprocessing"": ""lemma"", ""reg_alpha"": 0.004729157414011262, ""reg_lambda"": 0.10980261733498295, ""scale_pos_weight"": 2.033748959757746, ""subsample"": 0.5996774502678899}",COMPLETE
27,0.642620665234514,2026-10-01 08:43:56.070684,2026-10-01 08:43:58.768731,0 days 00:00:02.698047,0.6839748448880117,6.091267201459936,0.016952718255792084,6,4,450,uni_bi,lemma,0.0015553609474765497,0.11145380200718348,1.8102707380430425,0.5986476992191093,0.021510622031690924,,"{""colsample_bytree"": 0.6839748448880117, ""gamma"": 6.091267201459936, ""learning_rate"": 0.016952718255792084, ""max_depth"": 6, ""min_child_weight"": 4, ""n_estimators"": 450, ""ngramas"": ""uni_bi"", ""preprocessing"": ""lemma"", ""reg_alpha"": 0.0015553609474765497, ""reg_lambda"": 0.11145380200718348, ""scale_pos_weight"": 1.8102707380430425, ""subsample"": 0.5986476992191093}",COMPLETE
28,0.6432368394609959,2026-10-01 08:43:58.775240,2026-10-01 08:44:01.693332,0 days 00:00:02.918092,0.5514743784542345,4.620403321799369,0.02274823459759797,7,2,450,uni_bi,lemma,0.004065805033548607,0.39245534113362657,2.0371592046297535,0.6177499442046268,0.023699693442049734,,"{""colsample_bytree"": 0.5514743784542345, ""gamma"": 4.620403321799369, ""learning_rate"": 0.02274823459759797, ""max_depth"": 7, ""min_child_weight"": 2, ""n_estimators"": 450, ""ngramas"": ""uni_bi"", ""preprocessing"": ""lemma"", ""reg_alpha"": 0.004065805033548607, ""reg_lambda"": 0.39245534113362657, ""scale_pos_weight"": 2.0371592046297535, ""subsample"": 0.6177499442046268}",COMPLETE
29,0.6350897863993542,2026-10-01 08:44:01.700360,2026-10-01 08:44:04.114533,0 days 00:00:02.414173,0.5213127233490383,4.175248532014808,0.030780499729600612,6,2,400,uni_bi,lemma,0.0021357176529995703,0.5367932355291665,1.8966564449202536,0.6360564504195854,0.0176843143301837,,"{""colsample_bytree"": 0.5213127233490383, ""gamma"": 4.175248532014808, ""learning_rate"": 0.030780499729600612, ""max_depth"": 6, ""min_child_weight"": 2, ""n_estimators"": 400, ""ngramas"": ""uni_bi"", ""preprocessing"": ""lemma"", ""reg_alpha"": 0.0021357176529995703, ""reg_lambda"": 0.5367932355291665, ""scale_pos_weight"": 1.8966564449202536, ""subsample"": 0.6360564504195854}",COMPLETE
30,0.6246448993238958,2026-10-01 08:44:04.121651,2026-10-01 08:44:06.718478,0 days 00:00:02.596827,0.5664868258862172,4.1836170478995784,0.06088234286915408,7,4,500,uni_bi,lemma,0.009771974845554313,0.24585893774628945,1.8359625605434005,0.5937937666042693,0.010615241920611045,,"{""colsample_bytree"": 0.5664868258862172, ""gamma"": 4.1836170478995784, ""learning_rate"": 0.06088234286915408, ""max_depth"": 7, ""min_child_weight"": 4, ""n_estimators"": 500, ""ngramas"": ""uni_bi"", ""preprocessing"": ""lemma"", ""reg_alpha"": 0.009771974845554313, ""reg_lambda"": 0.24585893774628945, ""scale_pos_weight"": 1.8359625605434005, ""subsample"": 0.5937937666042693}",COMPLETE
31,0.6344957691523798,2026-10-01 08:44:06.724993,2026-10-01 08:44:09.332413,0 days 00:00:02.607420,0.5960179216434282,4.5577425680258905,0.013832676569725052,7,3,400,uni_bi,normal,0.001737526513112488,0.38309836805025954,2.3354591912596376,0.6401823640510853,0.019528914574999542,,"{""colsample_bytree"": 0.5960179216434282, ""gamma"": 4.5577425680258905, ""learning_rate"": 0.013832676569725052, ""max_depth"": 7, ""min_child_weight"": 3, ""n_estimators"": 400, ""ngramas"": ""uni_bi"", ""preprocessing"": ""normal"", ""reg_alpha"": 0.001737526513112488, ""reg_lambda"": 0.38309836805025954, ""scale_pos_weight"": 2.3354591912596376, ""subsample"": 0.6401823640510853}",COMPLETE
32,0.6401282122593073,2026-10-01 08:44:09.339368,2026-10-01 08:44:12.058699,0 days 00:00:02.719331,0.539219674565724,5.3905611853843585,0.026987063543880224,7,2,500,uni_bi,lemma,0.002077842676084315,1.7957434350057944,2.2331182126688303,0.6607672478091579,0.007922633242748939,,"{""colsample_bytree"": 0.539219674565724, ""gamma"": 5.3905611853843585, ""learning_rate"": 0.026987063543880224, ""max_depth"": 7, ""min_child_weight"": 2, ""n_estimators"": 500, ""ngramas"": ""uni_bi"", ""preprocessing"": ""lemma"", ""reg_alpha"": 0.002077842676084315, ""reg_lambda"": 1.7957434350057944, ""scale_pos_weight"": 2.2331182126688303, ""subsample"": 0.6607672478091579}",COMPLETE
33,0.6240224305775025,2026-10-01 08:44:12.066216,2026-10-01 08:44:14.430755,0 days 00:00:02.364539,0.6444212205919222,6.575484972977623,0.016168065822261064,7,6,450,uni_bi,lemma,0.0018200766603076158,0.17214779702411595,1.5293476333363256,0.556648994265325,0.026758698458288314,,"{""colsample_bytree"": 0.6444212205919222, ""gamma"": 6.575484972977623, ""learning_rate"": 0.016168065822261064, ""max_depth"": 7, ""min_child_weight"": 6, ""n_estimators"": 450, ""ngramas"": ""uni_bi"", ""preprocessing"": ""lemma"", ""reg_alpha"": 0.0018200766603076158, ""reg_lambda"": 0.17214779702411595, ""scale_pos_weight"": 1.5293476333363256, ""subsample"": 0.556648994265325}",COMPLETE
34,0.6399210656138709,2026-10-01 08:44:14.437002,2026-10-01 08:44:17.019550,0 days 00:00:02.582548,0.508837354632809,4.5383073579081765,0.012210390137892869,7,2,350,uni_bi,lemma,0.0030268256689731693,0.873140603106256,2.283525903122741,0.597187212485164,0.017325192085693195,,"{""colsample_bytree"": 0.508837354632809, ""gamma"": 4.5383073579081765, ""learning_rate"": 0.012210390137892869, ""max_depth"": 7, ""min_child_weight"": 2, ""n_estimators"": 350, ""ngramas"": ""uni_bi"", ""preprocessing"": ""lemma"", ""reg_alpha"": 0.0030268256689731693, ""reg_lambda"": 0.873140603106256, ""scale_pos_weight"": 2.283525903122741, ""subsample"": 0.597187212485164}",COMPLETE
35,0.643610594889192,2026-10-01 08:44:17.026166,2026-10-01 08:44:19.907115,0 days 00:00:02.880949,0.6059154207473287,5.126960962872296,0.01731541123475227,7,2,400,uni_bi,lemma,0.01516380908318341,0.35791225825482437,2.1921492349249423,0.6259322655616747,0.01643341744254325,,"{""colsample_bytree"": 0.6059154207473287, ""gamma"": 5.126960962872296, ""learning_rate"": 0.01731541123475227, ""max_depth"": 7, ""min_child_weight"": 2, ""n_estimators"": 400, ""ngramas"": ""uni_bi"", ""preprocessing"": ""lemma"", ""reg_alpha"": 0.01516380908318341, ""reg_lambda"": 0.35791225825482437, ""scale_pos_weight"": 2.1921492349249423, ""subsample"": 0.6259322655616747}",COMPLETE
