number,value,datetime_start,datetime_complete,duration,params_colsample_bytree,params_gamma,params_learning_rate,params_max_depth,params_min_child_weight,params_n_estimators,params_ngramas,params_preprocessing,params_reg_alpha,params_reg_lambda,params_scale_pos_weight,params_subsample,user_attrs_inner_f1_std,system_attrs_fixed_params,system_attrs_tpe:relative_params:0,state
0,0.684077967682108,2026-10-01 08:36:47.015298,2026-10-01 08:36:47.627224,0 days 00:00:00.611926,0.8198418406640215,5.341713908812194,0.0887371787765412,7,6,200,uni,normal,0.04554056650541418,4.213068640264806,1.369974072661963,0.7976617983906784,0.006961993802368818,"{'preprocessing': 'normal', 'ngramas': 'uni'}",,COMPLETE
1,0.6669641709989048,2026-10-01 08:36:47.630219,2026-10-01 08:36:49.085539,0 days 00:00:01.455320,0.6288831792277916,1.8912060355691782,0.013441428574233813,2,6,300,uni_bi,normal,4.66416811964312,0.42014277058045485,1.4103218373962032,0.774299487233649,0.015386482600610396,"{'preprocessing': 'normal', 'ngramas': 'uni_bi'}",,COMPLETE
2,0.6653334052205231,2026-10-01 08:36:49.089569,2026-10-01 08:36:50.120265,0 days 00:00:01.030696,0.7783824805286792,4.647692781759115,0.09380240737581035,2,2,700,uni,stem,5.507356497854536,1.5120359548651754,1.2664180983936855,0.8498767127525279,0.014826129803532054,"{'preprocessing': 'stem', 'ngramas': 'uni'}",,COMPLETE
3,0.6746318683716298,2026-10-01 08:36:50.124282,2026-10-01 08:36:52.847256,0 days 00:00:02.722974,0.876902389058918,6.087089733274703,0.010322706723101325,3,14,450,uni_bi,stem,0.011717684031659526,0.6802324349708322,1.7896058283592255,0.7797437268432061,0.013748011748182225,"{'preprocessing': 'stem', 'ngramas': 'uni_bi'}",,COMPLETE
4,0.6793405759636938,2026-10-01 08:36:52.851291,2026-10-01 08:36:53.734546,0 days 00:00:00.883255,0.6556314620606654,4.039162506093462,0.016873575773608734,3,7,450,uni,lemma,7.504256880623388,0.2162494779824781,1.7713820826482651,0.5990637928482865,0.023752858232961686,"{'preprocessing': 'lemma', 'ngramas': 'uni'}",,COMPLETE
5,0.6666551808466922,2026-10-01 08:36:53.738562,2026-10-01 08:36:56.272893,0 days 00:00:02.534331,0.7271864354075595,3.3972978559015674,0.016133984942950163,3,10,450,uni_bi,lemma,0.0021821680392635975,1.964160459738051,1.9721075178287282,0.5863050837516292,0.01872927548799998,"{'preprocessing': 'lemma', 'ngramas': 'uni_bi'}",,COMPLETE
6,0.6721426244574409,2026-10-01 08:36:56.277903,2026-10-01 08:36:58.808653,0 days 00:00:02.530750,0.85752939177751,6.155404022548753,0.1607579940959742,3,8,600,uni_bi,lemma,1.2526566980575673,10.537000279658317,1.7222234759503365,0.6820029668160755,0.014955558816777272,,,COMPLETE
7,0.682792765087267,2026-10-01 08:36:58.813176,2026-10-01 08:37:00.064325,0 days 00:00:01.251149,0.8601252063212457,7.377919063730868,0.12210827548434999,5,3,700,uni,lemma,0.007371130115661973,0.8352981135856257,1.817758235373197,0.7209017875367081,0.026814420404941093,,,COMPLETE
8,0.6636189520840793,2026-10-01 08:37:00.068357,2026-10-01 08:37:01.301952,0 days 00:00:01.233595,0.7201997696938602,6.498456879243526,0.04168099529637218,7,14,600,uni,normal,0.018159474084619286,0.1227925418626537,2.212503455379453,0.7813200368731505,0.018723810969726654,,,COMPLETE
9,0.6305651819271173,2026-10-01 08:37:01.305470,2026-10-01 08:37:02.986075,0 days 00:00:01.680605,0.6915180251981358,7.871813919440823,0.010100839810949176,2,10,350,uni_bi,normal,0.0060253938800961,0.5573606208674275,2.4651397010975105,0.67088362842534,0.008725721764166926,,,COMPLETE
10,0.6790527000936314,2026-10-01 08:37:02.990605,2026-10-01 08:37:03.626897,0 days 00:00:00.636292,0.8410451470405516,2.9761597843788725,0.053737280867597964,3,13,200,uni,normal,0.013148577509903753,3.2231545140533755,1.6889569746011135,0.8753041788219501,0.016998766295092144,,"{""colsample_bytree"": 0.8410451470405516, ""gamma"": 2.9761597843788725, ""learning_rate"": 0.053737280867597964, ""max_depth"": 3, ""min_child_weight"": 13, ""n_estimators"": 200, ""ngramas"": ""uni"", ""preprocessing"": ""normal"", ""reg_alpha"": 0.013148577509903753, ""reg_lambda"": 3.2231545140533755, ""scale_pos_weight"": 1.6889569746011135, ""subsample"": 0.8753041788219501}",COMPLETE
11,0.6927262502921039,2026-10-01 08:37:03.633095,2026-10-01 08:37:04.897497,0 days 00:00:01.264402,0.8358784294082278,6.290834736003981,0.18107219534644747,6,2,600,uni,normal,0.01262689445956107,0.9326201352404188,1.5652058887532088,0.7419063897828431,0.014695277448940796,,"{""colsample_bytree"": 0.8358784294082278, ""gamma"": 6.290834736003981, ""learning_rate"": 0.18107219534644747, ""max_depth"": 6, ""min_child_weight"": 2, ""n_estimators"": 600, ""ngramas"": ""uni"", ""preprocessing"": ""normal"", ""reg_alpha"": 0.01262689445956107, ""reg_lambda"": 0.9326201352404188, ""scale_pos_weight"": 1.5652058887532088, ""subsample"": 0.7419063897828431}",COMPLETE
12,0.6764218805759481,2026-10-01 08:37:04.902811,2026-10-01 08:37:05.740302,0 days 00:00:00.837491,0.7493616136023157,4.19254070095312,0.08029242137648791,7,5,300,uni,normal,0.0165955505767679,0.8717517117159282,1.6663922836258187,0.7165302159386859,0.009835861717654926,,"{""colsample_bytree"": 0.7493616136023157, ""gamma"": 4.19254070095312, ""learning_rate"": 0.08029242137648791, ""max_depth"": 7, ""min_child_weight"": 5, ""n_estimators"": 300, ""ngramas"": ""uni"", ""preprocessing"": ""normal"", ""reg_alpha"": 0.0165955505767679, ""reg_lambda"": 0.8717517117159282, ""scale_pos_weight"": 1.6663922836258187, ""subsample"": 0.7165302159386859}",COMPLETE
13,0.675490322494209,2026-10-01 08:37:05.742307,2026-10-01 08:37:06.774350,0 days 00:00:01.032043,0.7947375287666524,5.836876961185773,0.17615766543863237,6,2,450,uni,normal,0.022185848858766725,0.43475453369998895,1.737383867381357,0.6908939281327316,0.011156236158318148,,"{""colsample_bytree"": 0.7947375287666524, ""gamma"": 5.836876961185773, ""learning_rate"": 0.17615766543863237, ""max_depth"": 6, ""min_child_weight"": 2, ""n_estimators"": 450, ""ngramas"": ""uni"", ""preprocessing"": ""normal"", ""reg_alpha"": 0.022185848858766725, ""reg_lambda"": 0.43475453369998895, ""scale_pos_weight"": 1.737383867381357, ""subsample"": 0.6908939281327316}",COMPLETE
14,0.6862629964436144,2026-10-01 08:37:06.779870,2026-10-01 08:37:07.880998,0 days 00:00:01.101128,0.7449949921808567,6.39803397830012,0.13970689064722783,7,2,550,uni,normal,0.006006892541110467,4.42167591493454,1.332363011942799,0.7671786578898638,0.007556406239586722,,"{""colsample_bytree"": 0.7449949921808567, ""gamma"": 6.39803397830012, ""learning_rate"": 0.13970689064722783, ""max_depth"": 7, ""min_child_weight"": 2, ""n_estimators"": 550, ""ngramas"": ""uni"", ""preprocessing"": ""normal"", ""reg_alpha"": 0.006006892541110467, ""reg_lambda"": 4.42167591493454, ""scale_pos_weight"": 1.332363011942799, ""subsample"": 0.7671786578898638}",COMPLETE
15,0.6804772268524263,2026-10-01 08:37:07.885785,2026-10-01 08:37:09.012416,0 days 00:00:01.126631,0.7385947719327762,6.221490750728515,0.16827248595584854,6,2,550,uni,normal,0.011083097509385166,5.282979586460199,1.7434455747687698,0.7396363473988745,0.02218859554237815,,"{""colsample_bytree"": 0.7385947719327762, ""gamma"": 6.221490750728515, ""learning_rate"": 0.16827248595584854, ""max_depth"": 6, ""min_child_weight"": 2, ""n_estimators"": 550, ""ngramas"": ""uni"", ""preprocessing"": ""normal"", ""reg_alpha"": 0.011083097509385166, ""reg_lambda"": 5.282979586460199, ""scale_pos_weight"": 1.7434455747687698, ""subsample"": 0.7396363473988745}",COMPLETE
16,0.6787312809292182,2026-10-01 08:37:09.017481,2026-10-01 08:37:10.285722,0 days 00:00:01.268241,0.7651915869500704,3.0484075578264407,0.17772625522649899,7,2,600,uni,normal,0.009017834158446678,1.8500792500571566,1.2411696862118387,0.7896596269102509,0.0034656501381089243,,"{""colsample_bytree"": 0.7651915869500704, ""gamma"": 3.0484075578264407, ""learning_rate"": 0.17772625522649899, ""max_depth"": 7, ""min_child_weight"": 2, ""n_estimators"": 600, ""ngramas"": ""uni"", ""preprocessing"": ""normal"", ""reg_alpha"": 0.009017834158446678, ""reg_lambda"": 1.8500792500571566, ""scale_pos_weight"": 1.2411696862118387, ""subsample"": 0.7896596269102509}",COMPLETE
17,0.6864971890266313,2026-10-01 08:37:10.289229,2026-10-01 08:37:11.684610,0 days 00:00:01.395381,0.8112286022747881,7.450863066481235,0.06821160006225424,7,3,650,uni,normal,0.017889529388981713,7.785278294242779,1.4966976443684357,0.7507346904053047,0.011190311870389883,,"{""colsample_bytree"": 0.8112286022747881, ""gamma"": 7.450863066481235, ""learning_rate"": 0.06821160006225424, ""max_depth"": 7, ""min_child_weight"": 3, ""n_estimators"": 650, ""ngramas"": ""uni"", ""preprocessing"": ""normal"", ""reg_alpha"": 0.017889529388981713, ""reg_lambda"": 7.785278294242779, ""scale_pos_weight"": 1.4966976443684357, ""subsample"": 0.7507346904053047}",COMPLETE
18,0.6803734833681613,2026-10-01 08:37:11.689718,2026-10-01 08:37:12.902703,0 days 00:00:01.212985,0.856193559638273,5.8547038458380705,0.1154533677015196,5,3,550,uni,normal,0.0012582101450060977,2.0212741590030237,1.7064772082145832,0.721389677204866,0.011822559389353213,,"{""colsample_bytree"": 0.856193559638273, ""gamma"": 5.8547038458380705, ""learning_rate"": 0.1154533677015196, ""max_depth"": 5, ""min_child_weight"": 3, ""n_estimators"": 550, ""ngramas"": ""uni"", ""preprocessing"": ""normal"", ""reg_alpha"": 0.0012582101450060977, ""reg_lambda"": 2.0212741590030237, ""scale_pos_weight"": 1.7064772082145832, ""subsample"": 0.721389677204866}",COMPLETE
19,0.687195703200009,2026-10-01 08:37:12.909248,2026-10-01 08:37:13.852613,0 days 00:00:00.943365,0.8197610489363352,7.454766407016194,0.13194875538599812,6,5,550,uni,stem,0.0032846911640792196,4.385751761061948,1.394233946519185,0.6991476863013544,0.015562804814386327,,"{""colsample_bytree"": 0.8197610489363352, ""gamma"": 7.454766407016194, ""learning_rate"": 0.13194875538599812, ""max_depth"": 6, ""min_child_weight"": 5, ""n_estimators"": 550, ""ngramas"": ""uni"", ""preprocessing"": ""stem"", ""reg_alpha"": 0.0032846911640792196, ""reg_lambda"": 4.385751761061948, ""scale_pos_weight"": 1.394233946519185, ""subsample"": 0.6991476863013544}",COMPLETE
20,0.6834962685955058,2026-10-01 08:37:13.857613,2026-10-01 08:37:15.085955,0 days 00:00:01.228342,0.8079060503359806,7.546864223700531,0.12675827922331726,5,3,600,uni,normal,0.24926728274834753,0.8342438815204742,1.580325292674725,0.7019622947200701,0.01527252945870307,,"{""colsample_bytree"": 0.8079060503359806, ""gamma"": 7.546864223700531, ""learning_rate"": 0.12675827922331726, ""max_depth"": 5, ""min_child_weight"": 3, ""n_estimators"": 600, ""ngramas"": ""uni"", ""preprocessing"": ""normal"", ""reg_alpha"": 0.24926728274834753, ""reg_lambda"": 0.8342438815204742, ""scale_pos_weight"": 1.580325292674725, ""subsample"": 0.7019622947200701}",COMPLETE
21,0.6879561209952367,2026-10-01 08:37:15.092466,2026-10-01 08:37:16.126007,0 days 00:00:01.033541,0.7969350234280586,7.0285285764617225,0.08846560241224641,6,3,650,uni,stem,0.0019101348199051314,8.619558714963777,1.46537409727314,0.7074379394080403,0.019345139873326353,,"{""colsample_bytree"": 0.7969350234280586, ""gamma"": 7.0285285764617225, ""learning_rate"": 0.08846560241224641, ""max_depth"": 6, ""min_child_weight"": 3, ""n_estimators"": 650, ""ngramas"": ""uni"", ""preprocessing"": ""stem"", ""reg_alpha"": 0.0019101348199051314, ""reg_lambda"": 8.619558714963777, ""scale_pos_weight"": 1.46537409727314, ""subsample"": 0.7074379394080403}",COMPLETE
22,0.6829314289998024,2026-10-01 08:37:16.131774,2026-10-01 08:37:17.049113,0 days 00:00:00.917339,0.8242278832702172,5.203869040713256,0.07969774861892549,6,5,500,uni,stem,0.0016645252856457408,1.6427881669925042,1.1675826838352341,0.6448700964839459,0.006088676352699354,,"{""colsample_bytree"": 0.8242278832702172, ""gamma"": 5.203869040713256, ""learning_rate"": 0.07969774861892549, ""max_depth"": 6, ""min_child_weight"": 5, ""n_estimators"": 500, ""ngramas"": ""uni"", ""preprocessing"": ""stem"", ""reg_alpha"": 0.0016645252856457408, ""reg_lambda"": 1.6427881669925042, ""scale_pos_weight"": 1.1675826838352341, ""subsample"": 0.6448700964839459}",COMPLETE
23,0.6842536326557339,2026-10-01 08:37:17.055113,2026-10-01 08:37:17.988759,0 days 00:00:00.933646,0.8586593697171653,7.784467301165762,0.0709197553543067,6,7,550,uni,stem,0.0024032993904404124,17.920240710399515,1.6815771807502589,0.7270901482526555,0.029476704296691934,,"{""colsample_bytree"": 0.8586593697171653, ""gamma"": 7.784467301165762, ""learning_rate"": 0.0709197553543067, ""max_depth"": 6, ""min_child_weight"": 7, ""n_estimators"": 550, ""ngramas"": ""uni"", ""preprocessing"": ""stem"", ""reg_alpha"": 0.0024032993904404124, ""reg_lambda"": 17.920240710399515, ""scale_pos_weight"": 1.6815771807502589, ""subsample"": 0.7270901482526555}",COMPLETE
24,0.6912003052799142,2026-10-01 08:37:17.994770,2026-10-01 08:37:19.369192,0 days 00:00:01.374422,0.8601032487279923,6.554832463129888,0.16716797801220812,6,5,650,uni,normal,0.02169982381321149,0.1935553885018632,1.500326214528213,0.7653482064477822,0.011824741883359509,,"{""colsample_bytree"": 0.8601032487279923, ""gamma"": 6.554832463129888, ""learning_rate"": 0.16716797801220812, ""max_depth"": 6, ""min_child_weight"": 5, ""n_estimators"": 650, ""ngramas"": ""uni"", ""preprocessing"": ""normal"", ""reg_alpha"": 0.02169982381321149, ""reg_lambda"": 0.1935553885018632, ""scale_pos_weight"": 1.500326214528213, ""subsample"": 0.7653482064477822}",COMPLETE
25,0.6798340488083632,2026-10-01 08:37:19.375203,2026-10-01 08:37:20.650275,0 days 00:00:01.275072,0.8285571456058861,6.367965559449171,0.17469165675552822,7,2,600,uni,normal,0.013009151158303426,0.3755520297975787,1.381954675123236,0.6521439346949505,0.0031485108582106217,,"{""colsample_bytree"": 0.8285571456058861, ""gamma"": 6.367965559449171, ""learning_rate"": 0.17469165675552822, ""max_depth"": 7, ""min_child_weight"": 2, ""n_estimators"": 600, ""ngramas"": ""uni"", ""preprocessing"": ""normal"", ""reg_alpha"": 0.013009151158303426, ""reg_lambda"": 0.3755520297975787, ""scale_pos_weight"": 1.381954675123236, ""subsample"": 0.6521439346949505}",COMPLETE
26,0.681756455495262,2026-10-01 08:37:20.655785,2026-10-01 08:37:22.054318,0 days 00:00:01.398533,0.8724692553640472,7.228378155585041,0.18452129994301128,5,5,700,uni,normal,0.0036835369204584944,0.26704192159577667,1.2349269587289573,0.8462349755524206,0.0017565874779831923,,"{""colsample_bytree"": 0.8724692553640472, ""gamma"": 7.228378155585041, ""learning_rate"": 0.18452129994301128, ""max_depth"": 5, ""min_child_weight"": 5, ""n_estimators"": 700, ""ngramas"": ""uni"", ""preprocessing"": ""normal"", ""reg_alpha"": 0.0036835369204584944, ""reg_lambda"": 0.26704192159577667, ""scale_pos_weight"": 1.2349269587289573, ""subsample"": 0.8462349755524206}",COMPLETE
27,0.6875005708539738,2026-10-01 08:37:22.060333,2026-10-01 08:37:23.447091,0 days 00:00:01.386758,0.8338462868590377,5.397849962743462,0.169198538458608,6,4,700,uni,normal,0.058600516122916176,6.22056868095123,1.4132573574877119,0.7208759339541813,0.01704671424858678,,"{""colsample_bytree"": 0.8338462868590377, ""gamma"": 5.397849962743462, ""learning_rate"": 0.169198538458608, ""max_depth"": 6, ""min_child_weight"": 4, ""n_estimators"": 700, ""ngramas"": ""uni"", ""preprocessing"": ""normal"", ""reg_alpha"": 0.058600516122916176, ""reg_lambda"": 6.22056868095123, ""scale_pos_weight"": 1.4132573574877119, ""subsample"": 0.7208759339541813}",COMPLETE
28,0.6894382112881833,2026-10-01 08:37:23.453391,2026-10-01 08:37:24.428154,0 days 00:00:00.974763,0.731856865049754,6.240090559301128,0.047938671344326986,5,3,550,uni,stem,0.003697389838592303,7.6984693178403125,1.5198930257966188,0.7151853932070296,0.01078212412017181,,"{""colsample_bytree"": 0.731856865049754, ""gamma"": 6.240090559301128, ""learning_rate"": 0.047938671344326986, ""max_depth"": 5, ""min_child_weight"": 3, ""n_estimators"": 550, ""ngramas"": ""uni"", ""preprocessing"": ""stem"", ""reg_alpha"": 0.003697389838592303, ""reg_lambda"": 7.6984693178403125, ""scale_pos_weight"": 1.5198930257966188, ""subsample"": 0.7151853932070296}",COMPLETE
29,0.6785113166407029,2026-10-01 08:37:24.436710,2026-10-01 08:37:25.551697,0 days 00:00:01.114987,0.7605413765423538,7.542421434450847,0.16239507210567922,5,2,550,uni,normal,0.023235690574684765,0.10840436849834911,1.3711215180330534,0.7614760296534565,0.009447928987561792,,"{""colsample_bytree"": 0.7605413765423538, ""gamma"": 7.542421434450847, ""learning_rate"": 0.16239507210567922, ""max_depth"": 5, ""min_child_weight"": 2, ""n_estimators"": 550, ""ngramas"": ""uni"", ""preprocessing"": ""normal"", ""reg_alpha"": 0.023235690574684765, ""reg_lambda"": 0.10840436849834911, ""scale_pos_weight"": 1.3711215180330534, ""subsample"": 0.7614760296534565}",COMPLETE
30,0.6689615953070959,2026-10-01 08:37:25.557706,2026-10-01 08:37:26.785440,0 days 00:00:01.227734,0.862183860167822,6.38659734988763,0.08288171297408711,7,2,500,uni,normal,0.01007743111589783,0.10751127314304883,1.9174793692708523,0.7324383605543827,0.00843743129959977,,"{""colsample_bytree"": 0.862183860167822, ""gamma"": 6.38659734988763, ""learning_rate"": 0.08288171297408711, ""max_depth"": 7, ""min_child_weight"": 2, ""n_estimators"": 500, ""ngramas"": ""uni"", ""preprocessing"": ""normal"", ""reg_alpha"": 0.01007743111589783, ""reg_lambda"": 0.10751127314304883, ""scale_pos_weight"": 1.9174793692708523, ""subsample"": 0.7324383605543827}",COMPLETE
31,0.6844815743475675,2026-10-01 08:37:26.792072,2026-10-01 08:37:28.041284,0 days 00:00:01.249212,0.826140031270722,6.623459616136265,0.12953633547785948,6,4,600,uni,normal,0.13163391594079424,0.8288167910374901,1.723857632714075,0.7636482537453375,0.010151159870329548,,"{""colsample_bytree"": 0.826140031270722, ""gamma"": 6.623459616136265, ""learning_rate"": 0.12953633547785948, ""max_depth"": 6, ""min_child_weight"": 4, ""n_estimators"": 600, ""ngramas"": ""uni"", ""preprocessing"": ""normal"", ""reg_alpha"": 0.13163391594079424, ""reg_lambda"": 0.8288167910374901, ""scale_pos_weight"": 1.723857632714075, ""subsample"": 0.7636482537453375}",COMPLETE
32,0.6865734037836514,2026-10-01 08:37:28.049570,2026-10-01 08:37:29.073803,0 days 00:00:01.024233,0.7454885300609564,6.115810601362536,0.07925854604380628,5,4,650,uni,stem,0.0062529007627118134,9.651000943889436,1.5538356890260032,0.7147854152734676,0.018246635502314198,,"{""colsample_bytree"": 0.7454885300609564, ""gamma"": 6.115810601362536, ""learning_rate"": 0.07925854604380628, ""max_depth"": 5, ""min_child_weight"": 4, ""n_estimators"": 650, ""ngramas"": ""uni"", ""preprocessing"": ""stem"", ""reg_alpha"": 0.0062529007627118134, ""reg_lambda"": 9.651000943889436, ""scale_pos_weight"": 1.5538356890260032, ""subsample"": 0.7147854152734676}",COMPLETE
33,0.6860753591102163,2026-10-01 08:37:29.079815,2026-10-01 08:37:30.019733,0 days 00:00:00.939918,0.7889934215829952,6.79343686780023,0.03145344487620817,4,2,500,uni,stem,0.0018298478439512458,13.691516144477694,1.4603496283424668,0.6634822042814873,0.012041390443582586,,"{""colsample_bytree"": 0.7889934215829952, ""gamma"": 6.79343686780023, ""learning_rate"": 0.03145344487620817, ""max_depth"": 4, ""min_child_weight"": 2, ""n_estimators"": 500, ""ngramas"": ""uni"", ""preprocessing"": ""stem"", ""reg_alpha"": 0.0018298478439512458, ""reg_lambda"": 13.691516144477694, ""scale_pos_weight"": 1.4603496283424668, ""subsample"": 0.6634822042814873}",COMPLETE
34,0.6807171386848981,2026-10-01 08:37:30.027756,2026-10-01 08:37:31.326249,0 days 00:00:01.298493,0.8214969538760526,6.772124348929868,0.18881069765670086,6,3,650,uni,normal,0.014017980355903814,0.10598224252478922,1.2553022210485805,0.7706818033360153,0.0039481052974885515,,"{""colsample_bytree"": 0.8214969538760526, ""gamma"": 6.772124348929868, ""learning_rate"": 0.18881069765670086, ""max_depth"": 6, ""min_child_weight"": 3, ""n_estimators"": 650, ""ngramas"": ""uni"", ""preprocessing"": ""normal"", ""reg_alpha"": 0.014017980355903814, ""reg_lambda"": 0.10598224252478922, ""scale_pos_weight"": 1.2553022210485805, ""subsample"": 0.7706818033360153}",COMPLETE
35,0.6804436208283228,2026-10-01 08:37:31.333615,2026-10-01 08:37:32.483714,0 days 00:00:01.150099,0.8004253752198958,6.656801427266659,0.19950898340861706,5,2,550,uni,normal,0.015481206465306057,0.5446300284646861,1.5525781690623062,0.6854882357655441,0.01435687868834589,,"{""colsample_bytree"": 0.8004253752198958, ""gamma"": 6.656801427266659, ""learning_rate"": 0.19950898340861706, ""max_depth"": 5, ""min_child_weight"": 2, ""n_estimators"": 550, ""ngramas"": ""uni"", ""preprocessing"": ""normal"", ""reg_alpha"": 0.015481206465306057, ""reg_lambda"": 0.5446300284646861, ""scale_pos_weight"": 1.5525781690623062, ""subsample"": 0.6854882357655441}",COMPLETE
36,0.6800428601030083,2026-10-01 08:37:32.489509,2026-10-01 08:37:33.763054,0 days 00:00:01.273545,0.8852925076351076,7.5900947176978155,0.14194072943224798,6,4,600,uni,normal,0.007762075323871832,0.2453728075495902,1.5729333693577314,0.7402673043969927,0.014861536548127175,,"{""colsample_bytree"": 0.8852925076351076, ""gamma"": 7.5900947176978155, ""learning_rate"": 0.14194072943224798, ""max_depth"": 6, ""min_child_weight"": 4, ""n_estimators"": 600, ""ngramas"": ""uni"", ""preprocessing"": ""normal"", ""reg_alpha"": 0.007762075323871832, ""reg_lambda"": 0.2453728075495902, ""scale_pos_weight"": 1.5729333693577314, ""subsample"": 0.7402673043969927}",COMPLETE
