number,value,datetime_start,datetime_complete,duration,params_colsample_bytree,params_gamma,params_learning_rate,params_max_depth,params_min_child_weight,params_n_estimators,params_ngramas,params_preprocessing,params_reg_alpha,params_reg_lambda,params_scale_pos_weight,params_subsample,user_attrs_inner_f1_std,system_attrs_fixed_params,system_attrs_tpe:relative_params:0,state
0,0.6767202160820963,2026-10-01 08:33:08.750682,2026-10-01 08:33:09.577677,0 days 00:00:00.826995,0.8436549963794391,5.495676598235193,0.014912334799978505,5,5,200,uni,normal,0.1460995401984744,0.11661695042823148,2.1006224444204245,0.6644986695338989,0.015190361423631915,"{'preprocessing': 'normal', 'ngramas': 'uni'}",,COMPLETE
1,0.6732520651189375,2026-10-01 08:33:09.579682,2026-10-01 08:33:11.919506,0 days 00:00:02.339824,0.5884115983537486,3.5374208603544477,0.021429375567205422,6,2,350,uni_bi,normal,0.01838170889617177,0.15010776969324383,2.264837041344557,0.8533270243147202,0.007078580149337913,"{'preprocessing': 'normal', 'ngramas': 'uni_bi'}",,COMPLETE
2,0.6751161064039523,2026-10-01 08:33:11.923034,2026-10-01 08:33:13.278756,0 days 00:00:01.355722,0.7678898606887231,1.1187503727286656,0.0317239257884236,7,15,650,uni,stem,3.876094171803447,0.4849701336699878,1.393457233894572,0.7060154262939016,0.00994723942046085,"{'preprocessing': 'stem', 'ngramas': 'uni'}",,COMPLETE
3,0.6586951611320991,2026-10-01 08:33:13.280761,2026-10-01 08:33:14.363559,0 days 00:00:01.082798,0.8634651031324352,7.326148068351174,0.0415685752358692,5,10,150,uni_bi,stem,0.12618934451314417,0.17352047335193588,1.2713718928868514,0.8923714469287022,0.026057045253057926,"{'preprocessing': 'stem', 'ngramas': 'uni_bi'}",,COMPLETE
4,0.6539839106158296,2026-10-01 08:33:14.365565,2026-10-01 08:33:15.408042,0 days 00:00:01.042477,0.6102235106595808,7.22560452305647,0.13347908492973548,4,11,700,uni,lemma,0.006723036752122265,0.8522138632181322,2.490358738591155,0.7700750285587564,0.02359791003775703,"{'preprocessing': 'lemma', 'ngramas': 'uni'}",,COMPLETE
5,0.6749703740217369,2026-10-01 08:33:15.412052,2026-10-01 08:33:17.692869,0 days 00:00:02.280817,0.6596787543616299,5.526088735267864,0.05363392753815193,4,7,550,uni_bi,lemma,0.6589651263273641,2.5270599675396843,1.810051696272484,0.8044457971887959,0.013056736590634537,"{'preprocessing': 'lemma', 'ngramas': 'uni_bi'}",,COMPLETE
6,0.667679025566939,2026-10-01 08:33:17.696375,2026-10-01 08:33:19.255289,0 days 00:00:01.558914,0.7352416170633504,2.3400743972251985,0.03353974378857238,2,6,300,uni_bi,lemma,0.9796759510335362,4.540242377729664,2.0428913004326397,0.6351893056983369,0.02020980110553645,,,COMPLETE
7,0.664640917859291,2026-10-01 08:33:19.259303,2026-10-01 08:33:20.474573,0 days 00:00:01.215270,0.6165690758694432,0.9779042623798591,0.19922157744046312,7,2,500,uni,stem,0.1898880329986574,0.10272988230855988,1.9169163845050325,0.7184561667093609,0.016092171126048493,,,COMPLETE
8,0.6624799329202348,2026-10-01 08:33:20.478582,2026-10-01 08:33:21.565518,0 days 00:00:01.086936,0.5413410043512618,4.175822458017969,0.021469546007741834,7,8,400,uni,lemma,0.0015094461003314766,0.521271708121548,2.1280595295490374,0.7659279415373134,0.016207953840519197,,,COMPLETE
9,0.6662991684218443,2026-10-01 08:33:21.569533,2026-10-01 08:33:23.547066,0 days 00:00:01.977533,0.7392752546328507,3.7452355967270012,0.15855739027695478,7,13,450,uni_bi,stem,0.5978449195497908,1.3040016804653507,1.1923905123641099,0.6879692992859042,0.0037444850765290965,,,COMPLETE
10,0.6321822124020894,2026-10-01 08:33:23.552583,2026-10-01 08:33:24.161545,0 days 00:00:00.608962,0.7929224112365386,5.655830772365601,0.01281207852007849,4,4,150,uni,normal,0.2301932482763347,2.6550336079258843,2.3846042509765724,0.698573835445777,0.025230974851413946,,"{""colsample_bytree"": 0.7929224112365386, ""gamma"": 5.655830772365601, ""learning_rate"": 0.01281207852007849, ""max_depth"": 4, ""min_child_weight"": 4, ""n_estimators"": 150, ""ngramas"": ""uni"", ""preprocessing"": ""normal"", ""reg_alpha"": 0.2301932482763347, ""reg_lambda"": 2.6550336079258843, ""scale_pos_weight"": 2.3846042509765724, ""subsample"": 0.698573835445777}",COMPLETE
11,0.6679241015428579,2026-10-01 08:33:24.167563,2026-10-01 08:33:25.151444,0 days 00:00:00.983881,0.8187472555192935,3.391275068718547,0.010557525295761662,7,7,200,uni,normal,0.02575556896539078,0.17421945201706435,2.120120488217312,0.7054786342105529,0.012607605580101506,,"{""colsample_bytree"": 0.8187472555192935, ""gamma"": 3.391275068718547, ""learning_rate"": 0.010557525295761662, ""max_depth"": 7, ""min_child_weight"": 7, ""n_estimators"": 200, ""ngramas"": ""uni"", ""preprocessing"": ""normal"", ""reg_alpha"": 0.02575556896539078, ""reg_lambda"": 0.17421945201706435, ""scale_pos_weight"": 2.120120488217312, ""subsample"": 0.7054786342105529}",COMPLETE
12,0.6760815624608805,2026-10-01 08:33:25.155459,2026-10-01 08:33:26.612130,0 days 00:00:01.456671,0.8617453468640527,2.500249981324654,0.013675307373726837,6,14,650,uni,stem,8.053483697378738,0.3363031412370714,1.946400636564042,0.7163289584952542,0.015675617223799173,,"{""colsample_bytree"": 0.8617453468640527, ""gamma"": 2.500249981324654, ""learning_rate"": 0.013675307373726837, ""max_depth"": 6, ""min_child_weight"": 14, ""n_estimators"": 650, ""ngramas"": ""uni"", ""preprocessing"": ""stem"", ""reg_alpha"": 8.053483697378738, ""reg_lambda"": 0.3363031412370714, ""scale_pos_weight"": 1.946400636564042, ""subsample"": 0.7163289584952542}",COMPLETE
13,0.6784227975798857,2026-10-01 08:33:26.618153,2026-10-01 08:33:27.382292,0 days 00:00:00.764139,0.8832521463428847,5.920929780191921,0.013526589041457066,4,5,200,uni,normal,0.030350394000702142,0.13378505091255846,1.9794278572384136,0.6655777666855133,0.017759041235154857,,"{""colsample_bytree"": 0.8832521463428847, ""gamma"": 5.920929780191921, ""learning_rate"": 0.013526589041457066, ""max_depth"": 4, ""min_child_weight"": 5, ""n_estimators"": 200, ""ngramas"": ""uni"", ""preprocessing"": ""normal"", ""reg_alpha"": 0.030350394000702142, ""reg_lambda"": 0.13378505091255846, ""scale_pos_weight"": 1.9794278572384136, ""subsample"": 0.6655777666855133}",COMPLETE
14,0.6742880050607553,2026-10-01 08:33:27.385807,2026-10-01 08:33:28.183822,0 days 00:00:00.798015,0.8126436805387306,7.5193976906848885,0.01503737337428209,5,13,250,uni,normal,0.24521444669371462,0.39211920923991617,1.8043791497411446,0.6717298047155739,0.01956856131577008,,"{""colsample_bytree"": 0.8126436805387306, ""gamma"": 7.5193976906848885, ""learning_rate"": 0.01503737337428209, ""max_depth"": 5, ""min_child_weight"": 13, ""n_estimators"": 250, ""ngramas"": ""uni"", ""preprocessing"": ""normal"", ""reg_alpha"": 0.24521444669371462, ""reg_lambda"": 0.39211920923991617, ""scale_pos_weight"": 1.8043791497411446, ""subsample"": 0.6717298047155739}",COMPLETE
15,0.6616552498158059,2026-10-01 08:33:28.186948,2026-10-01 08:33:29.045038,0 days 00:00:00.858090,0.8866995502106424,5.968089329256611,0.01650862461261309,6,7,200,uni,normal,0.0044896214142492894,0.3979468456133165,2.3157298412058807,0.5601013742848897,0.029748718392493295,,"{""colsample_bytree"": 0.8866995502106424, ""gamma"": 5.968089329256611, ""learning_rate"": 0.01650862461261309, ""max_depth"": 6, ""min_child_weight"": 7, ""n_estimators"": 200, ""ngramas"": ""uni"", ""preprocessing"": ""normal"", ""reg_alpha"": 0.0044896214142492894, ""reg_lambda"": 0.3979468456133165, ""scale_pos_weight"": 2.3157298412058807, ""subsample"": 0.5601013742848897}",COMPLETE
16,0.6867641309621074,2026-10-01 08:33:29.049050,2026-10-01 08:33:29.837028,0 days 00:00:00.787978,0.8461621023651619,6.475216590361829,0.016780898292027592,3,4,250,uni,normal,0.025508223482414875,0.13072071005661162,1.7300299068245506,0.7587129957064566,0.01687797241842086,,"{""colsample_bytree"": 0.8461621023651619, ""gamma"": 6.475216590361829, ""learning_rate"": 0.016780898292027592, ""max_depth"": 3, ""min_child_weight"": 4, ""n_estimators"": 250, ""ngramas"": ""uni"", ""preprocessing"": ""normal"", ""reg_alpha"": 0.025508223482414875, ""reg_lambda"": 0.13072071005661162, ""scale_pos_weight"": 1.7300299068245506, ""subsample"": 0.7587129957064566}",COMPLETE
17,0.681553952394323,2026-10-01 08:33:29.842774,2026-10-01 08:33:30.708219,0 days 00:00:00.865445,0.8604714971659506,7.13669112773103,0.046541729096759465,4,3,300,uni,normal,0.004460146690990892,0.1914536381584495,1.8080123875709782,0.6189390368411699,0.024793602221900878,,"{""colsample_bytree"": 0.8604714971659506, ""gamma"": 7.13669112773103, ""learning_rate"": 0.046541729096759465, ""max_depth"": 4, ""min_child_weight"": 3, ""n_estimators"": 300, ""ngramas"": ""uni"", ""preprocessing"": ""normal"", ""reg_alpha"": 0.004460146690990892, ""reg_lambda"": 0.1914536381584495, ""scale_pos_weight"": 1.8080123875709782, ""subsample"": 0.6189390368411699}",COMPLETE
18,0.689951162573248,2026-10-01 08:33:30.714238,2026-10-01 08:33:31.479530,0 days 00:00:00.765292,0.8733475191220451,7.029626445002781,0.06009169305333291,4,5,250,uni,normal,0.002694708919966694,0.11678979932709878,1.8199957621553806,0.802019733727021,0.017581737066031212,,"{""colsample_bytree"": 0.8733475191220451, ""gamma"": 7.029626445002781, ""learning_rate"": 0.06009169305333291, ""max_depth"": 4, ""min_child_weight"": 5, ""n_estimators"": 250, ""ngramas"": ""uni"", ""preprocessing"": ""normal"", ""reg_alpha"": 0.002694708919966694, ""reg_lambda"": 0.11678979932709878, ""scale_pos_weight"": 1.8199957621553806, ""subsample"": 0.802019733727021}",COMPLETE
19,0.6711169879087521,2026-10-01 08:33:31.486046,2026-10-01 08:33:32.162069,0 days 00:00:00.676023,0.871472337121315,7.6853787535228655,0.04890255132581079,4,8,200,uni,normal,0.005488174916777638,0.7272027400146847,2.172968529829838,0.7794578574560783,0.016754010665872378,,"{""colsample_bytree"": 0.871472337121315, ""gamma"": 7.6853787535228655, ""learning_rate"": 0.04890255132581079, ""max_depth"": 4, ""min_child_weight"": 8, ""n_estimators"": 200, ""ngramas"": ""uni"", ""preprocessing"": ""normal"", ""reg_alpha"": 0.005488174916777638, ""reg_lambda"": 0.7272027400146847, ""scale_pos_weight"": 2.172968529829838, ""subsample"": 0.7794578574560783}",COMPLETE
20,0.6935940000431589,2026-10-01 08:33:32.168086,2026-10-01 08:33:33.339205,0 days 00:00:01.171119,0.8348840040513272,6.822832778131956,0.02555787093671376,5,4,400,uni,normal,0.05260188108240173,0.17130558451661348,1.5259008577224977,0.7897331639997199,0.017216050577563768,,"{""colsample_bytree"": 0.8348840040513272, ""gamma"": 6.822832778131956, ""learning_rate"": 0.02555787093671376, ""max_depth"": 5, ""min_child_weight"": 4, ""n_estimators"": 400, ""ngramas"": ""uni"", ""preprocessing"": ""normal"", ""reg_alpha"": 0.05260188108240173, ""reg_lambda"": 0.17130558451661348, ""scale_pos_weight"": 1.5259008577224977, ""subsample"": 0.7897331639997199}",COMPLETE
21,0.6590809099391821,2026-10-01 08:33:33.346106,2026-10-01 08:33:34.115178,0 days 00:00:00.769072,0.8211714272747787,6.998871435811867,0.01573440844291217,2,7,250,uni,normal,0.14168622743435233,0.1374034407019427,1.9159386261758649,0.7758015178651135,0.028643091463034405,,"{""colsample_bytree"": 0.8211714272747787, ""gamma"": 6.998871435811867, ""learning_rate"": 0.01573440844291217, ""max_depth"": 2, ""min_child_weight"": 7, ""n_estimators"": 250, ""ngramas"": ""uni"", ""preprocessing"": ""normal"", ""reg_alpha"": 0.14168622743435233, ""reg_lambda"": 0.1374034407019427, ""scale_pos_weight"": 1.9159386261758649, ""subsample"": 0.7758015178651135}",COMPLETE
22,0.6818984288423721,2026-10-01 08:33:34.120532,2026-10-01 08:33:35.472941,0 days 00:00:01.352409,0.8068989465852827,7.006440607269931,0.02345243735584052,5,6,550,uni,normal,0.2762760847572703,0.25699050616833374,1.505498599815223,0.8130250803833493,0.016411611733607837,,"{""colsample_bytree"": 0.8068989465852827, ""gamma"": 7.006440607269931, ""learning_rate"": 0.02345243735584052, ""max_depth"": 5, ""min_child_weight"": 6, ""n_estimators"": 550, ""ngramas"": ""uni"", ""preprocessing"": ""normal"", ""reg_alpha"": 0.2762760847572703, ""reg_lambda"": 0.25699050616833374, ""scale_pos_weight"": 1.505498599815223, ""subsample"": 0.8130250803833493}",COMPLETE
23,0.6888936522256368,2026-10-01 08:33:35.479506,2026-10-01 08:33:36.393402,0 days 00:00:00.913896,0.8261258979316617,5.428156717569275,0.06959435530501988,5,5,350,uni,normal,0.0035077850426576793,0.378450742089616,1.467380515831412,0.8244135354177832,0.01976673013496499,,"{""colsample_bytree"": 0.8261258979316617, ""gamma"": 5.428156717569275, ""learning_rate"": 0.06959435530501988, ""max_depth"": 5, ""min_child_weight"": 5, ""n_estimators"": 350, ""ngramas"": ""uni"", ""preprocessing"": ""normal"", ""reg_alpha"": 0.0035077850426576793, ""reg_lambda"": 0.378450742089616, ""scale_pos_weight"": 1.467380515831412, ""subsample"": 0.8244135354177832}",COMPLETE
24,0.6717556894764473,2026-10-01 08:33:36.398912,2026-10-01 08:33:36.998536,0 days 00:00:00.599624,0.8948677616370927,4.799210451522116,0.14583280873043383,3,5,200,uni,normal,0.004732909248213084,0.15890803683645927,1.8855731108061158,0.7910236468243638,0.02072453382266288,,"{""colsample_bytree"": 0.8948677616370927, ""gamma"": 4.799210451522116, ""learning_rate"": 0.14583280873043383, ""max_depth"": 3, ""min_child_weight"": 5, ""n_estimators"": 200, ""ngramas"": ""uni"", ""preprocessing"": ""normal"", ""reg_alpha"": 0.004732909248213084, ""reg_lambda"": 0.15890803683645927, ""scale_pos_weight"": 1.8855731108061158, ""subsample"": 0.7910236468243638}",COMPLETE
25,0.6805727473703458,2026-10-01 08:33:37.004335,2026-10-01 08:33:37.724149,0 days 00:00:00.719814,0.8963281359912322,6.422379687772607,0.04949482410766083,4,7,250,uni,normal,0.005259977686092522,0.36970871075078965,1.8744026832970289,0.8557274928923047,0.011323069943940382,,"{""colsample_bytree"": 0.8963281359912322, ""gamma"": 6.422379687772607, ""learning_rate"": 0.04949482410766083, ""max_depth"": 4, ""min_child_weight"": 7, ""n_estimators"": 250, ""ngramas"": ""uni"", ""preprocessing"": ""normal"", ""reg_alpha"": 0.005259977686092522, ""reg_lambda"": 0.36970871075078965, ""scale_pos_weight"": 1.8744026832970289, ""subsample"": 0.8557274928923047}",COMPLETE
26,0.6490205521231512,2026-10-01 08:33:37.732165,2026-10-01 08:33:38.738464,0 days 00:00:01.006299,0.8652406708351873,6.573029381983679,0.037385280116535066,5,4,400,uni,normal,0.007292996238268367,0.4699285368300815,1.0730632368384254,0.7710406565747994,0.009300149940342084,,"{""colsample_bytree"": 0.8652406708351873, ""gamma"": 6.573029381983679, ""learning_rate"": 0.037385280116535066, ""max_depth"": 5, ""min_child_weight"": 4, ""n_estimators"": 400, ""ngramas"": ""uni"", ""preprocessing"": ""normal"", ""reg_alpha"": 0.007292996238268367, ""reg_lambda"": 0.4699285368300815, ""scale_pos_weight"": 1.0730632368384254, ""subsample"": 0.7710406565747994}",COMPLETE
27,0.6833277119437016,2026-10-01 08:33:38.745826,2026-10-01 08:33:39.554120,0 days 00:00:00.808294,0.8352732649536939,4.441272672411836,0.09985347609145236,5,4,300,uni,normal,0.009165991478194812,0.31749680914584105,1.4338898048861526,0.8037037590896485,0.02135643789995716,,"{""colsample_bytree"": 0.8352732649536939, ""gamma"": 4.441272672411836, ""learning_rate"": 0.09985347609145236, ""max_depth"": 5, ""min_child_weight"": 4, ""n_estimators"": 300, ""ngramas"": ""uni"", ""preprocessing"": ""normal"", ""reg_alpha"": 0.009165991478194812, ""reg_lambda"": 0.31749680914584105, ""scale_pos_weight"": 1.4338898048861526, ""subsample"": 0.8037037590896485}",COMPLETE
28,0.6908375073597797,2026-10-01 08:33:39.562913,2026-10-01 08:33:40.086685,0 days 00:00:00.523772,0.8230724571018261,7.13647139896597,0.057751815489419704,3,3,150,uni,normal,0.004113367980964494,0.10956509945706525,1.7623317874287088,0.8564460629811697,0.020286159362275603,,"{""colsample_bytree"": 0.8230724571018261, ""gamma"": 7.13647139896597, ""learning_rate"": 0.057751815489419704, ""max_depth"": 3, ""min_child_weight"": 3, ""n_estimators"": 150, ""ngramas"": ""uni"", ""preprocessing"": ""normal"", ""reg_alpha"": 0.004113367980964494, ""reg_lambda"": 0.10956509945706525, ""scale_pos_weight"": 1.7623317874287088, ""subsample"": 0.8564460629811697}",COMPLETE
29,0.6859174333511108,2026-10-01 08:33:40.093676,2026-10-01 08:33:40.633855,0 days 00:00:00.540179,0.832674944632693,7.829163561810942,0.13822732008895242,2,5,200,uni,normal,0.003977914706402603,0.7897933769794276,1.7447134046807005,0.8492698751984903,0.020198333553450784,,"{""colsample_bytree"": 0.832674944632693, ""gamma"": 7.829163561810942, ""learning_rate"": 0.13822732008895242, ""max_depth"": 2, ""min_child_weight"": 5, ""n_estimators"": 200, ""ngramas"": ""uni"", ""preprocessing"": ""normal"", ""reg_alpha"": 0.003977914706402603, ""reg_lambda"": 0.7897933769794276, ""scale_pos_weight"": 1.7447134046807005, ""subsample"": 0.8492698751984903}",COMPLETE
30,0.683592001345393,2026-10-01 08:33:40.642314,2026-10-01 08:33:41.318530,0 days 00:00:00.676216,0.8392095731780429,6.82610813353387,0.09696195530729279,3,3,250,uni,normal,0.009106426362037007,0.21048833117963955,1.8535580263258882,0.7919583594652012,0.022379040926983867,,"{""colsample_bytree"": 0.8392095731780429, ""gamma"": 6.82610813353387, ""learning_rate"": 0.09696195530729279, ""max_depth"": 3, ""min_child_weight"": 3, ""n_estimators"": 250, ""ngramas"": ""uni"", ""preprocessing"": ""normal"", ""reg_alpha"": 0.009106426362037007, ""reg_lambda"": 0.21048833117963955, ""scale_pos_weight"": 1.8535580263258882, ""subsample"": 0.7919583594652012}",COMPLETE
31,0.6856229594431404,2026-10-01 08:33:41.325521,2026-10-01 08:33:42.028212,0 days 00:00:00.702691,0.8192257212429442,5.967978722771831,0.08385539438778467,4,4,250,uni,normal,0.002246860451284929,0.2245944630758293,1.8673610845455524,0.8260012219429002,0.02884608312590657,,"{""colsample_bytree"": 0.8192257212429442, ""gamma"": 5.967978722771831, ""learning_rate"": 0.08385539438778467, ""max_depth"": 4, ""min_child_weight"": 4, ""n_estimators"": 250, ""ngramas"": ""uni"", ""preprocessing"": ""normal"", ""reg_alpha"": 0.002246860451284929, ""reg_lambda"": 0.2245944630758293, ""scale_pos_weight"": 1.8673610845455524, ""subsample"": 0.8260012219429002}",COMPLETE
32,0.675735013703993,2026-10-01 08:33:42.035733,2026-10-01 08:33:42.779388,0 days 00:00:00.743655,0.8924399207486935,7.098772540766716,0.0954785427180931,3,8,300,uni,normal,0.002254044686633828,0.14072598127019909,1.678673181935901,0.8312039922269199,0.018535386096120234,,"{""colsample_bytree"": 0.8924399207486935, ""gamma"": 7.098772540766716, ""learning_rate"": 0.0954785427180931, ""max_depth"": 3, ""min_child_weight"": 8, ""n_estimators"": 300, ""ngramas"": ""uni"", ""preprocessing"": ""normal"", ""reg_alpha"": 0.002254044686633828, ""reg_lambda"": 0.14072598127019909, ""scale_pos_weight"": 1.678673181935901, ""subsample"": 0.8312039922269199}",COMPLETE
33,0.6722170764681031,2026-10-01 08:33:42.786423,2026-10-01 08:33:43.283581,0 days 00:00:00.497158,0.8762911810740799,7.542471609185829,0.03691729707825277,2,6,150,uni,normal,0.0049314626716348755,0.11641119670329175,1.8950142834477206,0.8308529998719854,0.023468016756344846,,"{""colsample_bytree"": 0.8762911810740799, ""gamma"": 7.542471609185829, ""learning_rate"": 0.03691729707825277, ""max_depth"": 2, ""min_child_weight"": 6, ""n_estimators"": 150, ""ngramas"": ""uni"", ""preprocessing"": ""normal"", ""reg_alpha"": 0.0049314626716348755, ""reg_lambda"": 0.11641119670329175, ""scale_pos_weight"": 1.8950142834477206, ""subsample"": 0.8308529998719854}",COMPLETE
34,0.6819337062720265,2026-10-01 08:33:43.291649,2026-10-01 08:33:43.873368,0 days 00:00:00.581719,0.7445867065952544,6.3074626738862785,0.07429398454885643,4,5,200,uni,normal,0.05628665562198668,0.18836723196578203,1.7071740605074428,0.8964138400166944,0.023899605882240802,,"{""colsample_bytree"": 0.7445867065952544, ""gamma"": 6.3074626738862785, ""learning_rate"": 0.07429398454885643, ""max_depth"": 4, ""min_child_weight"": 5, ""n_estimators"": 200, ""ngramas"": ""uni"", ""preprocessing"": ""normal"", ""reg_alpha"": 0.05628665562198668, ""reg_lambda"": 0.18836723196578203, ""scale_pos_weight"": 1.7071740605074428, ""subsample"": 0.8964138400166944}",COMPLETE
35,0.6869069165588689,2026-10-01 08:33:43.879921,2026-10-01 08:33:44.990935,0 days 00:00:01.111014,0.8003109954546155,5.767478108111416,0.0385360380193387,5,6,450,uni,normal,0.001524671087857504,0.21023372334149873,1.6880584242626848,0.8284183712911519,0.023758274542477444,,"{""colsample_bytree"": 0.8003109954546155, ""gamma"": 5.767478108111416, ""learning_rate"": 0.0385360380193387, ""max_depth"": 5, ""min_child_weight"": 6, ""n_estimators"": 450, ""ngramas"": ""uni"", ""preprocessing"": ""normal"", ""reg_alpha"": 0.001524671087857504, ""reg_lambda"": 0.21023372334149873, ""scale_pos_weight"": 1.6880584242626848, ""subsample"": 0.8284183712911519}",COMPLETE
36,0.6911652796355271,2026-10-01 08:33:44.997947,2026-10-01 08:33:45.698800,0 days 00:00:00.700853,0.8189669547027608,6.927710391294736,0.0617347925414035,4,2,250,uni,normal,0.0024337581809289145,0.11677182143669129,1.4942888265342915,0.8881632010911052,0.012028409024841336,,"{""colsample_bytree"": 0.8189669547027608, ""gamma"": 6.927710391294736, ""learning_rate"": 0.0617347925414035, ""max_depth"": 4, ""min_child_weight"": 2, ""n_estimators"": 250, ""ngramas"": ""uni"", ""preprocessing"": ""normal"", ""reg_alpha"": 0.0024337581809289145, ""reg_lambda"": 0.11677182143669129, ""scale_pos_weight"": 1.4942888265342915, ""subsample"": 0.8881632010911052}",COMPLETE
