number,value,datetime_start,datetime_complete,duration,params_colsample_bytree,params_gamma,params_learning_rate,params_max_depth,params_min_child_weight,params_n_estimators,params_ngramas,params_preprocessing,params_reg_alpha,params_reg_lambda,params_scale_pos_weight,params_subsample,user_attrs_inner_f1_std,system_attrs_fixed_params,system_attrs_tpe:relative_params:0,state
0,0.5689030935400997,2026-10-01 08:30:34.609682,2026-10-01 08:30:36.511961,0 days 00:00:01.902279,0.874894942995359,0.8214908626419793,0.02108688998712124,5,12,600,uni,normal,0.058005451785441836,12.595092659243525,1.6825058783901683,0.659576927471088,0.009099398052437452,"{'preprocessing': 'normal', 'ngramas': 'uni'}",,COMPLETE
1,0.5723651903556687,2026-10-01 08:30:36.513706,2026-10-01 08:30:38.290072,0 days 00:00:01.776366,0.6294663307602683,1.280557979849662,0.035866902055082216,2,12,450,uni_bi,normal,1.6159658826251597,0.810065540991291,1.9416521323512845,0.8534784884637766,0.013525584735538675,"{'preprocessing': 'normal', 'ngramas': 'uni_bi'}",,COMPLETE
2,0.5724342075289157,2026-10-01 08:30:38.295582,2026-10-01 08:30:38.760910,0 days 00:00:00.465328,0.8962104825650745,3.4635901107729525,0.011534486580212257,3,7,150,uni,stem,0.016988578856135868,0.3226713059542976,1.741037537479581,0.641845318749869,0.01589644511711071,"{'preprocessing': 'stem', 'ngramas': 'uni'}",,COMPLETE
3,0.4824705985286884,2026-10-01 08:30:38.763923,2026-10-01 08:30:39.840647,0 days 00:00:01.076724,0.8450335877208167,1.1756394215003227,0.02021517501781213,3,15,150,uni_bi,stem,0.003944169826212177,3.5287034801585984,2.468487887218651,0.7654858555771249,0.010461640929694408,"{'preprocessing': 'stem', 'ngramas': 'uni_bi'}",,COMPLETE
4,0.5655812596785837,2026-10-01 08:30:39.846664,2026-10-01 08:30:40.526561,0 days 00:00:00.679897,0.602293369523341,1.7720582334980068,0.01189943945641824,7,12,150,uni,lemma,0.006032664691710865,0.175869492597536,1.7811844005832906,0.572611007331439,0.016954176225533257,"{'preprocessing': 'lemma', 'ngramas': 'uni'}",,COMPLETE
5,0.5586481008501386,2026-10-01 08:30:40.530583,2026-10-01 08:30:41.720252,0 days 00:00:01.189669,0.5875891509501385,6.7688879679728275,0.015151899213942333,6,3,150,uni_bi,lemma,0.0010555987814221286,0.21942971082112142,2.0475157638097787,0.7003604072608834,0.019252282822453528,"{'preprocessing': 'lemma', 'ngramas': 'uni_bi'}",,COMPLETE
6,0.573014843038205,2026-10-01 08:30:41.723759,2026-10-01 08:30:42.650606,0 days 00:00:00.926847,0.7856061586672805,4.149288284766351,0.028177381498663497,7,7,400,uni,stem,0.008530561236333053,3.517904764265231,1.8679820236787972,0.8401242507817004,0.008728364555834235,,,COMPLETE
7,0.5646284074638301,2026-10-01 08:30:42.654027,2026-10-01 08:30:43.278776,0 days 00:00:00.624749,0.7230670508362705,2.9919163027527325,0.11343900023857142,5,8,350,uni,stem,0.0035388339011866517,12.035327894400558,1.3431544340025008,0.7685020537144995,0.01712674814739137,,,COMPLETE
8,0.5379431858973684,2026-10-01 08:30:43.282928,2026-10-01 08:30:45.163928,0 days 00:00:01.881000,0.5315117615108721,5.861270996685928,0.04687303072292285,6,11,550,uni_bi,lemma,0.7834236484860668,0.11307393730252309,1.184410107210054,0.658676894974765,0.010320639914304777,,,COMPLETE
9,0.5667621563784443,2026-10-01 08:30:45.169938,2026-10-01 08:30:46.883839,0 days 00:00:01.713901,0.5052526182824153,5.484751507084719,0.02051419574500176,6,4,400,uni_bi,lemma,0.022145633883549187,14.76355756770037,1.8926410761463255,0.5792307082785086,0.036035655821413146,,,COMPLETE
10,0.5781377811159301,2026-10-01 08:30:46.887851,2026-10-01 08:30:47.793862,0 days 00:00:00.906011,0.790940409790135,4.8302052563506095,0.12339540548238948,6,2,450,uni,stem,0.0016216460564478237,0.1467291936440829,2.295040910982621,0.8553374160639711,0.014741797695279156,,"{""colsample_bytree"": 0.790940409790135, ""gamma"": 4.8302052563506095, ""learning_rate"": 0.12339540548238948, ""max_depth"": 6, ""min_child_weight"": 2, ""n_estimators"": 450, ""ngramas"": ""uni"", ""preprocessing"": ""stem"", ""reg_alpha"": 0.0016216460564478237, ""reg_lambda"": 0.1467291936440829, ""scale_pos_weight"": 2.295040910982621, ""subsample"": 0.8553374160639711}",COMPLETE
11,0.5441334545343449,2026-10-01 08:30:47.797616,2026-10-01 08:30:48.655943,0 days 00:00:00.858327,0.7333839263172655,4.272805090037007,0.032165948456435695,5,9,400,uni,stem,0.0033189956942620055,0.11782885974489002,2.380452619272408,0.8483560008977956,0.013371740090045896,,"{""colsample_bytree"": 0.7333839263172655, ""gamma"": 4.272805090037007, ""learning_rate"": 0.032165948456435695, ""max_depth"": 5, ""min_child_weight"": 9, ""n_estimators"": 400, ""ngramas"": ""uni"", ""preprocessing"": ""stem"", ""reg_alpha"": 0.0033189956942620055, ""reg_lambda"": 0.11782885974489002, ""scale_pos_weight"": 2.380452619272408, ""subsample"": 0.8483560008977956}",COMPLETE
12,0.5502381565465203,2026-10-01 08:30:48.660959,2026-10-01 08:30:49.296141,0 days 00:00:00.635182,0.7731272358411476,7.600103297167678,0.16101340810705195,7,6,350,uni,stem,0.004189235635936798,0.6303620507350765,2.1182053049932152,0.8636633621656505,0.009368991159676258,,"{""colsample_bytree"": 0.7731272358411476, ""gamma"": 7.600103297167678, ""learning_rate"": 0.16101340810705195, ""max_depth"": 7, ""min_child_weight"": 6, ""n_estimators"": 350, ""ngramas"": ""uni"", ""preprocessing"": ""stem"", ""reg_alpha"": 0.004189235635936798, ""reg_lambda"": 0.6303620507350765, ""scale_pos_weight"": 2.1182053049932152, ""subsample"": 0.8636633621656505}",COMPLETE
13,0.5778046350726355,2026-10-01 08:30:49.302152,2026-10-01 08:30:50.256712,0 days 00:00:00.954560,0.7967369971995224,5.160585563701228,0.017361559259978666,6,5,350,uni,stem,0.0037418350029730226,1.4526412469633592,1.7100968582085598,0.7901018939348655,0.016184626606073296,,"{""colsample_bytree"": 0.7967369971995224, ""gamma"": 5.160585563701228, ""learning_rate"": 0.017361559259978666, ""max_depth"": 6, ""min_child_weight"": 5, ""n_estimators"": 350, ""ngramas"": ""uni"", ""preprocessing"": ""stem"", ""reg_alpha"": 0.0037418350029730226, ""reg_lambda"": 1.4526412469633592, ""scale_pos_weight"": 1.7100968582085598, ""subsample"": 0.7901018939348655}",COMPLETE
14,0.5823973718526667,2026-10-01 08:30:50.260460,2026-10-01 08:30:51.251252,0 days 00:00:00.990792,0.7046736394508525,4.307604513497202,0.08159793420400158,7,2,400,uni,stem,0.0024545372838791542,0.7209232626739895,2.4575863219248233,0.7623734303670051,0.0057565790716656495,,"{""colsample_bytree"": 0.7046736394508525, ""gamma"": 4.307604513497202, ""learning_rate"": 0.08159793420400158, ""max_depth"": 7, ""min_child_weight"": 2, ""n_estimators"": 400, ""ngramas"": ""uni"", ""preprocessing"": ""stem"", ""reg_alpha"": 0.0024545372838791542, ""reg_lambda"": 0.7209232626739895, ""scale_pos_weight"": 2.4575863219248233, ""subsample"": 0.7623734303670051}",COMPLETE
15,0.5843522577159804,2026-10-01 08:30:51.255272,2026-10-01 08:30:52.237660,0 days 00:00:00.982388,0.8247830552166838,4.642577276100845,0.19524364815904457,5,2,550,uni,stem,0.003535048735785575,0.11649720230160683,2.0177116579845924,0.8440589466074307,0.020137479621875284,,"{""colsample_bytree"": 0.8247830552166838, ""gamma"": 4.642577276100845, ""learning_rate"": 0.19524364815904457, ""max_depth"": 5, ""min_child_weight"": 2, ""n_estimators"": 550, ""ngramas"": ""uni"", ""preprocessing"": ""stem"", ""reg_alpha"": 0.003535048735785575, ""reg_lambda"": 0.11649720230160683, ""scale_pos_weight"": 2.0177116579845924, ""subsample"": 0.8440589466074307}",COMPLETE
16,0.5818805608496969,2026-10-01 08:30:52.243686,2026-10-01 08:30:53.083762,0 days 00:00:00.840076,0.8629578803543535,4.309535859543786,0.061304052892468264,6,4,300,uni,stem,0.0034744735864182634,0.3246213367075255,2.426185824193005,0.7689027719825743,0.006614179939826716,,"{""colsample_bytree"": 0.8629578803543535, ""gamma"": 4.309535859543786, ""learning_rate"": 0.061304052892468264, ""max_depth"": 6, ""min_child_weight"": 4, ""n_estimators"": 300, ""ngramas"": ""uni"", ""preprocessing"": ""stem"", ""reg_alpha"": 0.0034744735864182634, ""reg_lambda"": 0.3246213367075255, ""scale_pos_weight"": 2.426185824193005, ""subsample"": 0.7689027719825743}",COMPLETE
17,0.5868289569684375,2026-10-01 08:30:53.087832,2026-10-01 08:30:54.330494,0 days 00:00:01.242662,0.7723755375106112,5.05000471736057,0.06612180300869756,7,2,700,uni,stem,0.0036415155712575717,0.45480503875854067,1.887525795276374,0.8874981458414268,0.00541075500006086,,"{""colsample_bytree"": 0.7723755375106112, ""gamma"": 5.05000471736057, ""learning_rate"": 0.06612180300869756, ""max_depth"": 7, ""min_child_weight"": 2, ""n_estimators"": 700, ""ngramas"": ""uni"", ""preprocessing"": ""stem"", ""reg_alpha"": 0.0036415155712575717, ""reg_lambda"": 0.45480503875854067, ""scale_pos_weight"": 1.887525795276374, ""subsample"": 0.8874981458414268}",COMPLETE
18,0.578038458563222,2026-10-01 08:30:54.334836,2026-10-01 08:30:55.397205,0 days 00:00:01.062369,0.8173548138831916,3.3085558355903393,0.07890323081011923,7,5,550,uni,stem,0.0019794677909340933,0.3948630459666335,1.550217502277409,0.7971712564625908,0.00920557085720247,,"{""colsample_bytree"": 0.8173548138831916, ""gamma"": 3.3085558355903393, ""learning_rate"": 0.07890323081011923, ""max_depth"": 7, ""min_child_weight"": 5, ""n_estimators"": 550, ""ngramas"": ""uni"", ""preprocessing"": ""stem"", ""reg_alpha"": 0.0019794677909340933, ""reg_lambda"": 0.3948630459666335, ""scale_pos_weight"": 1.550217502277409, ""subsample"": 0.7971712564625908}",COMPLETE
19,0.5826137345527757,2026-10-01 08:30:55.403067,2026-10-01 08:30:56.415729,0 days 00:00:01.012662,0.882111144709072,5.159436220299224,0.14365942151176594,7,3,550,uni,stem,0.008231389679913952,0.3421545670175083,2.0097005498965785,0.8486099222676745,0.02333394089408948,,"{""colsample_bytree"": 0.882111144709072, ""gamma"": 5.159436220299224, ""learning_rate"": 0.14365942151176594, ""max_depth"": 7, ""min_child_weight"": 3, ""n_estimators"": 550, ""ngramas"": ""uni"", ""preprocessing"": ""stem"", ""reg_alpha"": 0.008231389679913952, ""reg_lambda"": 0.3421545670175083, ""scale_pos_weight"": 2.0097005498965785, ""subsample"": 0.8486099222676745}",COMPLETE
20,0.5778873076518051,2026-10-01 08:30:56.421746,2026-10-01 08:30:57.535654,0 days 00:00:01.113908,0.7668292488214465,4.980888766990741,0.0821769059072635,3,4,650,uni,stem,0.0012262433832315933,0.15024720160591307,2.0226023337171606,0.7770697524968473,0.01452115214358187,,"{""colsample_bytree"": 0.7668292488214465, ""gamma"": 4.980888766990741, ""learning_rate"": 0.0821769059072635, ""max_depth"": 3, ""min_child_weight"": 4, ""n_estimators"": 650, ""ngramas"": ""uni"", ""preprocessing"": ""stem"", ""reg_alpha"": 0.0012262433832315933, ""reg_lambda"": 0.15024720160591307, ""scale_pos_weight"": 2.0226023337171606, ""subsample"": 0.7770697524968473}",COMPLETE
21,0.580095200501975,2026-10-01 08:30:57.539667,2026-10-01 08:30:58.449760,0 days 00:00:00.910093,0.8119206656697756,4.684620138266841,0.15124258743230481,6,4,550,uni,stem,0.03586054517948341,0.26679142548431584,1.648521558958774,0.8849271440899636,0.017843231012672947,,"{""colsample_bytree"": 0.8119206656697756, ""gamma"": 4.684620138266841, ""learning_rate"": 0.15124258743230481, ""max_depth"": 6, ""min_child_weight"": 4, ""n_estimators"": 550, ""ngramas"": ""uni"", ""preprocessing"": ""stem"", ""reg_alpha"": 0.03586054517948341, ""reg_lambda"": 0.26679142548431584, ""scale_pos_weight"": 1.648521558958774, ""subsample"": 0.8849271440899636}",COMPLETE
22,0.5853170468589135,2026-10-01 08:30:58.455772,2026-10-01 08:30:59.479009,0 days 00:00:01.023237,0.861047659419174,4.202063044077185,0.1091967395754264,3,4,600,uni,stem,0.0013255157142101094,0.37036425232679054,1.9287040432767848,0.8501089267060518,0.01746501119127628,,"{""colsample_bytree"": 0.861047659419174, ""gamma"": 4.202063044077185, ""learning_rate"": 0.1091967395754264, ""max_depth"": 3, ""min_child_weight"": 4, ""n_estimators"": 600, ""ngramas"": ""uni"", ""preprocessing"": ""stem"", ""reg_alpha"": 0.0013255157142101094, ""reg_lambda"": 0.37036425232679054, ""scale_pos_weight"": 1.9287040432767848, ""subsample"": 0.8501089267060518}",COMPLETE
23,0.584208157708538,2026-10-01 08:30:59.485724,2026-10-01 08:31:00.383689,0 days 00:00:00.897965,0.8837920523896956,4.250769734306071,0.10202059961930034,2,4,500,uni,stem,0.0014520610059185588,0.8200236843440749,2.099858809577826,0.8682263987579132,0.00452047838316055,,"{""colsample_bytree"": 0.8837920523896956, ""gamma"": 4.250769734306071, ""learning_rate"": 0.10202059961930034, ""max_depth"": 2, ""min_child_weight"": 4, ""n_estimators"": 500, ""ngramas"": ""uni"", ""preprocessing"": ""stem"", ""reg_alpha"": 0.0014520610059185588, ""reg_lambda"": 0.8200236843440749, ""scale_pos_weight"": 2.099858809577826, ""subsample"": 0.8682263987579132}",COMPLETE
24,0.584006481299964,2026-10-01 08:31:00.389705,2026-10-01 08:31:01.545090,0 days 00:00:01.155385,0.8944628502655991,5.592356094945854,0.11423904798699594,4,3,700,uni,stem,0.03430989920166574,0.3672788650875362,1.8487244771638007,0.8559729833610248,0.021182597797167448,,"{""colsample_bytree"": 0.8944628502655991, ""gamma"": 5.592356094945854, ""learning_rate"": 0.11423904798699594, ""max_depth"": 4, ""min_child_weight"": 3, ""n_estimators"": 700, ""ngramas"": ""uni"", ""preprocessing"": ""stem"", ""reg_alpha"": 0.03430989920166574, ""reg_lambda"": 0.3672788650875362, ""scale_pos_weight"": 1.8487244771638007, ""subsample"": 0.8559729833610248}",COMPLETE
25,0.5771475859972587,2026-10-01 08:31:01.552857,2026-10-01 08:31:02.509307,0 days 00:00:00.956450,0.8345924368340452,3.8126988628477037,0.1972015896840596,5,4,500,uni,stem,0.005076082487587327,0.3314782454959515,2.094809313624701,0.794575236885303,0.020887979424131328,,"{""colsample_bytree"": 0.8345924368340452, ""gamma"": 3.8126988628477037, ""learning_rate"": 0.1972015896840596, ""max_depth"": 5, ""min_child_weight"": 4, ""n_estimators"": 500, ""ngramas"": ""uni"", ""preprocessing"": ""stem"", ""reg_alpha"": 0.005076082487587327, ""reg_lambda"": 0.3314782454959515, ""scale_pos_weight"": 2.094809313624701, ""subsample"": 0.794575236885303}",COMPLETE
26,0.5822587197645369,2026-10-01 08:31:02.515041,2026-10-01 08:31:03.625046,0 days 00:00:01.110005,0.7908193441453026,4.580681669992278,0.07939938080835053,5,5,700,uni,stem,0.004943076119299831,0.3533289141819843,1.507562811004473,0.8651024120959121,0.020881337915332927,,"{""colsample_bytree"": 0.7908193441453026, ""gamma"": 4.580681669992278, ""learning_rate"": 0.07939938080835053, ""max_depth"": 5, ""min_child_weight"": 5, ""n_estimators"": 700, ""ngramas"": ""uni"", ""preprocessing"": ""stem"", ""reg_alpha"": 0.004943076119299831, ""reg_lambda"": 0.3533289141819843, ""scale_pos_weight"": 1.507562811004473, ""subsample"": 0.8651024120959121}",COMPLETE
27,0.5874005736379178,2026-10-01 08:31:03.632215,2026-10-01 08:31:04.840046,0 days 00:00:01.207831,0.8673659357139206,4.074995403788891,0.07132324237813047,4,2,600,uni,stem,0.0059797726505602545,0.24454611669575668,1.8615383794285087,0.8746150751631883,0.021374097950219304,,"{""colsample_bytree"": 0.8673659357139206, ""gamma"": 4.074995403788891, ""learning_rate"": 0.07132324237813047, ""max_depth"": 4, ""min_child_weight"": 2, ""n_estimators"": 600, ""ngramas"": ""uni"", ""preprocessing"": ""stem"", ""reg_alpha"": 0.0059797726505602545, ""reg_lambda"": 0.24454611669575668, ""scale_pos_weight"": 1.8615383794285087, ""subsample"": 0.8746150751631883}",COMPLETE
28,0.6009665524530668,2026-10-01 08:31:04.846667,2026-10-01 08:31:05.867672,0 days 00:00:01.021005,0.7898158065566614,5.431986145952841,0.07543109044474498,2,3,650,uni,stem,0.013381793574594899,0.24679793271631542,1.620787855156816,0.8547662159777851,0.007743493442921512,,"{""colsample_bytree"": 0.7898158065566614, ""gamma"": 5.431986145952841, ""learning_rate"": 0.07543109044474498, ""max_depth"": 2, ""min_child_weight"": 3, ""n_estimators"": 650, ""ngramas"": ""uni"", ""preprocessing"": ""stem"", ""reg_alpha"": 0.013381793574594899, ""reg_lambda"": 0.24679793271631542, ""scale_pos_weight"": 1.620787855156816, ""subsample"": 0.8547662159777851}",COMPLETE
29,0.5833580225313597,2026-10-01 08:31:05.873690,2026-10-01 08:31:06.933250,0 days 00:00:01.059560,0.8139359231591846,5.528044903088502,0.043526757515643014,2,4,650,uni,stem,0.0020448671265924107,0.26925083863131843,1.7006002131744404,0.8802182631379322,0.013806292054438268,,"{""colsample_bytree"": 0.8139359231591846, ""gamma"": 5.528044903088502, ""learning_rate"": 0.043526757515643014, ""max_depth"": 2, ""min_child_weight"": 4, ""n_estimators"": 650, ""ngramas"": ""uni"", ""preprocessing"": ""stem"", ""reg_alpha"": 0.0020448671265924107, ""reg_lambda"": 0.26925083863131843, ""scale_pos_weight"": 1.7006002131744404, ""subsample"": 0.8802182631379322}",COMPLETE
30,0.5824814942167039,2026-10-01 08:31:06.939794,2026-10-01 08:31:08.193995,0 days 00:00:01.254201,0.8265979819184296,3.221316125760156,0.06237502030498788,6,4,600,uni,stem,0.007010426538688736,0.4426765561483605,1.849289553699561,0.8646642351566943,0.012892362112257374,,"{""colsample_bytree"": 0.8265979819184296, ""gamma"": 3.221316125760156, ""learning_rate"": 0.06237502030498788, ""max_depth"": 6, ""min_child_weight"": 4, ""n_estimators"": 600, ""ngramas"": ""uni"", ""preprocessing"": ""stem"", ""reg_alpha"": 0.007010426538688736, ""reg_lambda"": 0.4426765561483605, ""scale_pos_weight"": 1.849289553699561, ""subsample"": 0.8646642351566943}",COMPLETE
31,0.580415137366947,2026-10-01 08:31:08.200804,2026-10-01 08:31:09.323607,0 days 00:00:01.122803,0.8304965883633099,4.616751760554795,0.1169497446926094,3,2,700,uni,stem,0.004047184059968932,0.8573693913656876,1.8012061096769791,0.8626689390349231,0.02759504813365499,,"{""colsample_bytree"": 0.8304965883633099, ""gamma"": 4.616751760554795, ""learning_rate"": 0.1169497446926094, ""max_depth"": 3, ""min_child_weight"": 2, ""n_estimators"": 700, ""ngramas"": ""uni"", ""preprocessing"": ""stem"", ""reg_alpha"": 0.004047184059968932, ""reg_lambda"": 0.8573693913656876, ""scale_pos_weight"": 1.8012061096769791, ""subsample"": 0.8626689390349231}",COMPLETE
32,0.5954798345190627,2026-10-01 08:31:09.329618,2026-10-01 08:31:10.342124,0 days 00:00:01.012506,0.8588909293487638,6.103285707208208,0.10703136738907189,3,3,650,uni,stem,0.0011477469020035266,0.284847769949488,1.7845064055798958,0.8206319087966244,0.013202576771092262,,"{""colsample_bytree"": 0.8588909293487638, ""gamma"": 6.103285707208208, ""learning_rate"": 0.10703136738907189, ""max_depth"": 3, ""min_child_weight"": 3, ""n_estimators"": 650, ""ngramas"": ""uni"", ""preprocessing"": ""stem"", ""reg_alpha"": 0.0011477469020035266, ""reg_lambda"": 0.284847769949488, ""scale_pos_weight"": 1.7845064055798958, ""subsample"": 0.8206319087966244}",COMPLETE
33,0.5866309648918383,2026-10-01 08:31:10.348894,2026-10-01 08:31:11.248890,0 days 00:00:00.899996,0.8501772898020704,6.1739216575755,0.09620877894257983,4,3,550,uni,stem,0.0026483046188625096,0.6068540100973839,1.8943641949457344,0.8946269316694925,0.00865167819877381,,"{""colsample_bytree"": 0.8501772898020704, ""gamma"": 6.1739216575755, ""learning_rate"": 0.09620877894257983, ""max_depth"": 4, ""min_child_weight"": 3, ""n_estimators"": 550, ""ngramas"": ""uni"", ""preprocessing"": ""stem"", ""reg_alpha"": 0.0026483046188625096, ""reg_lambda"": 0.6068540100973839, ""scale_pos_weight"": 1.8943641949457344, ""subsample"": 0.8946269316694925}",COMPLETE
34,0.5744262780440121,2026-10-01 08:31:11.255469,2026-10-01 08:31:12.231365,0 days 00:00:00.975896,0.7559895504260289,5.2664251104582664,0.09879887501837417,2,4,700,uni,stem,0.026166576697000208,0.20928046502015357,1.4189717187143667,0.8617996534085435,0.021520097340377832,,"{""colsample_bytree"": 0.7559895504260289, ""gamma"": 5.2664251104582664, ""learning_rate"": 0.09879887501837417, ""max_depth"": 2, ""min_child_weight"": 4, ""n_estimators"": 700, ""ngramas"": ""uni"", ""preprocessing"": ""stem"", ""reg_alpha"": 0.026166576697000208, ""reg_lambda"": 0.20928046502015357, ""scale_pos_weight"": 1.4189717187143667, ""subsample"": 0.8617996534085435}",COMPLETE
35,0.589773787497654,2026-10-01 08:31:12.239954,2026-10-01 08:31:13.502585,0 days 00:00:01.262631,0.7432364290117387,5.241078492875096,0.04396136826481659,5,2,700,uni,stem,0.001892016209757906,0.2702076779677663,1.799956870273463,0.8693086976649648,0.023228072887551986,,"{""colsample_bytree"": 0.7432364290117387, ""gamma"": 5.241078492875096, ""learning_rate"": 0.04396136826481659, ""max_depth"": 5, ""min_child_weight"": 2, ""n_estimators"": 700, ""ngramas"": ""uni"", ""preprocessing"": ""stem"", ""reg_alpha"": 0.001892016209757906, ""reg_lambda"": 0.2702076779677663, ""scale_pos_weight"": 1.799956870273463, ""subsample"": 0.8693086976649648}",COMPLETE
36,0.588050706030021,2026-10-01 08:31:13.510600,2026-10-01 08:31:14.630699,0 days 00:00:01.120099,0.8165766569430158,5.724535455370692,0.09107814912004883,3,2,700,uni,stem,0.0010840789660320543,0.2583573753835067,1.7873008229837533,0.7852179926163467,0.01748419365021735,,"{""colsample_bytree"": 0.8165766569430158, ""gamma"": 5.724535455370692, ""learning_rate"": 0.09107814912004883, ""max_depth"": 3, ""min_child_weight"": 2, ""n_estimators"": 700, ""ngramas"": ""uni"", ""preprocessing"": ""stem"", ""reg_alpha"": 0.0010840789660320543, ""reg_lambda"": 0.2583573753835067, ""scale_pos_weight"": 1.7873008229837533, ""subsample"": 0.7852179926163467}",COMPLETE
