number,value,datetime_start,datetime_complete,duration,params_colsample_bytree,params_gamma,params_learning_rate,params_max_depth,params_min_child_weight,params_n_estimators,params_ngramas,params_preprocessing,params_reg_alpha,params_reg_lambda,params_scale_pos_weight,params_subsample,user_attrs_inner_f1_std,system_attrs_fixed_params,system_attrs_tpe:relative_params:0,state
0,0.64368020345199,2026-10-01 08:41:35.334015,2026-10-01 08:41:37.963195,0 days 00:00:02.629180,0.6891231879021942,0.8639150067983441,0.023236535796625712,5,3,700,uni,normal,0.004500883717053276,0.18484430097724697,1.941087524056639,0.7055643235901311,0.007726353395747561,"{'preprocessing': 'normal', 'ngramas': 'uni'}",,COMPLETE
1,0.625009770727582,2026-10-01 08:41:37.966412,2026-10-01 08:41:40.217574,0 days 00:00:02.251162,0.613066882612467,7.820024868631562,0.19451747759715904,5,8,650,uni_bi,normal,0.4923477941754624,1.0319883368576308,1.4345310103781423,0.7664030692485754,0.022323993670486077,"{'preprocessing': 'normal', 'ngramas': 'uni_bi'}",,COMPLETE
2,0.6125254568264019,2026-10-01 08:41:40.220575,2026-10-01 08:41:40.987594,0 days 00:00:00.767019,0.6551930070428668,6.641550706740324,0.019736720393672826,2,8,450,uni,stem,0.0019868411245652948,13.310512566656326,1.3373441230141867,0.6349653548730396,0.023293418887424755,"{'preprocessing': 'stem', 'ngramas': 'uni'}",,COMPLETE
3,0.6002610876350144,2026-10-01 08:41:40.991593,2026-10-01 08:41:43.167131,0 days 00:00:02.175538,0.6000121711375836,3.933034935954849,0.060523549810977774,2,7,550,uni_bi,stem,0.1697191354210946,0.3799662013880079,1.1653619833985986,0.8428903076512198,0.02520451194655018,"{'preprocessing': 'stem', 'ngramas': 'uni_bi'}",,COMPLETE
4,0.5918660164568488,2026-10-01 08:41:43.170541,2026-10-01 08:41:44.287351,0 days 00:00:01.116810,0.8548812950439446,6.063155959704572,0.11866719535932568,3,8,550,uni,lemma,0.003074178647527449,9.319238068033489,1.100407406782524,0.5829486251851724,0.027149426088269864,"{'preprocessing': 'lemma', 'ngramas': 'uni'}",,COMPLETE
5,0.592123858004768,2026-10-01 08:41:44.290358,2026-10-01 08:41:45.394028,0 days 00:00:01.103670,0.6005265011351406,7.880274237786688,0.15845695755209105,3,11,250,uni_bi,lemma,0.5190168975436719,0.8430792369302229,1.0962584439491385,0.6392698643678811,0.021879782715019374,"{'preprocessing': 'lemma', 'ngramas': 'uni_bi'}",,COMPLETE
6,0.618943580194972,2026-10-01 08:41:45.396826,2026-10-01 08:41:47.102735,0 days 00:00:01.705909,0.696705262812809,7.930840274214868,0.02430014978987304,3,3,400,uni_bi,normal,3.305628970444423,0.23502139737832395,1.4573699435865455,0.5831693803541145,0.01698900955646454,,,COMPLETE
7,0.6265456630635136,2026-10-01 08:41:47.106740,2026-10-01 08:41:48.065317,0 days 00:00:00.958577,0.8052782411310322,7.556582969305462,0.12375683614656545,4,9,150,uni_bi,stem,0.8072231060168935,0.38134176751215854,2.3611808533502288,0.8957704749875129,0.0041620549633728755,,,COMPLETE
8,0.5975303160438041,2026-10-01 08:41:48.069324,2026-10-01 08:41:49.949899,0 days 00:00:01.880575,0.7094997986725271,2.734133577254707,0.03659960537161425,7,12,700,uni,normal,0.19228385810388485,2.0929716195373667,1.0666323708731926,0.7840225949209721,0.005218489159831711,,,COMPLETE
9,0.6564200271781532,2026-10-01 08:41:49.953408,2026-10-01 08:41:51.774550,0 days 00:00:01.821142,0.6493203250273586,1.8839105247962622,0.010955866493909193,4,3,700,uni,stem,0.0032774885694430637,0.3497491276967984,1.610822228588859,0.5760585523629264,0.03675074032352699,,,COMPLETE
10,0.601469107513749,2026-10-01 08:41:51.779182,2026-10-01 08:41:52.570531,0 days 00:00:00.791349,0.5426492265097068,2.98336349853339,0.04851045578924297,4,11,400,uni,stem,0.0012035552519174305,1.0843850909471928,1.1543744797017454,0.6064445318986637,0.02955343532331816,,"{""colsample_bytree"": 0.5426492265097068, ""gamma"": 2.98336349853339, ""learning_rate"": 0.04851045578924297, ""max_depth"": 4, ""min_child_weight"": 11, ""n_estimators"": 400, ""ngramas"": ""uni"", ""preprocessing"": ""stem"", ""reg_alpha"": 0.0012035552519174305, ""reg_lambda"": 1.0843850909471928, ""scale_pos_weight"": 1.1543744797017454, ""subsample"": 0.6064445318986637}",COMPLETE
11,0.6503459677421021,2026-10-01 08:41:52.575040,2026-10-01 08:41:54.958102,0 days 00:00:02.383062,0.6635004194980425,2.058923818721264,0.025919000037898588,6,2,700,uni,stem,0.003988833418914467,0.16723095750797284,1.940753126573679,0.7218424076843897,0.028290343018342344,,"{""colsample_bytree"": 0.6635004194980425, ""gamma"": 2.058923818721264, ""learning_rate"": 0.025919000037898588, ""max_depth"": 6, ""min_child_weight"": 2, ""n_estimators"": 700, ""ngramas"": ""uni"", ""preprocessing"": ""stem"", ""reg_alpha"": 0.003988833418914467, ""reg_lambda"": 0.16723095750797284, ""scale_pos_weight"": 1.940753126573679, ""subsample"": 0.7218424076843897}",COMPLETE
12,0.6290837240283705,2026-10-01 08:41:54.962594,2026-10-01 08:41:56.753330,0 days 00:00:01.790736,0.5587680540580744,3.0513650220907924,0.033119135965370514,6,4,700,uni,stem,0.0010912596806284805,0.15120943653299887,1.6013604607902685,0.5685989109930248,0.016721716878717117,,"{""colsample_bytree"": 0.5587680540580744, ""gamma"": 3.0513650220907924, ""learning_rate"": 0.033119135965370514, ""max_depth"": 6, ""min_child_weight"": 4, ""n_estimators"": 700, ""ngramas"": ""uni"", ""preprocessing"": ""stem"", ""reg_alpha"": 0.0010912596806284805, ""reg_lambda"": 0.15120943653299887, ""scale_pos_weight"": 1.6013604607902685, ""subsample"": 0.5685989109930248}",COMPLETE
13,0.6294887383533183,2026-10-01 08:41:56.756353,2026-10-01 08:41:58.433884,0 days 00:00:01.677531,0.7023572645620736,2.8890707880801827,0.010326616497118779,4,6,650,uni,stem,0.001759897481563857,0.5741094491912054,1.5585392009484815,0.6305716131004414,0.03842996232493925,,"{""colsample_bytree"": 0.7023572645620736, ""gamma"": 2.8890707880801827, ""learning_rate"": 0.010326616497118779, ""max_depth"": 4, ""min_child_weight"": 6, ""n_estimators"": 650, ""ngramas"": ""uni"", ""preprocessing"": ""stem"", ""reg_alpha"": 0.001759897481563857, ""reg_lambda"": 0.5741094491912054, ""scale_pos_weight"": 1.5585392009484815, ""subsample"": 0.6305716131004414}",COMPLETE
14,0.664094906996966,2026-10-01 08:41:58.440411,2026-10-01 08:41:59.916365,0 days 00:00:01.475954,0.7649411413274574,1.4023783934987197,0.019116171564878066,3,2,600,uni,stem,0.012879734751574116,0.6133452302897344,1.9315393389862598,0.5856398502034312,0.03425047166676336,,"{""colsample_bytree"": 0.7649411413274574, ""gamma"": 1.4023783934987197, ""learning_rate"": 0.019116171564878066, ""max_depth"": 3, ""min_child_weight"": 2, ""n_estimators"": 600, ""ngramas"": ""uni"", ""preprocessing"": ""stem"", ""reg_alpha"": 0.012879734751574116, ""reg_lambda"": 0.6133452302897344, ""scale_pos_weight"": 1.9315393389862598, ""subsample"": 0.5856398502034312}",COMPLETE
15,0.6543346964305399,2026-10-01 08:41:59.920371,2026-10-01 08:42:01.644528,0 days 00:00:01.724157,0.8380262762318266,1.478511529854876,0.012907634999199698,4,3,600,uni,stem,0.028898514939827518,0.10154654221568894,1.6420672908308807,0.6148986949893437,0.02657953699375592,,"{""colsample_bytree"": 0.8380262762318266, ""gamma"": 1.478511529854876, ""learning_rate"": 0.012907634999199698, ""max_depth"": 4, ""min_child_weight"": 3, ""n_estimators"": 600, ""ngramas"": ""uni"", ""preprocessing"": ""stem"", ""reg_alpha"": 0.028898514939827518, ""reg_lambda"": 0.10154654221568894, ""scale_pos_weight"": 1.6420672908308807, ""subsample"": 0.6148986949893437}",COMPLETE
16,0.6324507552049156,2026-10-01 08:42:01.649003,2026-10-01 08:42:02.986546,0 days 00:00:01.337543,0.8116529313466254,2.415142014063405,0.018318808245461903,3,2,550,uni,stem,0.002374818499579125,0.747415439508789,1.2432603780792135,0.5541362784132984,0.02396999751494427,,"{""colsample_bytree"": 0.8116529313466254, ""gamma"": 2.415142014063405, ""learning_rate"": 0.018318808245461903, ""max_depth"": 3, ""min_child_weight"": 2, ""n_estimators"": 550, ""ngramas"": ""uni"", ""preprocessing"": ""stem"", ""reg_alpha"": 0.002374818499579125, ""reg_lambda"": 0.747415439508789, ""scale_pos_weight"": 1.2432603780792135, ""subsample"": 0.5541362784132984}",COMPLETE
17,0.6325884014048185,2026-10-01 08:42:02.990558,2026-10-01 08:42:04.178794,0 days 00:00:01.188236,0.6326301968052773,1.8264397538547397,0.022046845562181935,3,6,550,uni,stem,0.005006038572073135,0.7195162682882189,1.5161703717445287,0.7068171138024022,0.032481253578978735,,"{""colsample_bytree"": 0.6326301968052773, ""gamma"": 1.8264397538547397, ""learning_rate"": 0.022046845562181935, ""max_depth"": 3, ""min_child_weight"": 6, ""n_estimators"": 550, ""ngramas"": ""uni"", ""preprocessing"": ""stem"", ""reg_alpha"": 0.005006038572073135, ""reg_lambda"": 0.7195162682882189, ""scale_pos_weight"": 1.5161703717445287, ""subsample"": 0.7068171138024022}",COMPLETE
18,0.6646669949926789,2026-10-01 08:42:04.183807,2026-10-01 08:42:05.906982,0 days 00:00:01.723175,0.6177850563757249,3.8538128178210966,0.019529041532892064,5,2,650,uni,stem,0.0065060135216343015,2.66953944853444,1.6014662697819786,0.5679963231309985,0.03207442019580627,,"{""colsample_bytree"": 0.6177850563757249, ""gamma"": 3.8538128178210966, ""learning_rate"": 0.019529041532892064, ""max_depth"": 5, ""min_child_weight"": 2, ""n_estimators"": 650, ""ngramas"": ""uni"", ""preprocessing"": ""stem"", ""reg_alpha"": 0.0065060135216343015, ""reg_lambda"": 2.66953944853444, ""scale_pos_weight"": 1.6014662697819786, ""subsample"": 0.5679963231309985}",COMPLETE
19,0.6542473129663771,2026-10-01 08:42:05.912188,2026-10-01 08:42:07.400222,0 days 00:00:01.488034,0.5903467627078993,4.351942020327428,0.023373342076370478,4,2,700,uni,stem,0.005543726261213115,5.8583160794643225,1.77980125194401,0.5851259043567522,0.032430075240323174,,"{""colsample_bytree"": 0.5903467627078993, ""gamma"": 4.351942020327428, ""learning_rate"": 0.023373342076370478, ""max_depth"": 4, ""min_child_weight"": 2, ""n_estimators"": 700, ""ngramas"": ""uni"", ""preprocessing"": ""stem"", ""reg_alpha"": 0.005543726261213115, ""reg_lambda"": 5.8583160794643225, ""scale_pos_weight"": 1.77980125194401, ""subsample"": 0.5851259043567522}",COMPLETE
20,0.6489829597237322,2026-10-01 08:42:07.405747,2026-10-01 08:42:08.699535,0 days 00:00:01.293788,0.7419425361068837,4.555902674824362,0.02945369334609681,2,3,650,uni,stem,0.03342974699479381,0.10911189180889441,1.9767648885737623,0.5916470155656876,0.025325143469496107,,"{""colsample_bytree"": 0.7419425361068837, ""gamma"": 4.555902674824362, ""learning_rate"": 0.02945369334609681, ""max_depth"": 2, ""min_child_weight"": 3, ""n_estimators"": 650, ""ngramas"": ""uni"", ""preprocessing"": ""stem"", ""reg_alpha"": 0.03342974699479381, ""reg_lambda"": 0.10911189180889441, ""scale_pos_weight"": 1.9767648885737623, ""subsample"": 0.5916470155656876}",COMPLETE
21,0.632692652166821,2026-10-01 08:42:08.706042,2026-10-01 08:42:10.399862,0 days 00:00:01.693820,0.6205679264937284,4.271757469678752,0.010049472496582116,4,4,700,uni,stem,0.005048152166037062,0.18088929716714916,1.3780626169339254,0.5645237243354768,0.0318678811962923,,"{""colsample_bytree"": 0.6205679264937284, ""gamma"": 4.271757469678752, ""learning_rate"": 0.010049472496582116, ""max_depth"": 4, ""min_child_weight"": 4, ""n_estimators"": 700, ""ngramas"": ""uni"", ""preprocessing"": ""stem"", ""reg_alpha"": 0.005048152166037062, ""reg_lambda"": 0.18088929716714916, ""scale_pos_weight"": 1.3780626169339254, ""subsample"": 0.5645237243354768}",COMPLETE
22,0.6567749996616629,2026-10-01 08:42:10.405886,2026-10-01 08:42:12.086732,0 days 00:00:01.680846,0.7389293152067946,2.5269200148522737,0.011627115983498313,3,2,700,uni,stem,0.0062073584366958015,0.19437883826686994,1.596718241255976,0.5616260585691653,0.02874793985124609,,"{""colsample_bytree"": 0.7389293152067946, ""gamma"": 2.5269200148522737, ""learning_rate"": 0.011627115983498313, ""max_depth"": 3, ""min_child_weight"": 2, ""n_estimators"": 700, ""ngramas"": ""uni"", ""preprocessing"": ""stem"", ""reg_alpha"": 0.0062073584366958015, ""reg_lambda"": 0.19437883826686994, ""scale_pos_weight"": 1.596718241255976, ""subsample"": 0.5616260585691653}",COMPLETE
23,0.6576197274428038,2026-10-01 08:42:12.092748,2026-10-01 08:42:14.063422,0 days 00:00:01.970674,0.8399930542953988,4.684043637121823,0.01743073148116765,4,3,700,uni,stem,0.01485092790778765,0.5199389023577334,1.963584780847014,0.5875960277828377,0.025000807920895447,,"{""colsample_bytree"": 0.8399930542953988, ""gamma"": 4.684043637121823, ""learning_rate"": 0.01743073148116765, ""max_depth"": 4, ""min_child_weight"": 3, ""n_estimators"": 700, ""ngramas"": ""uni"", ""preprocessing"": ""stem"", ""reg_alpha"": 0.01485092790778765, ""reg_lambda"": 0.5199389023577334, ""scale_pos_weight"": 1.963584780847014, ""subsample"": 0.5875960277828377}",COMPLETE
24,0.6470326395066021,2026-10-01 08:42:14.070130,2026-10-01 08:42:16.075755,0 days 00:00:02.005625,0.8918571906995276,4.4122694912512115,0.014011393273304154,4,2,650,uni,stem,0.0051820817444776695,0.3782596873923198,2.3723678333246414,0.6489220848481544,0.015129741658889619,,"{""colsample_bytree"": 0.8918571906995276, ""gamma"": 4.4122694912512115, ""learning_rate"": 0.014011393273304154, ""max_depth"": 4, ""min_child_weight"": 2, ""n_estimators"": 650, ""ngramas"": ""uni"", ""preprocessing"": ""stem"", ""reg_alpha"": 0.0051820817444776695, ""reg_lambda"": 0.3782596873923198, ""scale_pos_weight"": 2.3723678333246414, ""subsample"": 0.6489220848481544}",COMPLETE
25,0.6473242758398546,2026-10-01 08:42:16.082080,2026-10-01 08:42:17.736326,0 days 00:00:01.654246,0.8592129779446243,1.4317779999553801,0.014028755749322969,3,4,600,uni,stem,0.018603192982514227,1.8361769119783604,2.144084768068659,0.5812161370119773,0.02229443321751595,,"{""colsample_bytree"": 0.8592129779446243, ""gamma"": 1.4317779999553801, ""learning_rate"": 0.014028755749322969, ""max_depth"": 3, ""min_child_weight"": 4, ""n_estimators"": 600, ""ngramas"": ""uni"", ""preprocessing"": ""stem"", ""reg_alpha"": 0.018603192982514227, ""reg_lambda"": 1.8361769119783604, ""scale_pos_weight"": 2.144084768068659, ""subsample"": 0.5812161370119773}",COMPLETE
26,0.6526843425064189,2026-10-01 08:42:17.743337,2026-10-01 08:42:19.925830,0 days 00:00:02.182493,0.7254447335926704,4.437191546196648,0.014424706263445134,5,3,600,uni,stem,0.02494024799399196,2.9046242504051567,1.5681287838819995,0.5955210033792703,0.034027718108591315,,"{""colsample_bytree"": 0.7254447335926704, ""gamma"": 4.437191546196648, ""learning_rate"": 0.014424706263445134, ""max_depth"": 5, ""min_child_weight"": 3, ""n_estimators"": 600, ""ngramas"": ""uni"", ""preprocessing"": ""stem"", ""reg_alpha"": 0.02494024799399196, ""reg_lambda"": 2.9046242504051567, ""scale_pos_weight"": 1.5681287838819995, ""subsample"": 0.5955210033792703}",COMPLETE
27,0.6437384244081357,2026-10-01 08:42:19.933594,2026-10-01 08:42:21.143445,0 days 00:00:01.209851,0.7180113171672525,2.1123077932904315,0.014417629578824032,2,3,500,uni,stem,0.016297469108703316,0.3984593015069001,1.6385160957159586,0.5689269635830416,0.0241682748890036,,"{""colsample_bytree"": 0.7180113171672525, ""gamma"": 2.1123077932904315, ""learning_rate"": 0.014417629578824032, ""max_depth"": 2, ""min_child_weight"": 3, ""n_estimators"": 500, ""ngramas"": ""uni"", ""preprocessing"": ""stem"", ""reg_alpha"": 0.016297469108703316, ""reg_lambda"": 0.3984593015069001, ""scale_pos_weight"": 1.6385160957159586, ""subsample"": 0.5689269635830416}",COMPLETE
28,0.6520759067429212,2026-10-01 08:42:21.150188,2026-10-01 08:42:23.217140,0 days 00:00:02.066952,0.821815281960834,1.3272465501103188,0.014132737121158357,4,4,650,uni,stem,0.005138935729914716,0.38725196701233555,2.1956816866698894,0.6447987779805174,0.015423335308102727,,"{""colsample_bytree"": 0.821815281960834, ""gamma"": 1.3272465501103188, ""learning_rate"": 0.014132737121158357, ""max_depth"": 4, ""min_child_weight"": 4, ""n_estimators"": 650, ""ngramas"": ""uni"", ""preprocessing"": ""stem"", ""reg_alpha"": 0.005138935729914716, ""reg_lambda"": 0.38725196701233555, ""scale_pos_weight"": 2.1956816866698894, ""subsample"": 0.6447987779805174}",COMPLETE
29,0.639086366396143,2026-10-01 08:42:23.225681,2026-10-01 08:42:24.573302,0 days 00:00:01.347621,0.7311978949277644,4.285990611510066,0.016283256830558927,2,6,650,uni,stem,0.009075483305458537,0.5297470278389191,2.1600633965443143,0.5994278233104553,0.013455312746456729,,"{""colsample_bytree"": 0.7311978949277644, ""gamma"": 4.285990611510066, ""learning_rate"": 0.016283256830558927, ""max_depth"": 2, ""min_child_weight"": 6, ""n_estimators"": 650, ""ngramas"": ""uni"", ""preprocessing"": ""stem"", ""reg_alpha"": 0.009075483305458537, ""reg_lambda"": 0.5297470278389191, ""scale_pos_weight"": 2.1600633965443143, ""subsample"": 0.5994278233104553}",COMPLETE
30,0.6521709092321554,2026-10-01 08:42:24.582364,2026-10-01 08:42:29.407089,0 days 00:00:04.824725,0.8642691647662315,4.945957273150716,0.015658349962737947,5,2,700,uni_bi,stem,0.017209637758069083,0.387640133895917,2.0818512753154255,0.5558993561752501,0.022299993517262466,,"{""colsample_bytree"": 0.8642691647662315, ""gamma"": 4.945957273150716, ""learning_rate"": 0.015658349962737947, ""max_depth"": 5, ""min_child_weight"": 2, ""n_estimators"": 700, ""ngramas"": ""uni_bi"", ""preprocessing"": ""stem"", ""reg_alpha"": 0.017209637758069083, ""reg_lambda"": 0.387640133895917, ""scale_pos_weight"": 2.0818512753154255, ""subsample"": 0.5558993561752501}",COMPLETE
31,0.651290699795486,2026-10-01 08:42:29.414397,2026-10-01 08:42:30.665018,0 days 00:00:01.250621,0.7368753889457013,2.0128096638280546,0.02352914394303688,3,2,500,uni,stem,0.015281914268485968,0.40886692330593855,2.1722052214595946,0.5566943337424982,0.020372698872720956,,"{""colsample_bytree"": 0.7368753889457013, ""gamma"": 2.0128096638280546, ""learning_rate"": 0.02352914394303688, ""max_depth"": 3, ""min_child_weight"": 2, ""n_estimators"": 500, ""ngramas"": ""uni"", ""preprocessing"": ""stem"", ""reg_alpha"": 0.015281914268485968, ""reg_lambda"": 0.40886692330593855, ""scale_pos_weight"": 2.1722052214595946, ""subsample"": 0.5566943337424982}",COMPLETE
32,0.6620594293659067,2026-10-01 08:42:30.672786,2026-10-01 08:42:32.186621,0 days 00:00:01.513835,0.7491353370826759,0.5506821933185282,0.016516457678912737,4,3,500,uni,stem,0.04730691014745655,0.28558177027012943,2.1026710353292115,0.5563744419532559,0.02794521291093673,,"{""colsample_bytree"": 0.7491353370826759, ""gamma"": 0.5506821933185282, ""learning_rate"": 0.016516457678912737, ""max_depth"": 4, ""min_child_weight"": 3, ""n_estimators"": 500, ""ngramas"": ""uni"", ""preprocessing"": ""stem"", ""reg_alpha"": 0.04730691014745655, ""reg_lambda"": 0.28558177027012943, ""scale_pos_weight"": 2.1026710353292115, ""subsample"": 0.5563744419532559}",COMPLETE
33,0.6646853947898473,2026-10-01 08:42:32.195210,2026-10-01 08:42:33.767627,0 days 00:00:01.572417,0.7543230227742341,4.250757880226273,0.01117255129922538,3,2,650,uni,stem,0.010802934426055674,0.10404038940187257,1.8426718695362454,0.5768745530802004,0.027061748386734148,,"{""colsample_bytree"": 0.7543230227742341, ""gamma"": 4.250757880226273, ""learning_rate"": 0.01117255129922538, ""max_depth"": 3, ""min_child_weight"": 2, ""n_estimators"": 650, ""ngramas"": ""uni"", ""preprocessing"": ""stem"", ""reg_alpha"": 0.010802934426055674, ""reg_lambda"": 0.10404038940187257, ""scale_pos_weight"": 1.8426718695362454, ""subsample"": 0.5768745530802004}",COMPLETE
34,0.6623723113812942,2026-10-01 08:42:33.775637,2026-10-01 08:42:35.715738,0 days 00:00:01.940101,0.7714508462065527,4.6719655019180015,0.010279465969754072,4,3,700,uni,stem,0.0023805328752174123,0.2990005274430405,1.71713346270263,0.6486205549720763,0.03197296549452137,,"{""colsample_bytree"": 0.7714508462065527, ""gamma"": 4.6719655019180015, ""learning_rate"": 0.010279465969754072, ""max_depth"": 4, ""min_child_weight"": 3, ""n_estimators"": 700, ""ngramas"": ""uni"", ""preprocessing"": ""stem"", ""reg_alpha"": 0.0023805328752174123, ""reg_lambda"": 0.2990005274430405, ""scale_pos_weight"": 1.71713346270263, ""subsample"": 0.6486205549720763}",COMPLETE
35,0.6480513623736471,2026-10-01 08:42:35.723738,2026-10-01 08:42:37.652648,0 days 00:00:01.928910,0.741252256058523,4.512557352296245,0.014867662917570799,4,2,700,uni,stem,0.005547333762251437,0.18916198072432397,1.305515745392629,0.6677787739902578,0.02437474692241321,,"{""colsample_bytree"": 0.741252256058523, ""gamma"": 4.512557352296245, ""learning_rate"": 0.014867662917570799, ""max_depth"": 4, ""min_child_weight"": 2, ""n_estimators"": 700, ""ngramas"": ""uni"", ""preprocessing"": ""stem"", ""reg_alpha"": 0.005547333762251437, ""reg_lambda"": 0.18916198072432397, ""scale_pos_weight"": 1.305515745392629, ""subsample"": 0.6677787739902578}",COMPLETE
36,0.6654371149668831,2026-10-01 08:42:37.660198,2026-10-01 08:42:39.254963,0 days 00:00:01.594765,0.7503020246270596,3.5822836431507934,0.01715644477248822,3,3,650,uni,stem,0.0017522910806858434,0.33171293009994435,1.8706871463016286,0.6518773450515357,0.022183546322870354,,"{""colsample_bytree"": 0.7503020246270596, ""gamma"": 3.5822836431507934, ""learning_rate"": 0.01715644477248822, ""max_depth"": 3, ""min_child_weight"": 3, ""n_estimators"": 650, ""ngramas"": ""uni"", ""preprocessing"": ""stem"", ""reg_alpha"": 0.0017522910806858434, ""reg_lambda"": 0.33171293009994435, ""scale_pos_weight"": 1.8706871463016286, ""subsample"": 0.6518773450515357}",COMPLETE
