number,value,datetime_start,datetime_complete,duration,params_colsample_bytree,params_gamma,params_learning_rate,params_max_depth,params_min_child_weight,params_n_estimators,params_ngramas,params_preprocessing,params_reg_alpha,params_reg_lambda,params_scale_pos_weight,params_subsample,user_attrs_cv_f1_std,system_attrs_fixed_params,system_attrs_tpe:relative_params:0,state
37,0.689737594241053,2026-10-01 08:50:03.833019,2026-10-01 08:50:05.657011,0 days 00:00:01.823992,0.5435905494525979,2.366622684191263,0.02218768332534519,2,3,700,uni,normal,0.0038407924867166427,1.5445340040425222,1.614819792870211,0.6267025660250523,0.024188653844875674,,"{""colsample_bytree"": 0.5435905494525979, ""gamma"": 2.366622684191263, ""learning_rate"": 0.02218768332534519, ""max_depth"": 2, ""min_child_weight"": 3, ""n_estimators"": 700, ""ngramas"": ""uni"", ""preprocessing"": ""normal"", ""reg_alpha"": 0.0038407924867166427, ""reg_lambda"": 1.5445340040425222, ""scale_pos_weight"": 1.614819792870211, ""subsample"": 0.6267025660250523}",COMPLETE
38,0.6931798861117707,2026-10-01 08:50:05.665024,2026-10-01 08:50:06.737540,0 days 00:00:01.072516,0.6607904620746995,3.0444030922760015,0.018996747246995124,2,2,500,uni,stem,0.00340652296736919,2.8857917910384394,1.4899844232715758,0.629903447424977,0.02365413970060218,,"{""colsample_bytree"": 0.6607904620746995, ""gamma"": 3.0444030922760015, ""learning_rate"": 0.018996747246995124, ""max_depth"": 2, ""min_child_weight"": 2, ""n_estimators"": 500, ""ngramas"": ""uni"", ""preprocessing"": ""stem"", ""reg_alpha"": 0.00340652296736919, ""reg_lambda"": 2.8857917910384394, ""scale_pos_weight"": 1.4899844232715758, ""subsample"": 0.629903447424977}",COMPLETE
39,0.6926450050929605,2026-10-01 08:50:06.745085,2026-10-01 08:50:08.149640,0 days 00:00:01.404555,0.6301794489508271,3.628756439649528,0.010864443024573761,3,2,550,uni,stem,0.0015086385843640763,4.110028244231667,1.8434923238158938,0.6606644957472879,0.031018888155683124,,"{""colsample_bytree"": 0.6301794489508271, ""gamma"": 3.628756439649528, ""learning_rate"": 0.010864443024573761, ""max_depth"": 3, ""min_child_weight"": 2, ""n_estimators"": 550, ""ngramas"": ""uni"", ""preprocessing"": ""stem"", ""reg_alpha"": 0.0015086385843640763, ""reg_lambda"": 4.110028244231667, ""scale_pos_weight"": 1.8434923238158938, ""subsample"": 0.6606644957472879}",COMPLETE
40,0.6942678098232825,2026-10-01 08:50:08.157807,2026-10-01 08:50:09.569212,0 days 00:00:01.411405,0.533407534178047,4.195638005904433,0.029921322634379,3,2,700,uni,stem,0.0023206713397016508,7.040722776504417,1.6002998123328074,0.627015265575689,0.02971202170851717,,"{""colsample_bytree"": 0.533407534178047, ""gamma"": 4.195638005904433, ""learning_rate"": 0.029921322634379, ""max_depth"": 3, ""min_child_weight"": 2, ""n_estimators"": 700, ""ngramas"": ""uni"", ""preprocessing"": ""stem"", ""reg_alpha"": 0.0023206713397016508, ""reg_lambda"": 7.040722776504417, ""scale_pos_weight"": 1.6002998123328074, ""subsample"": 0.627015265575689}",COMPLETE
41,0.6943712486490173,2026-10-01 08:50:09.579551,2026-10-01 08:50:10.925366,0 days 00:00:01.345815,0.5177633396833199,2.714868310681887,0.032920609691373004,2,5,700,uni,stem,0.0013907090063730648,2.52059166645299,1.7791583706833989,0.6132803488563872,0.019942626881885327,,"{""colsample_bytree"": 0.5177633396833199, ""gamma"": 2.714868310681887, ""learning_rate"": 0.032920609691373004, ""max_depth"": 2, ""min_child_weight"": 5, ""n_estimators"": 700, ""ngramas"": ""uni"", ""preprocessing"": ""stem"", ""reg_alpha"": 0.0013907090063730648, ""reg_lambda"": 2.52059166645299, ""scale_pos_weight"": 1.7791583706833989, ""subsample"": 0.6132803488563872}",COMPLETE
42,0.6990045509331829,2026-10-01 08:50:10.933869,2026-10-01 08:50:12.195632,0 days 00:00:01.261763,0.5045262865111844,2.6847640415433798,0.01974996616282554,2,2,650,uni,stem,0.0025403797840571427,2.9522466621510906,1.688256948425908,0.6469089437225278,0.020744894260259775,,"{""colsample_bytree"": 0.5045262865111844, ""gamma"": 2.6847640415433798, ""learning_rate"": 0.01974996616282554, ""max_depth"": 2, ""min_child_weight"": 2, ""n_estimators"": 650, ""ngramas"": ""uni"", ""preprocessing"": ""stem"", ""reg_alpha"": 0.0025403797840571427, ""reg_lambda"": 2.9522466621510906, ""scale_pos_weight"": 1.688256948425908, ""subsample"": 0.6469089437225278}",COMPLETE
43,0.6844365893375696,2026-10-01 08:50:12.204784,2026-10-01 08:50:13.482710,0 days 00:00:01.277926,0.5955819493656853,2.4247798758538535,0.01431776036795085,2,3,650,uni,stem,0.0011735763307334395,2.3196426571937336,2.047972954850327,0.6167303752335489,0.027303689767802987,,"{""colsample_bytree"": 0.5955819493656853, ""gamma"": 2.4247798758538535, ""learning_rate"": 0.01431776036795085, ""max_depth"": 2, ""min_child_weight"": 3, ""n_estimators"": 650, ""ngramas"": ""uni"", ""preprocessing"": ""stem"", ""reg_alpha"": 0.0011735763307334395, ""reg_lambda"": 2.3196426571937336, ""scale_pos_weight"": 2.047972954850327, ""subsample"": 0.6167303752335489}",COMPLETE
44,0.6913883124417849,2026-10-01 08:50:13.490943,2026-10-01 08:50:14.697874,0 days 00:00:01.206931,0.5166075526768263,2.709324053846179,0.023850874904433845,2,3,650,uni,stem,0.0013318957848996778,2.9332349960578767,1.9805787693592212,0.5708548787432819,0.02682542263264824,,"{""colsample_bytree"": 0.5166075526768263, ""gamma"": 2.709324053846179, ""learning_rate"": 0.023850874904433845, ""max_depth"": 2, ""min_child_weight"": 3, ""n_estimators"": 650, ""ngramas"": ""uni"", ""preprocessing"": ""stem"", ""reg_alpha"": 0.0013318957848996778, ""reg_lambda"": 2.9332349960578767, ""scale_pos_weight"": 1.9805787693592212, ""subsample"": 0.5708548787432819}",COMPLETE
45,0.6937237966574048,2026-10-01 08:50:14.705899,2026-10-01 08:50:15.988429,0 days 00:00:01.282530,0.5320749516504623,2.8139324440065403,0.04811393002986191,2,2,700,uni,stem,0.0024784425913119937,11.982753129872798,1.7124506395201549,0.6110689439766346,0.02793668763839097,,"{""colsample_bytree"": 0.5320749516504623, ""gamma"": 2.8139324440065403, ""learning_rate"": 0.04811393002986191, ""max_depth"": 2, ""min_child_weight"": 2, ""n_estimators"": 700, ""ngramas"": ""uni"", ""preprocessing"": ""stem"", ""reg_alpha"": 0.0024784425913119937, ""reg_lambda"": 11.982753129872798, ""scale_pos_weight"": 1.7124506395201549, ""subsample"": 0.6110689439766346}",COMPLETE
46,0.6969983387561259,2026-10-01 08:50:15.995943,2026-10-01 08:50:17.290755,0 days 00:00:01.294812,0.5422475804226465,1.7155712489250663,0.034297884116134304,2,3,700,uni,stem,0.002523606700972899,3.4076610077072322,1.7959032238155672,0.6260383767307287,0.019386903756672853,,"{""colsample_bytree"": 0.5422475804226465, ""gamma"": 1.7155712489250663, ""learning_rate"": 0.034297884116134304, ""max_depth"": 2, ""min_child_weight"": 3, ""n_estimators"": 700, ""ngramas"": ""uni"", ""preprocessing"": ""stem"", ""reg_alpha"": 0.002523606700972899, ""reg_lambda"": 3.4076610077072322, ""scale_pos_weight"": 1.7959032238155672, ""subsample"": 0.6260383767307287}",COMPLETE
47,0.6999337570013181,2026-10-01 08:50:17.300287,2026-10-01 08:50:18.728168,0 days 00:00:01.427881,0.5452070090798105,2.075177232325831,0.024889079384607965,3,2,600,uni,stem,0.0031794024510789633,2.5703362050488057,1.503621194911219,0.6595124566093318,0.009460200319050432,,"{""colsample_bytree"": 0.5452070090798105, ""gamma"": 2.075177232325831, ""learning_rate"": 0.024889079384607965, ""max_depth"": 3, ""min_child_weight"": 2, ""n_estimators"": 600, ""ngramas"": ""uni"", ""preprocessing"": ""stem"", ""reg_alpha"": 0.0031794024510789633, ""reg_lambda"": 2.5703362050488057, ""scale_pos_weight"": 1.503621194911219, ""subsample"": 0.6595124566093318}",COMPLETE
48,0.7018234780753977,2026-10-01 08:50:18.738572,2026-10-01 08:50:20.265163,0 days 00:00:01.526591,0.5069218046356705,2.839681456077562,0.027779348579956807,3,2,700,uni,stem,0.001254239612117824,2.5540871180073728,1.5599288554937685,0.5591423727934073,0.01352874072745545,,"{""colsample_bytree"": 0.5069218046356705, ""gamma"": 2.839681456077562, ""learning_rate"": 0.027779348579956807, ""max_depth"": 3, ""min_child_weight"": 2, ""n_estimators"": 700, ""ngramas"": ""uni"", ""preprocessing"": ""stem"", ""reg_alpha"": 0.001254239612117824, ""reg_lambda"": 2.5540871180073728, ""scale_pos_weight"": 1.5599288554937685, ""subsample"": 0.5591423727934073}",COMPLETE
49,0.6980406178602863,2026-10-01 08:50:20.276489,2026-10-01 08:50:21.737464,0 days 00:00:01.460975,0.5444392114421529,2.031431610225314,0.02805833872404463,3,3,650,uni,stem,0.0022002858100822476,2.354836991610801,1.808954052292624,0.6044654070960673,0.01847095603778994,,"{""colsample_bytree"": 0.5444392114421529, ""gamma"": 2.031431610225314, ""learning_rate"": 0.02805833872404463, ""max_depth"": 3, ""min_child_weight"": 3, ""n_estimators"": 650, ""ngramas"": ""uni"", ""preprocessing"": ""stem"", ""reg_alpha"": 0.0022002858100822476, ""reg_lambda"": 2.354836991610801, ""scale_pos_weight"": 1.808954052292624, ""subsample"": 0.6044654070960673}",COMPLETE
