number,value,datetime_start,datetime_complete,duration,params_colsample_bytree,params_gamma,params_learning_rate,params_max_depth,params_min_child_weight,params_n_estimators,params_ngramas,params_preprocessing,params_reg_alpha,params_reg_lambda,params_scale_pos_weight,params_subsample,user_attrs_inner_f1_std,system_attrs_fixed_params,system_attrs_tpe:relative_params:0,state
37,0.6793839291493003,2026-10-01 08:36:29.766802,2026-10-01 08:36:30.805076,0 days 00:00:01.038274,0.5783314912648319,3.8549979902098737,0.028796776760717225,6,14,600,uni,stem,0.120301176232394,1.9704088333585315,1.5475245515997476,0.5561737093630342,0.021995240285183428,,"{""colsample_bytree"": 0.5783314912648319, ""gamma"": 3.8549979902098737, ""learning_rate"": 0.028796776760717225, ""max_depth"": 6, ""min_child_weight"": 14, ""n_estimators"": 600, ""ngramas"": ""uni"", ""preprocessing"": ""stem"", ""reg_alpha"": 0.120301176232394, ""reg_lambda"": 1.9704088333585315, ""scale_pos_weight"": 1.5475245515997476, ""subsample"": 0.5561737093630342}",COMPLETE
38,0.6822249134568011,2026-10-01 08:36:30.812851,2026-10-01 08:36:31.993589,0 days 00:00:01.180738,0.5422149161548184,3.7880817988061586,0.02476204664506916,5,14,700,uni,stem,0.44389627736452936,2.831798705034913,1.4671594150868563,0.5736848401015493,0.021700964343357977,,"{""colsample_bytree"": 0.5422149161548184, ""gamma"": 3.7880817988061586, ""learning_rate"": 0.02476204664506916, ""max_depth"": 5, ""min_child_weight"": 14, ""n_estimators"": 700, ""ngramas"": ""uni"", ""preprocessing"": ""stem"", ""reg_alpha"": 0.44389627736452936, ""reg_lambda"": 2.831798705034913, ""scale_pos_weight"": 1.4671594150868563, ""subsample"": 0.5736848401015493}",COMPLETE
39,0.674806050787804,2026-10-01 08:36:32.002088,2026-10-01 08:36:33.148810,0 days 00:00:01.146722,0.5334820613381893,3.208690188535334,0.019618673356956193,5,15,650,uni,stem,0.6092100812586633,8.253097772007848,1.6709059558684702,0.5813702411998936,0.022036803581920974,,"{""colsample_bytree"": 0.5334820613381893, ""gamma"": 3.208690188535334, ""learning_rate"": 0.019618673356956193, ""max_depth"": 5, ""min_child_weight"": 15, ""n_estimators"": 650, ""ngramas"": ""uni"", ""preprocessing"": ""stem"", ""reg_alpha"": 0.6092100812586633, ""reg_lambda"": 8.253097772007848, ""scale_pos_weight"": 1.6709059558684702, ""subsample"": 0.5813702411998936}",COMPLETE
40,0.6819360517767571,2026-10-01 08:36:33.155833,2026-10-01 08:36:34.555341,0 days 00:00:01.399508,0.5718328795708578,3.433581035711549,0.01007194482655585,6,13,700,uni,stem,0.09117914242526932,8.19385366637178,1.4977829955974962,0.6019503488172735,0.020692584926478824,,"{""colsample_bytree"": 0.5718328795708578, ""gamma"": 3.433581035711549, ""learning_rate"": 0.01007194482655585, ""max_depth"": 6, ""min_child_weight"": 13, ""n_estimators"": 700, ""ngramas"": ""uni"", ""preprocessing"": ""stem"", ""reg_alpha"": 0.09117914242526932, ""reg_lambda"": 8.19385366637178, ""scale_pos_weight"": 1.4977829955974962, ""subsample"": 0.6019503488172735}",COMPLETE
41,0.6818682483583552,2026-10-01 08:36:34.562689,2026-10-01 08:36:35.746412,0 days 00:00:01.183723,0.5257271447986644,4.195992118498029,0.014243251484195472,6,13,700,uni,stem,0.005383469004976038,7.352236580866264,1.4279399885456459,0.5827517463297314,0.027426541982404785,,"{""colsample_bytree"": 0.5257271447986644, ""gamma"": 4.195992118498029, ""learning_rate"": 0.014243251484195472, ""max_depth"": 6, ""min_child_weight"": 13, ""n_estimators"": 700, ""ngramas"": ""uni"", ""preprocessing"": ""stem"", ""reg_alpha"": 0.005383469004976038, ""reg_lambda"": 7.352236580866264, ""scale_pos_weight"": 1.4279399885456459, ""subsample"": 0.5827517463297314}",COMPLETE
42,0.6815988173091586,2026-10-01 08:36:35.754953,2026-10-01 08:36:37.243910,0 days 00:00:01.488957,0.5505330944166503,2.5203623206450367,0.01335615994849271,5,13,700,uni,stem,0.015025323905663936,1.5328272897996138,1.3803662977853461,0.5625246888936726,0.026610270901887938,,"{""colsample_bytree"": 0.5505330944166503, ""gamma"": 2.5203623206450367, ""learning_rate"": 0.01335615994849271, ""max_depth"": 5, ""min_child_weight"": 13, ""n_estimators"": 700, ""ngramas"": ""uni"", ""preprocessing"": ""stem"", ""reg_alpha"": 0.015025323905663936, ""reg_lambda"": 1.5328272897996138, ""scale_pos_weight"": 1.3803662977853461, ""subsample"": 0.5625246888936726}",COMPLETE
43,0.6773369321012256,2026-10-01 08:36:37.251520,2026-10-01 08:36:38.367533,0 days 00:00:01.116013,0.542882762864913,2.9097451320047227,0.014215363485530371,5,13,550,uni,stem,0.010143028180582324,2.4262875038768588,1.272702065994852,0.576956883657736,0.01242944353795757,,"{""colsample_bytree"": 0.542882762864913, ""gamma"": 2.9097451320047227, ""learning_rate"": 0.014215363485530371, ""max_depth"": 5, ""min_child_weight"": 13, ""n_estimators"": 550, ""ngramas"": ""uni"", ""preprocessing"": ""stem"", ""reg_alpha"": 0.010143028180582324, ""reg_lambda"": 2.4262875038768588, ""scale_pos_weight"": 1.272702065994852, ""subsample"": 0.576956883657736}",COMPLETE
44,0.6870872146947886,2026-10-01 08:36:38.375055,2026-10-01 08:36:39.699054,0 days 00:00:01.323999,0.5118009384902052,3.267741344269025,0.010983693770268393,6,14,700,uni,stem,0.01642655713360697,7.27746956432713,1.4879367238353287,0.5808634048261415,0.022214370070889413,,"{""colsample_bytree"": 0.5118009384902052, ""gamma"": 3.267741344269025, ""learning_rate"": 0.010983693770268393, ""max_depth"": 6, ""min_child_weight"": 14, ""n_estimators"": 700, ""ngramas"": ""uni"", ""preprocessing"": ""stem"", ""reg_alpha"": 0.01642655713360697, ""reg_lambda"": 7.27746956432713, ""scale_pos_weight"": 1.4879367238353287, ""subsample"": 0.5808634048261415}",COMPLETE
45,0.671144173596702,2026-10-01 08:36:39.708587,2026-10-01 08:36:41.134025,0 days 00:00:01.425438,0.6015883961795181,3.0960548159133863,0.012056109375807434,5,15,700,uni,stem,0.013853654636741862,1.499034708313615,1.519401620676775,0.606351303258196,0.026117528232417902,,"{""colsample_bytree"": 0.6015883961795181, ""gamma"": 3.0960548159133863, ""learning_rate"": 0.012056109375807434, ""max_depth"": 5, ""min_child_weight"": 15, ""n_estimators"": 700, ""ngramas"": ""uni"", ""preprocessing"": ""stem"", ""reg_alpha"": 0.013853654636741862, ""reg_lambda"": 1.499034708313615, ""scale_pos_weight"": 1.519401620676775, ""subsample"": 0.606351303258196}",COMPLETE
46,0.6848055681356066,2026-10-01 08:36:41.142063,2026-10-01 08:36:42.309721,0 days 00:00:01.167658,0.5071892288082829,4.086896429772961,0.0145979318771137,5,15,650,uni,stem,0.003920287150606176,6.895041322116689,1.453477925607493,0.6118987138208927,0.01799797224450623,,"{""colsample_bytree"": 0.5071892288082829, ""gamma"": 4.086896429772961, ""learning_rate"": 0.0145979318771137, ""max_depth"": 5, ""min_child_weight"": 15, ""n_estimators"": 650, ""ngramas"": ""uni"", ""preprocessing"": ""stem"", ""reg_alpha"": 0.003920287150606176, ""reg_lambda"": 6.895041322116689, ""scale_pos_weight"": 1.453477925607493, ""subsample"": 0.6118987138208927}",COMPLETE
47,0.6765807452078937,2026-10-01 08:36:42.317868,2026-10-01 08:36:43.651771,0 days 00:00:01.333903,0.5044237778175754,2.5217525553283084,0.015543747288882085,7,13,650,uni,stem,0.17441537632750365,6.6826826670037125,1.6115066231704702,0.5817030892670275,0.021425843145381197,,"{""colsample_bytree"": 0.5044237778175754, ""gamma"": 2.5217525553283084, ""learning_rate"": 0.015543747288882085, ""max_depth"": 7, ""min_child_weight"": 13, ""n_estimators"": 650, ""ngramas"": ""uni"", ""preprocessing"": ""stem"", ""reg_alpha"": 0.17441537632750365, ""reg_lambda"": 6.6826826670037125, ""scale_pos_weight"": 1.6115066231704702, ""subsample"": 0.5817030892670275}",COMPLETE
48,0.6815652277997293,2026-10-01 08:36:43.661789,2026-10-01 08:36:44.957862,0 days 00:00:01.296073,0.5731869997586233,3.2154109287687573,0.010331753807314917,5,15,650,uni,stem,0.0978060419233718,6.805586871923195,1.5757673483271317,0.5541141091945712,0.0222941728750024,,"{""colsample_bytree"": 0.5731869997586233, ""gamma"": 3.2154109287687573, ""learning_rate"": 0.010331753807314917, ""max_depth"": 5, ""min_child_weight"": 15, ""n_estimators"": 650, ""ngramas"": ""uni"", ""preprocessing"": ""stem"", ""reg_alpha"": 0.0978060419233718, ""reg_lambda"": 6.805586871923195, ""scale_pos_weight"": 1.5757673483271317, ""subsample"": 0.5541141091945712}",COMPLETE
49,0.678556134198486,2026-10-01 08:36:44.967873,2026-10-01 08:36:46.083721,0 days 00:00:01.115848,0.5115422419921843,4.568968396469719,0.011735303041132954,6,14,650,uni,stem,0.0013850921867560684,18.897930774233423,1.578604252145827,0.595296863471051,0.025278984002624006,,"{""colsample_bytree"": 0.5115422419921843, ""gamma"": 4.568968396469719, ""learning_rate"": 0.011735303041132954, ""max_depth"": 6, ""min_child_weight"": 14, ""n_estimators"": 650, ""ngramas"": ""uni"", ""preprocessing"": ""stem"", ""reg_alpha"": 0.0013850921867560684, ""reg_lambda"": 18.897930774233423, ""scale_pos_weight"": 1.578604252145827, ""subsample"": 0.595296863471051}",COMPLETE
