number,value,datetime_start,datetime_complete,duration,params_colsample_bytree,params_gamma,params_learning_rate,params_max_depth,params_min_child_weight,params_n_estimators,params_ngramas,params_preprocessing,params_reg_alpha,params_reg_lambda,params_scale_pos_weight,params_subsample,user_attrs_inner_f1_std,system_attrs_fixed_params,system_attrs_tpe:relative_params:0,state
0,0.591846907496869,2026-10-01 08:29:19.691955,2026-10-01 08:29:21.718565,0 days 00:00:02.026610,0.6891231879021942,0.8639150067983441,0.023236535796625712,5,3,700,uni,normal,0.004500883717053276,0.18484430097724697,1.941087524056639,0.7055643235901311,0.011174735290453708,"{'preprocessing': 'normal', 'ngramas': 'uni'}",,COMPLETE
1,0.5837697604709488,2026-10-01 08:29:21.720568,2026-10-01 08:29:23.800116,0 days 00:00:02.079548,0.613066882612467,7.820024868631562,0.19451747759715904,5,8,650,uni_bi,normal,0.4923477941754624,1.0319883368576308,1.4345310103781423,0.7664030692485754,0.01572934614067267,"{'preprocessing': 'normal', 'ngramas': 'uni_bi'}",,COMPLETE
2,0.5318799946198973,2026-10-01 08:29:23.803128,2026-10-01 08:29:24.477776,0 days 00:00:00.674648,0.6551930070428668,6.641550706740324,0.019736720393672826,2,8,450,uni,stem,0.0019868411245652948,13.310512566656326,1.3373441230141867,0.6349653548730396,0.030110356922282103,"{'preprocessing': 'stem', 'ngramas': 'uni'}",,COMPLETE
3,0.5660579010719199,2026-10-01 08:29:24.479794,2026-10-01 08:29:26.444135,0 days 00:00:01.964341,0.6000121711375836,3.933034935954849,0.060523549810977774,2,7,550,uni_bi,stem,0.1697191354210946,0.3799662013880079,1.1653619833985986,0.8428903076512198,0.012060125058834293,"{'preprocessing': 'stem', 'ngramas': 'uni_bi'}",,COMPLETE
4,0.539386743506103,2026-10-01 08:29:26.446935,2026-10-01 08:29:27.405193,0 days 00:00:00.958258,0.8548812950439446,6.063155959704572,0.11866719535932568,3,8,550,uni,lemma,0.003074178647527449,9.319238068033489,1.100407406782524,0.5829486251851724,0.020982948429906594,"{'preprocessing': 'lemma', 'ngramas': 'uni'}",,COMPLETE
5,0.5186286236631367,2026-10-01 08:29:27.408783,2026-10-01 08:29:28.435777,0 days 00:00:01.026994,0.6005265011351406,7.880274237786688,0.15845695755209105,3,11,250,uni_bi,lemma,0.5190168975436719,0.8430792369302229,1.0962584439491385,0.6392698643678811,0.03216846724358234,"{'preprocessing': 'lemma', 'ngramas': 'uni_bi'}",,COMPLETE
6,0.5756672008665146,2026-10-01 08:29:28.440803,2026-10-01 08:29:29.987930,0 days 00:00:01.547127,0.696705262812809,7.930840274214868,0.02430014978987304,3,3,400,uni_bi,normal,3.305628970444423,0.23502139737832395,1.4573699435865455,0.5831693803541145,0.01977058487649544,,,COMPLETE
7,0.516752748943182,2026-10-01 08:29:29.991937,2026-10-01 08:29:30.855537,0 days 00:00:00.863600,0.8052782411310322,7.556582969305462,0.12375683614656545,4,9,150,uni_bi,stem,0.8072231060168935,0.38134176751215854,2.3611808533502288,0.8957704749875129,0.03770773839537978,,,COMPLETE
8,0.5350500682402745,2026-10-01 08:29:30.858655,2026-10-01 08:29:32.173151,0 days 00:00:01.314496,0.7094997986725271,2.734133577254707,0.03659960537161425,7,12,700,uni,normal,0.19228385810388485,2.0929716195373667,1.0666323708731926,0.7840225949209721,0.011513855568568645,,,COMPLETE
9,0.6155822077137153,2026-10-01 08:29:32.175748,2026-10-01 08:29:33.739762,0 days 00:00:01.564014,0.6493203250273586,1.8839105247962622,0.010955866493909193,4,3,700,uni,stem,0.0032774885694430637,0.3497491276967984,1.610822228588859,0.5760585523629264,0.02686718278469992,,,COMPLETE
10,0.5596354967965945,2026-10-01 08:29:33.741959,2026-10-01 08:29:34.391409,0 days 00:00:00.649450,0.5426492265097068,2.98336349853339,0.04851045578924297,4,11,400,uni,stem,0.0012035552519174305,1.0843850909471928,1.1543744797017454,0.6064445318986637,0.0077538970296032374,,"{""colsample_bytree"": 0.5426492265097068, ""gamma"": 2.98336349853339, ""learning_rate"": 0.04851045578924297, ""max_depth"": 4, ""min_child_weight"": 11, ""n_estimators"": 400, ""ngramas"": ""uni"", ""preprocessing"": ""stem"", ""reg_alpha"": 0.0012035552519174305, ""reg_lambda"": 1.0843850909471928, ""scale_pos_weight"": 1.1543744797017454, ""subsample"": 0.6064445318986637}",COMPLETE
11,0.6119585212333126,2026-10-01 08:29:34.394895,2026-10-01 08:29:36.314170,0 days 00:00:01.919275,0.6635004194980425,2.058923818721264,0.025919000037898588,6,2,700,uni,stem,0.003988833418914467,0.16723095750797284,1.940753126573679,0.7218424076843897,0.032268567281757914,,"{""colsample_bytree"": 0.6635004194980425, ""gamma"": 2.058923818721264, ""learning_rate"": 0.025919000037898588, ""max_depth"": 6, ""min_child_weight"": 2, ""n_estimators"": 700, ""ngramas"": ""uni"", ""preprocessing"": ""stem"", ""reg_alpha"": 0.003988833418914467, ""reg_lambda"": 0.16723095750797284, ""scale_pos_weight"": 1.940753126573679, ""subsample"": 0.7218424076843897}",COMPLETE
12,0.6029826246105316,2026-10-01 08:29:36.318177,2026-10-01 08:29:37.781647,0 days 00:00:01.463470,0.5587680540580744,3.0513650220907924,0.033119135965370514,6,4,700,uni,stem,0.0010912596806284805,0.15120943653299887,1.6013604607902685,0.5685989109930248,0.021515145927748655,,"{""colsample_bytree"": 0.5587680540580744, ""gamma"": 3.0513650220907924, ""learning_rate"": 0.033119135965370514, ""max_depth"": 6, ""min_child_weight"": 4, ""n_estimators"": 700, ""ngramas"": ""uni"", ""preprocessing"": ""stem"", ""reg_alpha"": 0.0010912596806284805, ""reg_lambda"": 0.15120943653299887, ""scale_pos_weight"": 1.6013604607902685, ""subsample"": 0.5685989109930248}",COMPLETE
13,0.6090584688162676,2026-10-01 08:29:37.784068,2026-10-01 08:29:39.181733,0 days 00:00:01.397665,0.7023572645620736,2.8890707880801827,0.010326616497118779,4,6,650,uni,stem,0.001759897481563857,0.5741094491912054,1.5585392009484815,0.6305716131004414,0.015826202608490835,,"{""colsample_bytree"": 0.7023572645620736, ""gamma"": 2.8890707880801827, ""learning_rate"": 0.010326616497118779, ""max_depth"": 4, ""min_child_weight"": 6, ""n_estimators"": 650, ""ngramas"": ""uni"", ""preprocessing"": ""stem"", ""reg_alpha"": 0.001759897481563857, ""reg_lambda"": 0.5741094491912054, ""scale_pos_weight"": 1.5585392009484815, ""subsample"": 0.6305716131004414}",COMPLETE
14,0.6155476071417992,2026-10-01 08:29:39.185746,2026-10-01 08:29:40.414861,0 days 00:00:01.229115,0.7649411413274574,1.4023783934987197,0.019116171564878066,3,2,600,uni,stem,0.012879734751574116,0.6133452302897344,1.9315393389862598,0.5856398502034312,0.032604747796791844,,"{""colsample_bytree"": 0.7649411413274574, ""gamma"": 1.4023783934987197, ""learning_rate"": 0.019116171564878066, ""max_depth"": 3, ""min_child_weight"": 2, ""n_estimators"": 600, ""ngramas"": ""uni"", ""preprocessing"": ""stem"", ""reg_alpha"": 0.012879734751574116, ""reg_lambda"": 0.6133452302897344, ""scale_pos_weight"": 1.9315393389862598, ""subsample"": 0.5856398502034312}",COMPLETE
15,0.6198426822823775,2026-10-01 08:29:40.420874,2026-10-01 08:29:41.851935,0 days 00:00:01.431061,0.8380262762318266,1.478511529854876,0.012907634999199698,4,3,600,uni,stem,0.028898514939827518,0.10154654221568894,1.6420672908308807,0.6148986949893437,0.01486039000722925,,"{""colsample_bytree"": 0.8380262762318266, ""gamma"": 1.478511529854876, ""learning_rate"": 0.012907634999199698, ""max_depth"": 4, ""min_child_weight"": 3, ""n_estimators"": 600, ""ngramas"": ""uni"", ""preprocessing"": ""stem"", ""reg_alpha"": 0.028898514939827518, ""reg_lambda"": 0.10154654221568894, ""scale_pos_weight"": 1.6420672908308807, ""subsample"": 0.6148986949893437}",COMPLETE
16,0.6148539610815256,2026-10-01 08:29:41.855948,2026-10-01 08:29:43.378093,0 days 00:00:01.522145,0.8482798676632367,4.231554200539145,0.020480159297434228,5,4,700,uni,stem,0.029439668401148318,0.21464146898164482,1.657103673446522,0.6741754758513716,0.026404991012335396,,"{""colsample_bytree"": 0.8482798676632367, ""gamma"": 4.231554200539145, ""learning_rate"": 0.020480159297434228, ""max_depth"": 5, ""min_child_weight"": 4, ""n_estimators"": 700, ""ngramas"": ""uni"", ""preprocessing"": ""stem"", ""reg_alpha"": 0.029439668401148318, ""reg_lambda"": 0.21464146898164482, ""scale_pos_weight"": 1.657103673446522, ""subsample"": 0.6741754758513716}",COMPLETE
17,0.5926440971336496,2026-10-01 08:29:43.383621,2026-10-01 08:29:45.290945,0 days 00:00:01.907324,0.579476342607548,1.9045086702916754,0.01336060603676676,6,5,700,uni,stem,0.0385848256116539,0.11429063296498145,2.048032410999438,0.602466796320799,0.031664712713548475,,"{""colsample_bytree"": 0.579476342607548, ""gamma"": 1.9045086702916754, ""learning_rate"": 0.01336060603676676, ""max_depth"": 6, ""min_child_weight"": 5, ""n_estimators"": 700, ""ngramas"": ""uni"", ""preprocessing"": ""stem"", ""reg_alpha"": 0.0385848256116539, ""reg_lambda"": 0.11429063296498145, ""scale_pos_weight"": 2.048032410999438, ""subsample"": 0.602466796320799}",COMPLETE
18,0.619105771005493,2026-10-01 08:29:45.298740,2026-10-01 08:29:46.771655,0 days 00:00:01.472915,0.6230159377044703,3.8538128178210966,0.019529041532892064,5,2,650,uni,stem,0.0065060135216343015,2.66953944853444,1.6014662697819786,0.5679963231309985,0.025559155394162193,,"{""colsample_bytree"": 0.6230159377044703, ""gamma"": 3.8538128178210966, ""learning_rate"": 0.019529041532892064, ""max_depth"": 5, ""min_child_weight"": 2, ""n_estimators"": 650, ""ngramas"": ""uni"", ""preprocessing"": ""stem"", ""reg_alpha"": 0.0065060135216343015, ""reg_lambda"": 2.66953944853444, ""scale_pos_weight"": 1.6014662697819786, ""subsample"": 0.5679963231309985}",COMPLETE
19,0.6024496349284286,2026-10-01 08:29:46.776688,2026-10-01 08:29:48.069556,0 days 00:00:01.292868,0.6001179021325173,4.336154144564784,0.023373342076370478,5,2,700,uni,stem,0.005543726261213115,5.948729976309192,1.77980125194401,0.5851259043567522,0.021804709971070133,,"{""colsample_bytree"": 0.6001179021325173, ""gamma"": 4.336154144564784, ""learning_rate"": 0.023373342076370478, ""max_depth"": 5, ""min_child_weight"": 2, ""n_estimators"": 700, ""ngramas"": ""uni"", ""preprocessing"": ""stem"", ""reg_alpha"": 0.005543726261213115, ""reg_lambda"": 5.948729976309192, ""scale_pos_weight"": 1.77980125194401, ""subsample"": 0.5851259043567522}",COMPLETE
20,0.6167477667926548,2026-10-01 08:29:48.075311,2026-10-01 08:29:49.367213,0 days 00:00:01.291902,0.7508124879591818,4.507544795948494,0.022955470640978713,3,4,650,uni,stem,0.06375113011034295,0.10489513181296159,1.7319437574943997,0.6030819687830208,0.025445178726800185,,"{""colsample_bytree"": 0.7508124879591818, ""gamma"": 4.507544795948494, ""learning_rate"": 0.022955470640978713, ""max_depth"": 3, ""min_child_weight"": 4, ""n_estimators"": 650, ""ngramas"": ""uni"", ""preprocessing"": ""stem"", ""reg_alpha"": 0.06375113011034295, ""reg_lambda"": 0.10489513181296159, ""scale_pos_weight"": 1.7319437574943997, ""subsample"": 0.6030819687830208}",COMPLETE
21,0.6091468791888596,2026-10-01 08:29:49.373225,2026-10-01 08:29:50.974177,0 days 00:00:01.600952,0.7820967813288485,4.524133255944735,0.010063459839333332,4,4,700,uni,stem,0.024945559835378876,0.1255270303729505,1.4149283168422384,0.5738124468359684,0.01383991179847751,,"{""colsample_bytree"": 0.7820967813288485, ""gamma"": 4.524133255944735, ""learning_rate"": 0.010063459839333332, ""max_depth"": 4, ""min_child_weight"": 4, ""n_estimators"": 700, ""ngramas"": ""uni"", ""preprocessing"": ""stem"", ""reg_alpha"": 0.024945559835378876, ""reg_lambda"": 0.1255270303729505, ""scale_pos_weight"": 1.4149283168422384, ""subsample"": 0.5738124468359684}",COMPLETE
22,0.5929743539052854,2026-10-01 08:29:50.980884,2026-10-01 08:29:52.463782,0 days 00:00:01.482898,0.8199394250852698,0.8463443572331026,0.028806513644238193,4,5,600,uni,stem,0.0024107561754670224,0.17487372784873373,1.3711895831652576,0.5952939358081383,0.004926952916107358,,"{""colsample_bytree"": 0.8199394250852698, ""gamma"": 0.8463443572331026, ""learning_rate"": 0.028806513644238193, ""max_depth"": 4, ""min_child_weight"": 5, ""n_estimators"": 600, ""ngramas"": ""uni"", ""preprocessing"": ""stem"", ""reg_alpha"": 0.0024107561754670224, ""reg_lambda"": 0.17487372784873373, ""scale_pos_weight"": 1.3711895831652576, ""subsample"": 0.5952939358081383}",COMPLETE
23,0.6096828062536088,2026-10-01 08:29:52.469826,2026-10-01 08:29:53.758924,0 days 00:00:01.289098,0.8185572205438,3.2757264931537815,0.02642465133087739,3,4,650,uni,stem,1.1292750036994772,0.16566934591501267,1.5450346345348287,0.5897456606515611,0.022585398968178978,,"{""colsample_bytree"": 0.8185572205438, ""gamma"": 3.2757264931537815, ""learning_rate"": 0.02642465133087739, ""max_depth"": 3, ""min_child_weight"": 4, ""n_estimators"": 650, ""ngramas"": ""uni"", ""preprocessing"": ""stem"", ""reg_alpha"": 1.1292750036994772, ""reg_lambda"": 0.16566934591501267, ""scale_pos_weight"": 1.5450346345348287, ""subsample"": 0.5897456606515611}",COMPLETE
24,0.5887450493878759,2026-10-01 08:29:53.763819,2026-10-01 08:29:54.900916,0 days 00:00:01.137097,0.863263496131939,2.0968915546577986,0.01797835909827245,2,6,600,uni,stem,0.030350703816805037,0.1932348319138474,2.0285818340939197,0.5731423252330969,0.02922959685280845,,"{""colsample_bytree"": 0.863263496131939, ""gamma"": 2.0968915546577986, ""learning_rate"": 0.01797835909827245, ""max_depth"": 2, ""min_child_weight"": 6, ""n_estimators"": 600, ""ngramas"": ""uni"", ""preprocessing"": ""stem"", ""reg_alpha"": 0.030350703816805037, ""reg_lambda"": 0.1932348319138474, ""scale_pos_weight"": 2.0285818340939197, ""subsample"": 0.5731423252330969}",COMPLETE
25,0.5945911251451118,2026-10-01 08:29:54.906935,2026-10-01 08:29:56.498187,0 days 00:00:01.591252,0.8793655516255535,1.4335918689687643,0.01217354478584085,4,5,600,uni,stem,0.037530998250466345,0.34260634769640164,1.868223283568539,0.5930972143624168,0.029790971684166504,,"{""colsample_bytree"": 0.8793655516255535, ""gamma"": 1.4335918689687643, ""learning_rate"": 0.01217354478584085, ""max_depth"": 4, ""min_child_weight"": 5, ""n_estimators"": 600, ""ngramas"": ""uni"", ""preprocessing"": ""stem"", ""reg_alpha"": 0.037530998250466345, ""reg_lambda"": 0.34260634769640164, ""scale_pos_weight"": 1.868223283568539, ""subsample"": 0.5930972143624168}",COMPLETE
26,0.5981658644917336,2026-10-01 08:29:56.505225,2026-10-01 08:29:58.034031,0 days 00:00:01.528806,0.818614036501027,0.5985197366787632,0.014432601716847562,3,2,700,uni,stem,0.00918257717319727,0.19659392212533147,1.3184327709918404,0.5605437000838335,0.022342886277100255,,"{""colsample_bytree"": 0.818614036501027, ""gamma"": 0.5985197366787632, ""learning_rate"": 0.014432601716847562, ""max_depth"": 3, ""min_child_weight"": 2, ""n_estimators"": 700, ""ngramas"": ""uni"", ""preprocessing"": ""stem"", ""reg_alpha"": 0.00918257717319727, ""reg_lambda"": 0.19659392212533147, ""scale_pos_weight"": 1.3184327709918404, ""subsample"": 0.5605437000838335}",COMPLETE
27,0.590522676571733,2026-10-01 08:29:58.040552,2026-10-01 08:29:59.159916,0 days 00:00:01.119364,0.79939897238631,2.1077860705709828,0.012404250959152435,3,3,500,uni,stem,0.03268765144030501,0.1537993513000769,1.3962416110244913,0.577340601928832,0.014391141687083097,,"{""colsample_bytree"": 0.79939897238631, ""gamma"": 2.1077860705709828, ""learning_rate"": 0.012404250959152435, ""max_depth"": 3, ""min_child_weight"": 3, ""n_estimators"": 500, ""ngramas"": ""uni"", ""preprocessing"": ""stem"", ""reg_alpha"": 0.03268765144030501, ""reg_lambda"": 0.1537993513000769, ""scale_pos_weight"": 1.3962416110244913, ""subsample"": 0.577340601928832}",COMPLETE
28,0.6139471265637263,2026-10-01 08:29:59.167443,2026-10-01 08:30:00.730344,0 days 00:00:01.562901,0.7165168846043192,2.1850479185363127,0.03389940778691011,4,2,650,uni,stem,0.07523362592698296,0.37486802629910465,1.6154891855957265,0.5937137828979839,0.02624037163869659,,"{""colsample_bytree"": 0.7165168846043192, ""gamma"": 2.1850479185363127, ""learning_rate"": 0.03389940778691011, ""max_depth"": 4, ""min_child_weight"": 2, ""n_estimators"": 650, ""ngramas"": ""uni"", ""preprocessing"": ""stem"", ""reg_alpha"": 0.07523362592698296, ""reg_lambda"": 0.37486802629910465, ""scale_pos_weight"": 1.6154891855957265, ""subsample"": 0.5937137828979839}",COMPLETE
29,0.6173717838927257,2026-10-01 08:30:00.736371,2026-10-01 08:30:02.145614,0 days 00:00:01.409243,0.7925074323455745,5.665251794743098,0.014070630117785999,4,3,600,uni,stem,0.004114932434483934,0.10388122775443667,1.7294553902604513,0.6251432494713973,0.025033945587497657,,"{""colsample_bytree"": 0.7925074323455745, ""gamma"": 5.665251794743098, ""learning_rate"": 0.014070630117785999, ""max_depth"": 4, ""min_child_weight"": 3, ""n_estimators"": 600, ""ngramas"": ""uni"", ""preprocessing"": ""stem"", ""reg_alpha"": 0.004114932434483934, ""reg_lambda"": 0.10388122775443667, ""scale_pos_weight"": 1.7294553902604513, ""subsample"": 0.6251432494713973}",COMPLETE
30,0.6111197446336034,2026-10-01 08:30:02.152137,2026-10-01 08:30:03.489374,0 days 00:00:01.337237,0.8802225771007662,1.4047054949391227,0.0119162752539155,4,4,500,uni,stem,0.031068751074165412,0.10945510071927594,1.5976503278900844,0.6656743271134932,0.010465567238176838,,"{""colsample_bytree"": 0.8802225771007662, ""gamma"": 1.4047054949391227, ""learning_rate"": 0.0119162752539155, ""max_depth"": 4, ""min_child_weight"": 4, ""n_estimators"": 500, ""ngramas"": ""uni"", ""preprocessing"": ""stem"", ""reg_alpha"": 0.031068751074165412, ""reg_lambda"": 0.10945510071927594, ""scale_pos_weight"": 1.5976503278900844, ""subsample"": 0.6656743271134932}",COMPLETE
31,0.6022728504525235,2026-10-01 08:30:03.497136,2026-10-01 08:30:04.693086,0 days 00:00:01.195950,0.7877040785311609,5.457997848069244,0.016581932652774675,5,5,550,uni,stem,0.02544920926149258,0.11033568389111942,1.5886675375019035,0.6083786848461306,0.012648775883924723,,"{""colsample_bytree"": 0.7877040785311609, ""gamma"": 5.457997848069244, ""learning_rate"": 0.016581932652774675, ""max_depth"": 5, ""min_child_weight"": 5, ""n_estimators"": 550, ""ngramas"": ""uni"", ""preprocessing"": ""stem"", ""reg_alpha"": 0.02544920926149258, ""reg_lambda"": 0.11033568389111942, ""scale_pos_weight"": 1.5886675375019035, ""subsample"": 0.6083786848461306}",COMPLETE
32,0.6137956866051305,2026-10-01 08:30:04.699102,2026-10-01 08:30:06.042633,0 days 00:00:01.343531,0.8133899813247644,0.5699671786420495,0.013337856273414408,4,3,500,uni,stem,0.10212275068613472,0.12813936594081726,1.794829694747888,0.5609057067389646,0.027551707427382124,,"{""colsample_bytree"": 0.8133899813247644, ""gamma"": 0.5699671786420495, ""learning_rate"": 0.013337856273414408, ""max_depth"": 4, ""min_child_weight"": 3, ""n_estimators"": 500, ""ngramas"": ""uni"", ""preprocessing"": ""stem"", ""reg_alpha"": 0.10212275068613472, ""reg_lambda"": 0.12813936594081726, ""scale_pos_weight"": 1.794829694747888, ""subsample"": 0.5609057067389646}",COMPLETE
33,0.6205607132063805,2026-10-01 08:30:06.048663,2026-10-01 08:30:07.674462,0 days 00:00:01.625799,0.7768555320645876,2.8889517824591477,0.011871268758117415,4,2,650,uni,stem,0.1699008472269046,0.3230257457961621,1.6554563757250151,0.6043336219181583,0.024328413807476655,,"{""colsample_bytree"": 0.7768555320645876, ""gamma"": 2.8889517824591477, ""learning_rate"": 0.011871268758117415, ""max_depth"": 4, ""min_child_weight"": 2, ""n_estimators"": 650, ""ngramas"": ""uni"", ""preprocessing"": ""stem"", ""reg_alpha"": 0.1699008472269046, ""reg_lambda"": 0.3230257457961621, ""scale_pos_weight"": 1.6554563757250151, ""subsample"": 0.6043336219181583}",COMPLETE
34,0.6211186502666607,2026-10-01 08:30:07.681193,2026-10-01 08:30:09.344243,0 days 00:00:01.663050,0.7515927117837634,3.4113638218897204,0.02040639636937636,5,2,600,uni,stem,0.027681591430378422,1.4716566887030964,1.6811168628059656,0.5543164101001016,0.025098143988880984,,"{""colsample_bytree"": 0.7515927117837634, ""gamma"": 3.4113638218897204, ""learning_rate"": 0.02040639636937636, ""max_depth"": 5, ""min_child_weight"": 2, ""n_estimators"": 600, ""ngramas"": ""uni"", ""preprocessing"": ""stem"", ""reg_alpha"": 0.027681591430378422, ""reg_lambda"": 1.4716566887030964, ""scale_pos_weight"": 1.6811168628059656, ""subsample"": 0.5543164101001016}",COMPLETE
35,0.6199945895820189,2026-10-01 08:30:09.351339,2026-10-01 08:30:11.053401,0 days 00:00:01.702062,0.7499327516303692,1.1058203801769144,0.011271296091022662,4,3,700,uni,stem,0.009417682063569214,0.43229021085933667,1.8061006086095284,0.6161973175327154,0.02754993672997174,,"{""colsample_bytree"": 0.7499327516303692, ""gamma"": 1.1058203801769144, ""learning_rate"": 0.011271296091022662, ""max_depth"": 4, ""min_child_weight"": 3, ""n_estimators"": 700, ""ngramas"": ""uni"", ""preprocessing"": ""stem"", ""reg_alpha"": 0.009417682063569214, ""reg_lambda"": 0.43229021085933667, ""scale_pos_weight"": 1.8061006086095284, ""subsample"": 0.6161973175327154}",COMPLETE
36,0.5974683856871631,2026-10-01 08:30:11.060930,2026-10-01 08:30:12.445035,0 days 00:00:01.384105,0.822986890684818,2.8684068363757946,0.016578346077171843,4,5,550,uni,stem,0.04071146420458844,1.3108995730988957,1.784901967951354,0.5835274867997452,0.02664865667308218,,"{""colsample_bytree"": 0.822986890684818, ""gamma"": 2.8684068363757946, ""learning_rate"": 0.016578346077171843, ""max_depth"": 4, ""min_child_weight"": 5, ""n_estimators"": 550, ""ngramas"": ""uni"", ""preprocessing"": ""stem"", ""reg_alpha"": 0.04071146420458844, ""reg_lambda"": 1.3108995730988957, ""scale_pos_weight"": 1.784901967951354, ""subsample"": 0.5835274867997452}",COMPLETE
