number,value,datetime_start,datetime_complete,duration,params_colsample_bytree,params_gamma,params_learning_rate,params_max_depth,params_min_child_weight,params_n_estimators,params_ngramas,params_preprocessing,params_reg_alpha,params_reg_lambda,params_scale_pos_weight,params_subsample,user_attrs_inner_f1_std,system_attrs_fixed_params,system_attrs_tpe:relative_params:0,state
37,0.6171519554146946,2026-10-01 08:30:12.452595,2026-10-01 08:30:14.265287,0 days 00:00:01.812692,0.817819922292525,1.248430034325792,0.02272793060351619,5,2,600,uni,stem,0.004829100762229125,0.7344494382073581,1.768563006290394,0.637862883287386,0.023533403209315337,,"{""colsample_bytree"": 0.817819922292525, ""gamma"": 1.248430034325792, ""learning_rate"": 0.02272793060351619, ""max_depth"": 5, ""min_child_weight"": 2, ""n_estimators"": 600, ""ngramas"": ""uni"", ""preprocessing"": ""stem"", ""reg_alpha"": 0.004829100762229125, ""reg_lambda"": 0.7344494382073581, ""scale_pos_weight"": 1.768563006290394, ""subsample"": 0.637862883287386}",COMPLETE
38,0.6104442710842551,2026-10-01 08:30:14.273310,2026-10-01 08:30:15.612968,0 days 00:00:01.339658,0.8303558213768031,1.2386643197536331,0.01051616823422776,3,4,600,uni,stem,0.06633357984111696,0.4357805087650972,1.669096335873392,0.6230088425352791,0.010790570162946524,,"{""colsample_bytree"": 0.8303558213768031, ""gamma"": 1.2386643197536331, ""learning_rate"": 0.01051616823422776, ""max_depth"": 3, ""min_child_weight"": 4, ""n_estimators"": 600, ""ngramas"": ""uni"", ""preprocessing"": ""stem"", ""reg_alpha"": 0.06633357984111696, ""reg_lambda"": 0.4357805087650972, ""scale_pos_weight"": 1.669096335873392, ""subsample"": 0.6230088425352791}",COMPLETE
39,0.6004188880249083,2026-10-01 08:30:15.620996,2026-10-01 08:30:17.202695,0 days 00:00:01.581699,0.794925651119193,1.4129479723818568,0.024420111799049224,4,5,650,uni,stem,0.04705985004084982,0.3259017681036917,1.6081743673760622,0.6141030091483466,0.01526879042403176,,"{""colsample_bytree"": 0.794925651119193, ""gamma"": 1.4129479723818568, ""learning_rate"": 0.024420111799049224, ""max_depth"": 4, ""min_child_weight"": 5, ""n_estimators"": 650, ""ngramas"": ""uni"", ""preprocessing"": ""stem"", ""reg_alpha"": 0.04705985004084982, ""reg_lambda"": 0.3259017681036917, ""scale_pos_weight"": 1.6081743673760622, ""subsample"": 0.6141030091483466}",COMPLETE
40,0.6082311001141151,2026-10-01 08:30:17.211728,2026-10-01 08:30:18.698340,0 days 00:00:01.486612,0.752137794309734,1.0302773741191293,0.01321218719375851,3,2,700,uni,stem,0.2607044496895172,0.3648043574782255,1.5273194630519478,0.6216793039477807,0.029656936199772086,,"{""colsample_bytree"": 0.752137794309734, ""gamma"": 1.0302773741191293, ""learning_rate"": 0.01321218719375851, ""max_depth"": 3, ""min_child_weight"": 2, ""n_estimators"": 700, ""ngramas"": ""uni"", ""preprocessing"": ""stem"", ""reg_alpha"": 0.2607044496895172, ""reg_lambda"": 0.3648043574782255, ""scale_pos_weight"": 1.5273194630519478, ""subsample"": 0.6216793039477807}",COMPLETE
41,0.6132727314717755,2026-10-01 08:30:18.705508,2026-10-01 08:30:20.239713,0 days 00:00:01.534205,0.8536164427338265,1.3254144419561789,0.01345680192921379,3,2,650,uni,stem,0.02896801666129464,0.11529840500623717,1.622062643877503,0.6727714799124282,0.02231104378826058,,"{""colsample_bytree"": 0.8536164427338265, ""gamma"": 1.3254144419561789, ""learning_rate"": 0.01345680192921379, ""max_depth"": 3, ""min_child_weight"": 2, ""n_estimators"": 650, ""ngramas"": ""uni"", ""preprocessing"": ""stem"", ""reg_alpha"": 0.02896801666129464, ""reg_lambda"": 0.11529840500623717, ""scale_pos_weight"": 1.622062643877503, ""subsample"": 0.6727714799124282}",COMPLETE
42,0.6270669116964911,2026-10-01 08:30:20.249744,2026-10-01 08:30:21.996025,0 days 00:00:01.746281,0.8372510441848876,4.495703940273562,0.011024644565360802,4,3,700,uni,stem,0.07864817521136745,0.15285073263580629,1.6553653972225881,0.5855636585512316,0.02384465250826764,,"{""colsample_bytree"": 0.8372510441848876, ""gamma"": 4.495703940273562, ""learning_rate"": 0.011024644565360802, ""max_depth"": 4, ""min_child_weight"": 3, ""n_estimators"": 700, ""ngramas"": ""uni"", ""preprocessing"": ""stem"", ""reg_alpha"": 0.07864817521136745, ""reg_lambda"": 0.15285073263580629, ""scale_pos_weight"": 1.6553653972225881, ""subsample"": 0.5855636585512316}",COMPLETE
43,0.609375032610081,2026-10-01 08:30:22.004077,2026-10-01 08:30:23.849541,0 days 00:00:01.845464,0.7859468005416037,1.8343184787958033,0.010129652938307924,5,3,650,uni,stem,0.686367716209741,0.17579275588084775,1.8229844547051963,0.612753559888831,0.018911998471327504,,"{""colsample_bytree"": 0.7859468005416037, ""gamma"": 1.8343184787958033, ""learning_rate"": 0.010129652938307924, ""max_depth"": 5, ""min_child_weight"": 3, ""n_estimators"": 650, ""ngramas"": ""uni"", ""preprocessing"": ""stem"", ""reg_alpha"": 0.686367716209741, ""reg_lambda"": 0.17579275588084775, ""scale_pos_weight"": 1.8229844547051963, ""subsample"": 0.612753559888831}",COMPLETE
44,0.6095605643746214,2026-10-01 08:30:23.858083,2026-10-01 08:30:25.683739,0 days 00:00:01.825656,0.7556199465546851,2.1241697329570206,0.011045454686240417,5,4,650,uni,stem,0.028462668246636402,0.49662792527942873,1.7170584203155426,0.5986595237270097,0.025158030430491196,,"{""colsample_bytree"": 0.7556199465546851, ""gamma"": 2.1241697329570206, ""learning_rate"": 0.011045454686240417, ""max_depth"": 5, ""min_child_weight"": 4, ""n_estimators"": 650, ""ngramas"": ""uni"", ""preprocessing"": ""stem"", ""reg_alpha"": 0.028462668246636402, ""reg_lambda"": 0.49662792527942873, ""scale_pos_weight"": 1.7170584203155426, ""subsample"": 0.5986595237270097}",COMPLETE
45,0.6075804172601348,2026-10-01 08:30:25.693756,2026-10-01 08:30:27.118584,0 days 00:00:01.424828,0.7986268864952568,4.109897066637162,0.01448529915975867,4,4,600,uni,stem,0.06381739315121221,0.11562223282847356,1.616232349000153,0.5569890034279594,0.024521148974040625,,"{""colsample_bytree"": 0.7986268864952568, ""gamma"": 4.109897066637162, ""learning_rate"": 0.01448529915975867, ""max_depth"": 4, ""min_child_weight"": 4, ""n_estimators"": 600, ""ngramas"": ""uni"", ""preprocessing"": ""stem"", ""reg_alpha"": 0.06381739315121221, ""reg_lambda"": 0.11562223282847356, ""scale_pos_weight"": 1.616232349000153, ""subsample"": 0.5569890034279594}",COMPLETE
46,0.6170730359452313,2026-10-01 08:30:27.126342,2026-10-01 08:30:28.891791,0 days 00:00:01.765449,0.8027012129538684,0.8483731152043964,0.012318064790324598,4,3,700,uni,stem,0.01917917368926292,0.18997591303553893,1.776492761321201,0.5967860891783555,0.028471150353929685,,"{""colsample_bytree"": 0.8027012129538684, ""gamma"": 0.8483731152043964, ""learning_rate"": 0.012318064790324598, ""max_depth"": 4, ""min_child_weight"": 3, ""n_estimators"": 700, ""ngramas"": ""uni"", ""preprocessing"": ""stem"", ""reg_alpha"": 0.01917917368926292, ""reg_lambda"": 0.18997591303553893, ""scale_pos_weight"": 1.776492761321201, ""subsample"": 0.5967860891783555}",COMPLETE
47,0.6097708371392855,2026-10-01 08:30:28.899329,2026-10-01 08:30:30.307953,0 days 00:00:01.408624,0.8983875079063217,2.4352103431697647,0.01383073437399767,3,3,600,uni,stem,0.1300191226641834,0.11848212442745544,1.5686750725426146,0.5847614198143686,0.017199711012143053,,"{""colsample_bytree"": 0.8983875079063217, ""gamma"": 2.4352103431697647, ""learning_rate"": 0.01383073437399767, ""max_depth"": 3, ""min_child_weight"": 3, ""n_estimators"": 600, ""ngramas"": ""uni"", ""preprocessing"": ""stem"", ""reg_alpha"": 0.1300191226641834, ""reg_lambda"": 0.11848212442745544, ""scale_pos_weight"": 1.5686750725426146, ""subsample"": 0.5847614198143686}",COMPLETE
48,0.6073517285071609,2026-10-01 08:30:30.317470,2026-10-01 08:30:31.742258,0 days 00:00:01.424788,0.810470234290276,3.7992024571814667,0.017432014827273027,4,5,650,uni,stem,0.053323810310101936,0.13366743555209717,1.4560363488257693,0.6285642717348485,0.02110244099168424,,"{""colsample_bytree"": 0.810470234290276, ""gamma"": 3.7992024571814667, ""learning_rate"": 0.017432014827273027, ""max_depth"": 4, ""min_child_weight"": 5, ""n_estimators"": 650, ""ngramas"": ""uni"", ""preprocessing"": ""stem"", ""reg_alpha"": 0.053323810310101936, ""reg_lambda"": 0.13366743555209717, ""scale_pos_weight"": 1.4560363488257693, ""subsample"": 0.6285642717348485}",COMPLETE
49,0.6153422392210989,2026-10-01 08:30:31.752366,2026-10-01 08:30:33.566507,0 days 00:00:01.814141,0.8311395014791739,2.1491215016798133,0.012266462858213116,4,2,700,uni,stem,0.03500959051201162,0.10993561541942634,1.5312047799171018,0.6466570955130393,0.026440188325848272,,"{""colsample_bytree"": 0.8311395014791739, ""gamma"": 2.1491215016798133, ""learning_rate"": 0.012266462858213116, ""max_depth"": 4, ""min_child_weight"": 2, ""n_estimators"": 700, ""ngramas"": ""uni"", ""preprocessing"": ""stem"", ""reg_alpha"": 0.03500959051201162, ""reg_lambda"": 0.10993561541942634, ""scale_pos_weight"": 1.5312047799171018, ""subsample"": 0.6466570955130393}",COMPLETE
