number,value,datetime_start,datetime_complete,duration,params_colsample_bytree,params_gamma,params_learning_rate,params_max_depth,params_min_child_weight,params_n_estimators,params_ngramas,params_preprocessing,params_reg_alpha,params_reg_lambda,params_scale_pos_weight,params_subsample,user_attrs_inner_f1_std,system_attrs_fixed_params,system_attrs_tpe:relative_params:0,state
37,0.665111400958697,2026-10-01 08:42:39.261979,2026-10-01 08:42:41.047123,0 days 00:00:01.785144,0.7257301799671353,3.381659720484638,0.012735626082971284,4,2,650,uni,stem,0.0017395513651288083,0.2023407948475867,1.768493844744339,0.6972737557984242,0.02471019493768764,,"{""colsample_bytree"": 0.7257301799671353, ""gamma"": 3.381659720484638, ""learning_rate"": 0.012735626082971284, ""max_depth"": 4, ""min_child_weight"": 2, ""n_estimators"": 650, ""ngramas"": ""uni"", ""preprocessing"": ""stem"", ""reg_alpha"": 0.0017395513651288083, ""reg_lambda"": 0.2023407948475867, ""scale_pos_weight"": 1.768493844744339, ""subsample"": 0.6972737557984242}",COMPLETE
38,0.6543468843765529,2026-10-01 08:42:41.055650,2026-10-01 08:42:42.255614,0 days 00:00:01.199964,0.8298919299544831,4.99952372598738,0.013430751552839737,2,2,550,uni,stem,0.0022778993636389366,0.1553827219184153,1.9633921906094596,0.5958426482345068,0.030569436103210917,,"{""colsample_bytree"": 0.8298919299544831, ""gamma"": 4.99952372598738, ""learning_rate"": 0.013430751552839737, ""max_depth"": 2, ""min_child_weight"": 2, ""n_estimators"": 550, ""ngramas"": ""uni"", ""preprocessing"": ""stem"", ""reg_alpha"": 0.0022778993636389366, ""reg_lambda"": 0.1553827219184153, ""scale_pos_weight"": 1.9633921906094596, ""subsample"": 0.5958426482345068}",COMPLETE
39,0.6459318939001835,2026-10-01 08:42:42.263168,2026-10-01 08:42:43.685258,0 days 00:00:01.422090,0.6798946743970071,3.862417594609002,0.022021978739758093,4,3,600,uni,stem,0.0018523526029195288,4.713181220103058,1.4985506027051982,0.5925368592691234,0.028134436770534555,,"{""colsample_bytree"": 0.6798946743970071, ""gamma"": 3.862417594609002, ""learning_rate"": 0.022021978739758093, ""max_depth"": 4, ""min_child_weight"": 3, ""n_estimators"": 600, ""ngramas"": ""uni"", ""preprocessing"": ""stem"", ""reg_alpha"": 0.0018523526029195288, ""reg_lambda"": 4.713181220103058, ""scale_pos_weight"": 1.4985506027051982, ""subsample"": 0.5925368592691234}",COMPLETE
40,0.6598690225635534,2026-10-01 08:42:43.694260,2026-10-01 08:42:44.944314,0 days 00:00:01.250054,0.7221268033480662,4.527873816379412,0.02003265566732701,2,3,650,uni,stem,0.0019256632681524364,0.1294586043630068,1.8909286747035723,0.6805446014443868,0.027785823973661892,,"{""colsample_bytree"": 0.7221268033480662, ""gamma"": 4.527873816379412, ""learning_rate"": 0.02003265566732701, ""max_depth"": 2, ""min_child_weight"": 3, ""n_estimators"": 650, ""ngramas"": ""uni"", ""preprocessing"": ""stem"", ""reg_alpha"": 0.0019256632681524364, ""reg_lambda"": 0.1294586043630068, ""scale_pos_weight"": 1.8909286747035723, ""subsample"": 0.6805446014443868}",COMPLETE
41,0.6351856298644434,2026-10-01 08:42:44.949850,2026-10-01 08:42:46.509675,0 days 00:00:01.559825,0.751915175607943,3.4888120700752037,0.018616838521256084,3,5,700,uni,stem,0.004562923635252035,0.2838730954065899,1.8183611449713535,0.5832084252999971,0.027534759499900516,,"{""colsample_bytree"": 0.751915175607943, ""gamma"": 3.4888120700752037, ""learning_rate"": 0.018616838521256084, ""max_depth"": 3, ""min_child_weight"": 5, ""n_estimators"": 700, ""ngramas"": ""uni"", ""preprocessing"": ""stem"", ""reg_alpha"": 0.004562923635252035, ""reg_lambda"": 0.2838730954065899, ""scale_pos_weight"": 1.8183611449713535, ""subsample"": 0.5832084252999971}",COMPLETE
42,0.6610661454465818,2026-10-01 08:42:46.519099,2026-10-01 08:42:48.223796,0 days 00:00:01.704697,0.8141724637181267,5.440671905766669,0.010909201248162336,3,3,700,uni,stem,0.0066852684036497285,0.11289430394916732,1.8420148086420103,0.5732850432948192,0.03120110840316748,,"{""colsample_bytree"": 0.8141724637181267, ""gamma"": 5.440671905766669, ""learning_rate"": 0.010909201248162336, ""max_depth"": 3, ""min_child_weight"": 3, ""n_estimators"": 700, ""ngramas"": ""uni"", ""preprocessing"": ""stem"", ""reg_alpha"": 0.0066852684036497285, ""reg_lambda"": 0.11289430394916732, ""scale_pos_weight"": 1.8420148086420103, ""subsample"": 0.5732850432948192}",COMPLETE
43,0.6540629140163364,2026-10-01 08:42:48.232165,2026-10-01 08:42:49.672682,0 days 00:00:01.440517,0.7830141686280492,4.359906875887103,0.012272412666739212,3,4,600,uni,stem,0.009360849236931989,0.10231214598992665,1.6817869921402182,0.5839266016225256,0.02905094699058472,,"{""colsample_bytree"": 0.7830141686280492, ""gamma"": 4.359906875887103, ""learning_rate"": 0.012272412666739212, ""max_depth"": 3, ""min_child_weight"": 4, ""n_estimators"": 600, ""ngramas"": ""uni"", ""preprocessing"": ""stem"", ""reg_alpha"": 0.009360849236931989, ""reg_lambda"": 0.10231214598992665, ""scale_pos_weight"": 1.6817869921402182, ""subsample"": 0.5839266016225256}",COMPLETE
44,0.6633496139356098,2026-10-01 08:42:49.682837,2026-10-01 08:42:51.626520,0 days 00:00:01.943683,0.783004198536096,4.458951748006077,0.01676915257381769,4,2,650,uni,stem,0.02021302528682201,0.15609637105699078,1.8958039734643903,0.5564077593767027,0.0204718403535162,,"{""colsample_bytree"": 0.783004198536096, ""gamma"": 4.458951748006077, ""learning_rate"": 0.01676915257381769, ""max_depth"": 4, ""min_child_weight"": 2, ""n_estimators"": 650, ""ngramas"": ""uni"", ""preprocessing"": ""stem"", ""reg_alpha"": 0.02021302528682201, ""reg_lambda"": 0.15609637105699078, ""scale_pos_weight"": 1.8958039734643903, ""subsample"": 0.5564077593767027}",COMPLETE
45,0.6592558339451581,2026-10-01 08:42:51.634649,2026-10-01 08:42:53.254406,0 days 00:00:01.619757,0.7147210734089424,3.978849436488132,0.015562445487979705,3,3,700,uni,stem,0.004588529681919539,0.3703643737235543,1.7983771479701192,0.6640891324006473,0.02229309254705981,,"{""colsample_bytree"": 0.7147210734089424, ""gamma"": 3.978849436488132, ""learning_rate"": 0.015562445487979705, ""max_depth"": 3, ""min_child_weight"": 3, ""n_estimators"": 700, ""ngramas"": ""uni"", ""preprocessing"": ""stem"", ""reg_alpha"": 0.004588529681919539, ""reg_lambda"": 0.3703643737235543, ""scale_pos_weight"": 1.7983771479701192, ""subsample"": 0.6640891324006473}",COMPLETE
46,0.665260935264195,2026-10-01 08:42:53.263425,2026-10-01 08:42:54.949135,0 days 00:00:01.685710,0.8030555049180824,2.5537759371537576,0.015158204352744125,3,3,700,uni,stem,0.005184619544738357,0.1758169061414847,1.8408060280088794,0.6221588796593732,0.026369170692869703,,"{""colsample_bytree"": 0.8030555049180824, ""gamma"": 2.5537759371537576, ""learning_rate"": 0.015158204352744125, ""max_depth"": 3, ""min_child_weight"": 3, ""n_estimators"": 700, ""ngramas"": ""uni"", ""preprocessing"": ""stem"", ""reg_alpha"": 0.005184619544738357, ""reg_lambda"": 0.1758169061414847, ""scale_pos_weight"": 1.8408060280088794, ""subsample"": 0.6221588796593732}",COMPLETE
47,0.6645029524526241,2026-10-01 08:42:54.958814,2026-10-01 08:42:56.686862,0 days 00:00:01.728048,0.7669213193249972,3.2296646442486185,0.010200681423905752,4,2,600,uni,stem,0.005605474497974659,0.29962510340888804,1.7896866605769406,0.5823651624987736,0.026432931524229826,,"{""colsample_bytree"": 0.7669213193249972, ""gamma"": 3.2296646442486185, ""learning_rate"": 0.010200681423905752, ""max_depth"": 4, ""min_child_weight"": 2, ""n_estimators"": 600, ""ngramas"": ""uni"", ""preprocessing"": ""stem"", ""reg_alpha"": 0.005605474497974659, ""reg_lambda"": 0.29962510340888804, ""scale_pos_weight"": 1.7896866605769406, ""subsample"": 0.5823651624987736}",COMPLETE
48,0.6410924616608632,2026-10-01 08:42:56.696829,2026-10-01 08:42:58.318816,0 days 00:00:01.621987,0.7839596160215712,1.9319725107979218,0.021696439580695007,3,5,650,uni,stem,0.004375041128539859,0.14007855268040098,1.64059909384738,0.6579817749061808,0.027470044814600258,,"{""colsample_bytree"": 0.7839596160215712, ""gamma"": 1.9319725107979218, ""learning_rate"": 0.021696439580695007, ""max_depth"": 3, ""min_child_weight"": 5, ""n_estimators"": 650, ""ngramas"": ""uni"", ""preprocessing"": ""stem"", ""reg_alpha"": 0.004375041128539859, ""reg_lambda"": 0.14007855268040098, ""scale_pos_weight"": 1.64059909384738, ""subsample"": 0.6579817749061808}",COMPLETE
49,0.6459053883066206,2026-10-01 08:42:58.328323,2026-10-01 08:42:59.808135,0 days 00:00:01.479812,0.7331598020390133,3.5455872619619333,0.014600937600697922,3,5,650,uni,stem,0.0016899800347330036,0.2559552479048088,1.7810059804051384,0.6297824026638047,0.03010766085485785,,"{""colsample_bytree"": 0.7331598020390133, ""gamma"": 3.5455872619619333, ""learning_rate"": 0.014600937600697922, ""max_depth"": 3, ""min_child_weight"": 5, ""n_estimators"": 650, ""ngramas"": ""uni"", ""preprocessing"": ""stem"", ""reg_alpha"": 0.0016899800347330036, ""reg_lambda"": 0.2559552479048088, ""scale_pos_weight"": 1.7810059804051384, ""subsample"": 0.6297824026638047}",COMPLETE
