number,value,datetime_start,datetime_complete,duration,params_colsample_bytree,params_gamma,params_learning_rate,params_max_depth,params_min_child_weight,params_n_estimators,params_ngramas,params_preprocessing,params_reg_alpha,params_reg_lambda,params_scale_pos_weight,params_subsample,user_attrs_inner_f1_std,system_attrs_fixed_params,system_attrs_tpe:relative_params:0,state
37,0.577028881465551,2026-10-01 08:31:14.637726,2026-10-01 08:31:15.591721,0 days 00:00:00.953995,0.7724576632448784,5.961505767943158,0.08506455894227698,4,5,650,uni,stem,0.0012449438354376482,0.26341177528945603,1.548302160028375,0.8197595872740614,0.016998833182953182,,"{""colsample_bytree"": 0.7724576632448784, ""gamma"": 5.961505767943158, ""learning_rate"": 0.08506455894227698, ""max_depth"": 4, ""min_child_weight"": 5, ""n_estimators"": 650, ""ngramas"": ""uni"", ""preprocessing"": ""stem"", ""reg_alpha"": 0.0012449438354376482, ""reg_lambda"": 0.26341177528945603, ""scale_pos_weight"": 1.548302160028375, ""subsample"": 0.8197595872740614}",COMPLETE
38,0.572651434363444,2026-10-01 08:31:15.599094,2026-10-01 08:31:16.569156,0 days 00:00:00.970062,0.7777029272294776,7.064509217623057,0.15358855008280686,2,4,700,uni,stem,0.0036889863457191144,0.35264330567547975,1.809440628373867,0.7758567324673891,0.006132640845052368,,"{""colsample_bytree"": 0.7777029272294776, ""gamma"": 7.064509217623057, ""learning_rate"": 0.15358855008280686, ""max_depth"": 2, ""min_child_weight"": 4, ""n_estimators"": 700, ""ngramas"": ""uni"", ""preprocessing"": ""stem"", ""reg_alpha"": 0.0036889863457191144, ""reg_lambda"": 0.35264330567547975, ""scale_pos_weight"": 1.809440628373867, ""subsample"": 0.7758567324673891}",COMPLETE
39,0.5894893603011957,2026-10-01 08:31:16.577679,2026-10-01 08:31:17.637630,0 days 00:00:01.059951,0.8006736894984637,4.704067015910661,0.1029861016533025,3,3,650,uni,stem,0.0022379447730400143,0.22104950505105278,1.999456631053727,0.8403341662969924,0.009886232784231902,,"{""colsample_bytree"": 0.8006736894984637, ""gamma"": 4.704067015910661, ""learning_rate"": 0.1029861016533025, ""max_depth"": 3, ""min_child_weight"": 3, ""n_estimators"": 650, ""ngramas"": ""uni"", ""preprocessing"": ""stem"", ""reg_alpha"": 0.0022379447730400143, ""reg_lambda"": 0.22104950505105278, ""scale_pos_weight"": 1.999456631053727, ""subsample"": 0.8403341662969924}",COMPLETE
40,0.5908151742546961,2026-10-01 08:31:17.646666,2026-10-01 08:31:18.783986,0 days 00:00:01.137320,0.8800692219145909,6.02839754202531,0.043579666553924215,4,3,600,uni,stem,0.002847689240766374,0.18789092749982386,1.8521327624608805,0.7874241469152943,0.009493746927225639,,"{""colsample_bytree"": 0.8800692219145909, ""gamma"": 6.02839754202531, ""learning_rate"": 0.043579666553924215, ""max_depth"": 4, ""min_child_weight"": 3, ""n_estimators"": 600, ""ngramas"": ""uni"", ""preprocessing"": ""stem"", ""reg_alpha"": 0.002847689240766374, ""reg_lambda"": 0.18789092749982386, ""scale_pos_weight"": 1.8521327624608805, ""subsample"": 0.7874241469152943}",COMPLETE
41,0.5862436970640832,2026-10-01 08:31:18.791505,2026-10-01 08:31:19.852846,0 days 00:00:01.061341,0.8941506078066069,6.215334100171717,0.09684417702558942,3,3,650,uni,stem,0.0010813821451017061,0.238702026074492,1.8258729577235986,0.7586012111108963,0.015638640812479544,,"{""colsample_bytree"": 0.8941506078066069, ""gamma"": 6.215334100171717, ""learning_rate"": 0.09684417702558942, ""max_depth"": 3, ""min_child_weight"": 3, ""n_estimators"": 650, ""ngramas"": ""uni"", ""preprocessing"": ""stem"", ""reg_alpha"": 0.0010813821451017061, ""reg_lambda"": 0.238702026074492, ""scale_pos_weight"": 1.8258729577235986, ""subsample"": 0.7586012111108963}",COMPLETE
42,0.5774263368639985,2026-10-01 08:31:19.860848,2026-10-01 08:31:20.990087,0 days 00:00:01.129239,0.7646074058703041,4.2614288738792885,0.10263779211175007,3,2,700,uni,stem,0.0018715099545384161,0.10818036512803325,1.9296850442750269,0.8359994462052215,0.01723573785583218,,"{""colsample_bytree"": 0.7646074058703041, ""gamma"": 4.2614288738792885, ""learning_rate"": 0.10263779211175007, ""max_depth"": 3, ""min_child_weight"": 2, ""n_estimators"": 700, ""ngramas"": ""uni"", ""preprocessing"": ""stem"", ""reg_alpha"": 0.0018715099545384161, ""reg_lambda"": 0.10818036512803325, ""scale_pos_weight"": 1.9296850442750269, ""subsample"": 0.8359994462052215}",COMPLETE
43,0.5780031005651272,2026-10-01 08:31:20.998891,2026-10-01 08:31:22.135637,0 days 00:00:01.136746,0.8623335308044455,4.923612560016335,0.09314454783504805,4,2,650,uni,stem,0.0016412559503626207,0.2537162927482727,2.0920903248673532,0.8422164891291182,0.015827943534102253,,"{""colsample_bytree"": 0.8623335308044455, ""gamma"": 4.923612560016335, ""learning_rate"": 0.09314454783504805, ""max_depth"": 4, ""min_child_weight"": 2, ""n_estimators"": 650, ""ngramas"": ""uni"", ""preprocessing"": ""stem"", ""reg_alpha"": 0.0016412559503626207, ""reg_lambda"": 0.2537162927482727, ""scale_pos_weight"": 2.0920903248673532, ""subsample"": 0.8422164891291182}",COMPLETE
44,0.5820370054954068,2026-10-01 08:31:22.143157,2026-10-01 08:31:23.140023,0 days 00:00:00.996866,0.8589914833583869,5.901526761441473,0.08780947656259096,3,4,600,uni,stem,0.0011296453318975375,0.10291753535148329,1.8569698627025222,0.8159994511957128,0.019643066306984803,,"{""colsample_bytree"": 0.8589914833583869, ""gamma"": 5.901526761441473, ""learning_rate"": 0.08780947656259096, ""max_depth"": 3, ""min_child_weight"": 4, ""n_estimators"": 600, ""ngramas"": ""uni"", ""preprocessing"": ""stem"", ""reg_alpha"": 0.0011296453318975375, ""reg_lambda"": 0.10291753535148329, ""scale_pos_weight"": 1.8569698627025222, ""subsample"": 0.8159994511957128}",COMPLETE
45,0.5899936167530215,2026-10-01 08:31:23.150587,2026-10-01 08:31:24.150132,0 days 00:00:00.999545,0.8029115740535393,5.657141499558737,0.05176259555937074,2,3,650,uni,stem,0.03824732167867,0.1474420415618261,1.578793970010033,0.8990527423654602,0.006314720450785216,,"{""colsample_bytree"": 0.8029115740535393, ""gamma"": 5.657141499558737, ""learning_rate"": 0.05176259555937074, ""max_depth"": 2, ""min_child_weight"": 3, ""n_estimators"": 650, ""ngramas"": ""uni"", ""preprocessing"": ""stem"", ""reg_alpha"": 0.03824732167867, ""reg_lambda"": 0.1474420415618261, ""scale_pos_weight"": 1.578793970010033, ""subsample"": 0.8990527423654602}",COMPLETE
46,0.5884607301261761,2026-10-01 08:31:24.159646,2026-10-01 08:31:25.148110,0 days 00:00:00.988464,0.7945558689115086,6.595479295445989,0.0661211078787411,3,3,650,uni,stem,0.053466558992481934,0.22094256400999068,1.452774242145725,0.8718031739892785,0.025031701778072093,,"{""colsample_bytree"": 0.7945558689115086, ""gamma"": 6.595479295445989, ""learning_rate"": 0.0661211078787411, ""max_depth"": 3, ""min_child_weight"": 3, ""n_estimators"": 650, ""ngramas"": ""uni"", ""preprocessing"": ""stem"", ""reg_alpha"": 0.053466558992481934, ""reg_lambda"": 0.22094256400999068, ""scale_pos_weight"": 1.452774242145725, ""subsample"": 0.8718031739892785}",COMPLETE
47,0.5864327347696047,2026-10-01 08:31:25.156623,2026-10-01 08:31:26.208307,0 days 00:00:01.051684,0.8024194884055692,5.956361767917696,0.08559319789319127,2,2,650,uni,stem,0.00119871787728065,0.29931240693435185,1.7289795932080105,0.8235876262743644,0.02246624720090466,,"{""colsample_bytree"": 0.8024194884055692, ""gamma"": 5.956361767917696, ""learning_rate"": 0.08559319789319127, ""max_depth"": 2, ""min_child_weight"": 2, ""n_estimators"": 650, ""ngramas"": ""uni"", ""preprocessing"": ""stem"", ""reg_alpha"": 0.00119871787728065, ""reg_lambda"": 0.29931240693435185, ""scale_pos_weight"": 1.7289795932080105, ""subsample"": 0.8235876262743644}",COMPLETE
48,0.5906452804716972,2026-10-01 08:31:26.217082,2026-10-01 08:31:27.343876,0 days 00:00:01.126794,0.8835179786722868,5.421373862603431,0.06892240323060085,4,3,650,uni,stem,0.00505092302868506,0.24935485446760342,1.968272563119561,0.8601128408857015,0.013185252831749487,,"{""colsample_bytree"": 0.8835179786722868, ""gamma"": 5.421373862603431, ""learning_rate"": 0.06892240323060085, ""max_depth"": 4, ""min_child_weight"": 3, ""n_estimators"": 650, ""ngramas"": ""uni"", ""preprocessing"": ""stem"", ""reg_alpha"": 0.00505092302868506, ""reg_lambda"": 0.24935485446760342, ""scale_pos_weight"": 1.968272563119561, ""subsample"": 0.8601128408857015}",COMPLETE
49,0.5900837740940038,2026-10-01 08:31:27.352777,2026-10-01 08:31:28.407463,0 days 00:00:01.054686,0.8670648107885427,6.958601122632508,0.06827404936181865,2,2,650,uni,stem,0.0012252801185137414,0.5334096494332219,1.6652453300035206,0.8234201726714108,0.021349387235549588,,"{""colsample_bytree"": 0.8670648107885427, ""gamma"": 6.958601122632508, ""learning_rate"": 0.06827404936181865, ""max_depth"": 2, ""min_child_weight"": 2, ""n_estimators"": 650, ""ngramas"": ""uni"", ""preprocessing"": ""stem"", ""reg_alpha"": 0.0012252801185137414, ""reg_lambda"": 0.5334096494332219, ""scale_pos_weight"": 1.6652453300035206, ""subsample"": 0.8234201726714108}",COMPLETE
