number,value,datetime_start,datetime_complete,duration,params_colsample_bytree,params_gamma,params_learning_rate,params_max_depth,params_min_child_weight,params_n_estimators,params_ngramas,params_preprocessing,params_reg_alpha,params_reg_lambda,params_scale_pos_weight,params_subsample,user_attrs_inner_f1_std,system_attrs_fixed_params,system_attrs_tpe:relative_params:0,state
0,0.6148567249163109,2026-10-01 08:45:04.006466,2026-10-01 08:45:04.769157,0 days 00:00:00.762691,0.8198418406640215,5.341713908812194,0.0887371787765412,7,6,200,uni,normal,0.04554056650541418,4.213068640264806,1.369974072661963,0.7976617983906784,0.01468255930869462,"{'preprocessing': 'normal', 'ngramas': 'uni'}",,COMPLETE
1,0.6149466538231653,2026-10-01 08:45:04.773369,2026-10-01 08:45:06.212029,0 days 00:00:01.438660,0.6288831792277916,1.8912060355691782,0.013441428574233813,2,6,300,uni_bi,normal,4.66416811964312,0.42014277058045485,1.4103218373962032,0.774299487233649,0.013703742735421458,"{'preprocessing': 'normal', 'ngramas': 'uni_bi'}",,COMPLETE
2,0.6059131032836085,2026-10-01 08:45:06.216037,2026-10-01 08:45:07.335963,0 days 00:00:01.119926,0.7783824805286792,4.647692781759115,0.09380240737581035,2,2,700,uni,stem,5.507356497854536,1.5120359548651754,1.2664180983936855,0.8498767127525279,0.015954518069344614,"{'preprocessing': 'stem', 'ngramas': 'uni'}",,COMPLETE
3,0.6360709286861171,2026-10-01 08:45:07.338058,2026-10-01 08:45:09.936524,0 days 00:00:02.598466,0.876902389058918,6.087089733274703,0.010322706723101325,3,14,450,uni_bi,stem,0.011717684031659526,0.6802324349708322,1.7896058283592255,0.7797437268432061,0.01950646366374253,"{'preprocessing': 'stem', 'ngramas': 'uni_bi'}",,COMPLETE
4,0.6237827536460537,2026-10-01 08:45:09.939698,2026-10-01 08:45:10.871250,0 days 00:00:00.931552,0.6556314620606654,4.039162506093462,0.016873575773608734,3,7,450,uni,lemma,7.504256880623388,0.2162494779824781,1.7713820826482651,0.5990637928482865,0.015443576343603294,"{'preprocessing': 'lemma', 'ngramas': 'uni'}",,COMPLETE
5,0.6298437026492446,2026-10-01 08:45:10.876045,2026-10-01 08:45:13.371399,0 days 00:00:02.495354,0.7271864354075595,3.3972978559015674,0.016133984942950163,3,10,450,uni_bi,lemma,0.0021821680392635975,1.964160459738051,1.9721075178287282,0.5863050837516292,0.008785820170766718,"{'preprocessing': 'lemma', 'ngramas': 'uni_bi'}",,COMPLETE
6,0.6298787029269626,2026-10-01 08:45:13.374180,2026-10-01 08:45:15.909865,0 days 00:00:02.535685,0.85752939177751,6.155404022548753,0.1607579940959742,3,8,600,uni_bi,lemma,1.2526566980575673,10.537000279658317,1.7222234759503365,0.6820029668160755,0.010097219595310621,,,COMPLETE
7,0.6456161374017088,2026-10-01 08:45:15.913873,2026-10-01 08:45:17.338376,0 days 00:00:01.424503,0.8601252063212457,7.377919063730868,0.12210827548434999,5,3,700,uni,lemma,0.007371130115661973,0.8352981135856257,1.817758235373197,0.7209017875367081,0.008718940862775432,,,COMPLETE
8,0.6127573025051075,2026-10-01 08:45:17.342412,2026-10-01 08:45:18.949131,0 days 00:00:01.606719,0.7201997696938602,6.498456879243526,0.04168099529637218,7,14,600,uni,normal,0.018159474084619286,0.1227925418626537,2.212503455379453,0.7813200368731505,0.008515947196012447,,,COMPLETE
9,0.6081565691351404,2026-10-01 08:45:18.954993,2026-10-01 08:45:20.627957,0 days 00:00:01.672964,0.6915180251981358,7.871813919440823,0.010100839810949176,2,10,350,uni_bi,normal,0.0060253938800961,0.5573606208674275,2.4651397010975105,0.67088362842534,0.00787854667846565,,,COMPLETE
10,0.6166711219440271,2026-10-01 08:45:20.631989,2026-10-01 08:45:21.697923,0 days 00:00:01.065934,0.7127708176932437,4.52867810134917,0.11660343972798515,6,6,450,uni,lemma,0.0011753544225567617,0.4372002937223215,1.8180633258774008,0.6324826771702221,0.011215263093956034,,"{""colsample_bytree"": 0.7127708176932437, ""gamma"": 4.52867810134917, ""learning_rate"": 0.11660343972798515, ""max_depth"": 6, ""min_child_weight"": 6, ""n_estimators"": 450, ""ngramas"": ""uni"", ""preprocessing"": ""lemma"", ""reg_alpha"": 0.0011753544225567617, ""reg_lambda"": 0.4372002937223215, ""scale_pos_weight"": 1.8180633258774008, ""subsample"": 0.6324826771702221}",COMPLETE
11,0.633981173624735,2026-10-01 08:45:21.703962,2026-10-01 08:45:23.046304,0 days 00:00:01.342342,0.8394906056217518,6.5415746949284435,0.03881874073571768,4,9,650,uni,lemma,0.0058227398358545795,3.7931084281618928,1.7081153511338325,0.766304914032787,0.011892552726070269,,"{""colsample_bytree"": 0.8394906056217518, ""gamma"": 6.5415746949284435, ""learning_rate"": 0.03881874073571768, ""max_depth"": 4, ""min_child_weight"": 9, ""n_estimators"": 650, ""ngramas"": ""uni"", ""preprocessing"": ""lemma"", ""reg_alpha"": 0.0058227398358545795, ""reg_lambda"": 3.7931084281618928, ""scale_pos_weight"": 1.7081153511338325, ""subsample"": 0.766304914032787}",COMPLETE
12,0.5965674674970648,2026-10-01 08:45:23.051326,2026-10-01 08:45:24.640914,0 days 00:00:01.589588,0.8870442261778033,7.904097624497543,0.01243567414274844,4,4,700,uni,lemma,0.14013551689444323,1.6642270369407615,1.2931801793813942,0.7017374108793925,0.0072323915254598565,,"{""colsample_bytree"": 0.8870442261778033, ""gamma"": 7.904097624497543, ""learning_rate"": 0.01243567414274844, ""max_depth"": 4, ""min_child_weight"": 4, ""n_estimators"": 700, ""ngramas"": ""uni"", ""preprocessing"": ""lemma"", ""reg_alpha"": 0.14013551689444323, ""reg_lambda"": 1.6642270369407615, ""scale_pos_weight"": 1.2931801793813942, ""subsample"": 0.7017374108793925}",COMPLETE
13,0.6242379583097779,2026-10-01 08:45:24.645425,2026-10-01 08:45:26.089046,0 days 00:00:01.443621,0.860215048204892,6.3623016177365725,0.01667639377147951,4,6,550,uni,lemma,0.008093089042964425,0.20271058789504115,1.4951479909586036,0.7221404602265254,0.016557229598276206,,"{""colsample_bytree"": 0.860215048204892, ""gamma"": 6.3623016177365725, ""learning_rate"": 0.01667639377147951, ""max_depth"": 4, ""min_child_weight"": 6, ""n_estimators"": 550, ""ngramas"": ""uni"", ""preprocessing"": ""lemma"", ""reg_alpha"": 0.008093089042964425, ""reg_lambda"": 0.20271058789504115, ""scale_pos_weight"": 1.4951479909586036, ""subsample"": 0.7221404602265254}",COMPLETE
14,0.6270410239242935,2026-10-01 08:45:26.094078,2026-10-01 08:45:27.392227,0 days 00:00:01.298149,0.8391754409316587,6.929006695362457,0.0541989224594609,5,14,650,uni,lemma,0.028149851178954157,0.7628707268070817,1.6302578625155202,0.7283415333750473,0.014380602221738766,,"{""colsample_bytree"": 0.8391754409316587, ""gamma"": 6.929006695362457, ""learning_rate"": 0.0541989224594609, ""max_depth"": 5, ""min_child_weight"": 14, ""n_estimators"": 650, ""ngramas"": ""uni"", ""preprocessing"": ""lemma"", ""reg_alpha"": 0.028149851178954157, ""reg_lambda"": 0.7628707268070817, ""scale_pos_weight"": 1.6302578625155202, ""subsample"": 0.7283415333750473}",COMPLETE
15,0.6269325709047223,2026-10-01 08:45:27.397227,2026-10-01 08:45:28.639200,0 days 00:00:01.241973,0.815691249631268,6.717630555232324,0.1433718303644327,4,3,600,uni,lemma,0.012596806218540216,1.4673001081953927,2.142395225835671,0.6999581611344581,0.01345162543759204,,"{""colsample_bytree"": 0.815691249631268, ""gamma"": 6.717630555232324, ""learning_rate"": 0.1433718303644327, ""max_depth"": 4, ""min_child_weight"": 3, ""n_estimators"": 600, ""ngramas"": ""uni"", ""preprocessing"": ""lemma"", ""reg_alpha"": 0.012596806218540216, ""reg_lambda"": 1.4673001081953927, ""scale_pos_weight"": 2.142395225835671, ""subsample"": 0.6999581611344581}",COMPLETE
16,0.6382480621148569,2026-10-01 08:45:28.643241,2026-10-01 08:45:30.758353,0 days 00:00:02.115112,0.7884553587057188,6.081035187650987,0.04266907081381617,5,14,450,uni_bi,stem,0.013139750782733328,2.759378066789177,1.6126773523618039,0.728337594776691,0.010482370709314374,,"{""colsample_bytree"": 0.7884553587057188, ""gamma"": 6.081035187650987, ""learning_rate"": 0.04266907081381617, ""max_depth"": 5, ""min_child_weight"": 14, ""n_estimators"": 450, ""ngramas"": ""uni_bi"", ""preprocessing"": ""stem"", ""reg_alpha"": 0.013139750782733328, ""reg_lambda"": 2.759378066789177, ""scale_pos_weight"": 1.6126773523618039, ""subsample"": 0.728337594776691}",COMPLETE
17,0.6192545850954464,2026-10-01 08:45:30.764373,2026-10-01 08:45:32.230635,0 days 00:00:01.466262,0.8880299063584329,6.138393942723247,0.06703466858098692,6,11,650,uni,lemma,0.002755444999911309,0.4236972060711622,2.192553833508298,0.6745473293001879,0.008939969562126565,,"{""colsample_bytree"": 0.8880299063584329, ""gamma"": 6.138393942723247, ""learning_rate"": 0.06703466858098692, ""max_depth"": 6, ""min_child_weight"": 11, ""n_estimators"": 650, ""ngramas"": ""uni"", ""preprocessing"": ""lemma"", ""reg_alpha"": 0.002755444999911309, ""reg_lambda"": 0.4236972060711622, ""scale_pos_weight"": 2.192553833508298, ""subsample"": 0.6745473293001879}",COMPLETE
18,0.6290708997442428,2026-10-01 08:45:32.235674,2026-10-01 08:45:33.312500,0 days 00:00:01.076826,0.8636910039164699,6.466923203928622,0.09577690772958801,4,6,550,uni,stem,0.0011903861639273774,1.395935606126776,1.9225517652422286,0.703266623647748,0.011685006764653083,,"{""colsample_bytree"": 0.8636910039164699, ""gamma"": 6.466923203928622, ""learning_rate"": 0.09577690772958801, ""max_depth"": 4, ""min_child_weight"": 6, ""n_estimators"": 550, ""ngramas"": ""uni"", ""preprocessing"": ""stem"", ""reg_alpha"": 0.0011903861639273774, ""reg_lambda"": 1.395935606126776, ""scale_pos_weight"": 1.9225517652422286, ""subsample"": 0.703266623647748}",COMPLETE
19,0.6225903950259973,2026-10-01 08:45:33.317018,2026-10-01 08:45:35.646552,0 days 00:00:02.329534,0.7321519044212985,6.778292815505368,0.020070475856047758,5,15,500,uni_bi,stem,0.014110017516397908,5.82237432990635,1.5679756005046188,0.6583167116787105,0.01888626366540842,,"{""colsample_bytree"": 0.7321519044212985, ""gamma"": 6.778292815505368, ""learning_rate"": 0.020070475856047758, ""max_depth"": 5, ""min_child_weight"": 15, ""n_estimators"": 500, ""ngramas"": ""uni_bi"", ""preprocessing"": ""stem"", ""reg_alpha"": 0.014110017516397908, ""reg_lambda"": 5.82237432990635, ""scale_pos_weight"": 1.5679756005046188, ""subsample"": 0.6583167116787105}",COMPLETE
20,0.6267147582771028,2026-10-01 08:45:35.652069,2026-10-01 08:45:36.847952,0 days 00:00:01.195883,0.8283907760186306,7.095597359053224,0.08121524556047348,6,8,500,uni,lemma,0.00204899731952761,1.7450809132312315,2.024363136135404,0.6967823168979517,0.011432578240661554,,"{""colsample_bytree"": 0.8283907760186306, ""gamma"": 7.095597359053224, ""learning_rate"": 0.08121524556047348, ""max_depth"": 6, ""min_child_weight"": 8, ""n_estimators"": 500, ""ngramas"": ""uni"", ""preprocessing"": ""lemma"", ""reg_alpha"": 0.00204899731952761, ""reg_lambda"": 1.7450809132312315, ""scale_pos_weight"": 2.024363136135404, ""subsample"": 0.6967823168979517}",COMPLETE
21,0.6301261200256233,2026-10-01 08:45:36.851967,2026-10-01 08:45:39.330854,0 days 00:00:02.478887,0.8673616307524865,5.484813973099975,0.02912186460699137,3,13,500,uni_bi,stem,0.10291151774211203,1.9160636839609537,1.609622655675797,0.7557102656255694,0.015152223235497643,,"{""colsample_bytree"": 0.8673616307524865, ""gamma"": 5.484813973099975, ""learning_rate"": 0.02912186460699137, ""max_depth"": 3, ""min_child_weight"": 13, ""n_estimators"": 500, ""ngramas"": ""uni_bi"", ""preprocessing"": ""stem"", ""reg_alpha"": 0.10291151774211203, ""reg_lambda"": 1.9160636839609537, ""scale_pos_weight"": 1.609622655675797, ""subsample"": 0.7557102656255694}",COMPLETE
22,0.6270112295889825,2026-10-01 08:45:39.335878,2026-10-01 08:45:42.098178,0 days 00:00:02.762300,0.8420277519135866,6.478488075374861,0.015269917195062573,4,14,500,uni_bi,stem,0.04781123951650112,0.6532896230071334,2.0239346512383247,0.6832560339062143,0.021658238547224443,,"{""colsample_bytree"": 0.8420277519135866, ""gamma"": 6.478488075374861, ""learning_rate"": 0.015269917195062573, ""max_depth"": 4, ""min_child_weight"": 14, ""n_estimators"": 500, ""ngramas"": ""uni_bi"", ""preprocessing"": ""stem"", ""reg_alpha"": 0.04781123951650112, ""reg_lambda"": 0.6532896230071334, ""scale_pos_weight"": 2.0239346512383247, ""subsample"": 0.6832560339062143}",COMPLETE
23,0.6334015397558723,2026-10-01 08:45:42.105441,2026-10-01 08:45:43.679815,0 days 00:00:01.574374,0.8260036436746266,7.585932184154134,0.03358131455981104,6,3,700,uni,lemma,0.004272892076284313,1.9055448842969154,2.066282954871249,0.7790149588926498,0.01642723576731944,,"{""colsample_bytree"": 0.8260036436746266, ""gamma"": 7.585932184154134, ""learning_rate"": 0.03358131455981104, ""max_depth"": 6, ""min_child_weight"": 3, ""n_estimators"": 700, ""ngramas"": ""uni"", ""preprocessing"": ""lemma"", ""reg_alpha"": 0.004272892076284313, ""reg_lambda"": 1.9055448842969154, ""scale_pos_weight"": 2.066282954871249, ""subsample"": 0.7790149588926498}",COMPLETE
24,0.633592685171227,2026-10-01 08:45:43.685846,2026-10-01 08:45:46.241958,0 days 00:00:02.556112,0.8732177663483187,6.416620321792042,0.054129087554529984,4,12,550,uni_bi,stem,0.0204034005830102,0.19693131721802237,1.7103368706542237,0.7993853851763071,0.011854565125859633,,"{""colsample_bytree"": 0.8732177663483187, ""gamma"": 6.416620321792042, ""learning_rate"": 0.054129087554529984, ""max_depth"": 4, ""min_child_weight"": 12, ""n_estimators"": 550, ""ngramas"": ""uni_bi"", ""preprocessing"": ""stem"", ""reg_alpha"": 0.0204034005830102, ""reg_lambda"": 0.19693131721802237, ""scale_pos_weight"": 1.7103368706542237, ""subsample"": 0.7993853851763071}",COMPLETE
25,0.6376840992980121,2026-10-01 08:45:46.247968,2026-10-01 08:45:48.227232,0 days 00:00:01.979264,0.8254628935991587,5.385618645793166,0.0139550765252381,3,2,300,uni_bi,stem,0.03029991098299687,0.6832027500924867,2.106830654451989,0.743644699890058,0.013015149846672514,,"{""colsample_bytree"": 0.8254628935991587, ""gamma"": 5.385618645793166, ""learning_rate"": 0.0139550765252381, ""max_depth"": 3, ""min_child_weight"": 2, ""n_estimators"": 300, ""ngramas"": ""uni_bi"", ""preprocessing"": ""stem"", ""reg_alpha"": 0.03029991098299687, ""reg_lambda"": 0.6832027500924867, ""scale_pos_weight"": 2.106830654451989, ""subsample"": 0.743644699890058}",COMPLETE
26,0.6295421953327188,2026-10-01 08:45:48.233778,2026-10-01 08:45:49.928386,0 days 00:00:01.694608,0.8945319577537946,6.871873950789117,0.018592857912180717,3,4,250,uni_bi,stem,0.009556501877134166,2.3051834225161083,2.103946733989623,0.7433076538579352,0.023109466231838502,,"{""colsample_bytree"": 0.8945319577537946, ""gamma"": 6.871873950789117, ""learning_rate"": 0.018592857912180717, ""max_depth"": 3, ""min_child_weight"": 4, ""n_estimators"": 250, ""ngramas"": ""uni_bi"", ""preprocessing"": ""stem"", ""reg_alpha"": 0.009556501877134166, ""reg_lambda"": 2.3051834225161083, ""scale_pos_weight"": 2.103946733989623, ""subsample"": 0.7433076538579352}",COMPLETE
27,0.6296726548598991,2026-10-01 08:45:49.933916,2026-10-01 08:45:51.343596,0 days 00:00:01.409680,0.806875590755568,5.4816214503931056,0.03915936969579819,4,6,200,uni_bi,stem,0.009090069612545614,4.22517028688403,1.8592213663441768,0.7629201928520752,0.0066196469275766915,,"{""colsample_bytree"": 0.806875590755568, ""gamma"": 5.4816214503931056, ""learning_rate"": 0.03915936969579819, ""max_depth"": 4, ""min_child_weight"": 6, ""n_estimators"": 200, ""ngramas"": ""uni_bi"", ""preprocessing"": ""stem"", ""reg_alpha"": 0.009090069612545614, ""reg_lambda"": 4.22517028688403, ""scale_pos_weight"": 1.8592213663441768, ""subsample"": 0.7629201928520752}",COMPLETE
28,0.6379903529139541,2026-10-01 08:45:51.350126,2026-10-01 08:45:52.742612,0 days 00:00:01.392486,0.8484731095490299,7.9449319407724115,0.059534137882408474,7,4,600,uni,lemma,0.0016096919886393712,0.9724370250764727,2.18126316392689,0.6961455370890167,0.02152632281832459,,"{""colsample_bytree"": 0.8484731095490299, ""gamma"": 7.9449319407724115, ""learning_rate"": 0.059534137882408474, ""max_depth"": 7, ""min_child_weight"": 4, ""n_estimators"": 600, ""ngramas"": ""uni"", ""preprocessing"": ""lemma"", ""reg_alpha"": 0.0016096919886393712, ""reg_lambda"": 0.9724370250764727, ""scale_pos_weight"": 2.18126316392689, ""subsample"": 0.6961455370890167}",COMPLETE
29,0.6216437878140558,2026-10-01 08:45:52.749641,2026-10-01 08:45:54.047585,0 days 00:00:01.297944,0.8940607634636368,7.434768231202611,0.1348059764720754,6,5,600,uni,lemma,0.04679843808819125,0.865722696161027,2.4258106205195498,0.7246353270684449,0.008015151888235183,,"{""colsample_bytree"": 0.8940607634636368, ""gamma"": 7.434768231202611, ""learning_rate"": 0.1348059764720754, ""max_depth"": 6, ""min_child_weight"": 5, ""n_estimators"": 600, ""ngramas"": ""uni"", ""preprocessing"": ""lemma"", ""reg_alpha"": 0.04679843808819125, ""reg_lambda"": 0.865722696161027, ""scale_pos_weight"": 2.4258106205195498, ""subsample"": 0.7246353270684449}",COMPLETE
30,0.6186115291913931,2026-10-01 08:45:54.055357,2026-10-01 08:45:55.485668,0 days 00:00:01.430311,0.8113144821108236,6.569922750715849,0.143594204519802,7,4,700,uni,lemma,0.040255750644621814,0.5631002997520733,2.2556695169984384,0.789881830954709,0.017624760300291805,,"{""colsample_bytree"": 0.8113144821108236, ""gamma"": 6.569922750715849, ""learning_rate"": 0.143594204519802, ""max_depth"": 7, ""min_child_weight"": 4, ""n_estimators"": 700, ""ngramas"": ""uni"", ""preprocessing"": ""lemma"", ""reg_alpha"": 0.040255750644621814, ""reg_lambda"": 0.5631002997520733, ""scale_pos_weight"": 2.2556695169984384, ""subsample"": 0.789881830954709}",COMPLETE
31,0.6436048629951673,2026-10-01 08:45:55.492390,2026-10-01 08:45:56.840032,0 days 00:00:01.347642,0.8325263687984615,7.781459766532624,0.07338988242464566,5,4,650,uni,lemma,0.006866743301999456,1.8095768354163364,1.7961439777464285,0.7445346841257576,0.010020020832693127,,"{""colsample_bytree"": 0.8325263687984615, ""gamma"": 7.781459766532624, ""learning_rate"": 0.07338988242464566, ""max_depth"": 5, ""min_child_weight"": 4, ""n_estimators"": 650, ""ngramas"": ""uni"", ""preprocessing"": ""lemma"", ""reg_alpha"": 0.006866743301999456, ""reg_lambda"": 1.8095768354163364, ""scale_pos_weight"": 1.7961439777464285, ""subsample"": 0.7445346841257576}",COMPLETE
32,0.62762931362725,2026-10-01 08:45:56.846545,2026-10-01 08:45:58.092149,0 days 00:00:01.245604,0.7807364750550243,7.911274878076311,0.11554666954651839,5,5,650,uni,lemma,0.004542483408922903,2.3420135400852358,1.4289942832280291,0.7048818938729807,0.001212455925524667,,"{""colsample_bytree"": 0.7807364750550243, ""gamma"": 7.911274878076311, ""learning_rate"": 0.11554666954651839, ""max_depth"": 5, ""min_child_weight"": 5, ""n_estimators"": 650, ""ngramas"": ""uni"", ""preprocessing"": ""lemma"", ""reg_alpha"": 0.004542483408922903, ""reg_lambda"": 2.3420135400852358, ""scale_pos_weight"": 1.4289942832280291, ""subsample"": 0.7048818938729807}",COMPLETE
33,0.6304030634416081,2026-10-01 08:45:58.099691,2026-10-01 08:45:59.509760,0 days 00:00:01.410069,0.8833266370658786,7.598975400931859,0.08178160162027262,7,10,700,uni,lemma,0.04738736565400754,2.938497791668532,1.8228928448227508,0.7613940353205544,0.009140231594851372,,"{""colsample_bytree"": 0.8833266370658786, ""gamma"": 7.598975400931859, ""learning_rate"": 0.08178160162027262, ""max_depth"": 7, ""min_child_weight"": 10, ""n_estimators"": 700, ""ngramas"": ""uni"", ""preprocessing"": ""lemma"", ""reg_alpha"": 0.04738736565400754, ""reg_lambda"": 2.938497791668532, ""scale_pos_weight"": 1.8228928448227508, ""subsample"": 0.7613940353205544}",COMPLETE
34,0.634195697842516,2026-10-01 08:45:59.515793,2026-10-01 08:46:00.963453,0 days 00:00:01.447660,0.884803526743025,5.644405514513236,0.06407606504407051,4,6,650,uni,lemma,0.0029205675324518988,1.0157438136261614,2.180317975807801,0.7644464543057475,0.02131929640296022,,"{""colsample_bytree"": 0.884803526743025, ""gamma"": 5.644405514513236, ""learning_rate"": 0.06407606504407051, ""max_depth"": 4, ""min_child_weight"": 6, ""n_estimators"": 650, ""ngramas"": ""uni"", ""preprocessing"": ""lemma"", ""reg_alpha"": 0.0029205675324518988, ""reg_lambda"": 1.0157438136261614, ""scale_pos_weight"": 2.180317975807801, ""subsample"": 0.7644464543057475}",COMPLETE
35,0.6357001173051198,2026-10-01 08:46:00.971469,2026-10-01 08:46:02.198739,0 days 00:00:01.227270,0.8170805501952693,7.249025791095322,0.19887660604798593,5,2,600,uni,lemma,0.009856432303978088,0.5675226795594064,1.7865109996956883,0.6648044698885984,0.010713758230430855,,"{""colsample_bytree"": 0.8170805501952693, ""gamma"": 7.249025791095322, ""learning_rate"": 0.19887660604798593, ""max_depth"": 5, ""min_child_weight"": 2, ""n_estimators"": 600, ""ngramas"": ""uni"", ""preprocessing"": ""lemma"", ""reg_alpha"": 0.009856432303978088, ""reg_lambda"": 0.5675226795594064, ""scale_pos_weight"": 1.7865109996956883, ""subsample"": 0.6648044698885984}",COMPLETE
36,0.6281826027328162,2026-10-01 08:46:02.207098,2026-10-01 08:46:03.574843,0 days 00:00:01.367745,0.8827239289182434,7.851897110789644,0.0719183968561812,6,3,550,uni,lemma,0.0017649486663562021,0.6756734406193136,2.1724853117520744,0.6722522644322483,0.008715739895138895,,"{""colsample_bytree"": 0.8827239289182434, ""gamma"": 7.851897110789644, ""learning_rate"": 0.0719183968561812, ""max_depth"": 6, ""min_child_weight"": 3, ""n_estimators"": 550, ""ngramas"": ""uni"", ""preprocessing"": ""lemma"", ""reg_alpha"": 0.0017649486663562021, ""reg_lambda"": 0.6756734406193136, ""scale_pos_weight"": 2.1724853117520744, ""subsample"": 0.6722522644322483}",COMPLETE
