number,value,datetime_start,datetime_complete,duration,params_colsample_bytree,params_gamma,params_learning_rate,params_max_depth,params_min_child_weight,params_n_estimators,params_ngramas,params_preprocessing,params_reg_alpha,params_reg_lambda,params_scale_pos_weight,params_subsample,user_attrs_cv_f1_std,system_attrs_fixed_params,system_attrs_tpe:relative_params:0,state
37,0.6171080266864941,2026-10-01 08:48:50.767363,2026-10-01 08:48:52.011100,0 days 00:00:01.243737,0.7181985914215572,2.7528025162111485,0.06232480577260006,4,2,450,uni,lemma,0.00249785239551582,5.853154682329335,1.8212810218517936,0.8462836463360689,0.015000363896883102,,"{""colsample_bytree"": 0.7181985914215572, ""gamma"": 2.7528025162111485, ""learning_rate"": 0.06232480577260006, ""max_depth"": 4, ""min_child_weight"": 2, ""n_estimators"": 450, ""ngramas"": ""uni"", ""preprocessing"": ""lemma"", ""reg_alpha"": 0.00249785239551582, ""reg_lambda"": 5.853154682329335, ""scale_pos_weight"": 1.8212810218517936, ""subsample"": 0.8462836463360689}",COMPLETE
38,0.6134526140503959,2026-10-01 08:48:52.019759,2026-10-01 08:48:53.133901,0 days 00:00:01.114142,0.5841476630009129,3.468982517485694,0.07612123832904479,3,2,550,uni,lemma,0.0032634824885800612,7.4242904624653825,1.723381873617438,0.8836890995811337,0.015446231922070343,,"{""colsample_bytree"": 0.5841476630009129, ""gamma"": 3.468982517485694, ""learning_rate"": 0.07612123832904479, ""max_depth"": 3, ""min_child_weight"": 2, ""n_estimators"": 550, ""ngramas"": ""uni"", ""preprocessing"": ""lemma"", ""reg_alpha"": 0.0032634824885800612, ""reg_lambda"": 7.4242904624653825, ""scale_pos_weight"": 1.723381873617438, ""subsample"": 0.8836890995811337}",COMPLETE
39,0.6004114518234407,2026-10-01 08:48:53.141922,2026-10-01 08:48:54.301640,0 days 00:00:01.159718,0.7038455293866032,2.94083323091083,0.045988646083155116,4,3,450,uni,lemma,0.0024969367251451925,15.883779150909064,1.9152957068296939,0.8756758019979421,0.013949830479061308,,"{""colsample_bytree"": 0.7038455293866032, ""gamma"": 2.94083323091083, ""learning_rate"": 0.045988646083155116, ""max_depth"": 4, ""min_child_weight"": 3, ""n_estimators"": 450, ""ngramas"": ""uni"", ""preprocessing"": ""lemma"", ""reg_alpha"": 0.0024969367251451925, ""reg_lambda"": 15.883779150909064, ""scale_pos_weight"": 1.9152957068296939, ""subsample"": 0.8756758019979421}",COMPLETE
40,0.6126172594128622,2026-10-01 08:48:54.310678,2026-10-01 08:48:55.805708,0 days 00:00:01.495030,0.6866530743605679,1.8510725898575455,0.05660699757040052,4,2,550,uni,lemma,0.0031866425904319685,15.300313021865524,1.8210558641554895,0.862827413846015,0.007423270907533169,,"{""colsample_bytree"": 0.6866530743605679, ""gamma"": 1.8510725898575455, ""learning_rate"": 0.05660699757040052, ""max_depth"": 4, ""min_child_weight"": 2, ""n_estimators"": 550, ""ngramas"": ""uni"", ""preprocessing"": ""lemma"", ""reg_alpha"": 0.0031866425904319685, ""reg_lambda"": 15.300313021865524, ""scale_pos_weight"": 1.8210558641554895, ""subsample"": 0.862827413846015}",COMPLETE
41,0.6062751042520097,2026-10-01 08:48:55.815473,2026-10-01 08:48:57.053549,0 days 00:00:01.238076,0.6777631455236044,2.9045118473962166,0.060249338888920305,4,2,450,uni,lemma,0.004670251797792483,4.647687839052764,1.9184649135112584,0.8551518731679209,0.015858791138595566,,"{""colsample_bytree"": 0.6777631455236044, ""gamma"": 2.9045118473962166, ""learning_rate"": 0.060249338888920305, ""max_depth"": 4, ""min_child_weight"": 2, ""n_estimators"": 450, ""ngramas"": ""uni"", ""preprocessing"": ""lemma"", ""reg_alpha"": 0.004670251797792483, ""reg_lambda"": 4.647687839052764, ""scale_pos_weight"": 1.9184649135112584, ""subsample"": 0.8551518731679209}",COMPLETE
42,0.6116030417137581,2026-10-01 08:48:57.062073,2026-10-01 08:48:58.056109,0 days 00:00:00.994036,0.5407953540461456,2.875280412391648,0.07463351475647044,3,3,500,uni,lemma,0.001056159677520228,10.755286066657785,1.7201856691603257,0.8479264956657697,0.013196262458340637,,"{""colsample_bytree"": 0.5407953540461456, ""gamma"": 2.875280412391648, ""learning_rate"": 0.07463351475647044, ""max_depth"": 3, ""min_child_weight"": 3, ""n_estimators"": 500, ""ngramas"": ""uni"", ""preprocessing"": ""lemma"", ""reg_alpha"": 0.001056159677520228, ""reg_lambda"": 10.755286066657785, ""scale_pos_weight"": 1.7201856691603257, ""subsample"": 0.8479264956657697}",COMPLETE
43,0.6028562703547422,2026-10-01 08:48:58.065717,2026-10-01 08:48:59.018001,0 days 00:00:00.952284,0.5845029342791165,3.87802666842132,0.07157945965114057,4,3,450,uni,lemma,0.005019083286272097,8.230455985332451,1.8389209542196814,0.8159064245454022,0.01239756831998683,,"{""colsample_bytree"": 0.5845029342791165, ""gamma"": 3.87802666842132, ""learning_rate"": 0.07157945965114057, ""max_depth"": 4, ""min_child_weight"": 3, ""n_estimators"": 450, ""ngramas"": ""uni"", ""preprocessing"": ""lemma"", ""reg_alpha"": 0.005019083286272097, ""reg_lambda"": 8.230455985332451, ""scale_pos_weight"": 1.8389209542196814, ""subsample"": 0.8159064245454022}",COMPLETE
44,0.6068358572701468,2026-10-01 08:48:59.026016,2026-10-01 08:49:00.143794,0 days 00:00:01.117778,0.5330306619267228,3.8348183044339543,0.045964782347042266,4,3,500,uni,lemma,0.0013122731359259735,4.176891881805758,1.8368745855406434,0.7730644215373855,0.022008087673693916,,"{""colsample_bytree"": 0.5330306619267228, ""gamma"": 3.8348183044339543, ""learning_rate"": 0.045964782347042266, ""max_depth"": 4, ""min_child_weight"": 3, ""n_estimators"": 500, ""ngramas"": ""uni"", ""preprocessing"": ""lemma"", ""reg_alpha"": 0.0013122731359259735, ""reg_lambda"": 4.176891881805758, ""scale_pos_weight"": 1.8368745855406434, ""subsample"": 0.7730644215373855}",COMPLETE
45,0.6089295750068454,2026-10-01 08:49:00.153385,2026-10-01 08:49:01.431152,0 days 00:00:01.277767,0.7228835612395217,2.6719024965434115,0.05623214654679999,4,4,500,uni,lemma,0.0010652715834122638,5.429201772844966,1.6459647673422804,0.8298414647588449,0.006842583152056127,,"{""colsample_bytree"": 0.7228835612395217, ""gamma"": 2.6719024965434115, ""learning_rate"": 0.05623214654679999, ""max_depth"": 4, ""min_child_weight"": 4, ""n_estimators"": 500, ""ngramas"": ""uni"", ""preprocessing"": ""lemma"", ""reg_alpha"": 0.0010652715834122638, ""reg_lambda"": 5.429201772844966, ""scale_pos_weight"": 1.6459647673422804, ""subsample"": 0.8298414647588449}",COMPLETE
46,0.6009441330753693,2026-10-01 08:49:01.441369,2026-10-01 08:49:02.540871,0 days 00:00:01.099502,0.5751663037951305,3.470828729921541,0.05338541837615603,4,3,550,uni,lemma,0.0012378252612984119,7.974356470026672,1.541176754427362,0.8717976000357448,0.02278020161635045,,"{""colsample_bytree"": 0.5751663037951305, ""gamma"": 3.470828729921541, ""learning_rate"": 0.05338541837615603, ""max_depth"": 4, ""min_child_weight"": 3, ""n_estimators"": 550, ""ngramas"": ""uni"", ""preprocessing"": ""lemma"", ""reg_alpha"": 0.0012378252612984119, ""reg_lambda"": 7.974356470026672, ""scale_pos_weight"": 1.541176754427362, ""subsample"": 0.8717976000357448}",COMPLETE
47,0.6209517628876063,2026-10-01 08:49:02.549110,2026-10-01 08:49:03.724670,0 days 00:00:01.175560,0.7255821550251189,2.136353897655443,0.07667732541649683,5,2,400,uni,lemma,0.0031500629506197213,4.902160851392887,1.6361660984833089,0.8469710880946255,0.008638117819710082,,"{""colsample_bytree"": 0.7255821550251189, ""gamma"": 2.136353897655443, ""learning_rate"": 0.07667732541649683, ""max_depth"": 5, ""min_child_weight"": 2, ""n_estimators"": 400, ""ngramas"": ""uni"", ""preprocessing"": ""lemma"", ""reg_alpha"": 0.0031500629506197213, ""reg_lambda"": 4.902160851392887, ""scale_pos_weight"": 1.6361660984833089, ""subsample"": 0.8469710880946255}",COMPLETE
48,0.616283458024974,2026-10-01 08:49:03.733456,2026-10-01 08:49:05.082734,0 days 00:00:01.349278,0.5846476834558152,1.7265643101251973,0.07152701534408375,3,3,600,uni,lemma,0.0016740332434228289,3.501144385035897,1.6403408943436952,0.8571051969699895,0.017431064463314185,,"{""colsample_bytree"": 0.5846476834558152, ""gamma"": 1.7265643101251973, ""learning_rate"": 0.07152701534408375, ""max_depth"": 3, ""min_child_weight"": 3, ""n_estimators"": 600, ""ngramas"": ""uni"", ""preprocessing"": ""lemma"", ""reg_alpha"": 0.0016740332434228289, ""reg_lambda"": 3.501144385035897, ""scale_pos_weight"": 1.6403408943436952, ""subsample"": 0.8571051969699895}",COMPLETE
49,0.6021142411794014,2026-10-01 08:49:05.091527,2026-10-01 08:49:06.480276,0 days 00:00:01.388749,0.5941182451093245,1.204643361363972,0.07160431979294303,3,4,600,uni,lemma,0.002467347958659059,3.207175429106365,1.888943180007514,0.8631730048785591,0.018039741448689008,,"{""colsample_bytree"": 0.5941182451093245, ""gamma"": 1.204643361363972, ""learning_rate"": 0.07160431979294303, ""max_depth"": 3, ""min_child_weight"": 4, ""n_estimators"": 600, ""ngramas"": ""uni"", ""preprocessing"": ""lemma"", ""reg_alpha"": 0.002467347958659059, ""reg_lambda"": 3.207175429106365, ""scale_pos_weight"": 1.888943180007514, ""subsample"": 0.8631730048785591}",COMPLETE
