number,value,datetime_start,datetime_complete,duration,params_colsample_bytree,params_gamma,params_learning_rate,params_max_depth,params_min_child_weight,params_n_estimators,params_ngramas,params_preprocessing,params_reg_alpha,params_reg_lambda,params_scale_pos_weight,params_subsample,user_attrs_inner_f1_std,system_attrs_fixed_params,system_attrs_tpe:relative_params:0,state
37,0.6312368683880445,2026-10-01 08:46:03.582122,2026-10-01 08:46:04.773883,0 days 00:00:01.191761,0.8528980030841944,7.379429490784333,0.11221261282513544,5,3,550,uni,lemma,0.009188389548775296,1.0181100858805485,1.8281529611049245,0.7920310574981915,0.003729560238804168,,"{""colsample_bytree"": 0.8528980030841944, ""gamma"": 7.379429490784333, ""learning_rate"": 0.11221261282513544, ""max_depth"": 5, ""min_child_weight"": 3, ""n_estimators"": 550, ""ngramas"": ""uni"", ""preprocessing"": ""lemma"", ""reg_alpha"": 0.009188389548775296, ""reg_lambda"": 1.0181100858805485, ""scale_pos_weight"": 1.8281529611049245, ""subsample"": 0.7920310574981915}",COMPLETE
38,0.6370572449727013,2026-10-01 08:46:04.780252,2026-10-01 08:46:06.223964,0 days 00:00:01.443712,0.8515876856453285,6.368476528463986,0.0363750724989261,7,4,550,uni,lemma,0.0020991829596630593,0.8109626632206638,1.9117942169149515,0.706834799549021,0.015035042133177183,,"{""colsample_bytree"": 0.8515876856453285, ""gamma"": 6.368476528463986, ""learning_rate"": 0.0363750724989261, ""max_depth"": 7, ""min_child_weight"": 4, ""n_estimators"": 550, ""ngramas"": ""uni"", ""preprocessing"": ""lemma"", ""reg_alpha"": 0.0020991829596630593, ""reg_lambda"": 0.8109626632206638, ""scale_pos_weight"": 1.9117942169149515, ""subsample"": 0.706834799549021}",COMPLETE
39,0.6227164938044739,2026-10-01 08:46:06.231228,2026-10-01 08:46:07.676359,0 days 00:00:01.445131,0.8732827920340976,7.370832501353339,0.158763606433976,5,2,700,uni,lemma,0.028433374025389913,0.5853465266755403,2.21854954007504,0.7973860158618407,0.0029438425397849168,,"{""colsample_bytree"": 0.8732827920340976, ""gamma"": 7.370832501353339, ""learning_rate"": 0.158763606433976, ""max_depth"": 5, ""min_child_weight"": 2, ""n_estimators"": 700, ""ngramas"": ""uni"", ""preprocessing"": ""lemma"", ""reg_alpha"": 0.028433374025389913, ""reg_lambda"": 0.5853465266755403, ""scale_pos_weight"": 2.21854954007504, ""subsample"": 0.7973860158618407}",COMPLETE
40,0.6318110329970522,2026-10-01 08:46:07.683890,2026-10-01 08:46:09.143550,0 days 00:00:01.459660,0.8677532077578766,6.290766566871792,0.11574457729499965,4,2,650,uni,lemma,0.02396252574814523,0.9227875695262644,2.110141126317537,0.6762761683624067,0.003895633750558717,,"{""colsample_bytree"": 0.8677532077578766, ""gamma"": 6.290766566871792, ""learning_rate"": 0.11574457729499965, ""max_depth"": 4, ""min_child_weight"": 2, ""n_estimators"": 650, ""ngramas"": ""uni"", ""preprocessing"": ""lemma"", ""reg_alpha"": 0.02396252574814523, ""reg_lambda"": 0.9227875695262644, ""scale_pos_weight"": 2.110141126317537, ""subsample"": 0.6762761683624067}",COMPLETE
41,0.6276026640574028,2026-10-01 08:46:09.152087,2026-10-01 08:46:10.272126,0 days 00:00:01.120039,0.868505601819235,6.437575059431699,0.07512718631022026,6,5,450,uni,lemma,0.001298774852053358,1.2061647427778062,2.1211273514081106,0.6349276375891632,0.02162953142887769,,"{""colsample_bytree"": 0.868505601819235, ""gamma"": 6.437575059431699, ""learning_rate"": 0.07512718631022026, ""max_depth"": 6, ""min_child_weight"": 5, ""n_estimators"": 450, ""ngramas"": ""uni"", ""preprocessing"": ""lemma"", ""reg_alpha"": 0.001298774852053358, ""reg_lambda"": 1.2061647427778062, ""scale_pos_weight"": 2.1211273514081106, ""subsample"": 0.6349276375891632}",COMPLETE
42,0.6367060083554122,2026-10-01 08:46:10.277007,2026-10-01 08:46:11.611377,0 days 00:00:01.334370,0.7771488478933781,7.158773289568816,0.11791451074089246,6,3,650,uni,lemma,0.002517165088344064,1.2620755417570175,2.091025085955976,0.6923439183076346,0.017781305067384984,,"{""colsample_bytree"": 0.7771488478933781, ""gamma"": 7.158773289568816, ""learning_rate"": 0.11791451074089246, ""max_depth"": 6, ""min_child_weight"": 3, ""n_estimators"": 650, ""ngramas"": ""uni"", ""preprocessing"": ""lemma"", ""reg_alpha"": 0.002517165088344064, ""reg_lambda"": 1.2620755417570175, ""scale_pos_weight"": 2.091025085955976, ""subsample"": 0.6923439183076346}",COMPLETE
43,0.6344253936881081,2026-10-01 08:46:11.619390,2026-10-01 08:46:12.900232,0 days 00:00:01.280842,0.8414164665472073,7.4049731338765135,0.06692933481349006,5,4,550,uni,lemma,0.00468617708246856,1.0919025973063472,2.2610741397121923,0.6535034280025454,0.020055497811948833,,"{""colsample_bytree"": 0.8414164665472073, ""gamma"": 7.4049731338765135, ""learning_rate"": 0.06692933481349006, ""max_depth"": 5, ""min_child_weight"": 4, ""n_estimators"": 550, ""ngramas"": ""uni"", ""preprocessing"": ""lemma"", ""reg_alpha"": 0.00468617708246856, ""reg_lambda"": 1.0919025973063472, ""scale_pos_weight"": 2.2610741397121923, ""subsample"": 0.6535034280025454}",COMPLETE
44,0.6363845446379714,2026-10-01 08:46:12.907935,2026-10-01 08:46:14.216607,0 days 00:00:01.308672,0.7961279487156115,7.374586269386174,0.06068042123407443,6,12,650,uni,lemma,0.00704863565257817,2.376642787392307,1.6788102535482914,0.7406000599059641,0.006410724340145409,,"{""colsample_bytree"": 0.7961279487156115, ""gamma"": 7.374586269386174, ""learning_rate"": 0.06068042123407443, ""max_depth"": 6, ""min_child_weight"": 12, ""n_estimators"": 650, ""ngramas"": ""uni"", ""preprocessing"": ""lemma"", ""reg_alpha"": 0.00704863565257817, ""reg_lambda"": 2.376642787392307, ""scale_pos_weight"": 1.6788102535482914, ""subsample"": 0.7406000599059641}",COMPLETE
45,0.6315614942725547,2026-10-01 08:46:14.226576,2026-10-01 08:46:15.631738,0 days 00:00:01.405162,0.8777130830540116,6.868683910411486,0.11875407701870515,5,2,650,uni,lemma,0.0022357295295728935,0.623785240102753,1.9094683008243862,0.7077641508103566,0.0029558027800430536,,"{""colsample_bytree"": 0.8777130830540116, ""gamma"": 6.868683910411486, ""learning_rate"": 0.11875407701870515, ""max_depth"": 5, ""min_child_weight"": 2, ""n_estimators"": 650, ""ngramas"": ""uni"", ""preprocessing"": ""lemma"", ""reg_alpha"": 0.0022357295295728935, ""reg_lambda"": 0.623785240102753, ""scale_pos_weight"": 1.9094683008243862, ""subsample"": 0.7077641508103566}",COMPLETE
46,0.6267957478506982,2026-10-01 08:46:15.641438,2026-10-01 08:46:16.866743,0 days 00:00:01.225305,0.8557967652466141,7.538338586187047,0.07924122229794452,6,5,550,uni,lemma,0.0015628885639946443,1.4335595283124614,2.3196873700786744,0.6854063333288868,0.018821141032630894,,"{""colsample_bytree"": 0.8557967652466141, ""gamma"": 7.538338586187047, ""learning_rate"": 0.07924122229794452, ""max_depth"": 6, ""min_child_weight"": 5, ""n_estimators"": 550, ""ngramas"": ""uni"", ""preprocessing"": ""lemma"", ""reg_alpha"": 0.0015628885639946443, ""reg_lambda"": 1.4335595283124614, ""scale_pos_weight"": 2.3196873700786744, ""subsample"": 0.6854063333288868}",COMPLETE
47,0.6393829710734074,2026-10-01 08:46:16.876364,2026-10-01 08:46:18.341210,0 days 00:00:01.464846,0.873009533812613,7.573088039628415,0.05719576702878059,6,2,650,uni,lemma,0.0032721680495319296,0.9096758128703001,1.8318022630242128,0.7106665502901461,0.004282330001381675,,"{""colsample_bytree"": 0.873009533812613, ""gamma"": 7.573088039628415, ""learning_rate"": 0.05719576702878059, ""max_depth"": 6, ""min_child_weight"": 2, ""n_estimators"": 650, ""ngramas"": ""uni"", ""preprocessing"": ""lemma"", ""reg_alpha"": 0.0032721680495319296, ""reg_lambda"": 0.9096758128703001, ""scale_pos_weight"": 1.8318022630242128, ""subsample"": 0.7106665502901461}",COMPLETE
48,0.6368273004571348,2026-10-01 08:46:18.348531,2026-10-01 08:46:19.837986,0 days 00:00:01.489455,0.830918534366685,6.557512608066345,0.12446906651009133,5,2,700,uni,lemma,0.023487090016901236,1.6053838751085328,1.9775074897547518,0.7258081916645833,0.015468128502531665,,"{""colsample_bytree"": 0.830918534366685, ""gamma"": 6.557512608066345, ""learning_rate"": 0.12446906651009133, ""max_depth"": 5, ""min_child_weight"": 2, ""n_estimators"": 700, ""ngramas"": ""uni"", ""preprocessing"": ""lemma"", ""reg_alpha"": 0.023487090016901236, ""reg_lambda"": 1.6053838751085328, ""scale_pos_weight"": 1.9775074897547518, ""subsample"": 0.7258081916645833}",COMPLETE
49,0.6296348188869171,2026-10-01 08:46:19.846981,2026-10-01 08:46:21.222034,0 days 00:00:01.375053,0.89570550751778,7.977414173911589,0.1609673225443303,5,4,650,uni,lemma,0.008683526301608168,0.9245216850309547,1.8683453973234914,0.7492990533141427,0.008445672384765696,,"{""colsample_bytree"": 0.89570550751778, ""gamma"": 7.977414173911589, ""learning_rate"": 0.1609673225443303, ""max_depth"": 5, ""min_child_weight"": 4, ""n_estimators"": 650, ""ngramas"": ""uni"", ""preprocessing"": ""lemma"", ""reg_alpha"": 0.008683526301608168, ""reg_lambda"": 0.9245216850309547, ""scale_pos_weight"": 1.8683453973234914, ""subsample"": 0.7492990533141427}",COMPLETE
