number,value,datetime_start,datetime_complete,duration,params_colsample_bytree,params_gamma,params_learning_rate,params_max_depth,params_min_child_weight,params_n_estimators,params_ngramas,params_preprocessing,params_reg_alpha,params_reg_lambda,params_scale_pos_weight,params_subsample,user_attrs_cv_f1_std,system_attrs_fixed_params,system_attrs_tpe:relative_params:0,state
0,0.5688748183636079,2026-10-01 08:48:01.149614,2026-10-01 08:48:02.322281,0 days 00:00:01.172667,0.562397808134481,0.9356270912614959,0.08960785365368121,7,10,350,uni,normal,2.9154431891537547,2.416482602989751,2.0621088666940683,0.6046065241548528,0.01741710883237699,"{'preprocessing': 'normal', 'ngramas': 'uni'}",,COMPLETE
1,0.5879258445563892,2026-10-01 08:48:02.326286,2026-10-01 08:48:03.337902,0 days 00:00:01.011616,0.5733618039413735,2.781816822196533,0.12106896936002161,7,4,150,uni_bi,normal,0.12561043700013558,0.9860942908083906,1.4368437102970628,0.6136387385224853,0.016036670557709763,"{'preprocessing': 'normal', 'ngramas': 'uni_bi'}",,COMPLETE
2,0.5590156038060096,2026-10-01 08:48:03.341910,2026-10-01 08:48:04.367855,0 days 00:00:01.025945,0.8140703845572055,1.997553366187698,0.023993242906812727,2,7,500,uni,stem,0.11400863701127326,2.3076168040117313,1.0696756190799965,0.7096244944759627,0.023201326196792597,"{'preprocessing': 'stem', 'ngramas': 'uni'}",,COMPLETE
3,0.5909869113274693,2026-10-01 08:48:04.369858,2026-10-01 08:48:07.311917,0 days 00:00:02.942059,0.8233589392465845,2.78460326880028,0.012151617026673379,3,15,500,uni_bi,stem,0.002458603276328005,3.753537145233125,1.6602287406094018,0.8879712115760958,0.026847354192410973,"{'preprocessing': 'stem', 'ngramas': 'uni_bi'}",,COMPLETE
4,0.5566039875700196,2026-10-01 08:48:07.315476,2026-10-01 08:48:08.014997,0 days 00:00:00.699521,0.7650089137415927,2.837833070670582,0.011085122517311707,4,14,200,uni,lemma,0.12030178871154672,1.811326544803338,1.2772816832882905,0.640572993560006,0.02528826339913147,"{'preprocessing': 'lemma', 'ngramas': 'uni'}",,COMPLETE
5,0.5682408479039807,2026-10-01 08:48:08.017510,2026-10-01 08:48:12.715347,0 days 00:00:04.697837,0.8687496940092467,1.1636937653893962,0.16684619386293467,6,14,700,uni_bi,lemma,0.006080390190296602,0.12707770074499689,1.4879954961448965,0.7592649925838798,0.02284907329515791,"{'preprocessing': 'lemma', 'ngramas': 'uni_bi'}",,COMPLETE
6,0.602356269609912,2026-10-01 08:48:12.719389,2026-10-01 08:48:13.783687,0 days 00:00:01.064298,0.808897907718663,1.9903676115062932,0.11058146376563001,2,3,450,uni,lemma,0.0010521761868451127,7.52317574354701,2.0602860157714256,0.8954104278101811,0.02210664477322399,,,COMPLETE
7,0.5987724066461678,2026-10-01 08:48:13.787700,2026-10-01 08:48:14.957784,0 days 00:00:01.170084,0.6300733288106988,5.97204633753548,0.026946865572417687,5,2,650,uni,stem,0.35500125258511606,11.00279783199859,1.7083223877429239,0.6588438126004819,0.02549121637173641,,,COMPLETE
8,0.5708205380338457,2026-10-01 08:48:14.961791,2026-10-01 08:48:17.174345,0 days 00:00:02.212554,0.5125716742746937,5.273078084478353,0.035995125264172326,5,2,400,uni_bi,lemma,0.018089390092767135,1.4799137841422207,2.3613497108891393,0.5877619994476566,0.012108495193842276,,,COMPLETE
9,0.6012973627555634,2026-10-01 08:48:17.178352,2026-10-01 08:48:17.866383,0 days 00:00:00.688031,0.848584236075087,6.527540576743358,0.16201847221720986,2,13,300,uni,lemma,0.005575453980775369,11.31892099052994,1.8090133628734761,0.7716913147786483,0.011494807049314482,,,COMPLETE
10,0.5833223518067131,2026-10-01 08:48:17.870390,2026-10-01 08:48:18.916037,0 days 00:00:01.045647,0.549006091067332,4.311700058458666,0.12894152652338936,3,4,600,uni,lemma,0.030955323601318526,16.531268589677858,2.203299802270258,0.7324731388122427,0.00937304699035589,,"{""colsample_bytree"": 0.549006091067332, ""gamma"": 4.311700058458666, ""learning_rate"": 0.12894152652338936, ""max_depth"": 3, ""min_child_weight"": 4, ""n_estimators"": 600, ""ngramas"": ""uni"", ""preprocessing"": ""lemma"", ""reg_alpha"": 0.030955323601318526, ""reg_lambda"": 16.531268589677858, ""scale_pos_weight"": 2.203299802270258, ""subsample"": 0.7324731388122427}",COMPLETE
11,0.5546631974496595,2026-10-01 08:48:18.920069,2026-10-01 08:48:20.090693,0 days 00:00:01.170624,0.8105899240090099,4.510596862103277,0.15448240672452201,3,15,600,uni,lemma,0.0018434060404597635,6.615394303414723,2.229764959979931,0.8339100906050897,0.014722503652193736,,"{""colsample_bytree"": 0.8105899240090099, ""gamma"": 4.510596862103277, ""learning_rate"": 0.15448240672452201, ""max_depth"": 3, ""min_child_weight"": 15, ""n_estimators"": 600, ""ngramas"": ""uni"", ""preprocessing"": ""lemma"", ""reg_alpha"": 0.0018434060404597635, ""reg_lambda"": 6.615394303414723, ""scale_pos_weight"": 2.229764959979931, ""subsample"": 0.8339100906050897}",COMPLETE
12,0.5792781421988459,2026-10-01 08:48:20.094699,2026-10-01 08:48:21.052489,0 days 00:00:00.957790,0.8799221148974624,2.8292218422783937,0.12977410952619342,2,12,400,uni,lemma,0.001212942311619249,1.176475217804506,1.8659810800738053,0.8736687159779204,0.009793231007594275,,"{""colsample_bytree"": 0.8799221148974624, ""gamma"": 2.8292218422783937, ""learning_rate"": 0.12977410952619342, ""max_depth"": 2, ""min_child_weight"": 12, ""n_estimators"": 400, ""ngramas"": ""uni"", ""preprocessing"": ""lemma"", ""reg_alpha"": 0.001212942311619249, ""reg_lambda"": 1.176475217804506, ""scale_pos_weight"": 1.8659810800738053, ""subsample"": 0.8736687159779204}",COMPLETE
13,0.5326750233214632,2026-10-01 08:48:21.057005,2026-10-01 08:48:21.956998,0 days 00:00:00.899993,0.7721722401642647,7.61394875897124,0.0942625997566881,2,11,450,uni,lemma,0.02066515473248254,18.766278483035,2.3372795368896675,0.8212820742194681,0.009441946999910378,,"{""colsample_bytree"": 0.7721722401642647, ""gamma"": 7.61394875897124, ""learning_rate"": 0.0942625997566881, ""max_depth"": 2, ""min_child_weight"": 11, ""n_estimators"": 450, ""ngramas"": ""uni"", ""preprocessing"": ""lemma"", ""reg_alpha"": 0.02066515473248254, ""reg_lambda"": 18.766278483035, ""scale_pos_weight"": 2.3372795368896675, ""subsample"": 0.8212820742194681}",COMPLETE
14,0.6023712483419911,2026-10-01 08:48:21.961004,2026-10-01 08:48:23.010666,0 days 00:00:01.049662,0.7976471057953635,3.5220182653139256,0.07188712314657049,2,2,450,uni,lemma,0.0026788207258443665,3.652477055269706,1.875169691075774,0.8689842127354592,0.014134233654671995,,"{""colsample_bytree"": 0.7976471057953635, ""gamma"": 3.5220182653139256, ""learning_rate"": 0.07188712314657049, ""max_depth"": 2, ""min_child_weight"": 2, ""n_estimators"": 450, ""ngramas"": ""uni"", ""preprocessing"": ""lemma"", ""reg_alpha"": 0.0026788207258443665, ""reg_lambda"": 3.652477055269706, ""scale_pos_weight"": 1.875169691075774, ""subsample"": 0.8689842127354592}",COMPLETE
15,0.5972938549459279,2026-10-01 08:48:23.016576,2026-10-01 08:48:23.914032,0 days 00:00:00.897456,0.8478530443665171,1.7712393471710839,0.19063687378611963,2,5,350,uni,lemma,0.003860999371595279,9.435089822059181,2.029713169325291,0.8584649396310889,0.008352831185246068,,"{""colsample_bytree"": 0.8478530443665171, ""gamma"": 1.7712393471710839, ""learning_rate"": 0.19063687378611963, ""max_depth"": 2, ""min_child_weight"": 5, ""n_estimators"": 350, ""ngramas"": ""uni"", ""preprocessing"": ""lemma"", ""reg_alpha"": 0.003860999371595279, ""reg_lambda"": 9.435089822059181, ""scale_pos_weight"": 2.029713169325291, ""subsample"": 0.8584649396310889}",COMPLETE
16,0.5919663886709033,2026-10-01 08:48:23.919328,2026-10-01 08:48:25.387632,0 days 00:00:01.468304,0.8142406129059679,2.3376545609100816,0.0834790377199927,2,7,700,uni,lemma,0.0015937357466699323,7.247688186154021,1.8597213394964667,0.7918835151980855,0.014148221186285767,,"{""colsample_bytree"": 0.8142406129059679, ""gamma"": 2.3376545609100816, ""learning_rate"": 0.0834790377199927, ""max_depth"": 2, ""min_child_weight"": 7, ""n_estimators"": 700, ""ngramas"": ""uni"", ""preprocessing"": ""lemma"", ""reg_alpha"": 0.0015937357466699323, ""reg_lambda"": 7.247688186154021, ""scale_pos_weight"": 1.8597213394964667, ""subsample"": 0.7918835151980855}",COMPLETE
17,0.6001814171822234,2026-10-01 08:48:25.391639,2026-10-01 08:48:26.581723,0 days 00:00:01.190084,0.8138150082193883,2.544913137019268,0.1461654449125388,3,6,500,uni,lemma,0.015030704948114228,2.4679770758649635,1.7475105541276257,0.8408202824334053,0.01288215758453761,,"{""colsample_bytree"": 0.8138150082193883, ""gamma"": 2.544913137019268, ""learning_rate"": 0.1461654449125388, ""max_depth"": 3, ""min_child_weight"": 6, ""n_estimators"": 500, ""ngramas"": ""uni"", ""preprocessing"": ""lemma"", ""reg_alpha"": 0.015030704948114228, ""reg_lambda"": 2.4679770758649635, ""scale_pos_weight"": 1.7475105541276257, ""subsample"": 0.8408202824334053}",COMPLETE
18,0.5880616293633167,2026-10-01 08:48:26.588254,2026-10-01 08:48:27.803795,0 days 00:00:01.215541,0.8936571329279718,3.017929533698667,0.07415605908489473,3,6,500,uni,lemma,0.04479191265265131,7.024122500620019,2.005060767632289,0.8486926399769601,0.009160847053923869,,"{""colsample_bytree"": 0.8936571329279718, ""gamma"": 3.017929533698667, ""learning_rate"": 0.07415605908489473, ""max_depth"": 3, ""min_child_weight"": 6, ""n_estimators"": 500, ""ngramas"": ""uni"", ""preprocessing"": ""lemma"", ""reg_alpha"": 0.04479191265265131, ""reg_lambda"": 7.024122500620019, ""scale_pos_weight"": 2.005060767632289, ""subsample"": 0.8486926399769601}",COMPLETE
19,0.613926303927097,2026-10-01 08:48:27.810817,2026-10-01 08:48:29.021225,0 days 00:00:01.210408,0.6848346043111121,3.2861495673117664,0.04584524850126149,3,2,500,uni,lemma,0.001319891914063735,4.181742951905691,1.7747477401501415,0.8484467937144328,0.00771090388653897,,"{""colsample_bytree"": 0.6848346043111121, ""gamma"": 3.2861495673117664, ""learning_rate"": 0.04584524850126149, ""max_depth"": 3, ""min_child_weight"": 2, ""n_estimators"": 500, ""ngramas"": ""uni"", ""preprocessing"": ""lemma"", ""reg_alpha"": 0.001319891914063735, ""reg_lambda"": 4.181742951905691, ""scale_pos_weight"": 1.7747477401501415, ""subsample"": 0.8484467937144328}",COMPLETE
20,0.5880005226711896,2026-10-01 08:48:29.027237,2026-10-01 08:48:29.965361,0 days 00:00:00.938124,0.5961029645142213,2.147421348559321,0.025452589844736206,3,3,350,uni,lemma,0.012259987100751995,2.3022961260998893,2.008197170951489,0.8761608875811232,0.012139807620657313,,"{""colsample_bytree"": 0.5961029645142213, ""gamma"": 2.147421348559321, ""learning_rate"": 0.025452589844736206, ""max_depth"": 3, ""min_child_weight"": 3, ""n_estimators"": 350, ""ngramas"": ""uni"", ""preprocessing"": ""lemma"", ""reg_alpha"": 0.012259987100751995, ""reg_lambda"": 2.3022961260998893, ""scale_pos_weight"": 2.008197170951489, ""subsample"": 0.8761608875811232}",COMPLETE
21,0.6127432783141101,2026-10-01 08:48:29.970360,2026-10-01 08:48:31.172631,0 days 00:00:01.202271,0.5648082994305249,3.2877800053834636,0.04845563186588829,4,2,500,uni,lemma,0.0015167437392825784,4.052502815778806,1.6283837252242752,0.8386882075760965,0.006146081973978428,,"{""colsample_bytree"": 0.5648082994305249, ""gamma"": 3.2877800053834636, ""learning_rate"": 0.04845563186588829, ""max_depth"": 4, ""min_child_weight"": 2, ""n_estimators"": 500, ""ngramas"": ""uni"", ""preprocessing"": ""lemma"", ""reg_alpha"": 0.0015167437392825784, ""reg_lambda"": 4.052502815778806, ""scale_pos_weight"": 1.6283837252242752, ""subsample"": 0.8386882075760965}",COMPLETE
22,0.6050204313985393,2026-10-01 08:48:31.178640,2026-10-01 08:48:32.740079,0 days 00:00:01.561439,0.647575662126083,1.9560431222545511,0.05826412995990898,4,5,600,uni,lemma,0.0010299583571626526,2.5026364749129835,1.9262315106478776,0.896058592675892,0.022545495843368457,,"{""colsample_bytree"": 0.647575662126083, ""gamma"": 1.9560431222545511, ""learning_rate"": 0.05826412995990898, ""max_depth"": 4, ""min_child_weight"": 5, ""n_estimators"": 600, ""ngramas"": ""uni"", ""preprocessing"": ""lemma"", ""reg_alpha"": 0.0010299583571626526, ""reg_lambda"": 2.5026364749129835, ""scale_pos_weight"": 1.9262315106478776, ""subsample"": 0.896058592675892}",COMPLETE
23,0.6084789820924827,2026-10-01 08:48:32.745610,2026-10-01 08:48:34.055991,0 days 00:00:01.310381,0.6194173814554674,2.6253485178768368,0.077135422516646,4,2,450,uni,lemma,0.0040990516713200476,6.300580885100442,1.871904292403838,0.8121034896539066,0.015147376212122228,,"{""colsample_bytree"": 0.6194173814554674, ""gamma"": 2.6253485178768368, ""learning_rate"": 0.077135422516646, ""max_depth"": 4, ""min_child_weight"": 2, ""n_estimators"": 450, ""ngramas"": ""uni"", ""preprocessing"": ""lemma"", ""reg_alpha"": 0.0040990516713200476, ""reg_lambda"": 6.300580885100442, ""scale_pos_weight"": 1.871904292403838, ""subsample"": 0.8121034896539066}",COMPLETE
24,0.5952884906177568,2026-10-01 08:48:34.062010,2026-10-01 08:48:35.241873,0 days 00:00:01.179863,0.5594505419140214,2.1948450328682627,0.04744374089457991,5,3,350,uni,lemma,0.004156410987247901,8.436507174443614,2.1078343386352296,0.8697714189633315,0.012953264474093076,,"{""colsample_bytree"": 0.5594505419140214, ""gamma"": 2.1948450328682627, ""learning_rate"": 0.04744374089457991, ""max_depth"": 5, ""min_child_weight"": 3, ""n_estimators"": 350, ""ngramas"": ""uni"", ""preprocessing"": ""lemma"", ""reg_alpha"": 0.004156410987247901, ""reg_lambda"": 8.436507174443614, ""scale_pos_weight"": 2.1078343386352296, ""subsample"": 0.8697714189633315}",COMPLETE
25,0.6098039755612432,2026-10-01 08:48:35.247839,2026-10-01 08:48:36.681371,0 days 00:00:01.433532,0.677748865144745,3.54742728419727,0.019945580240391517,4,4,450,uni,lemma,0.0013766712033039005,3.4939043599236665,1.694802737126574,0.7880189885665121,0.016399253968144404,,"{""colsample_bytree"": 0.677748865144745, ""gamma"": 3.54742728419727, ""learning_rate"": 0.019945580240391517, ""max_depth"": 4, ""min_child_weight"": 4, ""n_estimators"": 450, ""ngramas"": ""uni"", ""preprocessing"": ""lemma"", ""reg_alpha"": 0.0013766712033039005, ""reg_lambda"": 3.4939043599236665, ""scale_pos_weight"": 1.694802737126574, ""subsample"": 0.7880189885665121}",COMPLETE
26,0.6068631595885182,2026-10-01 08:48:36.687907,2026-10-01 08:48:38.151681,0 days 00:00:01.463774,0.7631423578336675,2.85353294245103,0.0511783680227675,4,4,550,uni,lemma,0.005046114968445915,2.8538199992046303,1.7525684506062098,0.8175615709647575,0.01592091515190962,,"{""colsample_bytree"": 0.7631423578336675, ""gamma"": 2.85353294245103, ""learning_rate"": 0.0511783680227675, ""max_depth"": 4, ""min_child_weight"": 4, ""n_estimators"": 550, ""ngramas"": ""uni"", ""preprocessing"": ""lemma"", ""reg_alpha"": 0.005046114968445915, ""reg_lambda"": 2.8538199992046303, ""scale_pos_weight"": 1.7525684506062098, ""subsample"": 0.8175615709647575}",COMPLETE
27,0.5975937079060815,2026-10-01 08:48:38.160204,2026-10-01 08:48:39.490672,0 days 00:00:01.330468,0.7005858454915935,3.1621879385815532,0.05158432855428432,3,6,600,uni,lemma,0.0013173185759782022,4.663840186627346,1.8538647470736023,0.8582160901856618,0.01617940985123342,,"{""colsample_bytree"": 0.7005858454915935, ""gamma"": 3.1621879385815532, ""learning_rate"": 0.05158432855428432, ""max_depth"": 3, ""min_child_weight"": 6, ""n_estimators"": 600, ""ngramas"": ""uni"", ""preprocessing"": ""lemma"", ""reg_alpha"": 0.0013173185759782022, ""reg_lambda"": 4.663840186627346, ""scale_pos_weight"": 1.8538647470736023, ""subsample"": 0.8582160901856618}",COMPLETE
28,0.6068717085119808,2026-10-01 08:48:39.499118,2026-10-01 08:48:40.911643,0 days 00:00:01.412525,0.6106296660001966,4.0162148479214155,0.04042287821614248,3,3,700,uni,lemma,0.0029359785803431404,3.3480797911463256,1.4405477761242802,0.8657456036628965,0.02587521133323999,,"{""colsample_bytree"": 0.6106296660001966, ""gamma"": 4.0162148479214155, ""learning_rate"": 0.04042287821614248, ""max_depth"": 3, ""min_child_weight"": 3, ""n_estimators"": 700, ""ngramas"": ""uni"", ""preprocessing"": ""lemma"", ""reg_alpha"": 0.0029359785803431404, ""reg_lambda"": 3.3480797911463256, ""scale_pos_weight"": 1.4405477761242802, ""subsample"": 0.8657456036628965}",COMPLETE
29,0.6028579980343028,2026-10-01 08:48:40.920257,2026-10-01 08:48:42.016503,0 days 00:00:01.096246,0.609521684679508,3.80348624920238,0.08818955968564302,4,3,500,uni,lemma,0.005324681684843149,3.8252482583127483,1.399990689300798,0.7673637251692034,0.024292096649741624,,"{""colsample_bytree"": 0.609521684679508, ""gamma"": 3.80348624920238, ""learning_rate"": 0.08818955968564302, ""max_depth"": 4, ""min_child_weight"": 3, ""n_estimators"": 500, ""ngramas"": ""uni"", ""preprocessing"": ""lemma"", ""reg_alpha"": 0.005324681684843149, ""reg_lambda"": 3.8252482583127483, ""scale_pos_weight"": 1.399990689300798, ""subsample"": 0.7673637251692034}",COMPLETE
30,0.5992885032438134,2026-10-01 08:48:42.023026,2026-10-01 08:48:43.095918,0 days 00:00:01.072892,0.6178081170007695,4.152946666998299,0.12197815358412319,3,3,500,uni,lemma,0.010436872250669206,1.7313819841086027,1.9521188287007105,0.8696918753572381,0.010498379171826163,,"{""colsample_bytree"": 0.6178081170007695, ""gamma"": 4.152946666998299, ""learning_rate"": 0.12197815358412319, ""max_depth"": 3, ""min_child_weight"": 3, ""n_estimators"": 500, ""ngramas"": ""uni"", ""preprocessing"": ""lemma"", ""reg_alpha"": 0.010436872250669206, ""reg_lambda"": 1.7313819841086027, ""scale_pos_weight"": 1.9521188287007105, ""subsample"": 0.8696918753572381}",COMPLETE
31,0.6156401856870476,2026-10-01 08:48:43.102393,2026-10-01 08:48:44.357541,0 days 00:00:01.255148,0.5959189928191027,2.0668909434264178,0.059423502011091145,4,2,450,uni,lemma,0.0012788315736391067,5.272210251652244,1.672415935164043,0.8778306682366832,0.019654621060218033,,"{""colsample_bytree"": 0.5959189928191027, ""gamma"": 2.0668909434264178, ""learning_rate"": 0.059423502011091145, ""max_depth"": 4, ""min_child_weight"": 2, ""n_estimators"": 450, ""ngramas"": ""uni"", ""preprocessing"": ""lemma"", ""reg_alpha"": 0.0012788315736391067, ""reg_lambda"": 5.272210251652244, ""scale_pos_weight"": 1.672415935164043, ""subsample"": 0.8778306682366832}",COMPLETE
32,0.601952280152184,2026-10-01 08:48:44.364953,2026-10-01 08:48:45.569617,0 days 00:00:01.204664,0.5750184167737544,3.1094169510579146,0.05646929602272337,5,2,500,uni,lemma,0.004326797144941368,4.545356622185161,1.4745337016819784,0.8225566659146232,0.01957282706646158,,"{""colsample_bytree"": 0.5750184167737544, ""gamma"": 3.1094169510579146, ""learning_rate"": 0.05646929602272337, ""max_depth"": 5, ""min_child_weight"": 2, ""n_estimators"": 500, ""ngramas"": ""uni"", ""preprocessing"": ""lemma"", ""reg_alpha"": 0.004326797144941368, ""reg_lambda"": 4.545356622185161, ""scale_pos_weight"": 1.4745337016819784, ""subsample"": 0.8225566659146232}",COMPLETE
33,0.6066300260408425,2026-10-01 08:48:45.577668,2026-10-01 08:48:46.969820,0 days 00:00:01.392152,0.6423654452048251,3.091053729105997,0.040720620721957326,4,3,550,uni,lemma,0.0019266342445298861,1.1918569389669222,1.3575658146144987,0.8716457714694938,0.02289990606151674,,"{""colsample_bytree"": 0.6423654452048251, ""gamma"": 3.091053729105997, ""learning_rate"": 0.040720620721957326, ""max_depth"": 4, ""min_child_weight"": 3, ""n_estimators"": 550, ""ngramas"": ""uni"", ""preprocessing"": ""lemma"", ""reg_alpha"": 0.0019266342445298861, ""reg_lambda"": 1.1918569389669222, ""scale_pos_weight"": 1.3575658146144987, ""subsample"": 0.8716457714694938}",COMPLETE
34,0.6096165711108757,2026-10-01 08:48:46.977849,2026-10-01 08:48:48.298620,0 days 00:00:01.320771,0.6050786727998685,3.049543816183305,0.031373375776140425,3,3,550,uni,lemma,0.0036306656748674913,4.250113166841073,1.6041352265494813,0.8838838927107021,0.022780456050418004,,"{""colsample_bytree"": 0.6050786727998685, ""gamma"": 3.049543816183305, ""learning_rate"": 0.031373375776140425, ""max_depth"": 3, ""min_child_weight"": 3, ""n_estimators"": 550, ""ngramas"": ""uni"", ""preprocessing"": ""lemma"", ""reg_alpha"": 0.0036306656748674913, ""reg_lambda"": 4.250113166841073, ""scale_pos_weight"": 1.6041352265494813, ""subsample"": 0.8838838927107021}",COMPLETE
35,0.603486644167298,2026-10-01 08:48:48.307155,2026-10-01 08:48:49.600702,0 days 00:00:01.293547,0.5529992297113472,3.4240357596345197,0.04900399771766997,5,3,550,uni,lemma,0.0017842740559811396,2.7108830192339983,1.5099233464652637,0.8665768481157554,0.017758289607177045,,"{""colsample_bytree"": 0.5529992297113472, ""gamma"": 3.4240357596345197, ""learning_rate"": 0.04900399771766997, ""max_depth"": 5, ""min_child_weight"": 3, ""n_estimators"": 550, ""ngramas"": ""uni"", ""preprocessing"": ""lemma"", ""reg_alpha"": 0.0017842740559811396, ""reg_lambda"": 2.7108830192339983, ""scale_pos_weight"": 1.5099233464652637, ""subsample"": 0.8665768481157554}",COMPLETE
36,0.6023602484964324,2026-10-01 08:48:49.608718,2026-10-01 08:48:50.759962,0 days 00:00:01.151244,0.6723836614284726,4.185904275708212,0.05140739739316688,5,3,450,uni,lemma,0.004691759511081699,2.5898060091642106,1.5822398093938834,0.832748563732769,0.01553782701803037,,"{""colsample_bytree"": 0.6723836614284726, ""gamma"": 4.185904275708212, ""learning_rate"": 0.05140739739316688, ""max_depth"": 5, ""min_child_weight"": 3, ""n_estimators"": 450, ""ngramas"": ""uni"", ""preprocessing"": ""lemma"", ""reg_alpha"": 0.004691759511081699, ""reg_lambda"": 2.5898060091642106, ""scale_pos_weight"": 1.5822398093938834, ""subsample"": 0.832748563732769}",COMPLETE
