number,value,datetime_start,datetime_complete,duration,params_colsample_bytree,params_gamma,params_learning_rate,params_max_depth,params_min_child_weight,params_n_estimators,params_ngramas,params_preprocessing,params_reg_alpha,params_reg_lambda,params_scale_pos_weight,params_subsample,user_attrs_inner_f1_std,system_attrs_fixed_params,system_attrs_tpe:relative_params:0,state
37,0.6795394468317513,2026-10-01 08:35:19.659832,2026-10-01 08:35:20.680123,0 days 00:00:01.020291,0.6509857686704043,3.290673614832116,0.024726053565073677,2,7,600,uni,stem,0.0011551707869568342,2.9150750465886732,1.514638053051887,0.6135855809126519,0.018944299771965913,,"{""colsample_bytree"": 0.6509857686704043, ""gamma"": 3.290673614832116, ""learning_rate"": 0.024726053565073677, ""max_depth"": 2, ""min_child_weight"": 7, ""n_estimators"": 600, ""ngramas"": ""uni"", ""preprocessing"": ""stem"", ""reg_alpha"": 0.0011551707869568342, ""reg_lambda"": 2.9150750465886732, ""scale_pos_weight"": 1.514638053051887, ""subsample"": 0.6135855809126519}",COMPLETE
38,0.6924721309673978,2026-10-01 08:35:20.687969,2026-10-01 08:35:22.003632,0 days 00:00:01.315663,0.6078066298866868,4.797325526989766,0.017997629229957613,2,4,650,uni,normal,0.003921725622771377,1.642827652475146,1.3651511883809078,0.6202274244794602,0.011930582912735735,,"{""colsample_bytree"": 0.6078066298866868, ""gamma"": 4.797325526989766, ""learning_rate"": 0.017997629229957613, ""max_depth"": 2, ""min_child_weight"": 4, ""n_estimators"": 650, ""ngramas"": ""uni"", ""preprocessing"": ""normal"", ""reg_alpha"": 0.003921725622771377, ""reg_lambda"": 1.642827652475146, ""scale_pos_weight"": 1.3651511883809078, ""subsample"": 0.6202274244794602}",COMPLETE
39,0.6868434013335558,2026-10-01 08:35:22.012008,2026-10-01 08:35:23.004031,0 days 00:00:00.992023,0.610802381459239,4.043895004526288,0.030575808609094788,2,5,600,uni,stem,0.0015110269502468835,4.570982481508147,1.3858062319196496,0.6035410174317816,0.024793019121050686,,"{""colsample_bytree"": 0.610802381459239, ""gamma"": 4.043895004526288, ""learning_rate"": 0.030575808609094788, ""max_depth"": 2, ""min_child_weight"": 5, ""n_estimators"": 600, ""ngramas"": ""uni"", ""preprocessing"": ""stem"", ""reg_alpha"": 0.0015110269502468835, ""reg_lambda"": 4.570982481508147, ""scale_pos_weight"": 1.3858062319196496, ""subsample"": 0.6035410174317816}",COMPLETE
40,0.6792550530846754,2026-10-01 08:35:23.011044,2026-10-01 08:35:24.179324,0 days 00:00:01.168280,0.5327071039886053,5.052796198743099,0.04589830120551084,2,3,650,uni,normal,0.0011684532376005038,0.8066469849811907,1.4355084725861906,0.684650091245755,0.015384098122253798,,"{""colsample_bytree"": 0.5327071039886053, ""gamma"": 5.052796198743099, ""learning_rate"": 0.04589830120551084, ""max_depth"": 2, ""min_child_weight"": 3, ""n_estimators"": 650, ""ngramas"": ""uni"", ""preprocessing"": ""normal"", ""reg_alpha"": 0.0011684532376005038, ""reg_lambda"": 0.8066469849811907, ""scale_pos_weight"": 1.4355084725861906, ""subsample"": 0.684650091245755}",COMPLETE
41,0.6865902372781324,2026-10-01 08:35:24.185861,2026-10-01 08:35:25.259531,0 days 00:00:01.073670,0.5446669563052909,4.020635029265135,0.04399784371057314,2,5,700,uni,stem,0.0015160496461369879,3.1773430466412607,1.35514627807397,0.6045756501260697,0.018477405979515756,,"{""colsample_bytree"": 0.5446669563052909, ""gamma"": 4.020635029265135, ""learning_rate"": 0.04399784371057314, ""max_depth"": 2, ""min_child_weight"": 5, ""n_estimators"": 700, ""ngramas"": ""uni"", ""preprocessing"": ""stem"", ""reg_alpha"": 0.0015160496461369879, ""reg_lambda"": 3.1773430466412607, ""scale_pos_weight"": 1.35514627807397, ""subsample"": 0.6045756501260697}",COMPLETE
42,0.6925769577908438,2026-10-01 08:35:25.268072,2026-10-01 08:35:26.340526,0 days 00:00:01.072454,0.5589177704024504,4.698127974594538,0.03294477831488029,2,3,700,uni,stem,0.001328137854917802,2.316758227989987,1.4896208164569635,0.6271816670871928,0.020405922695071292,,"{""colsample_bytree"": 0.5589177704024504, ""gamma"": 4.698127974594538, ""learning_rate"": 0.03294477831488029, ""max_depth"": 2, ""min_child_weight"": 3, ""n_estimators"": 700, ""ngramas"": ""uni"", ""preprocessing"": ""stem"", ""reg_alpha"": 0.001328137854917802, ""reg_lambda"": 2.316758227989987, ""scale_pos_weight"": 1.4896208164569635, ""subsample"": 0.6271816670871928}",COMPLETE
43,0.6847397646936323,2026-10-01 08:35:26.348043,2026-10-01 08:35:27.602406,0 days 00:00:01.254363,0.5244789275711049,4.230651485095713,0.03441783574559954,3,4,650,uni,normal,0.003196363615709009,1.171379945653903,1.1561058132158735,0.6499944585115744,0.008527533894336473,,"{""colsample_bytree"": 0.5244789275711049, ""gamma"": 4.230651485095713, ""learning_rate"": 0.03441783574559954, ""max_depth"": 3, ""min_child_weight"": 4, ""n_estimators"": 650, ""ngramas"": ""uni"", ""preprocessing"": ""normal"", ""reg_alpha"": 0.003196363615709009, ""reg_lambda"": 1.171379945653903, ""scale_pos_weight"": 1.1561058132158735, ""subsample"": 0.6499944585115744}",COMPLETE
44,0.6893186461954214,2026-10-01 08:35:27.611684,2026-10-01 08:35:28.674462,0 days 00:00:01.062778,0.5560390295121279,4.2725889257547855,0.027430208151122203,2,4,550,uni,normal,0.0032103264988999833,0.9437967020649761,1.3169917364048083,0.6467733117407559,0.01003196921803042,,"{""colsample_bytree"": 0.5560390295121279, ""gamma"": 4.2725889257547855, ""learning_rate"": 0.027430208151122203, ""max_depth"": 2, ""min_child_weight"": 4, ""n_estimators"": 550, ""ngramas"": ""uni"", ""preprocessing"": ""normal"", ""reg_alpha"": 0.0032103264988999833, ""reg_lambda"": 0.9437967020649761, ""scale_pos_weight"": 1.3169917364048083, ""subsample"": 0.6467733117407559}",COMPLETE
45,0.6866597984234847,2026-10-01 08:35:28.683266,2026-10-01 08:35:30.004199,0 days 00:00:01.320933,0.5761178684677226,5.18931257423465,0.01614794371879907,2,3,700,uni,normal,0.00790977954988443,1.743026134289714,1.3088580818565612,0.630501658379616,0.020356215366635365,,"{""colsample_bytree"": 0.5761178684677226, ""gamma"": 5.18931257423465, ""learning_rate"": 0.01614794371879907, ""max_depth"": 2, ""min_child_weight"": 3, ""n_estimators"": 700, ""ngramas"": ""uni"", ""preprocessing"": ""normal"", ""reg_alpha"": 0.00790977954988443, ""reg_lambda"": 1.743026134289714, ""scale_pos_weight"": 1.3088580818565612, ""subsample"": 0.630501658379616}",COMPLETE
46,0.68517745003314,2026-10-01 08:35:30.012322,2026-10-01 08:35:31.279131,0 days 00:00:01.266809,0.5933671013533588,4.393689195999882,0.03359601352293002,2,2,650,uni,normal,0.0011036456917205126,1.6881452260464278,1.6802384130338006,0.6424912035146272,0.006593856281238585,,"{""colsample_bytree"": 0.5933671013533588, ""gamma"": 4.393689195999882, ""learning_rate"": 0.03359601352293002, ""max_depth"": 2, ""min_child_weight"": 2, ""n_estimators"": 650, ""ngramas"": ""uni"", ""preprocessing"": ""normal"", ""reg_alpha"": 0.0011036456917205126, ""reg_lambda"": 1.6881452260464278, ""scale_pos_weight"": 1.6802384130338006, ""subsample"": 0.6424912035146272}",COMPLETE
47,0.6703016675372266,2026-10-01 08:35:31.287665,2026-10-01 08:35:32.499301,0 days 00:00:01.211636,0.5908584476689195,5.849925782840906,0.027105996048960166,2,4,650,uni,normal,0.0016118682653907578,4.31258386665983,1.2478913440662254,0.5784521376787358,0.01916123649654792,,"{""colsample_bytree"": 0.5908584476689195, ""gamma"": 5.849925782840906, ""learning_rate"": 0.027105996048960166, ""max_depth"": 2, ""min_child_weight"": 4, ""n_estimators"": 650, ""ngramas"": ""uni"", ""preprocessing"": ""normal"", ""reg_alpha"": 0.0016118682653907578, ""reg_lambda"": 4.31258386665983, ""scale_pos_weight"": 1.2478913440662254, ""subsample"": 0.5784521376787358}",COMPLETE
48,0.6866487382107788,2026-10-01 08:35:32.509654,2026-10-01 08:35:33.618532,0 days 00:00:01.108878,0.5574618993040548,4.154394539747326,0.0410368162222437,2,4,600,uni,normal,0.0011482962771685102,1.2302173631928648,1.322297933329227,0.6682678748886989,0.013987267578406182,,"{""colsample_bytree"": 0.5574618993040548, ""gamma"": 4.154394539747326, ""learning_rate"": 0.0410368162222437, ""max_depth"": 2, ""min_child_weight"": 4, ""n_estimators"": 600, ""ngramas"": ""uni"", ""preprocessing"": ""normal"", ""reg_alpha"": 0.0011482962771685102, ""reg_lambda"": 1.2302173631928648, ""scale_pos_weight"": 1.322297933329227, ""subsample"": 0.6682678748886989}",COMPLETE
49,0.6742790413522673,2026-10-01 08:35:33.626368,2026-10-01 08:35:34.659768,0 days 00:00:01.033400,0.5445803716172373,3.6553849096172986,0.031186494161548194,2,4,650,uni,stem,0.0016128940812222372,0.8469350073367408,1.4479012663583406,0.6054861958052012,0.022365764701035986,,"{""colsample_bytree"": 0.5445803716172373, ""gamma"": 3.6553849096172986, ""learning_rate"": 0.031186494161548194, ""max_depth"": 2, ""min_child_weight"": 4, ""n_estimators"": 650, ""ngramas"": ""uni"", ""preprocessing"": ""stem"", ""reg_alpha"": 0.0016128940812222372, ""reg_lambda"": 0.8469350073367408, ""scale_pos_weight"": 1.4479012663583406, ""subsample"": 0.6054861958052012}",COMPLETE
