number,value,datetime_start,datetime_complete,duration,params_colsample_bytree,params_gamma,params_learning_rate,params_max_depth,params_min_child_weight,params_n_estimators,params_ngramas,params_preprocessing,params_reg_alpha,params_reg_lambda,params_scale_pos_weight,params_subsample,user_attrs_inner_f1_std,system_attrs_fixed_params,system_attrs_tpe:relative_params:0,state
0,0.6193831121350791,2026-10-01 08:37:50.149645,2026-10-01 08:37:51.150946,0 days 00:00:01.001301,0.8436549963794391,5.495676598235193,0.014912334799978505,5,5,200,uni,normal,0.1460995401984744,0.11661695042823148,2.1006224444204245,0.6644986695338989,0.009257189908652472,"{'preprocessing': 'normal', 'ngramas': 'uni'}",,COMPLETE
1,0.6399342848842884,2026-10-01 08:37:51.154947,2026-10-01 08:37:53.382732,0 days 00:00:02.227785,0.5884115983537486,3.5374208603544477,0.021429375567205422,6,2,350,uni_bi,normal,0.01838170889617177,0.15010776969324383,2.264837041344557,0.8533270243147202,0.006896429226495943,"{'preprocessing': 'normal', 'ngramas': 'uni_bi'}",,COMPLETE
2,0.6146539681015534,2026-10-01 08:37:53.385602,2026-10-01 08:37:54.757471,0 days 00:00:01.371869,0.7678898606887231,1.1187503727286656,0.0317239257884236,7,15,650,uni,stem,3.876094171803447,0.4849701336699878,1.393457233894572,0.7060154262939016,0.026514780060917523,"{'preprocessing': 'stem', 'ngramas': 'uni'}",,COMPLETE
3,0.5966347840021737,2026-10-01 08:37:54.761987,2026-10-01 08:37:55.833852,0 days 00:00:01.071865,0.8634651031324352,7.326148068351174,0.0415685752358692,5,10,150,uni_bi,stem,0.12618934451314417,0.17352047335193588,1.2713718928868514,0.8923714469287022,0.012064514038983136,"{'preprocessing': 'stem', 'ngramas': 'uni_bi'}",,COMPLETE
4,0.5913510830085906,2026-10-01 08:37:55.837361,2026-10-01 08:37:57.006962,0 days 00:00:01.169601,0.6102235106595808,7.22560452305647,0.13347908492973548,4,11,700,uni,lemma,0.006723036752122265,0.8522138632181322,2.490358738591155,0.7700750285587564,0.017343925193176287,"{'preprocessing': 'lemma', 'ngramas': 'uni'}",,COMPLETE
5,0.6306948029862296,2026-10-01 08:37:57.011481,2026-10-01 08:37:59.283834,0 days 00:00:02.272353,0.6596787543616299,5.526088735267864,0.05363392753815193,4,7,550,uni_bi,lemma,0.6589651263273641,2.5270599675396843,1.810051696272484,0.8044457971887959,0.02279120546735349,"{'preprocessing': 'lemma', 'ngramas': 'uni_bi'}",,COMPLETE
6,0.6241830457719332,2026-10-01 08:37:59.287861,2026-10-01 08:38:00.851281,0 days 00:00:01.563420,0.7352416170633504,2.3400743972251985,0.03353974378857238,2,6,300,uni_bi,lemma,0.9796759510335362,4.540242377729664,2.0428913004326397,0.6351893056983369,0.016803021760039047,,,COMPLETE
7,0.5994492420479411,2026-10-01 08:38:00.855281,2026-10-01 08:38:02.206682,0 days 00:00:01.351401,0.6165690758694432,0.9779042623798591,0.19922157744046312,7,2,500,uni,stem,0.1898880329986574,0.10272988230855988,1.9169163845050325,0.7184561667093609,0.009912191960612713,,,COMPLETE
8,0.6142149622463172,2026-10-01 08:38:02.210692,2026-10-01 08:38:03.391991,0 days 00:00:01.181299,0.5413410043512618,4.175822458017969,0.021469546007741834,7,8,400,uni,lemma,0.0015094461003314766,0.521271708121548,2.1280595295490374,0.7659279415373134,0.01046968457669558,,,COMPLETE
9,0.601075861929871,2026-10-01 08:38:03.396009,2026-10-01 08:38:05.388277,0 days 00:00:01.992268,0.7392752546328507,3.7452355967270012,0.15855739027695478,7,13,450,uni_bi,stem,0.5978449195497908,1.3040016804653507,1.1923905123641099,0.6879692992859042,0.012441319117194217,,,COMPLETE
10,0.6140581387867612,2026-10-01 08:38:05.393796,2026-10-01 08:38:08.217252,0 days 00:00:02.823456,0.5372985669891145,4.83137228441047,0.013389587055799216,4,5,600,uni_bi,normal,0.012568450003473912,0.31911806537142345,2.462352403508748,0.720711510810284,0.020815284665199,,"{""colsample_bytree"": 0.5372985669891145, ""gamma"": 4.83137228441047, ""learning_rate"": 0.013389587055799216, ""max_depth"": 4, ""min_child_weight"": 5, ""n_estimators"": 600, ""ngramas"": ""uni_bi"", ""preprocessing"": ""normal"", ""reg_alpha"": 0.012568450003473912, ""reg_lambda"": 0.31911806537142345, ""scale_pos_weight"": 2.462352403508748, ""subsample"": 0.720711510810284}",COMPLETE
11,0.6147461868719003,2026-10-01 08:38:08.221260,2026-10-01 08:38:09.837854,0 days 00:00:01.616594,0.6254940948346135,2.8182585345572653,0.010933202497296384,7,5,200,uni_bi,normal,0.008799366379907492,0.28320821724921835,2.2442576440856947,0.8437621251557963,0.01564343584277448,,"{""colsample_bytree"": 0.6254940948346135, ""gamma"": 2.8182585345572653, ""learning_rate"": 0.010933202497296384, ""max_depth"": 7, ""min_child_weight"": 5, ""n_estimators"": 200, ""ngramas"": ""uni_bi"", ""preprocessing"": ""normal"", ""reg_alpha"": 0.008799366379907492, ""reg_lambda"": 0.28320821724921835, ""scale_pos_weight"": 2.2442576440856947, ""subsample"": 0.8437621251557963}",COMPLETE
12,0.6224562482536179,2026-10-01 08:38:09.841890,2026-10-01 08:38:10.730533,0 days 00:00:00.888643,0.5484413162582861,2.964590361276459,0.013217244594666616,2,3,150,uni_bi,normal,0.12715452877447117,1.8779415422276748,2.376924151876939,0.8671049951145822,0.017504672945800204,,"{""colsample_bytree"": 0.5484413162582861, ""gamma"": 2.964590361276459, ""learning_rate"": 0.013217244594666616, ""max_depth"": 2, ""min_child_weight"": 3, ""n_estimators"": 150, ""ngramas"": ""uni_bi"", ""preprocessing"": ""normal"", ""reg_alpha"": 0.12715452877447117, ""reg_lambda"": 1.8779415422276748, ""scale_pos_weight"": 2.376924151876939, ""subsample"": 0.8671049951145822}",COMPLETE
13,0.6230109174014159,2026-10-01 08:38:10.734037,2026-10-01 08:38:12.013149,0 days 00:00:01.279112,0.607983141715489,2.0558598665447616,0.03724982603679365,6,4,150,uni_bi,normal,0.019913410340502834,0.4983029094123852,1.937410540650513,0.7947753471341729,0.028816381407695275,,"{""colsample_bytree"": 0.607983141715489, ""gamma"": 2.0558598665447616, ""learning_rate"": 0.03724982603679365, ""max_depth"": 6, ""min_child_weight"": 4, ""n_estimators"": 150, ""ngramas"": ""uni_bi"", ""preprocessing"": ""normal"", ""reg_alpha"": 0.019913410340502834, ""reg_lambda"": 0.4983029094123852, ""scale_pos_weight"": 1.937410540650513, ""subsample"": 0.7947753471341729}",COMPLETE
14,0.6178854920008212,2026-10-01 08:38:12.017456,2026-10-01 08:38:14.614121,0 days 00:00:02.596665,0.6102403230287358,1.1904473820504862,0.024044432848057396,5,6,450,uni_bi,normal,0.0017504015503539447,4.620348921675208,2.2418005989927847,0.7837553397662368,0.02154802188422751,,"{""colsample_bytree"": 0.6102403230287358, ""gamma"": 1.1904473820504862, ""learning_rate"": 0.024044432848057396, ""max_depth"": 5, ""min_child_weight"": 6, ""n_estimators"": 450, ""ngramas"": ""uni_bi"", ""preprocessing"": ""normal"", ""reg_alpha"": 0.0017504015503539447, ""reg_lambda"": 4.620348921675208, ""scale_pos_weight"": 2.2418005989927847, ""subsample"": 0.7837553397662368}",COMPLETE
15,0.6238121027859638,2026-10-01 08:38:14.619577,2026-10-01 08:38:16.165462,0 days 00:00:01.545885,0.7128387228845334,5.525360554896256,0.06664644152602088,7,2,300,uni_bi,normal,0.496118619706832,1.1451909887851452,2.215252846694562,0.8888419070504809,0.0028358423712413648,,"{""colsample_bytree"": 0.7128387228845334, ""gamma"": 5.525360554896256, ""learning_rate"": 0.06664644152602088, ""max_depth"": 7, ""min_child_weight"": 2, ""n_estimators"": 300, ""ngramas"": ""uni_bi"", ""preprocessing"": ""normal"", ""reg_alpha"": 0.496118619706832, ""reg_lambda"": 1.1451909887851452, ""scale_pos_weight"": 2.215252846694562, ""subsample"": 0.8888419070504809}",COMPLETE
16,0.6175507428019001,2026-10-01 08:38:16.170453,2026-10-01 08:38:18.080152,0 days 00:00:01.909699,0.5735628978270089,5.648505225078322,0.032718629066025295,5,6,450,uni_bi,normal,0.03294135830991735,0.5755344244685611,2.024182335399874,0.8797465340698077,0.01547872052991832,,"{""colsample_bytree"": 0.5735628978270089, ""gamma"": 5.648505225078322, ""learning_rate"": 0.032718629066025295, ""max_depth"": 5, ""min_child_weight"": 6, ""n_estimators"": 450, ""ngramas"": ""uni_bi"", ""preprocessing"": ""normal"", ""reg_alpha"": 0.03294135830991735, ""reg_lambda"": 0.5755344244685611, ""scale_pos_weight"": 2.024182335399874, ""subsample"": 0.8797465340698077}",COMPLETE
17,0.6274322437842467,2026-10-01 08:38:18.085284,2026-10-01 08:38:19.788901,0 days 00:00:01.703617,0.5355169494841518,6.079104225087173,0.12290871707829419,5,3,450,uni_bi,normal,0.007058444285798282,0.2461133716759871,2.2559046143097294,0.8763977420887576,0.032904575894796936,,"{""colsample_bytree"": 0.5355169494841518, ""gamma"": 6.079104225087173, ""learning_rate"": 0.12290871707829419, ""max_depth"": 5, ""min_child_weight"": 3, ""n_estimators"": 450, ""ngramas"": ""uni_bi"", ""preprocessing"": ""normal"", ""reg_alpha"": 0.007058444285798282, ""reg_lambda"": 0.2461133716759871, ""scale_pos_weight"": 2.2559046143097294, ""subsample"": 0.8763977420887576}",COMPLETE
18,0.6202208314002817,2026-10-01 08:38:19.793918,2026-10-01 08:38:22.103782,0 days 00:00:02.309864,0.5428871289246016,4.188958651262681,0.010476792431095984,3,3,500,uni_bi,normal,0.19353013046616058,5.57791593569957,2.460659432285061,0.8167649154315172,0.01797216948398798,,"{""colsample_bytree"": 0.5428871289246016, ""gamma"": 4.188958651262681, ""learning_rate"": 0.010476792431095984, ""max_depth"": 3, ""min_child_weight"": 3, ""n_estimators"": 500, ""ngramas"": ""uni_bi"", ""preprocessing"": ""normal"", ""reg_alpha"": 0.19353013046616058, ""reg_lambda"": 5.57791593569957, ""scale_pos_weight"": 2.460659432285061, ""subsample"": 0.8167649154315172}",COMPLETE
19,0.6088462533797959,2026-10-01 08:38:22.109299,2026-10-01 08:38:23.162656,0 days 00:00:01.053357,0.5416127893875962,1.8622885578128467,0.0170349356487224,4,8,150,uni_bi,normal,0.02233374980696663,0.40767347861604897,2.427314468064037,0.7976150731550895,0.0190087797436561,,"{""colsample_bytree"": 0.5416127893875962, ""gamma"": 1.8622885578128467, ""learning_rate"": 0.0170349356487224, ""max_depth"": 4, ""min_child_weight"": 8, ""n_estimators"": 150, ""ngramas"": ""uni_bi"", ""preprocessing"": ""normal"", ""reg_alpha"": 0.02233374980696663, ""reg_lambda"": 0.40767347861604897, ""scale_pos_weight"": 2.427314468064037, ""subsample"": 0.7976150731550895}",COMPLETE
20,0.6354565154821034,2026-10-01 08:38:23.168412,2026-10-01 08:38:25.161225,0 days 00:00:01.992813,0.5380600910472612,4.247660634143796,0.0394443317270528,7,3,400,uni_bi,normal,0.03707482810837335,1.2071383747131088,2.106240045636382,0.802911862497861,0.01100650800391638,,"{""colsample_bytree"": 0.5380600910472612, ""gamma"": 4.247660634143796, ""learning_rate"": 0.0394443317270528, ""max_depth"": 7, ""min_child_weight"": 3, ""n_estimators"": 400, ""ngramas"": ""uni_bi"", ""preprocessing"": ""normal"", ""reg_alpha"": 0.03707482810837335, ""reg_lambda"": 1.2071383747131088, ""scale_pos_weight"": 2.106240045636382, ""subsample"": 0.802911862497861}",COMPLETE
21,0.6271833190784452,2026-10-01 08:38:25.167235,2026-10-01 08:38:27.063008,0 days 00:00:01.895773,0.6295342526415192,3.519223965268478,0.04243596388009856,7,4,350,uni_bi,normal,0.07655908182652565,0.26949458587032504,2.028561097632379,0.8923272203099778,0.025689073166800948,,"{""colsample_bytree"": 0.6295342526415192, ""gamma"": 3.519223965268478, ""learning_rate"": 0.04243596388009856, ""max_depth"": 7, ""min_child_weight"": 4, ""n_estimators"": 350, ""ngramas"": ""uni_bi"", ""preprocessing"": ""normal"", ""reg_alpha"": 0.07655908182652565, ""reg_lambda"": 0.26949458587032504, ""scale_pos_weight"": 2.028561097632379, ""subsample"": 0.8923272203099778}",COMPLETE
22,0.6215776910867171,2026-10-01 08:38:27.070234,2026-10-01 08:38:29.334955,0 days 00:00:02.264721,0.5646600098004186,5.024286881397011,0.032972062404851954,7,6,550,uni_bi,normal,0.4798471513069929,1.2662592751117403,2.0369351094576214,0.8231001837476989,0.015036646389953917,,"{""colsample_bytree"": 0.5646600098004186, ""gamma"": 5.024286881397011, ""learning_rate"": 0.032972062404851954, ""max_depth"": 7, ""min_child_weight"": 6, ""n_estimators"": 550, ""ngramas"": ""uni_bi"", ""preprocessing"": ""normal"", ""reg_alpha"": 0.4798471513069929, ""reg_lambda"": 1.2662592751117403, ""scale_pos_weight"": 2.0369351094576214, ""subsample"": 0.8231001837476989}",COMPLETE
23,0.6421800285913933,2026-10-01 08:38:29.338764,2026-10-01 08:38:31.822284,0 days 00:00:02.483520,0.5793382547907474,3.4313572905680267,0.015384975907172,6,2,400,uni_bi,normal,0.002863613349015319,0.32374792512704476,2.1481131342535624,0.8229504246572839,0.012195049071315918,,"{""colsample_bytree"": 0.5793382547907474, ""gamma"": 3.4313572905680267, ""learning_rate"": 0.015384975907172, ""max_depth"": 6, ""min_child_weight"": 2, ""n_estimators"": 400, ""ngramas"": ""uni_bi"", ""preprocessing"": ""normal"", ""reg_alpha"": 0.002863613349015319, ""reg_lambda"": 0.32374792512704476, ""scale_pos_weight"": 2.1481131342535624, ""subsample"": 0.8229504246572839}",COMPLETE
24,0.6286282011704637,2026-10-01 08:38:31.828303,2026-10-01 08:38:34.201854,0 days 00:00:02.373551,0.5421600176934098,3.050204046290348,0.022830309566723047,7,5,400,uni_bi,normal,0.002087331197456524,0.11680791224928688,2.0559927394077753,0.8588410510283605,0.02103229640446067,,"{""colsample_bytree"": 0.5421600176934098, ""gamma"": 3.050204046290348, ""learning_rate"": 0.022830309566723047, ""max_depth"": 7, ""min_child_weight"": 5, ""n_estimators"": 400, ""ngramas"": ""uni_bi"", ""preprocessing"": ""normal"", ""reg_alpha"": 0.002087331197456524, ""reg_lambda"": 0.11680791224928688, ""scale_pos_weight"": 2.0559927394077753, ""subsample"": 0.8588410510283605}",COMPLETE
25,0.6405787750636833,2026-10-01 08:38:34.208640,2026-10-01 08:38:36.654833,0 days 00:00:02.446193,0.5272768789945984,3.781110857252531,0.015175542881005205,6,2,400,uni_bi,normal,0.09916392560315623,0.4733597876632938,2.2273300581697666,0.845420014876788,0.010334921284694454,,"{""colsample_bytree"": 0.5272768789945984, ""gamma"": 3.781110857252531, ""learning_rate"": 0.015175542881005205, ""max_depth"": 6, ""min_child_weight"": 2, ""n_estimators"": 400, ""ngramas"": ""uni_bi"", ""preprocessing"": ""normal"", ""reg_alpha"": 0.09916392560315623, ""reg_lambda"": 0.4733597876632938, ""scale_pos_weight"": 2.2273300581697666, ""subsample"": 0.845420014876788}",COMPLETE
26,0.6313144456585239,2026-10-01 08:38:36.660851,2026-10-01 08:38:39.858117,0 days 00:00:03.197266,0.5530693083983609,3.06370128361183,0.010655872511527626,6,3,500,uni_bi,normal,0.00810483148496455,0.7772727584855982,2.0352838468987686,0.8418683065170576,0.025184299647875177,,"{""colsample_bytree"": 0.5530693083983609, ""gamma"": 3.06370128361183, ""learning_rate"": 0.010655872511527626, ""max_depth"": 6, ""min_child_weight"": 3, ""n_estimators"": 500, ""ngramas"": ""uni_bi"", ""preprocessing"": ""normal"", ""reg_alpha"": 0.00810483148496455, ""reg_lambda"": 0.7772727584855982, ""scale_pos_weight"": 2.0352838468987686, ""subsample"": 0.8418683065170576}",COMPLETE
27,0.6382456718470259,2026-10-01 08:38:39.865144,2026-10-01 08:38:42.822505,0 days 00:00:02.957361,0.6637288480157867,2.6168786571514726,0.015873415167979594,6,3,450,uni_bi,normal,0.017522556733033753,0.17339891774372385,2.1887502864038346,0.8658223974974725,0.015304238763825952,,"{""colsample_bytree"": 0.6637288480157867, ""gamma"": 2.6168786571514726, ""learning_rate"": 0.015873415167979594, ""max_depth"": 6, ""min_child_weight"": 3, ""n_estimators"": 450, ""ngramas"": ""uni_bi"", ""preprocessing"": ""normal"", ""reg_alpha"": 0.017522556733033753, ""reg_lambda"": 0.17339891774372385, ""scale_pos_weight"": 2.1887502864038346, ""subsample"": 0.8658223974974725}",COMPLETE
28,0.6363941520252805,2026-10-01 08:38:42.828575,2026-10-01 08:38:45.008385,0 days 00:00:02.179810,0.568851978567347,4.450377548140719,0.017354153916187692,7,3,350,uni_bi,normal,0.3856091664817798,1.3772650928954941,2.031238330405965,0.8018263989755746,0.017348020476329846,,"{""colsample_bytree"": 0.568851978567347, ""gamma"": 4.450377548140719, ""learning_rate"": 0.017354153916187692, ""max_depth"": 7, ""min_child_weight"": 3, ""n_estimators"": 350, ""ngramas"": ""uni_bi"", ""preprocessing"": ""normal"", ""reg_alpha"": 0.3856091664817798, ""reg_lambda"": 1.3772650928954941, ""scale_pos_weight"": 2.031238330405965, ""subsample"": 0.8018263989755746}",COMPLETE
29,0.6529577504535552,2026-10-01 08:38:45.014913,2026-10-01 08:38:48.061258,0 days 00:00:03.046345,0.557713034807817,3.7297743374007646,0.01688172171180271,7,2,500,uni_bi,normal,0.08331286157596024,0.34348783934399474,1.9424224813100275,0.8243764883272112,0.013724235136571223,,"{""colsample_bytree"": 0.557713034807817, ""gamma"": 3.7297743374007646, ""learning_rate"": 0.01688172171180271, ""max_depth"": 7, ""min_child_weight"": 2, ""n_estimators"": 500, ""ngramas"": ""uni_bi"", ""preprocessing"": ""normal"", ""reg_alpha"": 0.08331286157596024, ""reg_lambda"": 0.34348783934399474, ""scale_pos_weight"": 1.9424224813100275, ""subsample"": 0.8243764883272112}",COMPLETE
30,0.638506883693904,2026-10-01 08:38:48.068282,2026-10-01 08:38:50.752695,0 days 00:00:02.684413,0.5185332119066571,1.7120121496157323,0.013496634957500041,7,2,400,uni_bi,normal,0.04736608133880643,0.20775851759017594,1.9293038450060351,0.8129199803599687,0.014392716938308257,,"{""colsample_bytree"": 0.5185332119066571, ""gamma"": 1.7120121496157323, ""learning_rate"": 0.013496634957500041, ""max_depth"": 7, ""min_child_weight"": 2, ""n_estimators"": 400, ""ngramas"": ""uni_bi"", ""preprocessing"": ""normal"", ""reg_alpha"": 0.04736608133880643, ""reg_lambda"": 0.20775851759017594, ""scale_pos_weight"": 1.9293038450060351, ""subsample"": 0.8129199803599687}",COMPLETE
31,0.6422749437758949,2026-10-01 08:38:50.760002,2026-10-01 08:38:52.919324,0 days 00:00:02.159322,0.568234229341747,2.728824039796985,0.030957244031190982,6,2,350,uni_bi,normal,0.0071084929163226064,0.25597814409205255,2.2502632242037146,0.8599444802180309,0.013275046204821969,,"{""colsample_bytree"": 0.568234229341747, ""gamma"": 2.728824039796985, ""learning_rate"": 0.030957244031190982, ""max_depth"": 6, ""min_child_weight"": 2, ""n_estimators"": 350, ""ngramas"": ""uni_bi"", ""preprocessing"": ""normal"", ""reg_alpha"": 0.0071084929163226064, ""reg_lambda"": 0.25597814409205255, ""scale_pos_weight"": 2.2502632242037146, ""subsample"": 0.8599444802180309}",COMPLETE
32,0.6278526142472679,2026-10-01 08:38:52.925969,2026-10-01 08:38:55.064697,0 days 00:00:02.138728,0.522628960934787,3.775316737518791,0.029495613798084724,5,3,400,uni_bi,normal,0.0044193319426597604,0.4287660859447984,2.1410473334848157,0.821120937226773,0.017066709718024414,,"{""colsample_bytree"": 0.522628960934787, ""gamma"": 3.775316737518791, ""learning_rate"": 0.029495613798084724, ""max_depth"": 5, ""min_child_weight"": 3, ""n_estimators"": 400, ""ngramas"": ""uni_bi"", ""preprocessing"": ""normal"", ""reg_alpha"": 0.0044193319426597604, ""reg_lambda"": 0.4287660859447984, ""scale_pos_weight"": 2.1410473334848157, ""subsample"": 0.821120937226773}",COMPLETE
33,0.6309875520667311,2026-10-01 08:38:55.071974,2026-10-01 08:38:57.419844,0 days 00:00:02.347870,0.5813696104197992,3.296071589293363,0.01195177526096256,5,2,400,uni_bi,normal,0.012875717411186776,0.3747371160525968,2.3128431585763134,0.8051267676266305,0.00978205863699836,,"{""colsample_bytree"": 0.5813696104197992, ""gamma"": 3.296071589293363, ""learning_rate"": 0.01195177526096256, ""max_depth"": 5, ""min_child_weight"": 2, ""n_estimators"": 400, ""ngramas"": ""uni_bi"", ""preprocessing"": ""normal"", ""reg_alpha"": 0.012875717411186776, ""reg_lambda"": 0.3747371160525968, ""scale_pos_weight"": 2.3128431585763134, ""subsample"": 0.8051267676266305}",COMPLETE
34,0.6266911532058317,2026-10-01 08:38:57.427870,2026-10-01 08:38:59.790304,0 days 00:00:02.362434,0.5311119930953873,4.355614201941354,0.014206220124956405,7,2,350,uni_bi,normal,0.038544087919328784,0.3262641901259042,2.4805192536663747,0.8324715885118144,0.020294118780268326,,"{""colsample_bytree"": 0.5311119930953873, ""gamma"": 4.355614201941354, ""learning_rate"": 0.014206220124956405, ""max_depth"": 7, ""min_child_weight"": 2, ""n_estimators"": 350, ""ngramas"": ""uni_bi"", ""preprocessing"": ""normal"", ""reg_alpha"": 0.038544087919328784, ""reg_lambda"": 0.3262641901259042, ""scale_pos_weight"": 2.4805192536663747, ""subsample"": 0.8324715885118144}",COMPLETE
35,0.6448460078691255,2026-10-01 08:38:59.797838,2026-10-01 08:39:02.373919,0 days 00:00:02.576081,0.518072287496287,4.73118965647101,0.018047158761502008,6,2,450,uni_bi,normal,0.017253606080125997,0.8481669888249876,2.301922065208954,0.7663101142464677,0.01139390521500802,,"{""colsample_bytree"": 0.518072287496287, ""gamma"": 4.73118965647101, ""learning_rate"": 0.018047158761502008, ""max_depth"": 6, ""min_child_weight"": 2, ""n_estimators"": 450, ""ngramas"": ""uni_bi"", ""preprocessing"": ""normal"", ""reg_alpha"": 0.017253606080125997, ""reg_lambda"": 0.8481669888249876, ""scale_pos_weight"": 2.301922065208954, ""subsample"": 0.7663101142464677}",COMPLETE
