number,value,datetime_start,datetime_complete,duration,params_colsample_bytree,params_gamma,params_learning_rate,params_max_depth,params_min_child_weight,params_n_estimators,params_ngramas,params_preprocessing,params_reg_alpha,params_reg_lambda,params_scale_pos_weight,params_subsample,user_attrs_inner_f1_std,system_attrs_fixed_params,system_attrs_tpe:relative_params:0,state
0,0.6698963537201399,2026-10-01 08:35:35.418283,2026-10-01 08:35:37.419321,0 days 00:00:02.001038,0.874894942995359,0.8214908626419793,0.02108688998712124,5,12,600,uni,normal,0.058005451785441836,12.595092659243525,1.6825058783901683,0.659576927471088,0.02477261633710026,"{'preprocessing': 'normal', 'ngramas': 'uni'}",,COMPLETE
1,0.657618712554284,2026-10-01 08:35:37.423341,2026-10-01 08:35:39.387924,0 days 00:00:01.964583,0.6294663307602683,1.280557979849662,0.035866902055082216,2,12,450,uni_bi,normal,1.6159658826251597,0.810065540991291,1.9416521323512845,0.8534784884637766,0.017763628117538812,"{'preprocessing': 'normal', 'ngramas': 'uni_bi'}",,COMPLETE
2,0.6694614835762729,2026-10-01 08:35:39.393320,2026-10-01 08:35:39.873836,0 days 00:00:00.480516,0.8962104825650745,3.4635901107729525,0.011534486580212257,3,7,150,uni,stem,0.016988578856135868,0.3226713059542976,1.741037537479581,0.641845318749869,0.028947983984920718,"{'preprocessing': 'stem', 'ngramas': 'uni'}",,COMPLETE
3,0.6224611193886905,2026-10-01 08:35:39.876680,2026-10-01 08:35:40.988065,0 days 00:00:01.111385,0.8450335877208167,1.1756394215003227,0.02021517501781213,3,15,150,uni_bi,stem,0.003944169826212177,3.5287034801585984,2.468487887218651,0.7654858555771249,0.034842445464480246,"{'preprocessing': 'stem', 'ngramas': 'uni_bi'}",,COMPLETE
4,0.6696932517235233,2026-10-01 08:35:40.992619,2026-10-01 08:35:41.636089,0 days 00:00:00.643470,0.602293369523341,1.7720582334980068,0.01189943945641824,7,12,150,uni,lemma,0.006032664691710865,0.175869492597536,1.7811844005832906,0.572611007331439,0.0066575962194255186,"{'preprocessing': 'lemma', 'ngramas': 'uni'}",,COMPLETE
5,0.6549291016461664,2026-10-01 08:35:41.640104,2026-10-01 08:35:42.996241,0 days 00:00:01.356137,0.5875891509501385,6.7688879679728275,0.015151899213942333,6,3,150,uni_bi,lemma,0.0010555987814221286,0.21942971082112142,2.0475157638097787,0.7003604072608834,0.009932475653013008,"{'preprocessing': 'lemma', 'ngramas': 'uni_bi'}",,COMPLETE
6,0.6600450958805154,2026-10-01 08:35:43.000255,2026-10-01 08:35:44.019025,0 days 00:00:01.018770,0.7856061586672805,4.149288284766351,0.028177381498663497,7,7,400,uni,stem,0.008530561236333053,3.517904764265231,1.8679820236787972,0.8401242507817004,0.011063010882455043,,,COMPLETE
7,0.6686444036625687,2026-10-01 08:35:44.021028,2026-10-01 08:35:44.692315,0 days 00:00:00.671287,0.7230670508362705,2.9919163027527325,0.11343900023857142,5,8,350,uni,stem,0.0035388339011866517,12.035327894400558,1.3431544340025008,0.7685020537144995,0.035536701934050126,,,COMPLETE
8,0.6467587975437793,2026-10-01 08:35:44.695919,2026-10-01 08:35:46.793684,0 days 00:00:02.097765,0.5315117615108721,5.861270996685928,0.04687303072292285,6,11,550,uni_bi,lemma,0.7834236484860668,0.11307393730252309,1.184410107210054,0.658676894974765,0.030582709003761,,,COMPLETE
9,0.6649330870144653,2026-10-01 08:35:46.798490,2026-10-01 08:35:48.856178,0 days 00:00:02.057688,0.5052526182824153,5.484751507084719,0.02051419574500176,6,4,400,uni_bi,lemma,0.022145633883549187,14.76355756770037,1.8926410761463255,0.5792307082785086,0.01734075301083014,,,COMPLETE
10,0.6706801452796038,2026-10-01 08:35:48.860812,2026-10-01 08:35:50.633724,0 days 00:00:01.772912,0.5487068827723444,0.6499840537386729,0.014831286893982335,6,14,650,uni,normal,0.03599808304598256,5.74476195717816,1.366017432198899,0.5552118575004176,0.009823451915486269,,"{""colsample_bytree"": 0.5487068827723444, ""gamma"": 0.6499840537386729, ""learning_rate"": 0.014831286893982335, ""max_depth"": 6, ""min_child_weight"": 14, ""n_estimators"": 650, ""ngramas"": ""uni"", ""preprocessing"": ""normal"", ""reg_alpha"": 0.03599808304598256, ""reg_lambda"": 5.74476195717816, ""scale_pos_weight"": 1.366017432198899, ""subsample"": 0.5552118575004176}",COMPLETE
11,0.6643808533811271,2026-10-01 08:35:50.637739,2026-10-01 08:35:54.201033,0 days 00:00:03.563294,0.6439331662990198,2.265323174239547,0.014880832315133985,7,14,600,uni_bi,normal,0.03212548214858132,7.155839428773426,1.3854578117491523,0.6347833406177943,0.00792027053184601,,"{""colsample_bytree"": 0.6439331662990198, ""gamma"": 2.265323174239547, ""learning_rate"": 0.014880832315133985, ""max_depth"": 7, ""min_child_weight"": 14, ""n_estimators"": 600, ""ngramas"": ""uni_bi"", ""preprocessing"": ""normal"", ""reg_alpha"": 0.03212548214858132, ""reg_lambda"": 7.155839428773426, ""scale_pos_weight"": 1.3854578117491523, ""subsample"": 0.6347833406177943}",COMPLETE
12,0.668331224525117,2026-10-01 08:35:54.205557,2026-10-01 08:35:56.488162,0 days 00:00:02.282605,0.8788946917327803,1.2265126908992463,0.012772653564445353,5,15,700,uni,normal,0.004866970478130748,8.073754986800262,1.8913005525409354,0.6904069471627758,0.021002448414032766,,"{""colsample_bytree"": 0.8788946917327803, ""gamma"": 1.2265126908992463, ""learning_rate"": 0.012772653564445353, ""max_depth"": 5, ""min_child_weight"": 15, ""n_estimators"": 700, ""ngramas"": ""uni"", ""preprocessing"": ""normal"", ""reg_alpha"": 0.004866970478130748, ""reg_lambda"": 8.073754986800262, ""scale_pos_weight"": 1.8913005525409354, ""subsample"": 0.6904069471627758}",COMPLETE
13,0.6752879135384147,2026-10-01 08:35:56.492171,2026-10-01 08:35:58.101318,0 days 00:00:01.609147,0.5187934487848828,0.5866979568870402,0.025807355168161374,6,15,600,uni,normal,0.017429711649290962,5.665022319770904,1.40336456948456,0.5865241731291582,0.01235263338646544,,"{""colsample_bytree"": 0.5187934487848828, ""gamma"": 0.5866979568870402, ""learning_rate"": 0.025807355168161374, ""max_depth"": 6, ""min_child_weight"": 15, ""n_estimators"": 600, ""ngramas"": ""uni"", ""preprocessing"": ""normal"", ""reg_alpha"": 0.017429711649290962, ""reg_lambda"": 5.665022319770904, ""scale_pos_weight"": 1.40336456948456, ""subsample"": 0.5865241731291582}",COMPLETE
14,0.6580641597688792,2026-10-01 08:35:58.105853,2026-10-01 08:35:59.623856,0 days 00:00:01.518003,0.5576795910994039,1.2018411019692528,0.02637708111897041,5,10,550,uni,normal,0.012599288432745376,2.0392114389429876,1.1744977060783768,0.5723422058465173,0.02667284356811718,,"{""colsample_bytree"": 0.5576795910994039, ""gamma"": 1.2018411019692528, ""learning_rate"": 0.02637708111897041, ""max_depth"": 5, ""min_child_weight"": 10, ""n_estimators"": 550, ""ngramas"": ""uni"", ""preprocessing"": ""normal"", ""reg_alpha"": 0.012599288432745376, ""reg_lambda"": 2.0392114389429876, ""scale_pos_weight"": 1.1744977060783768, ""subsample"": 0.5723422058465173}",COMPLETE
15,0.6622890865395414,2026-10-01 08:35:59.628018,2026-10-01 08:36:01.189339,0 days 00:00:01.561321,0.503849051192335,2.031079296547112,0.012799583743133667,6,13,700,uni,normal,0.6124942335154564,6.085735980335377,1.2245908099352398,0.6204374026353594,0.01631113588731614,,"{""colsample_bytree"": 0.503849051192335, ""gamma"": 2.031079296547112, ""learning_rate"": 0.012799583743133667, ""max_depth"": 6, ""min_child_weight"": 13, ""n_estimators"": 700, ""ngramas"": ""uni"", ""preprocessing"": ""normal"", ""reg_alpha"": 0.6124942335154564, ""reg_lambda"": 6.085735980335377, ""scale_pos_weight"": 1.2245908099352398, ""subsample"": 0.6204374026353594}",COMPLETE
16,0.6617331680580999,2026-10-01 08:36:01.195760,2026-10-01 08:36:03.770748,0 days 00:00:02.574988,0.5837843775065302,2.592300834800777,0.03790588721559503,6,15,550,uni_bi,normal,0.0067122217398280235,14.898041801922643,1.733540669415726,0.5903675487435599,0.0022217861165976086,,"{""colsample_bytree"": 0.5837843775065302, ""gamma"": 2.592300834800777, ""learning_rate"": 0.03790588721559503, ""max_depth"": 6, ""min_child_weight"": 15, ""n_estimators"": 550, ""ngramas"": ""uni_bi"", ""preprocessing"": ""normal"", ""reg_alpha"": 0.0067122217398280235, ""reg_lambda"": 14.898041801922643, ""scale_pos_weight"": 1.733540669415726, ""subsample"": 0.5903675487435599}",COMPLETE
17,0.6615209096263724,2026-10-01 08:36:03.774273,2026-10-01 08:36:05.028105,0 days 00:00:01.253832,0.5237112484564164,3.190625545046977,0.020233913020104657,7,14,600,uni,lemma,0.0036927156744836183,2.138064825821956,1.323155203086736,0.6638562667340427,0.003877417859920587,,"{""colsample_bytree"": 0.5237112484564164, ""gamma"": 3.190625545046977, ""learning_rate"": 0.020233913020104657, ""max_depth"": 7, ""min_child_weight"": 14, ""n_estimators"": 600, ""ngramas"": ""uni"", ""preprocessing"": ""lemma"", ""reg_alpha"": 0.0036927156744836183, ""reg_lambda"": 2.138064825821956, ""scale_pos_weight"": 1.323155203086736, ""subsample"": 0.6638562667340427}",COMPLETE
18,0.669873781581715,2026-10-01 08:36:05.033624,2026-10-01 08:36:06.294483,0 days 00:00:01.260859,0.5419226880581913,0.9393675969940158,0.01628115146941975,7,15,400,uni,normal,0.005622028885726744,1.6215819096784319,1.348645793064431,0.6416346234923892,0.011409813198892598,,"{""colsample_bytree"": 0.5419226880581913, ""gamma"": 0.9393675969940158, ""learning_rate"": 0.01628115146941975, ""max_depth"": 7, ""min_child_weight"": 15, ""n_estimators"": 400, ""ngramas"": ""uni"", ""preprocessing"": ""normal"", ""reg_alpha"": 0.005622028885726744, ""reg_lambda"": 1.6215819096784319, ""scale_pos_weight"": 1.348645793064431, ""subsample"": 0.6416346234923892}",COMPLETE
19,0.6760897571696011,2026-10-01 08:36:06.298437,2026-10-01 08:36:07.833895,0 days 00:00:01.535458,0.6037423512499032,2.1883571560921076,0.019155668117092906,6,12,700,uni,stem,0.19459680214475197,2.8474855438544755,1.3845501452096662,0.6012518406869869,0.021958448862597568,,"{""colsample_bytree"": 0.6037423512499032, ""gamma"": 2.1883571560921076, ""learning_rate"": 0.019155668117092906, ""max_depth"": 6, ""min_child_weight"": 12, ""n_estimators"": 700, ""ngramas"": ""uni"", ""preprocessing"": ""stem"", ""reg_alpha"": 0.19459680214475197, ""reg_lambda"": 2.8474855438544755, ""scale_pos_weight"": 1.3845501452096662, ""subsample"": 0.6012518406869869}",COMPLETE
20,0.675994290173656,2026-10-01 08:36:07.837907,2026-10-01 08:36:09.301746,0 days 00:00:01.463839,0.7530476170861576,2.6526153360791405,0.018111606795509723,6,12,650,uni,stem,0.1822351877122214,6.094502958259648,1.3421926457836941,0.5976228314569325,0.0294768812073928,,"{""colsample_bytree"": 0.7530476170861576, ""gamma"": 2.6526153360791405, ""learning_rate"": 0.018111606795509723, ""max_depth"": 6, ""min_child_weight"": 12, ""n_estimators"": 650, ""ngramas"": ""uni"", ""preprocessing"": ""stem"", ""reg_alpha"": 0.1822351877122214, ""reg_lambda"": 6.094502958259648, ""scale_pos_weight"": 1.3421926457836941, ""subsample"": 0.5976228314569325}",COMPLETE
21,0.664198769428128,2026-10-01 08:36:09.306265,2026-10-01 08:36:10.533698,0 days 00:00:01.227433,0.5576259820279003,2.151542094529734,0.04664664085168744,5,13,600,uni,normal,0.06730550406478662,9.578821422809304,1.2520795693544953,0.5527654933713939,0.006504459940015047,,"{""colsample_bytree"": 0.5576259820279003, ""gamma"": 2.151542094529734, ""learning_rate"": 0.04664664085168744, ""max_depth"": 5, ""min_child_weight"": 13, ""n_estimators"": 600, ""ngramas"": ""uni"", ""preprocessing"": ""normal"", ""reg_alpha"": 0.06730550406478662, ""reg_lambda"": 9.578821422809304, ""scale_pos_weight"": 1.2520795693544953, ""subsample"": 0.5527654933713939}",COMPLETE
22,0.6783905565695408,2026-10-01 08:36:10.540223,2026-10-01 08:36:11.927054,0 days 00:00:01.386831,0.5618071796054809,2.195952758099979,0.021365429218186606,5,12,700,uni,stem,0.09675055595451963,3.795511481987536,1.3576358566183007,0.5679170595606373,0.031963369786535016,,"{""colsample_bytree"": 0.5618071796054809, ""gamma"": 2.195952758099979, ""learning_rate"": 0.021365429218186606, ""max_depth"": 5, ""min_child_weight"": 12, ""n_estimators"": 700, ""ngramas"": ""uni"", ""preprocessing"": ""stem"", ""reg_alpha"": 0.09675055595451963, ""reg_lambda"": 3.795511481987536, ""scale_pos_weight"": 1.3576358566183007, ""subsample"": 0.5679170595606373}",COMPLETE
23,0.6805704251979453,2026-10-01 08:36:11.932616,2026-10-01 08:36:13.241700,0 days 00:00:01.309084,0.573822454863396,2.9921844090970717,0.010242629811907879,5,14,650,uni,stem,0.02304511537712224,3.6227694217823108,1.3350081547449963,0.5514867505995845,0.012456067852183969,,"{""colsample_bytree"": 0.573822454863396, ""gamma"": 2.9921844090970717, ""learning_rate"": 0.010242629811907879, ""max_depth"": 5, ""min_child_weight"": 14, ""n_estimators"": 650, ""ngramas"": ""uni"", ""preprocessing"": ""stem"", ""reg_alpha"": 0.02304511537712224, ""reg_lambda"": 3.6227694217823108, ""scale_pos_weight"": 1.3350081547449963, ""subsample"": 0.5514867505995845}",COMPLETE
24,0.6754008213965529,2026-10-01 08:36:13.247314,2026-10-01 08:36:14.613546,0 days 00:00:01.366232,0.5724778919760063,2.7640889737053276,0.015151030209657431,6,15,700,uni,stem,0.020439735828214754,3.9382175590247064,1.4360777177416142,0.6122770108637805,0.021551921400237914,,"{""colsample_bytree"": 0.5724778919760063, ""gamma"": 2.7640889737053276, ""learning_rate"": 0.015151030209657431, ""max_depth"": 6, ""min_child_weight"": 15, ""n_estimators"": 700, ""ngramas"": ""uni"", ""preprocessing"": ""stem"", ""reg_alpha"": 0.020439735828214754, ""reg_lambda"": 3.9382175590247064, ""scale_pos_weight"": 1.4360777177416142, ""subsample"": 0.6122770108637805}",COMPLETE
25,0.678612236113087,2026-10-01 08:36:14.619596,2026-10-01 08:36:16.051925,0 days 00:00:01.432329,0.5935307918299847,2.5375485647988314,0.01315147381885522,7,15,700,uni,stem,0.331736887500694,2.6161032972169624,1.4292807338707505,0.5728162779408307,0.023055240304850733,,"{""colsample_bytree"": 0.5935307918299847, ""gamma"": 2.5375485647988314, ""learning_rate"": 0.01315147381885522, ""max_depth"": 7, ""min_child_weight"": 15, ""n_estimators"": 700, ""ngramas"": ""uni"", ""preprocessing"": ""stem"", ""reg_alpha"": 0.331736887500694, ""reg_lambda"": 2.6161032972169624, ""scale_pos_weight"": 1.4292807338707505, ""subsample"": 0.5728162779408307}",COMPLETE
26,0.6604914196719848,2026-10-01 08:36:16.057955,2026-10-01 08:36:17.314181,0 days 00:00:01.256226,0.565767154274184,3.0555890455845844,0.014442535304475177,7,14,700,uni,stem,0.4347086921502374,1.9836640900737441,1.1203977620931813,0.6465838057647821,0.009741464748019296,,"{""colsample_bytree"": 0.565767154274184, ""gamma"": 3.0555890455845844, ""learning_rate"": 0.014442535304475177, ""max_depth"": 7, ""min_child_weight"": 14, ""n_estimators"": 700, ""ngramas"": ""uni"", ""preprocessing"": ""stem"", ""reg_alpha"": 0.4347086921502374, ""reg_lambda"": 1.9836640900737441, ""scale_pos_weight"": 1.1203977620931813, ""subsample"": 0.6465838057647821}",COMPLETE
27,0.6763113709353826,2026-10-01 08:36:17.320732,2026-10-01 08:36:18.610962,0 days 00:00:01.290230,0.5889095434784867,3.3959806165667095,0.019089742085326537,5,15,700,uni,stem,0.003869821251673755,3.4743783193086535,1.6638965695717998,0.5835824640519314,0.019612607550511037,,"{""colsample_bytree"": 0.5889095434784867, ""gamma"": 3.3959806165667095, ""learning_rate"": 0.019089742085326537, ""max_depth"": 5, ""min_child_weight"": 15, ""n_estimators"": 700, ""ngramas"": ""uni"", ""preprocessing"": ""stem"", ""reg_alpha"": 0.003869821251673755, ""reg_lambda"": 3.4743783193086535, ""scale_pos_weight"": 1.6638965695717998, ""subsample"": 0.5835824640519314}",COMPLETE
28,0.6745378698197994,2026-10-01 08:36:18.617212,2026-10-01 08:36:20.062982,0 days 00:00:01.445770,0.5595283565592856,1.646926886138699,0.015682826179888636,7,12,600,uni,stem,0.009203161694767825,2.241211927562931,1.2339287877274192,0.5755443391340511,0.022783219270154566,,"{""colsample_bytree"": 0.5595283565592856, ""gamma"": 1.646926886138699, ""learning_rate"": 0.015682826179888636, ""max_depth"": 7, ""min_child_weight"": 12, ""n_estimators"": 600, ""ngramas"": ""uni"", ""preprocessing"": ""stem"", ""reg_alpha"": 0.009203161694767825, ""reg_lambda"": 2.241211927562931, ""scale_pos_weight"": 1.2339287877274192, ""subsample"": 0.5755443391340511}",COMPLETE
29,0.6692334310476652,2026-10-01 08:36:20.068671,2026-10-01 08:36:21.278693,0 days 00:00:01.210022,0.6003751047326908,4.440495421160201,0.010451032504048548,6,13,650,uni,stem,0.41627179935079756,2.2104245573372485,1.259826737372449,0.5673761617699848,0.009615005333701129,,"{""colsample_bytree"": 0.6003751047326908, ""gamma"": 4.440495421160201, ""learning_rate"": 0.010451032504048548, ""max_depth"": 6, ""min_child_weight"": 13, ""n_estimators"": 650, ""ngramas"": ""uni"", ""preprocessing"": ""stem"", ""reg_alpha"": 0.41627179935079756, ""reg_lambda"": 2.2104245573372485, ""scale_pos_weight"": 1.259826737372449, ""subsample"": 0.5673761617699848}",COMPLETE
30,0.6737321358774295,2026-10-01 08:36:21.286034,2026-10-01 08:36:22.469191,0 days 00:00:01.183157,0.5924445313284924,2.3171473199833508,0.038360497705828736,7,14,650,uni,stem,0.46592955692775884,1.2801317114693076,1.291685281837606,0.576771206722397,0.015596934283373602,,"{""colsample_bytree"": 0.5924445313284924, ""gamma"": 2.3171473199833508, ""learning_rate"": 0.038360497705828736, ""max_depth"": 7, ""min_child_weight"": 14, ""n_estimators"": 650, ""ngramas"": ""uni"", ""preprocessing"": ""stem"", ""reg_alpha"": 0.46592955692775884, ""reg_lambda"": 1.2801317114693076, ""scale_pos_weight"": 1.291685281837606, ""subsample"": 0.576771206722397}",COMPLETE
31,0.6731422026842221,2026-10-01 08:36:22.476733,2026-10-01 08:36:23.812537,0 days 00:00:01.335804,0.5790518515036337,2.8328925046710878,0.014912066023651051,4,9,650,uni,stem,0.10941267148983912,7.897751732448847,1.512869233125717,0.5916433393111321,0.0309847665837591,,"{""colsample_bytree"": 0.5790518515036337, ""gamma"": 2.8328925046710878, ""learning_rate"": 0.014912066023651051, ""max_depth"": 4, ""min_child_weight"": 9, ""n_estimators"": 650, ""ngramas"": ""uni"", ""preprocessing"": ""stem"", ""reg_alpha"": 0.10941267148983912, ""reg_lambda"": 7.897751732448847, ""scale_pos_weight"": 1.512869233125717, ""subsample"": 0.5916433393111321}",COMPLETE
32,0.6788776891563192,2026-10-01 08:36:23.819581,2026-10-01 08:36:24.933698,0 days 00:00:01.114117,0.5477781608395089,4.065039470127742,0.01959467416567502,6,14,650,uni,stem,0.03252724514751976,4.030932507955952,1.4687976380470182,0.56521033806119,0.027147348437618516,,"{""colsample_bytree"": 0.5477781608395089, ""gamma"": 4.065039470127742, ""learning_rate"": 0.01959467416567502, ""max_depth"": 6, ""min_child_weight"": 14, ""n_estimators"": 650, ""ngramas"": ""uni"", ""preprocessing"": ""stem"", ""reg_alpha"": 0.03252724514751976, ""reg_lambda"": 4.030932507955952, ""scale_pos_weight"": 1.4687976380470182, ""subsample"": 0.56521033806119}",COMPLETE
33,0.6702253226521758,2026-10-01 08:36:24.939714,2026-10-01 08:36:26.023653,0 days 00:00:01.083939,0.519586746430145,3.2500575283520456,0.023282131164576763,6,15,650,uni,stem,0.03743939825071183,2.0764139546485203,1.2768536080631545,0.5865102954839488,0.01044483278691447,,"{""colsample_bytree"": 0.519586746430145, ""gamma"": 3.2500575283520456, ""learning_rate"": 0.023282131164576763, ""max_depth"": 6, ""min_child_weight"": 15, ""n_estimators"": 650, ""ngramas"": ""uni"", ""preprocessing"": ""stem"", ""reg_alpha"": 0.03743939825071183, ""reg_lambda"": 2.0764139546485203, ""scale_pos_weight"": 1.2768536080631545, ""subsample"": 0.5865102954839488}",COMPLETE
34,0.6778282743886012,2026-10-01 08:36:26.030932,2026-10-01 08:36:27.185778,0 days 00:00:01.154846,0.5752075959125668,4.303977563868997,0.02466066221316165,6,11,700,uni,stem,0.15468678155564447,2.217965705943308,1.3239480465029234,0.5529746525131605,0.021353165967192913,,"{""colsample_bytree"": 0.5752075959125668, ""gamma"": 4.303977563868997, ""learning_rate"": 0.02466066221316165, ""max_depth"": 6, ""min_child_weight"": 11, ""n_estimators"": 700, ""ngramas"": ""uni"", ""preprocessing"": ""stem"", ""reg_alpha"": 0.15468678155564447, ""reg_lambda"": 2.217965705943308, ""scale_pos_weight"": 1.3239480465029234, ""subsample"": 0.5529746525131605}",COMPLETE
35,0.6716141432068218,2026-10-01 08:36:27.191787,2026-10-01 08:36:28.515235,0 days 00:00:01.323448,0.6167373170425497,3.050945801822755,0.018974103067141854,6,15,700,uni,stem,0.5197929764614133,3.190006858919176,1.5556785312348342,0.6442119392642065,0.026408876441099193,,"{""colsample_bytree"": 0.6167373170425497, ""gamma"": 3.050945801822755, ""learning_rate"": 0.018974103067141854, ""max_depth"": 6, ""min_child_weight"": 15, ""n_estimators"": 700, ""ngramas"": ""uni"", ""preprocessing"": ""stem"", ""reg_alpha"": 0.5197929764614133, ""reg_lambda"": 3.190006858919176, ""scale_pos_weight"": 1.5556785312348342, ""subsample"": 0.6442119392642065}",COMPLETE
36,0.6760328852635705,2026-10-01 08:36:28.523264,2026-10-01 08:36:29.759039,0 days 00:00:01.235775,0.5146907561294727,2.798155904211436,0.020336216119774726,6,12,700,uni,stem,0.25962575272883653,5.660185289429519,1.309950589308398,0.5857504215812082,0.02802486196410418,,"{""colsample_bytree"": 0.5146907561294727, ""gamma"": 2.798155904211436, ""learning_rate"": 0.020336216119774726, ""max_depth"": 6, ""min_child_weight"": 12, ""n_estimators"": 700, ""ngramas"": ""uni"", ""preprocessing"": ""stem"", ""reg_alpha"": 0.25962575272883653, ""reg_lambda"": 5.660185289429519, ""scale_pos_weight"": 1.309950589308398, ""subsample"": 0.5857504215812082}",COMPLETE
