number,value,datetime_start,datetime_complete,duration,params_colsample_bytree,params_gamma,params_learning_rate,params_max_depth,params_min_child_weight,params_n_estimators,params_ngramas,params_preprocessing,params_reg_alpha,params_reg_lambda,params_scale_pos_weight,params_subsample,user_attrs_cv_f1_std,system_attrs_fixed_params,system_attrs_tpe:relative_params:0,state
0,0.6675418902975664,2026-10-01 08:49:06.795510,2026-10-01 08:49:08.311851,0 days 00:00:01.516341,0.562397808134481,0.9356270912614959,0.08960785365368121,7,10,350,uni,normal,2.9154431891537547,2.416482602989751,2.0621088666940683,0.6046065241548528,0.023077759570623173,"{'preprocessing': 'normal', 'ngramas': 'uni'}",,COMPLETE
1,0.6731067133900887,2026-10-01 08:49:08.316086,2026-10-01 08:49:09.616138,0 days 00:00:01.300052,0.5733618039413735,2.781816822196533,0.12106896936002161,7,4,150,uni_bi,normal,0.12561043700013558,0.9860942908083906,1.4368437102970628,0.6136387385224853,0.024553404771270507,"{'preprocessing': 'normal', 'ngramas': 'uni_bi'}",,COMPLETE
2,0.6645537212310754,2026-10-01 08:49:09.618379,2026-10-01 08:49:10.757472,0 days 00:00:01.139093,0.8140703845572055,1.997553366187698,0.023993242906812727,2,7,500,uni,stem,0.11400863701127326,2.3076168040117313,1.0696756190799965,0.7096244944759627,0.013826292809118542,"{'preprocessing': 'stem', 'ngramas': 'uni'}",,COMPLETE
3,0.6815747037181463,2026-10-01 08:49:10.759484,2026-10-01 08:49:14.044625,0 days 00:00:03.285141,0.8233589392465845,2.78460326880028,0.012151617026673379,3,15,500,uni_bi,stem,0.002458603276328005,3.753537145233125,1.6602287406094018,0.8879712115760958,0.021785290936864075,"{'preprocessing': 'stem', 'ngramas': 'uni_bi'}",,COMPLETE
4,0.6567086736462898,2026-10-01 08:49:14.048632,2026-10-01 08:49:14.816845,0 days 00:00:00.768213,0.7650089137415927,2.837833070670582,0.011085122517311707,4,14,200,uni,lemma,0.12030178871154672,1.811326544803338,1.2772816832882905,0.640572993560006,0.006084795257644466,"{'preprocessing': 'lemma', 'ngramas': 'uni'}",,COMPLETE
5,0.6502032387284641,2026-10-01 08:49:14.820852,2026-10-01 08:49:20.207013,0 days 00:00:05.386161,0.8687496940092467,1.1636937653893962,0.16684619386293467,6,14,700,uni_bi,lemma,0.006080390190296602,0.12707770074499689,1.4879954961448965,0.7592649925838798,0.037092399477053326,"{'preprocessing': 'lemma', 'ngramas': 'uni_bi'}",,COMPLETE
6,0.6821748871301452,2026-10-01 08:49:20.211026,2026-10-01 08:49:21.350486,0 days 00:00:01.139460,0.808897907718663,1.9903676115062932,0.11058146376563001,2,3,450,uni,lemma,0.0010521761868451127,7.52317574354701,2.0602860157714256,0.8954104278101811,0.023826886779950616,,,COMPLETE
7,0.6889156925763412,2026-10-01 08:49:21.352489,2026-10-01 08:49:22.659144,0 days 00:00:01.306655,0.6300733288106988,5.97204633753548,0.026946865572417687,5,2,650,uni,stem,0.35500125258511606,11.00279783199859,1.7083223877429239,0.6588438126004819,0.024983168772342506,,,COMPLETE
8,0.6648748011759155,2026-10-01 08:49:22.663174,2026-10-01 08:49:25.206639,0 days 00:00:02.543465,0.5125716742746937,5.273078084478353,0.035995125264172326,5,2,400,uni_bi,lemma,0.018089390092767135,1.4799137841422207,2.3613497108891393,0.5877619994476566,0.03014509320416034,,,COMPLETE
9,0.6794407132888748,2026-10-01 08:49:25.210646,2026-10-01 08:49:25.954250,0 days 00:00:00.743604,0.848584236075087,6.527540576743358,0.16201847221720986,2,13,300,uni,lemma,0.005575453980775369,11.31892099052994,1.8090133628734761,0.7716913147786483,0.02958272775868581,,,COMPLETE
10,0.6732115666933055,2026-10-01 08:49:25.959573,2026-10-01 08:49:27.475442,0 days 00:00:01.515869,0.6270257347982706,2.2750627415819586,0.014613388917947915,5,6,500,uni,stem,3.4883924182294566,8.736712332929269,2.1855207009078055,0.5694125977595033,0.032503134828495456,,"{""colsample_bytree"": 0.6270257347982706, ""gamma"": 2.2750627415819586, ""learning_rate"": 0.014613388917947915, ""max_depth"": 5, ""min_child_weight"": 6, ""n_estimators"": 500, ""ngramas"": ""uni"", ""preprocessing"": ""stem"", ""reg_alpha"": 3.4883924182294566, ""reg_lambda"": 8.736712332929269, ""scale_pos_weight"": 2.1855207009078055, ""subsample"": 0.5694125977595033}",COMPLETE
11,0.6774192565827551,2026-10-01 08:49:27.481452,2026-10-01 08:49:28.796293,0 days 00:00:01.314841,0.8968510090889494,4.3198791208291265,0.10339589292027135,5,2,500,uni,lemma,0.33751189279402294,9.87758239168426,1.9983956737532214,0.6621032724591444,0.02875076934153122,,"{""colsample_bytree"": 0.8968510090889494, ""gamma"": 4.3198791208291265, ""learning_rate"": 0.10339589292027135, ""max_depth"": 5, ""min_child_weight"": 2, ""n_estimators"": 500, ""ngramas"": ""uni"", ""preprocessing"": ""lemma"", ""reg_alpha"": 0.33751189279402294, ""reg_lambda"": 9.87758239168426, ""scale_pos_weight"": 1.9983956737532214, ""subsample"": 0.6621032724591444}",COMPLETE
12,0.6755764194248831,2026-10-01 08:49:28.800917,2026-10-01 08:49:29.563042,0 days 00:00:00.762125,0.7399267326989238,2.8128456401481086,0.023775364936984938,2,4,250,uni,lemma,0.0012683583268716704,2.218720441254137,1.9378326706721576,0.8030287031455701,0.0261984665392204,,"{""colsample_bytree"": 0.7399267326989238, ""gamma"": 2.8128456401481086, ""learning_rate"": 0.023775364936984938, ""max_depth"": 2, ""min_child_weight"": 4, ""n_estimators"": 250, ""ngramas"": ""uni"", ""preprocessing"": ""lemma"", ""reg_alpha"": 0.0012683583268716704, ""reg_lambda"": 2.218720441254137, ""scale_pos_weight"": 1.9378326706721576, ""subsample"": 0.8030287031455701}",COMPLETE
13,0.6802189013991908,2026-10-01 08:49:29.569462,2026-10-01 08:49:30.730567,0 days 00:00:01.161105,0.797513953535997,5.038957677411739,0.030241378843967583,4,6,600,uni,stem,8.354969644118716,14.746587656326092,1.50071175814078,0.8295837214656672,0.02252400622265821,,"{""colsample_bytree"": 0.797513953535997, ""gamma"": 5.038957677411739, ""learning_rate"": 0.030241378843967583, ""max_depth"": 4, ""min_child_weight"": 6, ""n_estimators"": 600, ""ngramas"": ""uni"", ""preprocessing"": ""stem"", ""reg_alpha"": 8.354969644118716, ""reg_lambda"": 14.746587656326092, ""scale_pos_weight"": 1.50071175814078, ""subsample"": 0.8295837214656672}",COMPLETE
14,0.6797711625332008,2026-10-01 08:49:30.736214,2026-10-01 08:49:31.925615,0 days 00:00:01.189401,0.7370961412096397,1.2925357227937515,0.05825582006543167,2,6,500,uni,lemma,0.011580824100689993,10.132446650521098,1.7972093234906388,0.7367250916100896,0.0316541205969853,,"{""colsample_bytree"": 0.7370961412096397, ""gamma"": 1.2925357227937515, ""learning_rate"": 0.05825582006543167, ""max_depth"": 2, ""min_child_weight"": 6, ""n_estimators"": 500, ""ngramas"": ""uni"", ""preprocessing"": ""lemma"", ""reg_alpha"": 0.011580824100689993, ""reg_lambda"": 10.132446650521098, ""scale_pos_weight"": 1.7972093234906388, ""subsample"": 0.7367250916100896}",COMPLETE
15,0.6943049509412559,2026-10-01 08:49:31.931626,2026-10-01 08:49:33.194288,0 days 00:00:01.262662,0.6057768015919364,3.5386034590172097,0.04078597363200068,2,3,650,uni,stem,0.0028768303272103685,4.646144896864637,1.8166761105614828,0.6043846789234761,0.018745165849284554,,"{""colsample_bytree"": 0.6057768015919364, ""gamma"": 3.5386034590172097, ""learning_rate"": 0.04078597363200068, ""max_depth"": 2, ""min_child_weight"": 3, ""n_estimators"": 650, ""ngramas"": ""uni"", ""preprocessing"": ""stem"", ""reg_alpha"": 0.0028768303272103685, ""reg_lambda"": 4.646144896864637, ""scale_pos_weight"": 1.8166761105614828, ""subsample"": 0.6043846789234761}",COMPLETE
16,0.6811565984572828,2026-10-01 08:49:33.200743,2026-10-01 08:49:34.366319,0 days 00:00:01.165576,0.6620901082817865,6.4959653427776205,0.015060175731276276,3,4,600,uni,stem,8.511397256223137,6.737538950425533,1.5750030933413095,0.6119699924406554,0.025157588218827756,,"{""colsample_bytree"": 0.6620901082817865, ""gamma"": 6.4959653427776205, ""learning_rate"": 0.015060175731276276, ""max_depth"": 3, ""min_child_weight"": 4, ""n_estimators"": 600, ""ngramas"": ""uni"", ""preprocessing"": ""stem"", ""reg_alpha"": 8.511397256223137, ""reg_lambda"": 6.737538950425533, ""scale_pos_weight"": 1.5750030933413095, ""subsample"": 0.6119699924406554}",COMPLETE
17,0.6875456719755239,2026-10-01 08:49:34.371595,2026-10-01 08:49:38.744353,0 days 00:00:04.372758,0.6466674680626305,2.5624234614464947,0.03113377136356381,5,2,700,uni_bi,stem,0.06494457962579048,12.28105992702691,1.6671030113842034,0.6936514517275307,0.017866802078055882,,"{""colsample_bytree"": 0.6466674680626305, ""gamma"": 2.5624234614464947, ""learning_rate"": 0.03113377136356381, ""max_depth"": 5, ""min_child_weight"": 2, ""n_estimators"": 700, ""ngramas"": ""uni_bi"", ""preprocessing"": ""stem"", ""reg_alpha"": 0.06494457962579048, ""reg_lambda"": 12.28105992702691, ""scale_pos_weight"": 1.6671030113842034, ""subsample"": 0.6936514517275307}",COMPLETE
18,0.6759977695949969,2026-10-01 08:49:38.751023,2026-10-01 08:49:40.630272,0 days 00:00:01.879249,0.5639700611178837,2.6047251826306894,0.036677221410700095,7,6,700,uni,stem,0.6823342400685987,1.3187289059899185,1.8340321720333663,0.674482621751882,0.005252106122793848,,"{""colsample_bytree"": 0.5639700611178837, ""gamma"": 2.6047251826306894, ""learning_rate"": 0.036677221410700095, ""max_depth"": 7, ""min_child_weight"": 6, ""n_estimators"": 700, ""ngramas"": ""uni"", ""preprocessing"": ""stem"", ""reg_alpha"": 0.6823342400685987, ""reg_lambda"": 1.3187289059899185, ""scale_pos_weight"": 1.8340321720333663, ""subsample"": 0.674482621751882}",COMPLETE
19,0.6935389765216667,2026-10-01 08:49:40.634802,2026-10-01 08:49:41.698944,0 days 00:00:01.064142,0.5000043540571573,5.588729647106824,0.0806688903938627,3,3,650,uni,stem,0.01661247180139337,6.76408050277963,1.4929941877025887,0.5931817669190818,0.025383319619694675,,"{""colsample_bytree"": 0.5000043540571573, ""gamma"": 5.588729647106824, ""learning_rate"": 0.0806688903938627, ""max_depth"": 3, ""min_child_weight"": 3, ""n_estimators"": 650, ""ngramas"": ""uni"", ""preprocessing"": ""stem"", ""reg_alpha"": 0.01661247180139337, ""reg_lambda"": 6.76408050277963, ""scale_pos_weight"": 1.4929941877025887, ""subsample"": 0.5931817669190818}",COMPLETE
20,0.6922256806612532,2026-10-01 08:49:41.707069,2026-10-01 08:49:42.887224,0 days 00:00:01.180155,0.621226266040594,5.781856032197372,0.03458030516474267,4,3,600,uni,stem,0.015466906619299775,10.049544284272393,1.6021795455632726,0.556530205875474,0.025224379884157967,,"{""colsample_bytree"": 0.621226266040594, ""gamma"": 5.781856032197372, ""learning_rate"": 0.03458030516474267, ""max_depth"": 4, ""min_child_weight"": 3, ""n_estimators"": 600, ""ngramas"": ""uni"", ""preprocessing"": ""stem"", ""reg_alpha"": 0.015466906619299775, ""reg_lambda"": 10.049544284272393, ""scale_pos_weight"": 1.6021795455632726, ""subsample"": 0.556530205875474}",COMPLETE
21,0.6925843338639615,2026-10-01 08:49:42.893235,2026-10-01 08:49:43.967962,0 days 00:00:01.074727,0.5414226521480056,5.596865015840053,0.03705795504957224,4,2,550,uni,stem,0.00368718677722095,7.461343092615772,1.4675787819032167,0.6090036776047191,0.022462406554605595,,"{""colsample_bytree"": 0.5414226521480056, ""gamma"": 5.596865015840053, ""learning_rate"": 0.03705795504957224, ""max_depth"": 4, ""min_child_weight"": 2, ""n_estimators"": 550, ""ngramas"": ""uni"", ""preprocessing"": ""stem"", ""reg_alpha"": 0.00368718677722095, ""reg_lambda"": 7.461343092615772, ""scale_pos_weight"": 1.4675787819032167, ""subsample"": 0.6090036776047191}",COMPLETE
22,0.6876562988285829,2026-10-01 08:49:43.973761,2026-10-01 08:49:45.184684,0 days 00:00:01.210923,0.5311818531879189,6.875520130641564,0.045562709885135826,3,2,700,uni,stem,0.013966968228470076,2.054103990213204,1.232033698050705,0.6455051519044294,0.013640773679766923,,"{""colsample_bytree"": 0.5311818531879189, ""gamma"": 6.875520130641564, ""learning_rate"": 0.045562709885135826, ""max_depth"": 3, ""min_child_weight"": 2, ""n_estimators"": 700, ""ngramas"": ""uni"", ""preprocessing"": ""stem"", ""reg_alpha"": 0.013966968228470076, ""reg_lambda"": 2.054103990213204, ""scale_pos_weight"": 1.232033698050705, ""subsample"": 0.6455051519044294}",COMPLETE
23,0.6966840663300218,2026-10-01 08:49:45.190958,2026-10-01 08:49:46.338755,0 days 00:00:01.147797,0.646844174182618,3.910428777867793,0.019771286153440207,2,2,550,uni,stem,0.0021064058473546973,3.92510911740115,1.6276822333426444,0.6297427901713866,0.028200291473683112,,"{""colsample_bytree"": 0.646844174182618, ""gamma"": 3.910428777867793, ""learning_rate"": 0.019771286153440207, ""max_depth"": 2, ""min_child_weight"": 2, ""n_estimators"": 550, ""ngramas"": ""uni"", ""preprocessing"": ""stem"", ""reg_alpha"": 0.0021064058473546973, ""reg_lambda"": 3.92510911740115, ""scale_pos_weight"": 1.6276822333426444, ""subsample"": 0.6297427901713866}",COMPLETE
24,0.6884033625858135,2026-10-01 08:49:46.344270,2026-10-01 08:49:47.670362,0 days 00:00:01.326092,0.6048231134618635,2.413961104301053,0.04786357277282069,2,5,700,uni,stem,0.015717097392708497,5.935992267081206,1.7954294396532704,0.5583707694709288,0.022603226628437886,,"{""colsample_bytree"": 0.6048231134618635, ""gamma"": 2.413961104301053, ""learning_rate"": 0.04786357277282069, ""max_depth"": 2, ""min_child_weight"": 5, ""n_estimators"": 700, ""ngramas"": ""uni"", ""preprocessing"": ""stem"", ""reg_alpha"": 0.015717097392708497, ""reg_lambda"": 5.935992267081206, ""scale_pos_weight"": 1.7954294396532704, ""subsample"": 0.5583707694709288}",COMPLETE
25,0.6943269832190335,2026-10-01 08:49:47.676400,2026-10-01 08:49:49.068072,0 days 00:00:01.391672,0.6177437905854831,3.781207763640727,0.01618039317379185,3,5,600,uni,stem,0.0015722529520891002,3.8123842598211706,1.7348509034779414,0.5894715773294446,0.025096250754307624,,"{""colsample_bytree"": 0.6177437905854831, ""gamma"": 3.781207763640727, ""learning_rate"": 0.01618039317379185, ""max_depth"": 3, ""min_child_weight"": 5, ""n_estimators"": 600, ""ngramas"": ""uni"", ""preprocessing"": ""stem"", ""reg_alpha"": 0.0015722529520891002, ""reg_lambda"": 3.8123842598211706, ""scale_pos_weight"": 1.7348509034779414, ""subsample"": 0.5894715773294446}",COMPLETE
26,0.6990080356435486,2026-10-01 08:49:49.076055,2026-10-01 08:49:50.484937,0 days 00:00:01.408882,0.51730588953813,2.102639461479323,0.024894242495474898,2,2,700,uni,stem,0.0016529015746029228,2.8100252121263356,1.7725351660365676,0.6131964421719047,0.027172254777668006,,"{""colsample_bytree"": 0.51730588953813, ""gamma"": 2.102639461479323, ""learning_rate"": 0.024894242495474898, ""max_depth"": 2, ""min_child_weight"": 2, ""n_estimators"": 700, ""ngramas"": ""uni"", ""preprocessing"": ""stem"", ""reg_alpha"": 0.0016529015746029228, ""reg_lambda"": 2.8100252121263356, ""scale_pos_weight"": 1.7725351660365676, ""subsample"": 0.6131964421719047}",COMPLETE
27,0.6902379636999852,2026-10-01 08:49:50.491812,2026-10-01 08:49:51.813363,0 days 00:00:01.321551,0.5866700744597639,2.0624118728027727,0.0467547245002642,2,5,700,uni,stem,0.001347634501437593,3.8727698557790196,1.9278084851247863,0.7074063776913093,0.017303220552230034,,"{""colsample_bytree"": 0.5866700744597639, ""gamma"": 2.0624118728027727, ""learning_rate"": 0.0467547245002642, ""max_depth"": 2, ""min_child_weight"": 5, ""n_estimators"": 700, ""ngramas"": ""uni"", ""preprocessing"": ""stem"", ""reg_alpha"": 0.001347634501437593, ""reg_lambda"": 3.8727698557790196, ""scale_pos_weight"": 1.9278084851247863, ""subsample"": 0.7074063776913093}",COMPLETE
28,0.6884348689350093,2026-10-01 08:49:51.821165,2026-10-01 08:49:53.145775,0 days 00:00:01.324610,0.5363010800069486,0.9749885703586558,0.0422401170086396,2,2,700,uni,stem,0.010295152867700105,1.283336514582894,1.5680259082187449,0.642398427020927,0.012643630680015557,,"{""colsample_bytree"": 0.5363010800069486, ""gamma"": 0.9749885703586558, ""learning_rate"": 0.0422401170086396, ""max_depth"": 2, ""min_child_weight"": 2, ""n_estimators"": 700, ""ngramas"": ""uni"", ""preprocessing"": ""stem"", ""reg_alpha"": 0.010295152867700105, ""reg_lambda"": 1.283336514582894, ""scale_pos_weight"": 1.5680259082187449, ""subsample"": 0.642398427020927}",COMPLETE
29,0.6924376046943713,2026-10-01 08:49:53.153973,2026-10-01 08:49:54.264064,0 days 00:00:01.110091,0.5975534141251656,3.668756359196795,0.025103264062303395,2,2,550,uni,stem,0.0011561464842449987,3.158967611089738,1.9293222795729794,0.5702405745815871,0.031044043909380117,,"{""colsample_bytree"": 0.5975534141251656, ""gamma"": 3.668756359196795, ""learning_rate"": 0.025103264062303395, ""max_depth"": 2, ""min_child_weight"": 2, ""n_estimators"": 550, ""ngramas"": ""uni"", ""preprocessing"": ""stem"", ""reg_alpha"": 0.0011561464842449987, ""reg_lambda"": 3.158967611089738, ""scale_pos_weight"": 1.9293222795729794, ""subsample"": 0.5702405745815871}",COMPLETE
30,0.6868834138440566,2026-10-01 08:49:54.271190,2026-10-01 08:49:55.466615,0 days 00:00:01.195425,0.5881267440983966,3.0088185845166255,0.0293709433369203,3,3,500,uni,stem,0.00828899047668312,2.6365273708405437,1.9124524075853042,0.5519355215861844,0.026148619949079417,,"{""colsample_bytree"": 0.5881267440983966, ""gamma"": 3.0088185845166255, ""learning_rate"": 0.0293709433369203, ""max_depth"": 3, ""min_child_weight"": 3, ""n_estimators"": 500, ""ngramas"": ""uni"", ""preprocessing"": ""stem"", ""reg_alpha"": 0.00828899047668312, ""reg_lambda"": 2.6365273708405437, ""scale_pos_weight"": 1.9124524075853042, ""subsample"": 0.5519355215861844}",COMPLETE
31,0.6957002111398073,2026-10-01 08:49:55.473728,2026-10-01 08:49:56.896530,0 days 00:00:01.422802,0.5944877100347983,3.1225306732151337,0.014724345860365324,3,4,600,uni,stem,0.0011433240821811083,3.414320643593573,1.5372060645520216,0.6846219724663993,0.021806060048503273,,"{""colsample_bytree"": 0.5944877100347983, ""gamma"": 3.1225306732151337, ""learning_rate"": 0.014724345860365324, ""max_depth"": 3, ""min_child_weight"": 4, ""n_estimators"": 600, ""ngramas"": ""uni"", ""preprocessing"": ""stem"", ""reg_alpha"": 0.0011433240821811083, ""reg_lambda"": 3.414320643593573, ""scale_pos_weight"": 1.5372060645520216, ""subsample"": 0.6846219724663993}",COMPLETE
32,0.6981360379327209,2026-10-01 08:49:56.901790,2026-10-01 08:49:58.417559,0 days 00:00:01.515769,0.616761960388717,3.587200704529508,0.02057806591647351,4,2,550,uni,stem,0.004406468322150738,4.3037667063982505,1.578408202519029,0.6032433119847479,0.02525825869480978,,"{""colsample_bytree"": 0.616761960388717, ""gamma"": 3.587200704529508, ""learning_rate"": 0.02057806591647351, ""max_depth"": 4, ""min_child_weight"": 2, ""n_estimators"": 550, ""ngramas"": ""uni"", ""preprocessing"": ""stem"", ""reg_alpha"": 0.004406468322150738, ""reg_lambda"": 4.3037667063982505, ""scale_pos_weight"": 1.578408202519029, ""subsample"": 0.6032433119847479}",COMPLETE
33,0.6949014170877114,2026-10-01 08:49:58.425428,2026-10-01 08:49:59.675463,0 days 00:00:01.250035,0.5518913532111864,2.6190939950216015,0.01974728033638741,3,5,550,uni,stem,0.0027050707443912335,1.793805219921963,1.7328399643905836,0.6230727778620221,0.025496231730433763,,"{""colsample_bytree"": 0.5518913532111864, ""gamma"": 2.6190939950216015, ""learning_rate"": 0.01974728033638741, ""max_depth"": 3, ""min_child_weight"": 5, ""n_estimators"": 550, ""ngramas"": ""uni"", ""preprocessing"": ""stem"", ""reg_alpha"": 0.0027050707443912335, ""reg_lambda"": 1.793805219921963, ""scale_pos_weight"": 1.7328399643905836, ""subsample"": 0.6230727778620221}",COMPLETE
34,0.6950631681506239,2026-10-01 08:49:59.681475,2026-10-01 08:50:00.979420,0 days 00:00:01.297945,0.5703553944160549,3.655116651201205,0.016803565304971502,3,3,550,uni,stem,0.004589632233048882,4.0153951667123575,1.4603800125639892,0.7065778742437384,0.023436061331356353,,"{""colsample_bytree"": 0.5703553944160549, ""gamma"": 3.655116651201205, ""learning_rate"": 0.016803565304971502, ""max_depth"": 3, ""min_child_weight"": 3, ""n_estimators"": 550, ""ngramas"": ""uni"", ""preprocessing"": ""stem"", ""reg_alpha"": 0.004589632233048882, ""reg_lambda"": 4.0153951667123575, ""scale_pos_weight"": 1.4603800125639892, ""subsample"": 0.7065778742437384}",COMPLETE
35,0.6917724349653133,2026-10-01 08:50:00.987691,2026-10-01 08:50:02.510815,0 days 00:00:01.523124,0.6092498650562044,2.8034910881276742,0.021514910540046898,3,5,650,uni,stem,0.0019449403910705026,3.710265672019358,1.8909661738038341,0.6578895973248504,0.028585265400663157,,"{""colsample_bytree"": 0.6092498650562044, ""gamma"": 2.8034910881276742, ""learning_rate"": 0.021514910540046898, ""max_depth"": 3, ""min_child_weight"": 5, ""n_estimators"": 650, ""ngramas"": ""uni"", ""preprocessing"": ""stem"", ""reg_alpha"": 0.0019449403910705026, ""reg_lambda"": 3.710265672019358, ""scale_pos_weight"": 1.8909661738038341, ""subsample"": 0.6578895973248504}",COMPLETE
36,0.69925604733239,2026-10-01 08:50:02.518879,2026-10-01 08:50:03.825007,0 days 00:00:01.306128,0.5292445115087188,2.331320952030755,0.029595791898257007,2,2,700,uni,stem,0.0053515993072898935,4.877029836343556,1.7408985052713344,0.5919158980589992,0.02611821105384694,,"{""colsample_bytree"": 0.5292445115087188, ""gamma"": 2.331320952030755, ""learning_rate"": 0.029595791898257007, ""max_depth"": 2, ""min_child_weight"": 2, ""n_estimators"": 700, ""ngramas"": ""uni"", ""preprocessing"": ""stem"", ""reg_alpha"": 0.0053515993072898935, ""reg_lambda"": 4.877029836343556, ""scale_pos_weight"": 1.7408985052713344, ""subsample"": 0.5919158980589992}",COMPLETE
