number,value,datetime_start,datetime_complete,duration,params_colsample_bytree,params_gamma,params_learning_rate,params_max_depth,params_min_child_weight,params_n_estimators,params_ngramas,params_preprocessing,params_reg_alpha,params_reg_lambda,params_scale_pos_weight,params_subsample,user_attrs_cv_f1_std,system_attrs_fixed_params,system_attrs_tpe:relative_params:0,state
37,0.6526391639154844,2026-10-01 08:52:05.314429,2026-10-01 08:52:08.679148,0 days 00:00:03.364719,0.7279023327015953,4.460559630455673,0.019263544238052693,3,3,550,uni_bi,stem,0.013646982119016958,3.6423536432439447,1.7778973217811145,0.8619705300772821,0.010225046161752049,,"{""colsample_bytree"": 0.7279023327015953, ""gamma"": 4.460559630455673, ""learning_rate"": 0.019263544238052693, ""max_depth"": 3, ""min_child_weight"": 3, ""n_estimators"": 550, ""ngramas"": ""uni_bi"", ""preprocessing"": ""stem"", ""reg_alpha"": 0.013646982119016958, ""reg_lambda"": 3.6423536432439447, ""scale_pos_weight"": 1.7778973217811145, ""subsample"": 0.8619705300772821}",COMPLETE
38,0.6486662527153303,2026-10-01 08:52:08.686179,2026-10-01 08:52:11.093819,0 days 00:00:02.407640,0.7100071705951495,5.442138573328136,0.018854609261182226,2,4,450,uni_bi,stem,0.005672620208651097,3.0653928780024464,1.690929338594409,0.8429862825465689,0.018386776909624546,,"{""colsample_bytree"": 0.7100071705951495, ""gamma"": 5.442138573328136, ""learning_rate"": 0.018854609261182226, ""max_depth"": 2, ""min_child_weight"": 4, ""n_estimators"": 450, ""ngramas"": ""uni_bi"", ""preprocessing"": ""stem"", ""reg_alpha"": 0.005672620208651097, ""reg_lambda"": 3.0653928780024464, ""scale_pos_weight"": 1.690929338594409, ""subsample"": 0.8429862825465689}",COMPLETE
39,0.6352953251855765,2026-10-01 08:52:11.101836,2026-10-01 08:52:13.747426,0 days 00:00:02.645590,0.7118034340899801,4.243091707881731,0.010382862027671701,2,5,500,uni_bi,stem,0.026692711038716378,2.150242643002289,1.4922497688822787,0.8538703753362119,0.03011711031888658,,"{""colsample_bytree"": 0.7118034340899801, ""gamma"": 4.243091707881731, ""learning_rate"": 0.010382862027671701, ""max_depth"": 2, ""min_child_weight"": 5, ""n_estimators"": 500, ""ngramas"": ""uni_bi"", ""preprocessing"": ""stem"", ""reg_alpha"": 0.026692711038716378, ""reg_lambda"": 2.150242643002289, ""scale_pos_weight"": 1.4922497688822787, ""subsample"": 0.8538703753362119}",COMPLETE
40,0.6542980003028601,2026-10-01 08:52:13.757452,2026-10-01 08:52:17.362770,0 days 00:00:03.605318,0.8052039592816385,3.7314162203529784,0.02182588740714771,4,2,500,uni_bi,stem,0.005464392129099674,2.7759880331283893,1.9718618161094685,0.8376234120062372,0.021593929758372134,,"{""colsample_bytree"": 0.8052039592816385, ""gamma"": 3.7314162203529784, ""learning_rate"": 0.02182588740714771, ""max_depth"": 4, ""min_child_weight"": 2, ""n_estimators"": 500, ""ngramas"": ""uni_bi"", ""preprocessing"": ""stem"", ""reg_alpha"": 0.005464392129099674, ""reg_lambda"": 2.7759880331283893, ""scale_pos_weight"": 1.9718618161094685, ""subsample"": 0.8376234120062372}",COMPLETE
41,0.6501452899187846,2026-10-01 08:52:17.371796,2026-10-01 08:52:19.535867,0 days 00:00:02.164071,0.7088181879034945,5.530767095951982,0.027020159914419146,2,5,400,uni_bi,stem,0.01345188613574807,1.9542268707680686,1.5722078814721985,0.8628420510038239,0.01590747973684268,,"{""colsample_bytree"": 0.7088181879034945, ""gamma"": 5.530767095951982, ""learning_rate"": 0.027020159914419146, ""max_depth"": 2, ""min_child_weight"": 5, ""n_estimators"": 400, ""ngramas"": ""uni_bi"", ""preprocessing"": ""stem"", ""reg_alpha"": 0.01345188613574807, ""reg_lambda"": 1.9542268707680686, ""scale_pos_weight"": 1.5722078814721985, ""subsample"": 0.8628420510038239}",COMPLETE
42,0.6406949613838919,2026-10-01 08:52:19.544576,2026-10-01 08:52:22.730491,0 days 00:00:03.185915,0.7874892147429171,4.045080608086153,0.016758144823810554,2,5,600,uni_bi,stem,0.0032542149926114705,5.416561000120125,1.518817810388852,0.8470943925647578,0.02368641914441262,,"{""colsample_bytree"": 0.7874892147429171, ""gamma"": 4.045080608086153, ""learning_rate"": 0.016758144823810554, ""max_depth"": 2, ""min_child_weight"": 5, ""n_estimators"": 600, ""ngramas"": ""uni_bi"", ""preprocessing"": ""stem"", ""reg_alpha"": 0.0032542149926114705, ""reg_lambda"": 5.416561000120125, ""scale_pos_weight"": 1.518817810388852, ""subsample"": 0.8470943925647578}",COMPLETE
43,0.6517380708182862,2026-10-01 08:52:22.738028,2026-10-01 08:52:25.989961,0 days 00:00:03.251933,0.8658796760365258,4.298362692565129,0.011122586152920624,3,4,500,uni_bi,stem,0.001397707127463269,2.4535094550655976,1.9367640187290105,0.8464524353257937,0.02911830747439732,,"{""colsample_bytree"": 0.8658796760365258, ""gamma"": 4.298362692565129, ""learning_rate"": 0.011122586152920624, ""max_depth"": 3, ""min_child_weight"": 4, ""n_estimators"": 500, ""ngramas"": ""uni_bi"", ""preprocessing"": ""stem"", ""reg_alpha"": 0.001397707127463269, ""reg_lambda"": 2.4535094550655976, ""scale_pos_weight"": 1.9367640187290105, ""subsample"": 0.8464524353257937}",COMPLETE
44,0.6576928487044762,2026-10-01 08:52:25.998672,2026-10-01 08:52:29.339195,0 days 00:00:03.340523,0.7642439663211562,4.595505778347533,0.01585693406608487,3,5,550,uni_bi,stem,0.0017514109572122037,3.101763326459145,1.869272053441393,0.7942897857899482,0.011366923977337122,,"{""colsample_bytree"": 0.7642439663211562, ""gamma"": 4.595505778347533, ""learning_rate"": 0.01585693406608487, ""max_depth"": 3, ""min_child_weight"": 5, ""n_estimators"": 550, ""ngramas"": ""uni_bi"", ""preprocessing"": ""stem"", ""reg_alpha"": 0.0017514109572122037, ""reg_lambda"": 3.101763326459145, ""scale_pos_weight"": 1.869272053441393, ""subsample"": 0.7942897857899482}",COMPLETE
45,0.6570325422501077,2026-10-01 08:52:29.347065,2026-10-01 08:52:33.026234,0 days 00:00:03.679169,0.7370172295128076,4.41837783719254,0.017764435575089596,4,3,550,uni_bi,stem,0.037174424353349424,1.9585457641332262,1.5590136867824906,0.8186552487613941,0.014130357108603346,,"{""colsample_bytree"": 0.7370172295128076, ""gamma"": 4.41837783719254, ""learning_rate"": 0.017764435575089596, ""max_depth"": 4, ""min_child_weight"": 3, ""n_estimators"": 550, ""ngramas"": ""uni_bi"", ""preprocessing"": ""stem"", ""reg_alpha"": 0.037174424353349424, ""reg_lambda"": 1.9585457641332262, ""scale_pos_weight"": 1.5590136867824906, ""subsample"": 0.8186552487613941}",COMPLETE
46,0.653001797758859,2026-10-01 08:52:33.036001,2026-10-01 08:52:36.357370,0 days 00:00:03.321369,0.7290814786007419,4.637528500182114,0.0218440644960141,4,4,550,uni_bi,stem,0.002943104120767203,7.25668422436912,1.6900276465133293,0.8813729982043135,0.015584611409920908,,"{""colsample_bytree"": 0.7290814786007419, ""gamma"": 4.637528500182114, ""learning_rate"": 0.0218440644960141, ""max_depth"": 4, ""min_child_weight"": 4, ""n_estimators"": 550, ""ngramas"": ""uni_bi"", ""preprocessing"": ""stem"", ""reg_alpha"": 0.002943104120767203, ""reg_lambda"": 7.25668422436912, ""scale_pos_weight"": 1.6900276465133293, ""subsample"": 0.8813729982043135}",COMPLETE
47,0.6585983819757831,2026-10-01 08:52:36.366508,2026-10-01 08:52:40.597692,0 days 00:00:04.231184,0.8157279349117083,4.242680767742599,0.020075004105078148,4,2,600,uni_bi,stem,0.046351870629552906,4.580643560946202,1.9490602729806832,0.8193494057220626,0.023654392731963476,,"{""colsample_bytree"": 0.8157279349117083, ""gamma"": 4.242680767742599, ""learning_rate"": 0.020075004105078148, ""max_depth"": 4, ""min_child_weight"": 2, ""n_estimators"": 600, ""ngramas"": ""uni_bi"", ""preprocessing"": ""stem"", ""reg_alpha"": 0.046351870629552906, ""reg_lambda"": 4.580643560946202, ""scale_pos_weight"": 1.9490602729806832, ""subsample"": 0.8193494057220626}",COMPLETE
48,0.6570125794236139,2026-10-01 08:52:40.606223,2026-10-01 08:52:44.541171,0 days 00:00:03.934948,0.7240962882086491,2.8679106971383677,0.021067464624627392,4,4,600,uni_bi,stem,0.0016162908018650642,3.431534413059608,1.6071028534948157,0.8559707480830394,0.006542031953391829,,"{""colsample_bytree"": 0.7240962882086491, ""gamma"": 2.8679106971383677, ""learning_rate"": 0.021067464624627392, ""max_depth"": 4, ""min_child_weight"": 4, ""n_estimators"": 600, ""ngramas"": ""uni_bi"", ""preprocessing"": ""stem"", ""reg_alpha"": 0.0016162908018650642, ""reg_lambda"": 3.431534413059608, ""scale_pos_weight"": 1.6071028534948157, ""subsample"": 0.8559707480830394}",COMPLETE
49,0.6555511137142064,2026-10-01 08:52:44.551606,2026-10-01 08:52:48.491060,0 days 00:00:03.939454,0.7288247078889273,2.0570172780064744,0.02164798317441789,4,4,600,uni_bi,stem,0.0024307076679852967,3.1454085605380833,1.9123301569490763,0.8625727187531368,0.013573008210118816,,"{""colsample_bytree"": 0.7288247078889273, ""gamma"": 2.0570172780064744, ""learning_rate"": 0.02164798317441789, ""max_depth"": 4, ""min_child_weight"": 4, ""n_estimators"": 600, ""ngramas"": ""uni_bi"", ""preprocessing"": ""stem"", ""reg_alpha"": 0.0024307076679852967, ""reg_lambda"": 3.1454085605380833, ""scale_pos_weight"": 1.9123301569490763, ""subsample"": 0.8625727187531368}",COMPLETE
