number,value,datetime_start,datetime_complete,duration,params_colsample_bytree,params_gamma,params_learning_rate,params_max_depth,params_min_child_weight,params_n_estimators,params_ngramas,params_preprocessing,params_reg_alpha,params_reg_lambda,params_scale_pos_weight,params_subsample,user_attrs_inner_f1_std,system_attrs_fixed_params,system_attrs_tpe:relative_params:0,state
36,0.5976991029754785,2026-10-01 08:32:37.311398,2026-10-01 08:32:39.441276,0 days 00:00:02.129878,0.7186019180964934,4.107172558126555,0.014438240925719154,2,9,500,uni_bi,normal,0.0013381782119341974,2.4398180106335565,1.9484364328955945,0.8295144924557498,0.014061965710326464,,"{""colsample_bytree"": 0.7186019180964934, ""gamma"": 4.107172558126555, ""learning_rate"": 0.014438240925719154, ""max_depth"": 2, ""min_child_weight"": 9, ""n_estimators"": 500, ""ngramas"": ""uni_bi"", ""preprocessing"": ""normal"", ""reg_alpha"": 0.0013381782119341974, ""reg_lambda"": 2.4398180106335565, ""scale_pos_weight"": 1.9484364328955945, ""subsample"": 0.8295144924557498}",COMPLETE
37,0.5946953960953684,2026-10-01 08:32:39.448829,2026-10-01 08:32:41.930926,0 days 00:00:02.482097,0.6822507391154493,2.5034306620604094,0.010755779549540613,2,10,600,uni_bi,normal,0.0015974796731107687,3.716051011791579,2.0408741567873485,0.8530461782134406,0.02423399865624772,,"{""colsample_bytree"": 0.6822507391154493, ""gamma"": 2.5034306620604094, ""learning_rate"": 0.010755779549540613, ""max_depth"": 2, ""min_child_weight"": 10, ""n_estimators"": 600, ""ngramas"": ""uni_bi"", ""preprocessing"": ""normal"", ""reg_alpha"": 0.0015974796731107687, ""reg_lambda"": 3.716051011791579, ""scale_pos_weight"": 2.0408741567873485, ""subsample"": 0.8530461782134406}",COMPLETE
38,0.6001197789788209,2026-10-01 08:32:41.939075,2026-10-01 08:32:44.222539,0 days 00:00:02.283464,0.6379302829033465,1.4920026109664926,0.01577159454964422,2,8,550,uni_bi,normal,0.008077732230133411,1.5923001994427533,1.8170640834521516,0.8879725024946317,0.012629590242886762,,"{""colsample_bytree"": 0.6379302829033465, ""gamma"": 1.4920026109664926, ""learning_rate"": 0.01577159454964422, ""max_depth"": 2, ""min_child_weight"": 8, ""n_estimators"": 550, ""ngramas"": ""uni_bi"", ""preprocessing"": ""normal"", ""reg_alpha"": 0.008077732230133411, ""reg_lambda"": 1.5923001994427533, ""scale_pos_weight"": 1.8170640834521516, ""subsample"": 0.8879725024946317}",COMPLETE
39,0.5943553825117766,2026-10-01 08:32:44.230554,2026-10-01 08:32:45.898441,0 days 00:00:01.667887,0.6460309226490302,3.008811154932763,0.017602372443410327,2,6,400,uni_bi,normal,0.0031377684153087114,0.9192612124161915,1.773431307329108,0.8494026361063789,0.014482014475291882,,"{""colsample_bytree"": 0.6460309226490302, ""gamma"": 3.008811154932763, ""learning_rate"": 0.017602372443410327, ""max_depth"": 2, ""min_child_weight"": 6, ""n_estimators"": 400, ""ngramas"": ""uni_bi"", ""preprocessing"": ""normal"", ""reg_alpha"": 0.0031377684153087114, ""reg_lambda"": 0.9192612124161915, ""scale_pos_weight"": 1.773431307329108, ""subsample"": 0.8494026361063789}",COMPLETE
40,0.5670182516855398,2026-10-01 08:32:45.907722,2026-10-01 08:32:48.173292,0 days 00:00:02.265570,0.600702125002427,2.091802183423007,0.016322735459796008,2,8,600,uni_bi,normal,0.10457333330189732,1.4049116743184809,2.1118056891764887,0.8656424606142107,0.009940267827170874,,"{""colsample_bytree"": 0.600702125002427, ""gamma"": 2.091802183423007, ""learning_rate"": 0.016322735459796008, ""max_depth"": 2, ""min_child_weight"": 8, ""n_estimators"": 600, ""ngramas"": ""uni_bi"", ""preprocessing"": ""normal"", ""reg_alpha"": 0.10457333330189732, ""reg_lambda"": 1.4049116743184809, ""scale_pos_weight"": 2.1118056891764887, ""subsample"": 0.8656424606142107}",COMPLETE
41,0.603597838303668,2026-10-01 08:32:48.181818,2026-10-01 08:32:50.556292,0 days 00:00:02.374474,0.6593576205480238,2.166051537131681,0.014568780746281448,3,9,550,uni_bi,normal,0.032052724152722326,1.1582950936318224,1.6077165144050625,0.7963908560063683,0.01779605153085095,,"{""colsample_bytree"": 0.6593576205480238, ""gamma"": 2.166051537131681, ""learning_rate"": 0.014568780746281448, ""max_depth"": 3, ""min_child_weight"": 9, ""n_estimators"": 550, ""ngramas"": ""uni_bi"", ""preprocessing"": ""normal"", ""reg_alpha"": 0.032052724152722326, ""reg_lambda"": 1.1582950936318224, ""scale_pos_weight"": 1.6077165144050625, ""subsample"": 0.7963908560063683}",COMPLETE
42,0.5992310803463955,2026-10-01 08:32:50.566321,2026-10-01 08:32:52.770946,0 days 00:00:02.204625,0.7493358548712329,3.2074816385090728,0.015671087824176814,2,13,550,uni_bi,normal,0.0029621045689078806,0.6234023810019235,1.7765568866302595,0.8059241267147076,0.013662974623584784,,"{""colsample_bytree"": 0.7493358548712329, ""gamma"": 3.2074816385090728, ""learning_rate"": 0.015671087824176814, ""max_depth"": 2, ""min_child_weight"": 13, ""n_estimators"": 550, ""ngramas"": ""uni_bi"", ""preprocessing"": ""normal"", ""reg_alpha"": 0.0029621045689078806, ""reg_lambda"": 0.6234023810019235, ""scale_pos_weight"": 1.7765568866302595, ""subsample"": 0.8059241267147076}",COMPLETE
43,0.5861934285236756,2026-10-01 08:32:52.779518,2026-10-01 08:32:54.885629,0 days 00:00:02.106111,0.6463900658498016,4.254542503026147,0.010054418935661887,2,12,550,uni_bi,normal,0.0016523823422586485,1.4388934637807103,1.4834068211549298,0.811565576654266,0.006659782300113864,,"{""colsample_bytree"": 0.6463900658498016, ""gamma"": 4.254542503026147, ""learning_rate"": 0.010054418935661887, ""max_depth"": 2, ""min_child_weight"": 12, ""n_estimators"": 550, ""ngramas"": ""uni_bi"", ""preprocessing"": ""normal"", ""reg_alpha"": 0.0016523823422586485, ""reg_lambda"": 1.4388934637807103, ""scale_pos_weight"": 1.4834068211549298, ""subsample"": 0.811565576654266}",COMPLETE
44,0.6003653467365007,2026-10-01 08:32:54.894154,2026-10-01 08:32:56.702402,0 days 00:00:01.808248,0.6793493624920001,4.1789015437257255,0.012927685659277174,2,9,450,uni_bi,normal,0.006348237636227699,0.9261459044412791,1.8816765357330936,0.8012353215408674,0.012253674487505549,,"{""colsample_bytree"": 0.6793493624920001, ""gamma"": 4.1789015437257255, ""learning_rate"": 0.012927685659277174, ""max_depth"": 2, ""min_child_weight"": 9, ""n_estimators"": 450, ""ngramas"": ""uni_bi"", ""preprocessing"": ""normal"", ""reg_alpha"": 0.006348237636227699, ""reg_lambda"": 0.9261459044412791, ""scale_pos_weight"": 1.8816765357330936, ""subsample"": 0.8012353215408674}",COMPLETE
45,0.6016054777666819,2026-10-01 08:32:56.711450,2026-10-01 08:32:58.812817,0 days 00:00:02.101367,0.5973975128541625,2.759420515531113,0.014751565784882232,3,9,500,uni_bi,normal,0.04339096667454949,1.9132434592009158,1.7296610894014215,0.8530372671535211,0.010234839395431015,,"{""colsample_bytree"": 0.5973975128541625, ""gamma"": 2.759420515531113, ""learning_rate"": 0.014751565784882232, ""max_depth"": 3, ""min_child_weight"": 9, ""n_estimators"": 500, ""ngramas"": ""uni_bi"", ""preprocessing"": ""normal"", ""reg_alpha"": 0.04339096667454949, ""reg_lambda"": 1.9132434592009158, ""scale_pos_weight"": 1.7296610894014215, ""subsample"": 0.8530372671535211}",COMPLETE
46,0.5950455969668043,2026-10-01 08:32:58.821594,2026-10-01 08:33:00.887593,0 days 00:00:02.065999,0.6448259528080735,3.1008961542120534,0.017166453872327337,2,10,550,uni_bi,normal,0.01347893711591121,3.1909883345356143,2.0318696175833897,0.8496560827476228,0.020694415125362794,,"{""colsample_bytree"": 0.6448259528080735, ""gamma"": 3.1008961542120534, ""learning_rate"": 0.017166453872327337, ""max_depth"": 2, ""min_child_weight"": 10, ""n_estimators"": 550, ""ngramas"": ""uni_bi"", ""preprocessing"": ""normal"", ""reg_alpha"": 0.01347893711591121, ""reg_lambda"": 3.1909883345356143, ""scale_pos_weight"": 2.0318696175833897, ""subsample"": 0.8496560827476228}",COMPLETE
47,0.6028689406700397,2026-10-01 08:33:00.895245,2026-10-01 08:33:02.830768,0 days 00:00:01.935523,0.7187887205220151,4.272434825611909,0.021597275360618114,2,8,500,uni_bi,normal,0.01309503679302702,0.555584923576715,1.5741454039893465,0.7648750429022815,0.021543853863018526,,"{""colsample_bytree"": 0.7187887205220151, ""gamma"": 4.272434825611909, ""learning_rate"": 0.021597275360618114, ""max_depth"": 2, ""min_child_weight"": 8, ""n_estimators"": 500, ""ngramas"": ""uni_bi"", ""preprocessing"": ""normal"", ""reg_alpha"": 0.01309503679302702, ""reg_lambda"": 0.555584923576715, ""scale_pos_weight"": 1.5741454039893465, ""subsample"": 0.7648750429022815}",COMPLETE
48,0.6017952886828614,2026-10-01 08:33:02.838446,2026-10-01 08:33:04.761226,0 days 00:00:01.922780,0.5714383242102231,2.188555534947302,0.015944722697801776,2,9,500,uni_bi,normal,0.02066661273906767,3.8209811659280444,1.8950460439064816,0.8448834212199211,0.012618407671261943,,"{""colsample_bytree"": 0.5714383242102231, ""gamma"": 2.188555534947302, ""learning_rate"": 0.015944722697801776, ""max_depth"": 2, ""min_child_weight"": 9, ""n_estimators"": 500, ""ngramas"": ""uni_bi"", ""preprocessing"": ""normal"", ""reg_alpha"": 0.02066661273906767, ""reg_lambda"": 3.8209811659280444, ""scale_pos_weight"": 1.8950460439064816, ""subsample"": 0.8448834212199211}",COMPLETE
49,0.5999296670366658,2026-10-01 08:33:04.771399,2026-10-01 08:33:07.334028,0 days 00:00:02.562629,0.651154484220813,3.2443515039472186,0.015094964448813145,2,13,700,uni_bi,normal,0.007298404031674487,2.521550467287632,1.8962197236032352,0.8642999338124899,0.011558479203589508,,"{""colsample_bytree"": 0.651154484220813, ""gamma"": 3.2443515039472186, ""learning_rate"": 0.015094964448813145, ""max_depth"": 2, ""min_child_weight"": 13, ""n_estimators"": 700, ""ngramas"": ""uni_bi"", ""preprocessing"": ""normal"", ""reg_alpha"": 0.007298404031674487, ""reg_lambda"": 2.521550467287632, ""scale_pos_weight"": 1.8962197236032352, ""subsample"": 0.8642999338124899}",COMPLETE
