number,value,datetime_start,datetime_complete,duration,params_colsample_bytree,params_gamma,params_learning_rate,params_max_depth,params_min_child_weight,params_n_estimators,params_ngramas,params_preprocessing,params_reg_alpha,params_reg_lambda,params_scale_pos_weight,params_subsample,user_attrs_inner_f1_std,system_attrs_fixed_params,system_attrs_tpe:relative_params:0,state
0,0.67289778928017,2026-10-01 08:34:31.701503,2026-10-01 08:34:33.942652,0 days 00:00:02.241149,0.6891231879021942,0.8639150067983441,0.023236535796625712,5,3,700,uni,normal,0.004500883717053276,0.18484430097724697,1.941087524056639,0.7055643235901311,0.010555251261389599,"{'preprocessing': 'normal', 'ngramas': 'uni'}",,COMPLETE
1,0.6580928334587463,2026-10-01 08:34:33.945659,2026-10-01 08:34:36.171569,0 days 00:00:02.225910,0.613066882612467,7.820024868631562,0.19451747759715904,5,8,650,uni_bi,normal,0.4923477941754624,1.0319883368576308,1.4345310103781423,0.7664030692485754,0.026354215565150493,"{'preprocessing': 'normal', 'ngramas': 'uni_bi'}",,COMPLETE
2,0.6499025139625916,2026-10-01 08:34:36.175921,2026-10-01 08:34:36.933931,0 days 00:00:00.758010,0.6551930070428668,6.641550706740324,0.019736720393672826,2,8,450,uni,stem,0.0019868411245652948,13.310512566656326,1.3373441230141867,0.6349653548730396,0.024892232392763787,"{'preprocessing': 'stem', 'ngramas': 'uni'}",,COMPLETE
3,0.6620198410056776,2026-10-01 08:34:36.937946,2026-10-01 08:34:39.071839,0 days 00:00:02.133893,0.6000121711375836,3.933034935954849,0.060523549810977774,2,7,550,uni_bi,stem,0.1697191354210946,0.3799662013880079,1.1653619833985986,0.8428903076512198,0.03171499531567577,"{'preprocessing': 'stem', 'ngramas': 'uni_bi'}",,COMPLETE
4,0.6556779482356775,2026-10-01 08:34:39.076161,2026-10-01 08:34:40.066014,0 days 00:00:00.989853,0.8548812950439446,6.063155959704572,0.11866719535932568,3,8,550,uni,lemma,0.003074178647527449,9.319238068033489,1.100407406782524,0.5829486251851724,0.01564992731607615,"{'preprocessing': 'lemma', 'ngramas': 'uni'}",,COMPLETE
5,0.6497147422468165,2026-10-01 08:34:40.070025,2026-10-01 08:34:41.253815,0 days 00:00:01.183790,0.6005265011351406,7.880274237786688,0.15845695755209105,3,11,250,uni_bi,lemma,0.5190168975436719,0.8430792369302229,1.0962584439491385,0.6392698643678811,0.017290216446751775,"{'preprocessing': 'lemma', 'ngramas': 'uni_bi'}",,COMPLETE
6,0.654588542912602,2026-10-01 08:34:41.257171,2026-10-01 08:34:43.120819,0 days 00:00:01.863648,0.696705262812809,7.930840274214868,0.02430014978987304,3,3,400,uni_bi,normal,3.305628970444423,0.23502139737832395,1.4573699435865455,0.5831693803541145,0.03236389674718372,,,COMPLETE
7,0.6372052121857094,2026-10-01 08:34:43.124295,2026-10-01 08:34:44.090940,0 days 00:00:00.966645,0.8052782411310322,7.556582969305462,0.12375683614656545,4,9,150,uni_bi,stem,0.8072231060168935,0.38134176751215854,2.3611808533502288,0.8957704749875129,0.009671534116434613,,,COMPLETE
8,0.6664489200238117,2026-10-01 08:34:44.094457,2026-10-01 08:34:45.688483,0 days 00:00:01.594026,0.7094997986725271,2.734133577254707,0.03659960537161425,7,12,700,uni,normal,0.19228385810388485,2.0929716195373667,1.0666323708731926,0.7840225949209721,0.013696578015840207,,,COMPLETE
9,0.6822868371801641,2026-10-01 08:34:45.693179,2026-10-01 08:34:47.376470,0 days 00:00:01.683291,0.6493203250273586,1.8839105247962622,0.010955866493909193,4,3,700,uni,stem,0.0032774885694430637,0.3497491276967984,1.610822228588859,0.5760585523629264,0.022329194980596087,,,COMPLETE
10,0.6727387844996592,2026-10-01 08:34:47.380478,2026-10-01 08:34:48.135987,0 days 00:00:00.755509,0.5426492265097068,2.98336349853339,0.04851045578924297,4,11,400,uni,stem,0.0012035552519174305,1.0843850909471928,1.1543744797017454,0.6064445318986637,0.03223702906804412,,"{""colsample_bytree"": 0.5426492265097068, ""gamma"": 2.98336349853339, ""learning_rate"": 0.04851045578924297, ""max_depth"": 4, ""min_child_weight"": 11, ""n_estimators"": 400, ""ngramas"": ""uni"", ""preprocessing"": ""stem"", ""reg_alpha"": 0.0012035552519174305, ""reg_lambda"": 1.0843850909471928, ""scale_pos_weight"": 1.1543744797017454, ""subsample"": 0.6064445318986637}",COMPLETE
11,0.6698561378721107,2026-10-01 08:34:48.140817,2026-10-01 08:34:50.330589,0 days 00:00:02.189772,0.6635004194980425,2.058923818721264,0.025919000037898588,6,2,700,uni,stem,0.003988833418914467,0.16723095750797284,1.940753126573679,0.7218424076843897,0.008170077585484376,,"{""colsample_bytree"": 0.6635004194980425, ""gamma"": 2.058923818721264, ""learning_rate"": 0.025919000037898588, ""max_depth"": 6, ""min_child_weight"": 2, ""n_estimators"": 700, ""ngramas"": ""uni"", ""preprocessing"": ""stem"", ""reg_alpha"": 0.003988833418914467, ""reg_lambda"": 0.16723095750797284, ""scale_pos_weight"": 1.940753126573679, ""subsample"": 0.7218424076843897}",COMPLETE
12,0.6867686152391221,2026-10-01 08:34:50.335614,2026-10-01 08:34:51.330586,0 days 00:00:00.994972,0.5837997088133616,1.0330160127470571,0.015233077213498043,2,6,600,uni,stem,0.008653366315052324,1.0990826036111097,1.5209195330821703,0.6161687595098646,0.01713191813559145,,"{""colsample_bytree"": 0.5837997088133616, ""gamma"": 1.0330160127470571, ""learning_rate"": 0.015233077213498043, ""max_depth"": 2, ""min_child_weight"": 6, ""n_estimators"": 600, ""ngramas"": ""uni"", ""preprocessing"": ""stem"", ""reg_alpha"": 0.008653366315052324, ""reg_lambda"": 1.0990826036111097, ""scale_pos_weight"": 1.5209195330821703, ""subsample"": 0.6161687595098646}",COMPLETE
13,0.6831990651281455,2026-10-01 08:34:51.335608,2026-10-01 08:34:52.885834,0 days 00:00:01.550226,0.7023572645620736,2.8890707880801827,0.010287416119685757,4,6,650,uni,stem,0.001759897481563857,0.5741094491912054,1.5585392009484815,0.603390393792413,0.01584880195381205,,"{""colsample_bytree"": 0.7023572645620736, ""gamma"": 2.8890707880801827, ""learning_rate"": 0.010287416119685757, ""max_depth"": 4, ""min_child_weight"": 6, ""n_estimators"": 650, ""ngramas"": ""uni"", ""preprocessing"": ""stem"", ""reg_alpha"": 0.001759897481563857, ""reg_lambda"": 0.5741094491912054, ""scale_pos_weight"": 1.5585392009484815, ""subsample"": 0.603390393792413}",COMPLETE
14,0.6818013614916264,2026-10-01 08:34:52.891051,2026-10-01 08:34:53.841590,0 days 00:00:00.950539,0.5082815368273368,1.049901458652098,0.01124742756920972,2,9,600,uni,stem,0.010073427857088589,0.289190730215602,1.444588047217897,0.6457150076052135,0.033557626502431895,,"{""colsample_bytree"": 0.5082815368273368, ""gamma"": 1.049901458652098, ""learning_rate"": 0.01124742756920972, ""max_depth"": 2, ""min_child_weight"": 9, ""n_estimators"": 600, ""ngramas"": ""uni"", ""preprocessing"": ""stem"", ""reg_alpha"": 0.010073427857088589, ""reg_lambda"": 0.289190730215602, ""scale_pos_weight"": 1.444588047217897, ""subsample"": 0.6457150076052135}",COMPLETE
15,0.6761907482708803,2026-10-01 08:34:53.845962,2026-10-01 08:34:55.620173,0 days 00:00:01.774211,0.8035431604192438,2.2382327713407477,0.011367355908861777,5,5,600,uni,stem,0.008363630020964357,0.10143470603160762,1.3411911088176653,0.6235389560137752,0.020794979734925875,,"{""colsample_bytree"": 0.8035431604192438, ""gamma"": 2.2382327713407477, ""learning_rate"": 0.011367355908861777, ""max_depth"": 5, ""min_child_weight"": 5, ""n_estimators"": 600, ""ngramas"": ""uni"", ""preprocessing"": ""stem"", ""reg_alpha"": 0.008363630020964357, ""reg_lambda"": 0.10143470603160762, ""scale_pos_weight"": 1.3411911088176653, ""subsample"": 0.6235389560137752}",COMPLETE
16,0.6771423926978349,2026-10-01 08:34:55.624913,2026-10-01 08:34:57.087994,0 days 00:00:01.463081,0.7971623569961283,5.35893631272723,0.018409098661673638,5,6,700,uni,stem,0.0052351621911391755,0.5455559481428299,1.587610695861093,0.6664783345315375,0.02299268390718151,,"{""colsample_bytree"": 0.7971623569961283, ""gamma"": 5.35893631272723, ""learning_rate"": 0.018409098661673638, ""max_depth"": 5, ""min_child_weight"": 6, ""n_estimators"": 700, ""ngramas"": ""uni"", ""preprocessing"": ""stem"", ""reg_alpha"": 0.0052351621911391755, ""reg_lambda"": 0.5455559481428299, ""scale_pos_weight"": 1.587610695861093, ""subsample"": 0.6664783345315375}",COMPLETE
17,0.6848471920167284,2026-10-01 08:34:57.091556,2026-10-01 08:34:58.364308,0 days 00:00:01.272752,0.6149962373763371,2.4442825068957816,0.019734498363444444,4,5,550,uni,stem,0.0015566225563093793,1.714712887875382,1.4025719778048835,0.6230822381774086,0.01649339329562535,,"{""colsample_bytree"": 0.6149962373763371, ""gamma"": 2.4442825068957816, ""learning_rate"": 0.019734498363444444, ""max_depth"": 4, ""min_child_weight"": 5, ""n_estimators"": 550, ""ngramas"": ""uni"", ""preprocessing"": ""stem"", ""reg_alpha"": 0.0015566225563093793, ""reg_lambda"": 1.714712887875382, ""scale_pos_weight"": 1.4025719778048835, ""subsample"": 0.6230822381774086}",COMPLETE
18,0.6790213346362729,2026-10-01 08:34:58.370320,2026-10-01 08:34:59.677473,0 days 00:00:01.307153,0.5759289386522896,1.4497093136033774,0.018004087390782277,3,9,700,uni,stem,0.014146077448639093,1.8889067985768837,1.4612531135352058,0.6336562074632168,0.02400238163754365,,"{""colsample_bytree"": 0.5759289386522896, ""gamma"": 1.4497093136033774, ""learning_rate"": 0.018004087390782277, ""max_depth"": 3, ""min_child_weight"": 9, ""n_estimators"": 700, ""ngramas"": ""uni"", ""preprocessing"": ""stem"", ""reg_alpha"": 0.014146077448639093, ""reg_lambda"": 1.8889067985768837, ""scale_pos_weight"": 1.4612531135352058, ""subsample"": 0.6336562074632168}",COMPLETE
19,0.6832777983216918,2026-10-01 08:34:59.684014,2026-10-01 08:35:01.114943,0 days 00:00:01.430929,0.5820625069113845,3.082152210845893,0.023534108502412412,4,3,650,uni,stem,0.003074335067967617,4.1087494630944486,1.6166224887360368,0.6054128312031671,0.01525368928767077,,"{""colsample_bytree"": 0.5820625069113845, ""gamma"": 3.082152210845893, ""learning_rate"": 0.023534108502412412, ""max_depth"": 4, ""min_child_weight"": 3, ""n_estimators"": 650, ""ngramas"": ""uni"", ""preprocessing"": ""stem"", ""reg_alpha"": 0.003074335067967617, ""reg_lambda"": 4.1087494630944486, ""scale_pos_weight"": 1.6166224887360368, ""subsample"": 0.6054128312031671}",COMPLETE
20,0.6824196819792968,2026-10-01 08:35:01.119965,2026-10-01 08:35:02.180137,0 days 00:00:01.060172,0.6117101819067966,3.5299881960901884,0.025311198376177204,2,6,650,uni,stem,0.02493068038105083,0.1204279898300748,1.6303423914446502,0.6036545368206501,0.01710979935842706,,"{""colsample_bytree"": 0.6117101819067966, ""gamma"": 3.5299881960901884, ""learning_rate"": 0.025311198376177204, ""max_depth"": 2, ""min_child_weight"": 6, ""n_estimators"": 650, ""ngramas"": ""uni"", ""preprocessing"": ""stem"", ""reg_alpha"": 0.02493068038105083, ""reg_lambda"": 0.1204279898300748, ""scale_pos_weight"": 1.6303423914446502, ""subsample"": 0.6036545368206501}",COMPLETE
21,0.6756518528193839,2026-10-01 08:35:02.185673,2026-10-01 08:35:03.460264,0 days 00:00:01.274591,0.6053609834065796,1.6977661141358587,0.02975831866334624,4,6,550,uni,stem,0.015251731846909514,5.328847713523007,1.7193107281665476,0.6031570388450986,0.021886425939293623,,"{""colsample_bytree"": 0.6053609834065796, ""gamma"": 1.6977661141358587, ""learning_rate"": 0.02975831866334624, ""max_depth"": 4, ""min_child_weight"": 6, ""n_estimators"": 550, ""ngramas"": ""uni"", ""preprocessing"": ""stem"", ""reg_alpha"": 0.015251731846909514, ""reg_lambda"": 5.328847713523007, ""scale_pos_weight"": 1.7193107281665476, ""subsample"": 0.6031570388450986}",COMPLETE
22,0.6870311002902864,2026-10-01 08:35:03.464070,2026-10-01 08:35:04.496398,0 days 00:00:01.032328,0.5311575427902596,3.3056392390491163,0.027257797225962072,3,3,600,uni,stem,0.0027073347012739964,12.80011822395582,1.43648607613689,0.5856078246604964,0.026419832200454848,,"{""colsample_bytree"": 0.5311575427902596, ""gamma"": 3.3056392390491163, ""learning_rate"": 0.027257797225962072, ""max_depth"": 3, ""min_child_weight"": 3, ""n_estimators"": 600, ""ngramas"": ""uni"", ""preprocessing"": ""stem"", ""reg_alpha"": 0.0027073347012739964, ""reg_lambda"": 12.80011822395582, ""scale_pos_weight"": 1.43648607613689, ""subsample"": 0.5856078246604964}",COMPLETE
23,0.6751690108665506,2026-10-01 08:35:04.499909,2026-10-01 08:35:05.414235,0 days 00:00:00.914326,0.5660321229209755,1.063641912948183,0.015544730825409095,2,9,550,uni,stem,0.0019101015448166234,6.943907334684692,1.5377003168669612,0.5522110069444934,0.03072568299799978,,"{""colsample_bytree"": 0.5660321229209755, ""gamma"": 1.063641912948183, ""learning_rate"": 0.015544730825409095, ""max_depth"": 2, ""min_child_weight"": 9, ""n_estimators"": 550, ""ngramas"": ""uni"", ""preprocessing"": ""stem"", ""reg_alpha"": 0.0019101015448166234, ""reg_lambda"": 6.943907334684692, ""scale_pos_weight"": 1.5377003168669612, ""subsample"": 0.5522110069444934}",COMPLETE
24,0.6754176407932819,2026-10-01 08:35:05.420281,2026-10-01 08:35:06.487957,0 days 00:00:01.067676,0.6616654883279386,1.4774630899325238,0.019791709254324396,2,8,600,uni,stem,0.011158259239081557,1.007836530090973,1.91423256603952,0.573547304730267,0.00976767205590308,,"{""colsample_bytree"": 0.6616654883279386, ""gamma"": 1.4774630899325238, ""learning_rate"": 0.019791709254324396, ""max_depth"": 2, ""min_child_weight"": 8, ""n_estimators"": 600, ""ngramas"": ""uni"", ""preprocessing"": ""stem"", ""reg_alpha"": 0.011158259239081557, ""reg_lambda"": 1.007836530090973, ""scale_pos_weight"": 1.91423256603952, ""subsample"": 0.573547304730267}",COMPLETE
25,0.6883883316993331,2026-10-01 08:35:06.494350,2026-10-01 08:35:07.461208,0 days 00:00:00.966858,0.5229285807403378,4.578263672591177,0.023319554224282946,2,2,550,uni,lemma,0.002405235507368624,1.6133217003763212,1.5104815573555512,0.5660855447454066,0.005172854778317703,,"{""colsample_bytree"": 0.5229285807403378, ""gamma"": 4.578263672591177, ""learning_rate"": 0.023319554224282946, ""max_depth"": 2, ""min_child_weight"": 2, ""n_estimators"": 550, ""ngramas"": ""uni"", ""preprocessing"": ""lemma"", ""reg_alpha"": 0.002405235507368624, ""reg_lambda"": 1.6133217003763212, ""scale_pos_weight"": 1.5104815573555512, ""subsample"": 0.5660855447454066}",COMPLETE
26,0.6938867034649213,2026-10-01 08:35:07.467216,2026-10-01 08:35:08.553203,0 days 00:00:01.085987,0.5716019520611834,4.03784048255775,0.02823546563672044,2,5,700,uni,stem,0.003491890439909208,2.8829404151593647,1.4799651960256726,0.5901613405400934,0.021150710241540967,,"{""colsample_bytree"": 0.5716019520611834, ""gamma"": 4.03784048255775, ""learning_rate"": 0.02823546563672044, ""max_depth"": 2, ""min_child_weight"": 5, ""n_estimators"": 700, ""ngramas"": ""uni"", ""preprocessing"": ""stem"", ""reg_alpha"": 0.003491890439909208, ""reg_lambda"": 2.8829404151593647, ""scale_pos_weight"": 1.4799651960256726, ""subsample"": 0.5901613405400934}",COMPLETE
27,0.6875305710572458,2026-10-01 08:35:08.558850,2026-10-01 08:35:09.608912,0 days 00:00:01.050062,0.6025247275760007,4.918880010081864,0.019160960028122703,3,4,600,uni,stem,0.0013347846344980469,6.94514336473263,1.4613391669483569,0.617876571937098,0.029762329644298004,,"{""colsample_bytree"": 0.6025247275760007, ""gamma"": 4.918880010081864, ""learning_rate"": 0.019160960028122703, ""max_depth"": 3, ""min_child_weight"": 4, ""n_estimators"": 600, ""ngramas"": ""uni"", ""preprocessing"": ""stem"", ""reg_alpha"": 0.0013347846344980469, ""reg_lambda"": 6.94514336473263, ""scale_pos_weight"": 1.4613391669483569, ""subsample"": 0.617876571937098}",COMPLETE
28,0.6766083007446632,2026-10-01 08:35:09.615436,2026-10-01 08:35:10.919016,0 days 00:00:01.303580,0.5305705307423847,4.477632582630305,0.01367827936878676,3,5,650,uni,lemma,0.003926162437777258,4.058383421479123,1.7355748356098177,0.6061007546704771,0.0046172562315268005,,"{""colsample_bytree"": 0.5305705307423847, ""gamma"": 4.477632582630305, ""learning_rate"": 0.01367827936878676, ""max_depth"": 3, ""min_child_weight"": 5, ""n_estimators"": 650, ""ngramas"": ""uni"", ""preprocessing"": ""lemma"", ""reg_alpha"": 0.003926162437777258, ""reg_lambda"": 4.058383421479123, ""scale_pos_weight"": 1.7355748356098177, ""subsample"": 0.6061007546704771}",COMPLETE
29,0.6915587178001391,2026-10-01 08:35:10.925648,2026-10-01 08:35:11.960751,0 days 00:00:01.035103,0.657199186906567,3.3223668026554427,0.021881266913361633,2,4,600,uni,stem,0.001995164924970477,4.984484659271548,1.2680803691351203,0.6551189726559873,0.031962788244580737,,"{""colsample_bytree"": 0.657199186906567, ""gamma"": 3.3223668026554427, ""learning_rate"": 0.021881266913361633, ""max_depth"": 2, ""min_child_weight"": 4, ""n_estimators"": 600, ""ngramas"": ""uni"", ""preprocessing"": ""stem"", ""reg_alpha"": 0.001995164924970477, ""reg_lambda"": 4.984484659271548, ""scale_pos_weight"": 1.2680803691351203, ""subsample"": 0.6551189726559873}",COMPLETE
30,0.6910767524844958,2026-10-01 08:35:11.965259,2026-10-01 08:35:13.058688,0 days 00:00:01.093429,0.5280480981614265,4.594901494936375,0.0208351710274777,3,2,500,uni,normal,0.0012557884930424806,1.5991189676300064,1.319047398191501,0.5642215052510471,0.021822816963767838,,"{""colsample_bytree"": 0.5280480981614265, ""gamma"": 4.594901494936375, ""learning_rate"": 0.0208351710274777, ""max_depth"": 3, ""min_child_weight"": 2, ""n_estimators"": 500, ""ngramas"": ""uni"", ""preprocessing"": ""normal"", ""reg_alpha"": 0.0012557884930424806, ""reg_lambda"": 1.5991189676300064, ""scale_pos_weight"": 1.319047398191501, ""subsample"": 0.5642215052510471}",COMPLETE
31,0.6707016393713374,2026-10-01 08:35:13.065488,2026-10-01 08:35:14.020784,0 days 00:00:00.955296,0.5395630962481441,4.861421659736803,0.027953252919343172,3,2,450,uni,lemma,0.004477639706091819,1.0679334719154199,1.7250898556297583,0.5549244171120785,0.011561890582558304,,"{""colsample_bytree"": 0.5395630962481441, ""gamma"": 4.861421659736803, ""learning_rate"": 0.027953252919343172, ""max_depth"": 3, ""min_child_weight"": 2, ""n_estimators"": 450, ""ngramas"": ""uni"", ""preprocessing"": ""lemma"", ""reg_alpha"": 0.004477639706091819, ""reg_lambda"": 1.0679334719154199, ""scale_pos_weight"": 1.7250898556297583, ""subsample"": 0.5549244171120785}",COMPLETE
32,0.6873458592637917,2026-10-01 08:35:14.027768,2026-10-01 08:35:15.068999,0 days 00:00:01.041231,0.7021738280196146,2.4770573608166955,0.025238589520672896,2,6,600,uni,stem,0.004894853584787079,5.432190370257143,1.2577424127727193,0.720977885095942,0.02523821415073198,,"{""colsample_bytree"": 0.7021738280196146, ""gamma"": 2.4770573608166955, ""learning_rate"": 0.025238589520672896, ""max_depth"": 2, ""min_child_weight"": 6, ""n_estimators"": 600, ""ngramas"": ""uni"", ""preprocessing"": ""stem"", ""reg_alpha"": 0.004894853584787079, ""reg_lambda"": 5.432190370257143, ""scale_pos_weight"": 1.2577424127727193, ""subsample"": 0.720977885095942}",COMPLETE
33,0.6857469457754647,2026-10-01 08:35:15.075856,2026-10-01 08:35:16.155740,0 days 00:00:01.079884,0.5446285064455506,3.1246741577590442,0.019402257515347226,2,4,650,uni,stem,0.010532866011715537,2.28582898082657,1.549072659744911,0.5983848883210818,0.024171265541783452,,"{""colsample_bytree"": 0.5446285064455506, ""gamma"": 3.1246741577590442, ""learning_rate"": 0.019402257515347226, ""max_depth"": 2, ""min_child_weight"": 4, ""n_estimators"": 650, ""ngramas"": ""uni"", ""preprocessing"": ""stem"", ""reg_alpha"": 0.010532866011715537, ""reg_lambda"": 2.28582898082657, ""scale_pos_weight"": 1.549072659744911, ""subsample"": 0.5983848883210818}",COMPLETE
34,0.6917184670421194,2026-10-01 08:35:16.163108,2026-10-01 08:35:17.355646,0 days 00:00:01.192538,0.5181014082017851,4.784023470303396,0.03033169650165694,2,2,650,uni,normal,0.0011725746221114797,1.578594297101869,1.3663874238798654,0.613893859611133,0.015113127485311604,,"{""colsample_bytree"": 0.5181014082017851, ""gamma"": 4.784023470303396, ""learning_rate"": 0.03033169650165694, ""max_depth"": 2, ""min_child_weight"": 2, ""n_estimators"": 650, ""ngramas"": ""uni"", ""preprocessing"": ""normal"", ""reg_alpha"": 0.0011725746221114797, ""reg_lambda"": 1.578594297101869, ""scale_pos_weight"": 1.3663874238798654, ""subsample"": 0.613893859611133}",COMPLETE
35,0.650400711472748,2026-10-01 08:35:17.363674,2026-10-01 08:35:18.482439,0 days 00:00:01.118765,0.5153841154427742,4.824407130618289,0.0131603131563658,3,6,550,uni,normal,0.0013644630551067438,2.0276355820336662,1.0841896748732993,0.5618513892403717,0.022880537763041893,,"{""colsample_bytree"": 0.5153841154427742, ""gamma"": 4.824407130618289, ""learning_rate"": 0.0131603131563658, ""max_depth"": 3, ""min_child_weight"": 6, ""n_estimators"": 550, ""ngramas"": ""uni"", ""preprocessing"": ""normal"", ""reg_alpha"": 0.0013644630551067438, ""reg_lambda"": 2.0276355820336662, ""scale_pos_weight"": 1.0841896748732993, ""subsample"": 0.5618513892403717}",COMPLETE
36,0.6935126410720582,2026-10-01 08:35:18.489959,2026-10-01 08:35:19.652713,0 days 00:00:01.162754,0.5397384721037053,3.692879821354575,0.04008411237043925,2,2,600,uni,normal,0.001483841792404216,1.4368899784902218,1.5348338665835892,0.6227533123626521,0.0052816463541634755,,"{""colsample_bytree"": 0.5397384721037053, ""gamma"": 3.692879821354575, ""learning_rate"": 0.04008411237043925, ""max_depth"": 2, ""min_child_weight"": 2, ""n_estimators"": 600, ""ngramas"": ""uni"", ""preprocessing"": ""normal"", ""reg_alpha"": 0.001483841792404216, ""reg_lambda"": 1.4368899784902218, ""scale_pos_weight"": 1.5348338665835892, ""subsample"": 0.6227533123626521}",COMPLETE
