number,value,datetime_start,datetime_complete,duration,params_colsample_bytree,params_gamma,params_learning_rate,params_max_depth,params_min_child_weight,params_n_estimators,params_ngramas,params_preprocessing,params_reg_alpha,params_reg_lambda,params_scale_pos_weight,params_subsample,user_attrs_cv_f1_std,system_attrs_fixed_params,system_attrs_tpe:relative_params:0,state
0,0.6227250261977425,2026-10-01 08:50:22.045273,2026-10-01 08:50:23.795820,0 days 00:00:01.750547,0.562397808134481,0.9356270912614959,0.08960785365368121,7,10,350,uni,normal,2.9154431891537547,2.416482602989751,2.0621088666940683,0.6046065241548528,0.014086011772129701,"{'preprocessing': 'normal', 'ngramas': 'uni'}",,COMPLETE
1,0.6387095891066686,2026-10-01 08:50:23.799834,2026-10-01 08:50:25.052128,0 days 00:00:01.252294,0.5733618039413735,2.781816822196533,0.12106896936002161,7,4,150,uni_bi,normal,0.12561043700013558,0.9860942908083906,1.4368437102970628,0.6136387385224853,0.010279594584402037,"{'preprocessing': 'normal', 'ngramas': 'uni_bi'}",,COMPLETE
2,0.6035669151038311,2026-10-01 08:50:25.055110,2026-10-01 08:50:26.278349,0 days 00:00:01.223239,0.8140703845572055,1.997553366187698,0.023993242906812727,2,7,500,uni,stem,0.11400863701127326,2.3076168040117313,1.0696756190799965,0.7096244944759627,0.016926649547356887,"{'preprocessing': 'stem', 'ngramas': 'uni'}",,COMPLETE
3,0.6456950501596012,2026-10-01 08:50:26.280352,2026-10-01 08:50:29.576568,0 days 00:00:03.296216,0.8233589392465845,2.78460326880028,0.012151617026673379,3,15,500,uni_bi,stem,0.002458603276328005,3.753537145233125,1.6602287406094018,0.8879712115760958,0.016322272228139426,"{'preprocessing': 'stem', 'ngramas': 'uni_bi'}",,COMPLETE
4,0.6073749878422404,2026-10-01 08:50:29.580575,2026-10-01 08:50:30.488908,0 days 00:00:00.908333,0.7650089137415927,2.837833070670582,0.011085122517311707,4,14,200,uni,lemma,0.12030178871154672,1.811326544803338,1.2772816832882905,0.640572993560006,0.013166520778736304,"{'preprocessing': 'lemma', 'ngramas': 'uni'}",,COMPLETE
5,0.5919201473877377,2026-10-01 08:50:30.492656,2026-10-01 08:50:35.848427,0 days 00:00:05.355771,0.8687496940092467,1.1636937653893962,0.16684619386293467,6,14,700,uni_bi,lemma,0.006080390190296602,0.12707770074499689,1.4879954961448965,0.7592649925838798,0.009450988526678123,"{'preprocessing': 'lemma', 'ngramas': 'uni_bi'}",,COMPLETE
6,0.6330206693805599,2026-10-01 08:50:35.853851,2026-10-01 08:50:37.178746,0 days 00:00:01.324895,0.808897907718663,1.9903676115062932,0.11058146376563001,2,3,450,uni,lemma,0.0010521761868451127,7.52317574354701,2.0602860157714256,0.8954104278101811,0.008605229316792556,,,COMPLETE
7,0.6402055952627228,2026-10-01 08:50:37.183756,2026-10-01 08:50:38.621776,0 days 00:00:01.438020,0.6300733288106988,5.97204633753548,0.026946865572417687,5,2,650,uni,stem,0.35500125258511606,11.00279783199859,1.7083223877429239,0.6588438126004819,0.02615154659814479,,,COMPLETE
8,0.6355313988291357,2026-10-01 08:50:38.625776,2026-10-01 08:50:41.148195,0 days 00:00:02.522419,0.5125716742746937,5.273078084478353,0.035995125264172326,5,2,400,uni_bi,lemma,0.018089390092767135,1.4799137841422207,2.3613497108891393,0.5877619994476566,0.01135186598802622,,,COMPLETE
9,0.6276496643037849,2026-10-01 08:50:41.154106,2026-10-01 08:50:42.017379,0 days 00:00:00.863273,0.848584236075087,6.527540576743358,0.16201847221720986,2,13,300,uni,lemma,0.005575453980775369,11.31892099052994,1.8090133628734761,0.7716913147786483,0.004544904207343713,,,COMPLETE
10,0.6112657018834734,2026-10-01 08:50:42.022904,2026-10-01 08:50:46.868492,0 days 00:00:04.845588,0.7712655484998097,1.638158141746138,0.023242300405945573,6,14,550,uni_bi,stem,0.06064029390783,2.330518938675237,2.133850592820718,0.7894110325555779,0.01819074704876218,,"{""colsample_bytree"": 0.7712655484998097, ""gamma"": 1.638158141746138, ""learning_rate"": 0.023242300405945573, ""max_depth"": 6, ""min_child_weight"": 14, ""n_estimators"": 550, ""ngramas"": ""uni_bi"", ""preprocessing"": ""stem"", ""reg_alpha"": 0.06064029390783, ""reg_lambda"": 2.330518938675237, ""scale_pos_weight"": 2.133850592820718, ""subsample"": 0.7894110325555779}",COMPLETE
11,0.6378229594714598,2026-10-01 08:50:46.872843,2026-10-01 08:50:48.438045,0 days 00:00:01.565202,0.6296284389194562,3.7889164744030244,0.013074303307381869,7,15,700,uni,stem,2.5536495852164727,10.11399496235287,1.835940733283413,0.7094377419008767,0.02374351248845885,,"{""colsample_bytree"": 0.6296284389194562, ""gamma"": 3.7889164744030244, ""learning_rate"": 0.013074303307381869, ""max_depth"": 7, ""min_child_weight"": 15, ""n_estimators"": 700, ""ngramas"": ""uni"", ""preprocessing"": ""stem"", ""reg_alpha"": 2.5536495852164727, ""reg_lambda"": 10.11399496235287, ""scale_pos_weight"": 1.835940733283413, ""subsample"": 0.7094377419008767}",COMPLETE
12,0.639875775697918,2026-10-01 08:50:48.443066,2026-10-01 08:50:49.720170,0 days 00:00:01.277104,0.524709723771783,3.0915607676961128,0.03772729689374108,4,10,600,uni,stem,0.1579049206550785,8.833508818124573,1.5211799810091307,0.8382372728764198,0.017601556283855506,,"{""colsample_bytree"": 0.524709723771783, ""gamma"": 3.0915607676961128, ""learning_rate"": 0.03772729689374108, ""max_depth"": 4, ""min_child_weight"": 10, ""n_estimators"": 600, ""ngramas"": ""uni"", ""preprocessing"": ""stem"", ""reg_alpha"": 0.1579049206550785, ""reg_lambda"": 8.833508818124573, ""scale_pos_weight"": 1.5211799810091307, ""subsample"": 0.8382372728764198}",COMPLETE
13,0.6312387205144693,2026-10-01 08:50:49.725147,2026-10-01 08:50:50.942680,0 days 00:00:01.217533,0.537576351236964,7.955664816240899,0.012993606572859102,6,3,550,uni,stem,0.08337146872883147,6.79644501847179,1.6122792169487115,0.6290928978214241,0.016418697019356956,,"{""colsample_bytree"": 0.537576351236964, ""gamma"": 7.955664816240899, ""learning_rate"": 0.012993606572859102, ""max_depth"": 6, ""min_child_weight"": 3, ""n_estimators"": 550, ""ngramas"": ""uni"", ""preprocessing"": ""stem"", ""reg_alpha"": 0.08337146872883147, ""reg_lambda"": 6.79644501847179, ""scale_pos_weight"": 1.6122792169487115, ""subsample"": 0.6290928978214241}",COMPLETE
14,0.6483650889218041,2026-10-01 08:50:50.946687,2026-10-01 08:50:53.713876,0 days 00:00:02.767189,0.7664712669980773,3.4561861152582822,0.015421227086515112,2,2,500,uni_bi,stem,0.008635817023609292,2.193119050374339,1.5383530732761874,0.849581259092292,0.021671285786016473,,"{""colsample_bytree"": 0.7664712669980773, ""gamma"": 3.4561861152582822, ""learning_rate"": 0.015421227086515112, ""max_depth"": 2, ""min_child_weight"": 2, ""n_estimators"": 500, ""ngramas"": ""uni_bi"", ""preprocessing"": ""stem"", ""reg_alpha"": 0.008635817023609292, ""reg_lambda"": 2.193119050374339, ""scale_pos_weight"": 1.5383530732761874, ""subsample"": 0.849581259092292}",COMPLETE
15,0.6299256635094391,2026-10-01 08:50:53.717882,2026-10-01 08:50:56.247006,0 days 00:00:02.529124,0.8037772895899251,5.108306802445618,0.012233379213685782,2,7,450,uni_bi,stem,0.03674813667483571,5.036757951019334,1.5127227606868443,0.8887618808105896,0.02312951081799409,,"{""colsample_bytree"": 0.8037772895899251, ""gamma"": 5.108306802445618, ""learning_rate"": 0.012233379213685782, ""max_depth"": 2, ""min_child_weight"": 7, ""n_estimators"": 450, ""ngramas"": ""uni_bi"", ""preprocessing"": ""stem"", ""reg_alpha"": 0.03674813667483571, ""reg_lambda"": 5.036757951019334, ""scale_pos_weight"": 1.5127227606868443, ""subsample"": 0.8887618808105896}",COMPLETE
16,0.629979217926622,2026-10-01 08:50:56.253023,2026-10-01 08:50:59.985733,0 days 00:00:03.732710,0.8221930886429835,2.866283170879207,0.0168358370333909,2,14,700,uni_bi,stem,0.0018513445871518434,4.745400388222647,1.522819529222311,0.7877620430655583,0.012090365026313301,,"{""colsample_bytree"": 0.8221930886429835, ""gamma"": 2.866283170879207, ""learning_rate"": 0.0168358370333909, ""max_depth"": 2, ""min_child_weight"": 14, ""n_estimators"": 700, ""ngramas"": ""uni_bi"", ""preprocessing"": ""stem"", ""reg_alpha"": 0.0018513445871518434, ""reg_lambda"": 4.745400388222647, ""scale_pos_weight"": 1.522819529222311, ""subsample"": 0.7877620430655583}",COMPLETE
17,0.6378293441250408,2026-10-01 08:50:59.993606,2026-10-01 08:51:04.055217,0 days 00:00:04.061611,0.778721041251703,2.5594128213880394,0.016298340340746332,3,2,650,uni_bi,stem,0.024383681176939603,8.5210413233552,1.4382919041669444,0.8644495501325932,0.022119876850448777,,"{""colsample_bytree"": 0.778721041251703, ""gamma"": 2.5594128213880394, ""learning_rate"": 0.016298340340746332, ""max_depth"": 3, ""min_child_weight"": 2, ""n_estimators"": 650, ""ngramas"": ""uni_bi"", ""preprocessing"": ""stem"", ""reg_alpha"": 0.024383681176939603, ""reg_lambda"": 8.5210413233552, ""scale_pos_weight"": 1.4382919041669444, ""subsample"": 0.8644495501325932}",COMPLETE
18,0.6119570877516441,2026-10-01 08:51:04.060014,2026-10-01 08:51:08.076573,0 days 00:00:04.016559,0.7750570791119653,4.539958958110059,0.010069593196357083,4,5,600,uni_bi,stem,0.004218519214575653,0.915756126359999,1.089977551562706,0.8647825758457819,0.021524157704807496,,"{""colsample_bytree"": 0.7750570791119653, ""gamma"": 4.539958958110059, ""learning_rate"": 0.010069593196357083, ""max_depth"": 4, ""min_child_weight"": 5, ""n_estimators"": 600, ""ngramas"": ""uni_bi"", ""preprocessing"": ""stem"", ""reg_alpha"": 0.004218519214575653, ""reg_lambda"": 0.915756126359999, ""scale_pos_weight"": 1.089977551562706, ""subsample"": 0.8647825758457819}",COMPLETE
19,0.6413031768824901,2026-10-01 08:51:08.082586,2026-10-01 08:51:11.000175,0 days 00:00:02.917589,0.8301614221411195,4.658320175999584,0.03269268781688608,2,8,550,uni_bi,stem,0.05691941122298917,2.854153037494092,1.794405608814521,0.7714419334645233,0.019851684982025303,,"{""colsample_bytree"": 0.8301614221411195, ""gamma"": 4.658320175999584, ""learning_rate"": 0.03269268781688608, ""max_depth"": 2, ""min_child_weight"": 8, ""n_estimators"": 550, ""ngramas"": ""uni_bi"", ""preprocessing"": ""stem"", ""reg_alpha"": 0.05691941122298917, ""reg_lambda"": 2.854153037494092, ""scale_pos_weight"": 1.794405608814521, ""subsample"": 0.7714419334645233}",COMPLETE
20,0.6324917829881492,2026-10-01 08:51:11.005544,2026-10-01 08:51:14.910663,0 days 00:00:03.905119,0.866922329453743,3.1221752604062605,0.014705850448362869,3,10,600,uni_bi,stem,0.0022953943257130625,8.497835207553123,1.436386493723664,0.8709409198274877,0.01929109088746191,,"{""colsample_bytree"": 0.866922329453743, ""gamma"": 3.1221752604062605, ""learning_rate"": 0.014705850448362869, ""max_depth"": 3, ""min_child_weight"": 10, ""n_estimators"": 600, ""ngramas"": ""uni_bi"", ""preprocessing"": ""stem"", ""reg_alpha"": 0.0022953943257130625, ""reg_lambda"": 8.497835207553123, ""scale_pos_weight"": 1.436386493723664, ""subsample"": 0.8709409198274877}",COMPLETE
21,0.6406499214623884,2026-10-01 08:51:14.915782,2026-10-01 08:51:18.776728,0 days 00:00:03.860946,0.8662711065880997,2.2836591824812635,0.012987477522518623,3,7,600,uni_bi,stem,0.021705206978362104,1.3303849424343832,1.7481680828197235,0.8319256311235181,0.015584550624289038,,"{""colsample_bytree"": 0.8662711065880997, ""gamma"": 2.2836591824812635, ""learning_rate"": 0.012987477522518623, ""max_depth"": 3, ""min_child_weight"": 7, ""n_estimators"": 600, ""ngramas"": ""uni_bi"", ""preprocessing"": ""stem"", ""reg_alpha"": 0.021705206978362104, ""reg_lambda"": 1.3303849424343832, ""scale_pos_weight"": 1.7481680828197235, ""subsample"": 0.8319256311235181}",COMPLETE
22,0.6345156228998496,2026-10-01 08:51:18.783758,2026-10-01 08:51:21.584682,0 days 00:00:02.800924,0.8650295603449769,3.311765629145439,0.011757222356517346,3,15,400,uni_bi,stem,0.0024794976891771006,2.2561897773442614,1.5984472448651046,0.8370888378211282,0.01622359091813763,,"{""colsample_bytree"": 0.8650295603449769, ""gamma"": 3.311765629145439, ""learning_rate"": 0.011757222356517346, ""max_depth"": 3, ""min_child_weight"": 15, ""n_estimators"": 400, ""ngramas"": ""uni_bi"", ""preprocessing"": ""stem"", ""reg_alpha"": 0.0024794976891771006, ""reg_lambda"": 2.2561897773442614, ""scale_pos_weight"": 1.5984472448651046, ""subsample"": 0.8370888378211282}",COMPLETE
23,0.6370044694462175,2026-10-01 08:51:21.589711,2026-10-01 08:51:24.233923,0 days 00:00:02.644212,0.8339480493777804,3.0780380275577377,0.011321903464690836,2,3,450,uni_bi,stem,0.0020074879100416966,3.283221399122969,1.49386540440766,0.8527590101878336,0.031402451314741425,,"{""colsample_bytree"": 0.8339480493777804, ""gamma"": 3.0780380275577377, ""learning_rate"": 0.011321903464690836, ""max_depth"": 2, ""min_child_weight"": 3, ""n_estimators"": 450, ""ngramas"": ""uni_bi"", ""preprocessing"": ""stem"", ""reg_alpha"": 0.0020074879100416966, ""reg_lambda"": 3.283221399122969, ""scale_pos_weight"": 1.49386540440766, ""subsample"": 0.8527590101878336}",COMPLETE
24,0.6394946554080986,2026-10-01 08:51:24.240964,2026-10-01 08:51:27.378125,0 days 00:00:03.137161,0.8634541805910595,2.616677504808623,0.01815349454401273,4,13,400,uni_bi,stem,0.013739069221354015,9.45147245396564,1.8239075313439554,0.866823137090521,0.015303997182869539,,"{""colsample_bytree"": 0.8634541805910595, ""gamma"": 2.616677504808623, ""learning_rate"": 0.01815349454401273, ""max_depth"": 4, ""min_child_weight"": 13, ""n_estimators"": 400, ""ngramas"": ""uni_bi"", ""preprocessing"": ""stem"", ""reg_alpha"": 0.013739069221354015, ""reg_lambda"": 9.45147245396564, ""scale_pos_weight"": 1.8239075313439554, ""subsample"": 0.866823137090521}",COMPLETE
25,0.6308389736805041,2026-10-01 08:51:27.383650,2026-10-01 08:51:30.349905,0 days 00:00:02.966255,0.7546170016555799,1.6142330160959946,0.013118106785194452,2,12,550,uni_bi,stem,0.002930749514852168,2.303675166559428,1.651613419024742,0.8730336862217754,0.014291356565532437,,"{""colsample_bytree"": 0.7546170016555799, ""gamma"": 1.6142330160959946, ""learning_rate"": 0.013118106785194452, ""max_depth"": 2, ""min_child_weight"": 12, ""n_estimators"": 550, ""ngramas"": ""uni_bi"", ""preprocessing"": ""stem"", ""reg_alpha"": 0.002930749514852168, ""reg_lambda"": 2.303675166559428, ""scale_pos_weight"": 1.651613419024742, ""subsample"": 0.8730336862217754}",COMPLETE
26,0.6348352757906145,2026-10-01 08:51:30.356835,2026-10-01 08:51:33.023312,0 days 00:00:02.666477,0.6929210198145875,4.499023984316052,0.014344093911395989,2,15,500,uni_bi,stem,0.00393715146457149,3.3141795558918146,1.545656176909843,0.8893034168043455,0.012778184117805779,,"{""colsample_bytree"": 0.6929210198145875, ""gamma"": 4.499023984316052, ""learning_rate"": 0.014344093911395989, ""max_depth"": 2, ""min_child_weight"": 15, ""n_estimators"": 500, ""ngramas"": ""uni_bi"", ""preprocessing"": ""stem"", ""reg_alpha"": 0.00393715146457149, ""reg_lambda"": 3.3141795558918146, ""scale_pos_weight"": 1.545656176909843, ""subsample"": 0.8893034168043455}",COMPLETE
27,0.6280050405217411,2026-10-01 08:51:33.029649,2026-10-01 08:51:36.247996,0 days 00:00:03.218347,0.8417883088121598,2.9536291845941145,0.019114089509739446,2,7,600,uni_bi,stem,0.0024720965840170045,1.3995800403584258,1.522324657819774,0.8157665722187869,0.014123275763612261,,"{""colsample_bytree"": 0.8417883088121598, ""gamma"": 2.9536291845941145, ""learning_rate"": 0.019114089509739446, ""max_depth"": 2, ""min_child_weight"": 7, ""n_estimators"": 600, ""ngramas"": ""uni_bi"", ""preprocessing"": ""stem"", ""reg_alpha"": 0.0024720965840170045, ""reg_lambda"": 1.3995800403584258, ""scale_pos_weight"": 1.522324657819774, ""subsample"": 0.8157665722187869}",COMPLETE
28,0.6320626049699686,2026-10-01 08:51:36.254505,2026-10-01 08:51:39.354942,0 days 00:00:03.100437,0.7801678038712019,3.4281108925657655,0.02026719924648025,4,15,500,uni_bi,stem,0.0021923055502843167,4.3449332617193575,1.4109756519594503,0.8663419985996004,0.00810615783047999,,"{""colsample_bytree"": 0.7801678038712019, ""gamma"": 3.4281108925657655, ""learning_rate"": 0.02026719924648025, ""max_depth"": 4, ""min_child_weight"": 15, ""n_estimators"": 500, ""ngramas"": ""uni_bi"", ""preprocessing"": ""stem"", ""reg_alpha"": 0.0021923055502843167, ""reg_lambda"": 4.3449332617193575, ""scale_pos_weight"": 1.4109756519594503, ""subsample"": 0.8663419985996004}",COMPLETE
29,0.6350728051755336,2026-10-01 08:51:39.360747,2026-10-01 08:51:42.854564,0 days 00:00:03.493817,0.7334946762419073,3.739001156163872,0.016888690745677074,3,9,600,uni_bi,stem,0.008148157602201807,0.6681853413773055,1.4610027463393855,0.8798282012862225,0.016282944820412867,,"{""colsample_bytree"": 0.7334946762419073, ""gamma"": 3.739001156163872, ""learning_rate"": 0.016888690745677074, ""max_depth"": 3, ""min_child_weight"": 9, ""n_estimators"": 600, ""ngramas"": ""uni_bi"", ""preprocessing"": ""stem"", ""reg_alpha"": 0.008148157602201807, ""reg_lambda"": 0.6681853413773055, ""scale_pos_weight"": 1.4610027463393855, ""subsample"": 0.8798282012862225}",COMPLETE
30,0.6330360952552783,2026-10-01 08:51:42.861447,2026-10-01 08:51:46.503633,0 days 00:00:03.642186,0.7626361862416686,1.7329808655890562,0.0156795458034105,4,15,500,uni_bi,stem,0.0037656785984931684,3.330364607905188,1.9216429786261373,0.8841479508188597,0.014204293824961692,,"{""colsample_bytree"": 0.7626361862416686, ""gamma"": 1.7329808655890562, ""learning_rate"": 0.0156795458034105, ""max_depth"": 4, ""min_child_weight"": 15, ""n_estimators"": 500, ""ngramas"": ""uni_bi"", ""preprocessing"": ""stem"", ""reg_alpha"": 0.0037656785984931684, ""reg_lambda"": 3.330364607905188, ""scale_pos_weight"": 1.9216429786261373, ""subsample"": 0.8841479508188597}",COMPLETE
31,0.6375671077673585,2026-10-01 08:51:46.512150,2026-10-01 08:51:50.274166,0 days 00:00:03.762016,0.877903930750136,3.058534338147641,0.018518728275562314,3,15,600,uni_bi,stem,0.0028126481744516203,3.1453392248143053,1.7751770977910284,0.8921287173215152,0.015898277277984586,,"{""colsample_bytree"": 0.877903930750136, ""gamma"": 3.058534338147641, ""learning_rate"": 0.018518728275562314, ""max_depth"": 3, ""min_child_weight"": 15, ""n_estimators"": 600, ""ngramas"": ""uni_bi"", ""preprocessing"": ""stem"", ""reg_alpha"": 0.0028126481744516203, ""reg_lambda"": 3.1453392248143053, ""scale_pos_weight"": 1.7751770977910284, ""subsample"": 0.8921287173215152}",COMPLETE
32,0.6466882161051898,2026-10-01 08:51:50.283955,2026-10-01 08:51:53.373266,0 days 00:00:03.089311,0.7602938795518135,3.2708685506300514,0.02433463803355366,3,2,500,uni_bi,stem,0.014090987384299706,2.553979558668597,1.389886705648406,0.8301438886005367,0.011501128495770008,,"{""colsample_bytree"": 0.7602938795518135, ""gamma"": 3.2708685506300514, ""learning_rate"": 0.02433463803355366, ""max_depth"": 3, ""min_child_weight"": 2, ""n_estimators"": 500, ""ngramas"": ""uni_bi"", ""preprocessing"": ""stem"", ""reg_alpha"": 0.014090987384299706, ""reg_lambda"": 2.553979558668597, ""scale_pos_weight"": 1.389886705648406, ""subsample"": 0.8301438886005367}",COMPLETE
33,0.6433767008683444,2026-10-01 08:51:53.380565,2026-10-01 08:51:55.708062,0 days 00:00:02.327497,0.755468548793988,3.8573413729026718,0.014175430649864748,3,5,350,uni_bi,stem,0.007182127655202301,1.4079994509422906,1.5043632301763457,0.8349329759806241,0.030331837459456713,,"{""colsample_bytree"": 0.755468548793988, ""gamma"": 3.8573413729026718, ""learning_rate"": 0.014175430649864748, ""max_depth"": 3, ""min_child_weight"": 5, ""n_estimators"": 350, ""ngramas"": ""uni_bi"", ""preprocessing"": ""stem"", ""reg_alpha"": 0.007182127655202301, ""reg_lambda"": 1.4079994509422906, ""scale_pos_weight"": 1.5043632301763457, ""subsample"": 0.8349329759806241}",COMPLETE
34,0.6522944779482195,2026-10-01 08:51:55.716076,2026-10-01 08:51:58.489015,0 days 00:00:02.772939,0.8022671444925702,4.2335974612911995,0.01250280392005152,2,4,500,uni_bi,stem,0.02841562478875969,0.8463412412676595,1.708763027109213,0.837481102097609,0.02610120095089731,,"{""colsample_bytree"": 0.8022671444925702, ""gamma"": 4.2335974612911995, ""learning_rate"": 0.01250280392005152, ""max_depth"": 2, ""min_child_weight"": 4, ""n_estimators"": 500, ""ngramas"": ""uni_bi"", ""preprocessing"": ""stem"", ""reg_alpha"": 0.02841562478875969, ""reg_lambda"": 0.8463412412676595, ""scale_pos_weight"": 1.708763027109213, ""subsample"": 0.837481102097609}",COMPLETE
35,0.652017449878495,2026-10-01 08:51:58.497212,2026-10-01 08:52:01.950386,0 days 00:00:03.453174,0.8187511180627021,4.052610012025099,0.015157899926443992,3,5,550,uni_bi,stem,0.004390802898673631,2.974890118916623,1.6608908108939897,0.8641365670845388,0.01250005931394994,,"{""colsample_bytree"": 0.8187511180627021, ""gamma"": 4.052610012025099, ""learning_rate"": 0.015157899926443992, ""max_depth"": 3, ""min_child_weight"": 5, ""n_estimators"": 550, ""ngramas"": ""uni_bi"", ""preprocessing"": ""stem"", ""reg_alpha"": 0.004390802898673631, ""reg_lambda"": 2.974890118916623, ""scale_pos_weight"": 1.6608908108939897, ""subsample"": 0.8641365670845388}",COMPLETE
36,0.6308159044360566,2026-10-01 08:52:01.958399,2026-10-01 08:52:05.305482,0 days 00:00:03.347083,0.7282202105554109,2.403421702810324,0.021041461809685632,3,2,550,uni_bi,stem,0.012254370384462098,4.244751016530847,1.2241661407487645,0.8293856986394429,0.02050979905310131,,"{""colsample_bytree"": 0.7282202105554109, ""gamma"": 2.403421702810324, ""learning_rate"": 0.021041461809685632, ""max_depth"": 3, ""min_child_weight"": 2, ""n_estimators"": 550, ""ngramas"": ""uni_bi"", ""preprocessing"": ""stem"", ""reg_alpha"": 0.012254370384462098, ""reg_lambda"": 4.244751016530847, ""scale_pos_weight"": 1.2241661407487645, ""subsample"": 0.8293856986394429}",COMPLETE
